name,stars,text,timeSince,openStatus,key
Brenna Beauclair,5.0,"My pizza where prefect, even though you guys had a busy night. Sorry about the rude and inpatient customer. You all did great. My pizza was on time and prefect. Thankx again. 5/7/20 the one on 21st in Topeka",6 months ago,Closed,2000172676
Megan O’Brien,1.0,"We love this pizza, we frequent other locations... I stopped here this time because it was on my way. I won't be stopping here ever again. After having to wait to order I was rushed along. I asked for a pepperoni pizza, just a boring …More",3 years ago,Closed,2000172676
Michelle Hubler,5.0,"They are really speedy. Also, the best supreme in town. THEY ARE CLOSED NOW!!",a year ago,Closed,2000172676
Matthew Chenoweth,3.0,Nothing was ready waited about 20 minutes usually pretty good about that though.,2 years ago,Closed,2000172676
R. Mark,4.0,"While being pretty busy, they still managed to get our pizza out quickly, and accurately. Tasty, too!",2 years ago,Closed,2000172676
Brandon Bower,5.0,"I had a great experience at Little Ceasars, I was there for the Crazy Happened Promotion. It was alittle busier than I thought it would be but I was patient. I waited in line for about 30-35 but it was well worth it. The staff were very …More",2 years ago,Closed,2000172676
Ny Jasper,5.0,"Nice and friendly, good customer service and great quality food",2 years ago,Closed,2000172676
Jaiden Itiss,1.0,"My fiancé and I came to this place as soon as we got to Topeka Kansas from Houston for bussiness purposes. We were hungry,tired. There was no wait. The bread sticks were dry no butter no cheese disgusting. Pizza was reheated. Their store …More",2 years ago,Closed,2000172676
BACKDOORSALE,5.0,I love Little Ceasars!  Just wish this restaurant was a little closer to home!,2 years ago,Closed,2000172676
Mary Lou,5.0,"Best employees ever great on time best pizza nice price bread sticks best cheese bread are the best and Tara , Wesely , Aliciana , Hannah Are the best helpers ever when us people can't explain what we want the right way over All Rate 5 Thanks Guys .",2 years ago,Closed,2000172676
Devon Griffith,5.0,"Friendly helpful service every time, called ahead multiple times and perfect timing on their part every time. Couldn't ask for a better location!",2 years ago,Closed,2000172676
Tara Dickerson,5.0,"Great service, nice staff, good quality pizza, best pizza place in town by far.",2 years ago,Closed,2000172676
Guera Guera,1.0,They need to work on their customer service. Stood there for 5 minutes waiting while everyone was staring at me. Lost my business sense this is the second time that has happened.,3 years ago,Closed,2000172676
Nick Newberry,3.0,"It's cheap pizza carryout only no in-store dining, but it is quick and easy",2 years ago,Closed,2000172676
Solomon Smallback,3.0,Food is average/what you'd expect from Little Caesar's. The wait time was a lot longer than expected and the lobby kind of felt dingy.,2 years ago,Closed,2000172676
Lou Stubby,5.0,"Great service, great pizza, great price. 8.50 with tax for a deep dish pep.",2 years ago,Closed,2000172676
C Smith,4.0,"Hot, fresh, and if you do have to wait is is usually very short.",2 years ago,Closed,2000172676
Clifford F,4.0,"Quick but the pizza wasn't exactly ""hot"". Still good though.",2 years ago,Closed,2000172676
Evelyn Lizzeth,1.0,i would give this 0 starz because the guy with glases gave me awful service . waited 30 mins for 2 peporoni pizzas and some wings .,2 years ago,Closed,2000172676
Kyle&April Stiles,5.0,Food great max  and 10min wait,2 years ago,Closed,2000172676
Jackie M,5.0,Hot and tasty for 5 bucks,2 years ago,Closed,2000172676
LeANDro,1.0,The Little Caesars near my house is horrible. They need to manage peak business hours better. Even on a slow day they never have Hot and Readys. Your average wait time is 10 minutes and that is sad cause thats the business Hot and Readys (Little Caesars on Burlingame in Topeka KS) Horrible!,3 years ago,Closed,2000172676
Nikki Krutz,5.0,Love the option to just walk in and grab a pizza or two without a wait!,3 years ago,Closed,2000172676
Jeffrey Deloach,5.0,It's a great place to get food fast,2 years ago,Closed,2000172676
Nick Will,4.0,Never have to wait on a pizza.. very quick,3 years ago,Closed,2000172676
Racheal Coleman,3.0,Average pizza for a decent price. Great for feeding a crowd or kids.,2 years ago,Closed,2000172676
michael pennington,1.0,We went in tonight and got two pizzas and they tasted like they sat all day long. One of the worst pizzas I have ever gotten will never go back..,3 years ago,Closed,2000172676
DR. Filthyfrank2,1.0,Was told they were waiting to close until I got my pizza and they closed the cash registers and threw away my pizzas can't rate 0 stars and I think these teens should be fired.,2 years ago,Closed,2000172676
State Of Kansass,5.0,Always fast and friendly staff!,2 years ago,Closed,2000172676
Darla Barnhart,4.0,As far as I know there is only one location in town and it is not very convenient.,2 years ago,Closed,2000172676
Rachel Duncan,5.0,I like the ultimate pizza and the cinnabons.,3 years ago,Closed,2000172676
adam Morstorf,4.0,Always have hot and ready,3 years ago,Closed,2000172676
Jason Stafford,3.0,"At $6 for a large pizza that you don't have to wait for, expectations really can't be all that high, but if you want good carry out pizza, just about anything is probably better... with a wait.",4 years ago,Closed,2000172676
aimee glase,5.0,Super nice and friendly!,2 years ago,Closed,2000172676
Eric Williams,4.0,Darn good tasting pizza.,2 years ago,Closed,2000172676
T&R,1.0,Pizza never done .always doughy,2 years ago,Closed,2000172676
Chris Cazier,5.0,Love,2 years ago,Closed,2000172676
TPD Gaming,5.0,Goood food,2 years ago,Closed,2000172676
Zac Glenn,4.0,Great customer service.,2 years ago,Closed,2000172676
Jenette Poore,5.0,Food is awesome,3 years ago,Closed,2000172676
Adam Mentzer,5.0,Best pizza in the U.S.,2 years ago,Closed,2000172676
James Pfeiffer,3.0,Ok pizza. A little slow.,3 years ago,Closed,2000172676
Kan Seether,4.0,Clean. And friendly staff,4 years ago,Closed,2000172676
William Knox,4.0,"Fast, affordable, convenient.",3 years ago,Closed,2000172676
Giselle Rivera,5.0,😋😋😋😋😋,2 years ago,Closed,2000172676
Edgar Blake,4.0,"(Translated by Google) Very fast service

(Original)
Muy rápido el servicio",3 years ago,Closed,2000172676
brittney fuller,5.0,,2 years ago,Closed,2000172676
Rip Kord,1.0,,2 years ago,Closed,2000172676
Michael Robinson,5.0,,2 years ago,Closed,2000172676
Brian Spillers,4.0,,3 years ago,Closed,2000172676
Wesley Roush,5.0,,2 years ago,Closed,2000172676
Tom Bombardier,3.0,,3 years ago,Closed,2000172676
Amy Ehmke,5.0,,3 years ago,Closed,2000172676
Crispin Glenn,3.0,,2 years ago,Closed,2000172676
Melissa Dominguez Stringfield,4.0,,2 years ago,Closed,2000172676
Marissa Coyle,5.0,,3 years ago,Closed,2000172676
Brooke Martinez,4.0,,4 years ago,Closed,2000172676
Treasa Kopp,4.0,,3 years ago,Closed,2000172676
Hannah Abel,5.0,,2 years ago,Closed,2000172676
Aaron Callahan,5.0,,2 years ago,Closed,2000172676
Pat,4.0,,2 years ago,Closed,2000172676
Tristin Leonard,5.0,,3 years ago,Closed,2000172676
Aimee Jones,5.0,,3 years ago,Closed,2000172676
