name,stars,text,timeSince,openStatus,key
Keith Enfinger,5.0,"Best salad bar in Tennessee. Taco pizza is amazing, Zeke and his crew are the nicest people around. I'm literally in there 2-3 times a week for the salad bar. Great restaurant been looking for a Pizza Inn for years since the one in Shelbyville closed 20+ years.",4 years ago,Closed,2000503335
Selina Gallegos,5.0,The staff here is incredibly kind and welcoming!!! We loved the food and they were happy to make us our favorite pizza!!! The bathroom was clean and well stocked! I also loved the music and atmosphere! We can't wait to come back!!!!,a year ago,Closed,2000503335
Eva Pierce,5.0,This place has a great buffet. Everything is hot and fresh. The Salad bar was super fresh with lots of options especially for a small business. The buffet has both pizza and pasta options. The price was really good too!,a year ago,Closed,2000503335
Jessica Spray,5.0,"My husband and I had lunch at the buffet today & it was terrific! The variety of pizzas was nice, the salad bar was great & the restaurant was clean. We've been to some buffets in the past & the floor is sticky or there is a general mess, …More",a year ago,Closed,2000503335
Jamel Jeansonne,5.0,"Great food, staff and prices.",2 years ago,Closed,2000503335
Jeremy Searcy,5.0,Fantastic every time. Great pizza. Great staff. They are so friendly and will make whatever your heart desires. So much better than any other pizza buffet I've been to. This is becoming one of favourite places to go out to and relax the end …More,a year ago,Closed,2000503335
Ben Weaver,5.0,This place is awesome. Excellent pizza buffet for good prices. The specials on take out and delivery are very good too. I love that loaded potato pizza!,a year ago,Closed,2000503335
Cecilia Texas,5.0,"Excellent prices, good service, a terrific salad bar, and tasty pizza and pasta.  They'll make any pizza you want and put it on the buffet.  Going here is a special treat.  I lived just around the corner from the very first Pizza Inn in …More",a year ago,Closed,2000503335
Ruth Smith,5.0,I love pizza inn,a year ago,Closed,2000503335
Kellie Applegett,5.0,"They take credit cards even during the current internet outage!!! Amazing restaurant, great staff, and fantastic food. Give it a try!! Will not regret it",a year ago,Closed,2000503335
Shannon Tuttle,4.0,I really enjoy the 🍕 and the variety on the buffet. Soft drink choices are limited. This time I assume I arrived after a big rush as a lot of tables were empty and not cleaned.,a year ago,Closed,2000503335
Sarah Timmerman Jones,5.0,We came here from mount Juliet which is 45 minutes away because the reviews were exceptional. I’m pregnant and was looking for a yummy pizza buffet (pregnancy cravings 🤷🏻‍♀️). This place was so much better than the reviews. The staff is …More,a year ago,Closed,2000503335
Dawn Wood,5.0,"If you haven't tried Pizza Inn, you are missing out. This place is great and is now our Wednesday night dinner place. And no, I don't feel guilty about eating at a pizza place EVERY week because they have an amazing salad bar too! It takes …More",2 years ago,Closed,2000503335
S,2.0,"Loved the price, however we ordered lemonade and got (unsweetened) tea instead. Delivery guy was really nice but he tried to tell me they didn't put a drink on my order after telling me that they told him to tell us they didn't have any …More",2 years ago,Closed,2000503335
J - Way,5.0,Pizza was hot and fresh. Salad bar was bomb. And they had like this oreo dessert (served hot) and i had bout 3 slices of that alone. The only thing id def have to recommend they change is the music. It sounded so sad . but i enjoyed and its a nice place to get full for jus 20 to 30 dollars. Non expensive and great food!,a year ago,Closed,2000503335
Kiki,5.0,"Great place if you have kids. Casual place. Good food. Has highchair and boosters. They do have a kids eat free night. You can ask them to make any pizza for you, and they will bring you a couple pieces and then put it in the buffet. Very …More",2 years ago,Closed,2000503335
Phillip Chrisman,2.0,Walked in about an hour before close. It's a buffet so they had several pizzas on the bar. Went up to order and get a seat. They refused to let us touch food on the bar. It just had to be thrown in the trash since the bar was closed as of …More,a year ago,Closed,2000503335
James Moore,5.0,Consistent quality provided and the employees are always so polite. The gentleman that no doubt runs the establishment is very business oriented and straight to the point.  That type of personality an come off a little rude but i don't …More,2 years ago,Closed,2000503335
Rajiv Hudek,5.0,Great pizza and really nice staff. I didn't get to try the buffet but it looks really good so I'd definitely give it a try.,a year ago,Closed,2000503335
rocky lewis,5.0,The pizza was delicious and priced great. We had the buffet and the atmosphere and food was nice. Definitely will be back.,a year ago,Closed,2000503335
Allen Thompson,5.0,"I love this place, unfortunately tonight was it's last night if business at this location.",a year ago,Closed,2000503335
S Saffel,5.0,"It's a PIZZA BUFFET, so let's compare it to other pizza buffets.  Excellent selection. Hot and fresh,  but not dried out. Stands out among pizza buffets as one of the few that also offers beer. …More",2 years ago,Closed,2000503335
Jenna SinClair,5.0,Love this place. They will make you any pizza 🍕 🍕 so good,a year ago,Closed,2000503335
Jim Morgan,3.0,"My kids and I like it. My wife isn't a fan. It depends on when you go if you're getting the buffet. If it's near 8pm, then you should probably pass it by. If it's 630pm, then it should be good to eat.",a year ago,Closed,2000503335
Tahirah,3.0,I came to this place because its near my house and I wanted to find a convenient pizza spot. The sauce tastes like its from a jar in my opinion. The crust tastes like its from Restaurant Depot. The Garlic Knots tasted like some random …More,a year ago,Closed,2000503335
Donnie Hensley,5.0,"Great pizza, regardless if it was buffet or not... Surprised me how good it was. I'll definitely be going back. Super friendly staff as well!",2 years ago,Closed,2000503335
Daniel,5.0,Great buffet with quality higher than CiCi's. Definitely recommend as an alternative.,a year ago,Closed,2000503335
Tasmine Brown,5.0,Great food. Great Atmosphere. Would definitely recommend.,a year ago,Closed,2000503335
Jason Patterson,1.0,"Grown up version of Cici's. Pizza buffet chain with a simple salad bar and beer. Quiet atmosphere, remember the Tony's frozen pizza that you microwave? Kinda tasted like that.",a year ago,Closed,2000503335
Robert Pevahouse,5.0,It was our first time and we really enjoyed the food and the friendly service and will be back.,a year ago,Closed,2000503335
Jonathan Evans,5.0,Great staff and excellent food for the price,3 years ago,Closed,2000503335
lynn king,4.0,Pizza Inn was a nice place to to eat at. They make pizza your way just ask and it's there in minutes. The price is a little too much to me which was $8.99 but all the tea you can drink was included it kinda reminds you of Ci-Ci's pizza but …More,2 years ago,Closed,2000503335
Jim Ball,5.0,Pretty darn good pizza!! They'll even make your favorite pie as part of the buffet.  Great salad bar options.  Super friendly staff.,2 years ago,Closed,2000503335
Chad Foley,4.0,"Fast, simple place for lunch. A little high priced at $10...but it is an all you can eat buffet with salad bar. Pizza is decent, the store could have been a little cleaner, nice people.",2 years ago,Closed,2000503335
Rollin Kellogg,3.0,Pizza is ok..ice melted in beer cooler by register and 3/4 of it was warm...,a year ago,Closed,2000503335
Jennifer Griffith,5.0,"Clean environment. Great pizza, love the chocolate chip one! Will be back.",a year ago,Closed,2000503335
Angie Abraham,5.0,"So many great choices!  Many varieties of great tasting pizzas.  From a loaded baked potato pizza,  Mac and cheese pizza,  Hawaiian pizza, taco pizza and cheeseburger pizza, buffalo chicken or chicken Alfredo pizza and ALL the traditional …More",3 years ago,Closed,2000503335
Amy Peguese,5.0,"Love this restaurant! Great management, great food. Can't go wrong when you get to customize your own pizza for the buffet.",a year ago,Closed,2000503335
JS Maker,4.0,Buffet was loaded and kept up well. Really tasty pizza.,a year ago,Closed,2000503335
Patrice Whisnant,5.0,I only regret is I wish they had one in Nashville or sumner co.!  Awesome buffett,a year ago,Closed,2000503335
Eric Saxon,1.0,"Worst place in Murfreesboro for Pizza. The employees do not wear gloves as required, the ovens are filthy and have never been cleaned and I mean never.  Take a look for yourself or ask to see the clean dates as required by Pizza Inn.  They …More",2 years ago,Closed,2000503335
Yulanda Pillow,5.0,"Absolutely amazing! Customer service is is great! The owner is very friendly and accommodating, as well as the staff.",a year ago,Closed,2000503335
SAMANTHA JOHNSON,1.0,"Owner yells at his employees,  has Christian music playing but cussing at the employees.  I have experience this first hand.   I ordered pizza online for delivery and when I got it,  it looked like it was tossed around I took pictures and …More",2 years ago,Closed,2000503335
dcross1107,5.0,The pizza was better than expected! I dined in and ate the buffet. The buffalo chicken pizza and the BBQ chicken pizza was the best I ever had. I will say that I'm tried their pan pizza but wasn't too thrilled about it. Other than that …More,3 years ago,Closed,2000503335
ajcd1sc1ple,5.0,Great staff. They seem to care. Like the atmosphere.,a year ago,Closed,2000503335
Anna Watts,4.0,"Kind of expensive for one person. I paid $11 for me and my 2year old. Not sure why. But it was a good salad bar. Lettuce was kind of brown. Pasta was good. My daughter ate 1 peice. Smh. But overall way better than cicis pizza. Clean plates, …More",a year ago,Closed,2000503335
Nevis Farm,5.0,"Great food, clean buffett and resturant and the most friendly staff!!! Everyone working made a point to say a meaningful hello or start a casual conversation: drivers, cooks, cashiers, buffet person! Great place, great food!",a year ago,Closed,2000503335
Kyle R,4.0,I went for the lunch buffet. It was better food than Cici's but expect to pay $12.,a year ago,Closed,2000503335
RusticBB8,5.0,"Super good, nice place to eat with family, not crowded, And they have a good selection",a year ago,Closed,2000503335
joel w,5.0,"Always enjoyed the buffet. Many great selections and they are delicious.   Busy place, yet they keep it pretty clean.  Have not tried delivery.  In house experience  has always been great.",2 years ago,Closed,2000503335
Angie Morris,5.0,"Pizza INN, great service, lots of options on the buffett and service is outstanding!",a year ago,Closed,2000503335
Blake B,5.0,Best pizza buffet around.  Always super clean and friendly staff and ownership.,a year ago,Closed,2000503335
Venessa Fitchie,5.0,My family and I had the buffet. Everything was fresh and the staff was amazing. I asked about the Taco pizza and they promptly put it on the bar. It was awesome! Special thanks for the dinner experience we didn't expect! We will be back ♡,3 years ago,Closed,2000503335
Nathan Butterick,5.0,Staff was awesome. Food was great selection was top notch.,a year ago,Closed,2000503335
Abigail Renth,4.0,"The pizza was well cheesed and deliscious. However, the lettuce for salad was slightly soggy.",a year ago,Closed,2000503335
Marcus Marble,3.0,"No pepperoni pizza for 20-30 mins we were there? Really? Asked us each, what kind of pizza we wanted on bar,which was nice of them...But made them with toppings on both pizzas mixed up from order. Not nice of them.Been there 3x, each time always something. Oh well, Murfreesboro has 319 more restaurants to eat at right?",a year ago,Closed,2000503335
Tiffany Reed,3.0,Pizza was pretty old on the bar. The salad bar was pretty good. For the price it was ok.,a year ago,Closed,2000503335
tod aulph,5.0,Great food and way better than CeCe's very peaceful atmosphere,a year ago,Closed,2000503335
Shannon Thompson,1.0,The seating is horrible. Went to the bar and the spaghetti was old and the pizza was completely out for about 5-10 min. The staff was not friendly at all. The pizza bar and the salad bar is to far away from each other. The pizza is not …More,4 years ago,Closed,2000503335
Xally Smith,4.0,Only complaints I have are pizza selection and the soda machine is ok th fritz. But excellent za,a year ago,Closed,2000503335
Firerenza,2.0,"Pizza is just ok. We order from here because of the location convenience. Every time I order something there is at least one ""upcharge"". The chocolate chip pizzert that comes with the family feast is absolutely disgusting, I really wish …More",a year ago,Closed,2000503335
frances Lee benning,5.0,"This all you can eat pizza buffet with a nice salad bar, mac and cheese, spagetti, sauce, and (when I was there) really tasty, tender pork ribs was great!  The place is kept very clean, the staff is friendly and helpful, and they'll make …More",3 years ago,Closed,2000503335
Sherry Klaus,5.0,"THE BEST buffett pizza i have had yet. Dough is not dry, sauce is perfect ( i dont like that sweet stuff) even liked their salad bar, they offered three kinds of lettuce, I even enjoyed the Sunday afternoon music. Only thing I had a problem …More",a year ago,Closed,2000503335
larry hudson,5.0,"Great food, service and atmosphere for a great price. I will definately be back.",a year ago,Closed,2000503335
Jessica Wall,4.0,"Tried Pizza Inn on a recommendation from a friend. My teen son enjoyed it, especially since it was a buffet. The pizza didn't blow me away, but was good for the price.",2 years ago,Closed,2000503335
Mike Morefield,1.0,"The only reason it's getting a star is because you can't review without star...Man I'd always got great service thought that whomever the person was in charge was a great Christian man, however I was just there, same great service, however …More",2 years ago,Closed,2000503335
J Paul,5.0,Great service and food.  Consistent.,a year ago,Closed,2000503335
Jessica Harper,5.0,Delicious pizza and the staff is real awesome! Best customer service ever! Def bring the kids.,2 years ago,Closed,2000503335
Tracy Martin,5.0,We have eaten several times at this Pizza Inn location and have always had a good experience.  We have ordered different pizzas each time and have not had a bad pizza yet. The staff and managers were all friendly and our food was brought out to us in a timely manner. I would definitely recommend this Pizza Inn.,5 years ago,Closed,2000503335
Darrick Ensey,5.0,"Friendly staff, adequately and freshly kept buffet. Don't mind paying $7.99 for the quality pizza, salad and desserts offered. Great location. Please open one in Shelbyville, where we used to have one.",3 years ago,Closed,2000503335
Cathy Watkins,5.0,"Mr. James, We apologize for your experience last night. Due to the extremely high volume of deliveries, dine in, and carry-outs,  the staff was unable to keep up with the demand.  There is no excuse we can give you for the manner in which …More",4 years ago,Closed,2000503335
Alex,5.0,"Friendly staff. Pizza and cheese bread was delicious with a wonderful, yet delicate, crunch to the crust. Hot marinara sauce available upon request, pairs extremely well with the cheese bread and pizza crust. Definitely recommend the cinnamon dessert; it  has an amazing creamy middle layer. Sooo good! Will eat here again!",4 years ago,Closed,2000503335
BIll Travis,4.0,Good food. Clean and a great salad bar.,a year ago,Closed,2000503335
Mark Petty,1.0,First time to order from here and only did based off reviews. Very disappointing results with what I got!  I ordered  a med. stuffed crust pizza (with one topping and extra cheese) half of the pizza was over cooked (not sure how that …More,2 years ago,Closed,2000503335
Emalece Carr,5.0,Very friendly people and delicious food and still just as famous for their cookie pizza as when they first opened,a year ago,Closed,2000503335
Julie Mims,5.0,This is one of my favorite Pizza places! They will specially make any type of Pizza you want but they are all amazing.,2 years ago,Closed,2000503335
Corey Copley,5.0,"Love this place, great pizza friendly employees that make the pizza you want, great price has well",a year ago,Closed,2000503335
Jeff Campbell,3.0,Good food and conveniently located close to my house .,a year ago,Closed,2000503335
Jeff Adair,5.0,"I love this place. Great pizza, great process, and everyone is friendly! The owner is frequently there and makes sure that all customers are greeted personally and are satisfied with their meals.",3 years ago,Closed,2000503335
Gary Farmer,1.0,"Always good when eating at the restaurant. However, I ordered a pizza for delivery over an hour ago have called twice about it and it still hasn't shown up. I live less than a mile away from restaurant.
Not a good showing.",2 years ago,Closed,2000503335
Christopher Abbott,5.0,Great menu and excellent service for reasonable prices.  I love the lunch buffet!  Very family friendly.  The staff are willing to cater to children's tastes on request.,4 years ago,Closed,2000503335
Durk Milliron,5.0,Good pizza an adult Cicis pizza only better,a year ago,Closed,2000503335
Herbert Cutrell,4.0,Pretty good for buffet pizza. Tables could have been cleaner,a year ago,Closed,2000503335
Tressa Etheridge,1.0,Usually good service and food. This visit had rude staff and buffet food was old. No tomatoes at all,2 years ago,Closed,2000503335
Lydia Scott,5.0,"Great, interesting food. Had my first date there and we were treated with great hospitality by the workers.",2 years ago,Closed,2000503335
Steph S.,5.0,"My husband and I are so glad that Pizza Inn is so close by now. We have had great experiences so far with both the food and staff.
The garlic cheese bread is amazing!
We would definitely recommend this location to others.",5 years ago,Closed,2000503335
Michael Donahue,4.0,"Pizza is always good, with plenty of variety in types. Full salad bar, dessert pizzas, and ribs in the bar.",2 years ago,Closed,2000503335
Amanda Enfinger,5.0,"Amazing food, good atmosphere, and nice staff.",2 years ago,Closed,2000503335
James Montero,5.0,"Been here so many times and the service and food never let me down when in the area for a quick bite, awesome little pizza joint and always fast and easy, if its not on the bar all you gotta do is ask and it will be ready in 15 minutes or so. Great Little Business",2 years ago,Closed,2000503335
The OnePrime,4.0,"Pizza Inn has some of the best pizza in town.  I love getting the Italian Crust with some extra marinara sauce and dipping it!  Delivery time has been an issue a time or 2, but they aren't the only place I've run into that problem.",3 years ago,Closed,2000503335
Zachary Crumpton,5.0,"The taco pizza is the bomb, much better than cici's",2 years ago,Closed,2000503335
Jarrod McHenry,2.0,I have ordered from Pizza Inn twice now and of the two both were delivery. The first time the pizza was soggy in the middle and the dough in the crust was still raw in the center. I went ahead and decided to give them another chance …More,5 years ago,Closed,2000503335
Carolyn Shelton,5.0,Awesome buffet. The taco pizza is the best.,a year ago,Closed,2000503335
michael burrows,5.0,Great staff and huge selection on the buffet. Very family friendly. Me and my family love going here. Ziek and his wife have an awesome pizza restaurant.,3 years ago,Closed,2000503335
Sam Ayers,5.0,"Good pizza, good price",a year ago,Closed,2000503335
Mark Posey,5.0,"Great food, fun atmosphere. Great selection on the buffet.",a year ago,Closed,2000503335
Jimmy Burnett,3.0,"They were really awesome a couple months ago.  Most tables dirty, pizza dried out.",a year ago,Closed,2000503335
Kaz Shakir,4.0,"Good pizza, and nice service.",a year ago,Closed,2000503335
Bobby Davis,5.0,Grate service some of the best pizza  ever,a year ago,Closed,2000503335
Tina Allen,5.0,Me and the fam just ate here and it was super good with a nice staff as well.,2 years ago,Closed,2000503335
R J,5.0,The Service was great. Relaxing atmosphere.,a year ago,Closed,2000503335
CM Evans,3.0,"Great selection today, but the thin crust pizzas were all undercooked and had a doughy layer under the sauce with crust that was barely crisp like they were rushed. We were there at 3 pm and there was no crowd, no reason to rush. This is the only disappointing experience we've ever had here.",2 years ago,Closed,2000503335
Paige Guzman,5.0,"Pizza inn is FABULOUS!

We have community events at Colony House Apartments with our CARES Teams. …More",4 years ago,Closed,2000503335
brenda boyd,5.0,Place surprised me good pizza great staff .,2 years ago,Closed,2000503335
Travis Whitehead,4.0,great food friendly staff,a year ago,Closed,2000503335
Teresa Schmidt,5.0,Awesome any and every time we go.,a year ago,Closed,2000503335
Aaron Wyatt,5.0,Great service and great pizza!,a year ago,Closed,2000503335
Kayla Huckaby,4.0,"It has really good pizza and delivery is only $2!
On a side note, the buffet is okay, but the quality is lacking there. But I guess that's expected. The reward system is slow, but they have one at all, so I guess that's nice",2 years ago,Closed,2000503335
Chad Cooper,3.0,To me it was pretty generic pizza. Service however was great. I might be opened to trying the buffet at lunch to give it a second chance.,5 years ago,Closed,2000503335
Ariel McGill,5.0,"Amazing!  This was our first time trying Pizza Inn in Murfreesboro Tennesse.  the staff was friendly, the food was delicious and the location is perfect!  We really loved the variety on the buffet and the willingness from the staff to make anything we asked for!  This will become a frequent stop for our family!",3 years ago,Closed,2000503335
Mike Pennington,5.0,"Best Pizza Ever.
I grew eating Pizza Inn.
Owner is so nice.",a year ago,Closed,2000503335
Tiffany Smith - Turley,5.0,Good selection for family. Fresh and staff was polite and offered to make whatever we requested for the Buffett!,2 years ago,Closed,2000503335
tray4168,5.0,By far the best pizza ever. Had one in Hendersonville for 30 plus years until it closed. So glad they opened one in Murfreesboro. Even at a 55 minute drive it is well worth it. Also very polite and courteous staff as well with the owners.,3 years ago,Closed,2000503335
Kristen Ward,5.0,"Delivery time is what you expect. Pizza was very yummy, but the Bavarian Creme pizzert... OH MY!  I ordered online and they didn't have the cookie dough that I originally ordered. I immediately received a call to let me know and BC was suggested. I'm so glad. It was like a pizza donut. So good.",4 years ago,Closed,2000503335
Andrew Hooper,5.0,"Excellent service, friendly staff, delicious pizza!",a year ago,Closed,2000503335
Walt Robinson,5.0,To me.... Best known for its buffet with salad bar and dessert pizza. Cold beer available too. Will make any pizza you request.,4 years ago,Closed,2000503335
J D,1.0,Only a few pieces of two different pizzas that looked dried bout when we got there. Asked for a bacon and pineapple and he finally brought out a pepperoni with a couple chunks of pineapple. Sure wasn't worth $10 a person!,2 years ago,Closed,2000503335
Keith James,1.0,We ordered a pizza at 6 pm and was told we would have it in 45 minutes. At an hour and a half I called to be told we should get it in 30 minutes. After 45 more minutes I called back to be told they were getting ready to call me and tell me …More,4 years ago,Closed,2000503335
Chris Holley,5.0,"Nice buffet. Fresh pizza, ribs, free drink and an impressive salad bar. Clean place, nice atmosphere and friendly staff. Well worth the cost.",4 years ago,Closed,2000503335
Bill Gailey,5.0,Best buffet around and the owner is great guy love how they ask is there a pizza you would like us to make and put out on the bar also have a great salid bar as well,2 years ago,Closed,2000503335
Marcia Conatser,5.0,"Came to support the Blackman Smoke Cheer team!  Everything was great the food, the staff and the girls who were there to wait on us hand and foot.",2 years ago,Closed,2000503335
Jess Cowart,5.0,Custom make a pizza for the bar or yourself. Can't beat the service and prices are super fair! Wouldn't go anywhere else for buffet pizza!,2 years ago,Closed,2000503335
Chris Wood,5.0,We love Pizza Inn and the staff are friendly! Good salad bar and pizza buffet!,2 years ago,Closed,2000503335
Josh Collins,5.0,Great food and the owner loves his customers and employees great atmosphere,2 years ago,Closed,2000503335
Conner Hicks,5.0,"The manager and owner there was the sweetest person I'll probably ever meet🙌🏼. The staff was inviting (even the custodians). You could tell once you took a that savory bite of that pizza, you could tell it was made from scratch.🔥",4 years ago,Closed,2000503335
Ben Nelson,3.0,Good pizza. Freshness and quality depend heavily on the amount of customers,2 years ago,Closed,2000503335
Kevin Wagner,5.0,Great service good pizza,2 years ago,Closed,2000503335
Jared Witham,5.0,"Great pizza, great owners! Best place in town! I drive across town to eat this pizza!",2 years ago,Closed,2000503335
Davida Vaughn,2.0,Found the price good but the pizza not great and the buffet simple. Good if you are looking for a quick bite at a reasonable price.,3 years ago,Closed,2000503335
Andrea Hibar Ensley,5.0,Excellent! So happy that they have gluten free crust. Best ranch dressing ever!!!,2 years ago,Closed,2000503335
Matt Hobbs,5.0,Great place. Wonderful staff. Excellent good and service.,3 years ago,Closed,2000503335
