name,stars,text,timeSince,openStatus,key
Ryan,1.0,"Ordered a very sad looking Extramostbestest cheese pizza yesterday 9/19 @ 8:45pm and it had no sauce and a sprinkle of cheese. Long story short, it was dry and inedible - and ultimately, ended up in the trash. I do not recommend ordering from this location.",2 months ago,Open,1000840876
Dan,1.0,"Horrible and pathetic! I ordered online at 6:40pm...It’s 8:05pm, no tracking, no delivery, the actual location doesn’t answer the phone and the customer service number hangs up on you. Worst service I’ve ever seen in food delivery. Never …More",3 weeks ago,Open,1000840876
Karla De La Torre Cedeno,5.0,My favorite place! If you order through the app they will have your pizza really fast.,3 weeks ago,Open,1000840876
Baxter Knight,2.0,They were too busy trying to go home to even come give me one pizza and I was only nine we had an hour to go then the two employees with arguing at each other about who's going to give me the pizza I guess pizza was good pretty fresh,a month ago,Open,1000840876
Sylvia M Sobel,4.0,"Good pizza for the price.
However they are usually UNDER STAFFED, so I have to wait a lot. Unless you order to pickup inside. I always manage, sometimes even run into Publix for a quick pick up,while my special 🍕 is baking.",a month ago,Open,1000840876
Jasmine Atkinson,5.0,Great staff and wish for gluten free menu,a month ago,Open,1000840876
Manuel Flores,1.0,It says it closes at 11 but at 9:20 they don't have or prepare pizza very bad,a day ago,Open,1000840876
Teresa Pacheco,1.0,Worst customer service ever today & i came here many times before. The 3 working in the front was so busy talkin when i went in they acted like they didnt even see me & i had to speak to get their attention. They made my pizza wrong & when …More,3 months ago,Open,1000840876
mirna trejos,5.0,"Very easy to place the order online, just come pick it up open the door verse the code number for your order and that's it. You don't have to wait for nobody to take care of I love it",7 months ago,Open,1000840876
Padrino Soy,5.0,"Excellent pizza, good price
to fill you up... Under 15 minutes
waiting time...",a month ago,Open,1000840876
kadezya harper,5.0,Awsome costumer sevice  Emily and her crew took good care of me and food ❤,4 months ago,Open,1000840876
Bobby Ojeda,5.0,Their Pizza still one of the great tastiest in my neighborhood.,3 months ago,Open,1000840876
Chay Blakely,1.0,The pizza tasted funny and the wait was ridiculous.,a month ago,Open,1000840876
Mayyy D,1.0,Horrible rude management! Definitely will never purchase from this store again.,4 months ago,Open,1000840876
Aurelio Vizcardo,5.0,"New cashier, very polite and diligent.",3 months ago,Open,1000840876
Hangry Sumtimes,5.0,I've been eating Little Caesars for almost 30 yrs..Still love it,4 months ago,Open,1000840876
Justin Rosier,5.0,I enjoy coming to Little Caesars.,2 months ago,Open,1000840876
Juan Pablo Lopez,5.0,Great pizza at a good price customer service is doing great understanding and calm with the guest.,8 months ago,Open,1000840876
Oscar Navarro,4.0,"Fast service, and excellent customer service",2 months ago,Open,1000840876
Maxwell Nelson,4.0,"You can actually ""see"" them making your pizza. Clean facility, taste fresh.",9 months ago,Open,1000840876
Waris Siddiqui,5.0,"On time delivery, Good delivery",2 months ago,Open,1000840876
ian alcayaga,1.0,Ordered our food and then when we went to go get it they said they were closed,4 months ago,Open,1000840876
Luna 34,5.0,"Its change, it looks very nice and clean, new people with nice customer service. 😊👍",9 months ago,Open,1000840876
R C,4.0,"Good pizza. It isn’t my favorite pizza, but it’s pretty good. It is cool how you unlock the pizza with your order.",a year ago,Open,1000840876
Moni Cel,5.0,Great place.,2 months ago,Open,1000840876
Andre Beaufils,5.0,Nice and clean,3 weeks ago,Open,1000840876
Magic Carpet Ride,4.0,Fast and friendly pizza was hot,5 months ago,Open,1000840876
Ada Velez,1.0,Ir way cold,3 weeks ago,Open,1000840876
Maynor Chavez,4.0,awesome pizza but its too greasy,11 months ago,Open,1000840876
Luigi P,5.0,Great customer service,4 months ago,Open,1000840876
JOEY Cobalt,4.0,Like the prize. Like the thin crust. Love the sufficient cheese and meat. I love their pizza. I will buy here whenever I crave again for pizza.,a year ago,Open,1000840876
Matthew Walker,5.0,Best place for cheap pizza on a budget,8 months ago,Open,1000840876
Lucy Flores,3.0,Sometimes they add too much sauce in their pizzas. But other than that its good.,a year ago,Open,1000840876
Desert Locust,2.0,"This place used to be a great, cheap pizza place. Nowadays it's a damn mess and you gotta wait 30 min for a pizza. A regular Pizza. After the lady went and said ""3 min"" it took 28 min on the dot, for Lil Caesars lol. Two stars because it used to be good.",a year ago,Open,1000840876
Ricardo Correa,1.0,"Never answered the phone or gave explanation if temporarily closed. Don't buy from here, find better service.",10 months ago,Open,1000840876
Ross Cotzen,4.0,The pizza is very good but it has to much cheese,a year ago,Open,1000840876
Andjela Mesidor,5.0,Love them but they make people wait too long especially when they busy,a year ago,Open,1000840876
Seth Lopato,3.0,For the money it is the best pizza going its a shamr this location is not as efficient as they should be pizza great service and speed need improvment,a year ago,Open,1000840876
Yeimi & Imari,3.0,It's good but work on customer service! To be great!,a year ago,Open,1000840876
Hooyah Fish,1.0,"I try to give this place another chance every couple months and they always mess up my order.
They are the worse little Caesars franchise in Miami. …More",2 years ago,Open,1000840876
Tania Morraz,3.0,Cheese Pizza was okay but tasted like it had been sitting  for a while. Cheese was not hot.,a year ago,Open,1000840876
Veronica Suarez,1.0,Employees were not polite and they were on their phones talking nonsense. They acted like they didn’t care about working here.I had to wait a long time.,a year ago,Open,1000840876
Joe Black,5.0,Great service. Manager was really nice. Pizza was fresh. No complaints. Better than a lot of little Caesars in the area.,2 years ago,Open,1000840876
Mark Aguilar,4.0,Get the stuff cheese crust pizza with pepperoni the best.,a year ago,Open,1000840876
Queenie Bee,2.0,"My experience was not so good. I went on a Sunday night and although the cashier was nice he was misleading. I called mmtwice and confirmed all was good, just taking some time. It took about an hour to get it.When we got it, my friend …More",2 years ago,Open,1000840876
Jake Herring,2.0,"Two stars only because the price is very convinent. That being said the current employees are unprofessional. You're at work, no need for airpods. Maybe giving your full attention will prevent future mistakes. I ordered online and waited an …More",a year ago,Open,1000840876
Enoch Richard,4.0,"Good pizza, order online and my favorite...",a year ago,Open,1000840876
Paul Trainer,5.0,The best cheapest piece of pizza you'll ever eat LOL the chicken wings are kind of tasty and their crazy bread is off the hook especially with the garlic butter dipping sauce you can walk out of there with a meal for 10 bucks and feed four people LOL..pj,a year ago,Open,1000840876
dadas world,5.0,My kids love this place love the pizza love the customer service,a year ago,Open,1000840876
Marco Polo,3.0,"It  is what is, fast and cheap can't be beat..",a year ago,Open,1000840876
Pam Moss,3.0,The pizza was hot and fresh i also order buffalo wings that had just the right heat.,a year ago,Open,1000840876
Josue Mirtil,4.0,One of the quicker little Caesars. In and out pretty fast,a year ago,Open,1000840876
Ernst St Jour,5.0,Use the app for smooth service,a year ago,Open,1000840876
PEMG HUSTLE WOMAN GROUP,1.0,"NOT ANSWERING THE PHONE RIGHT NOW!
CANT ORDER A PIZZA BECAUSE THERE ISN'T A NO SAUCE BUTTON ONLINE!!!
9:26 PM WEDNESDAY NIGHT!
DATE 12/12/18",2 years ago,Open,1000840876
Dandy Dan,2.0,"The app said the pizza was ready, I stood around for 10 minutes because it wasn't. The lady at the counter was rude and very impersonal (would have killed her to smile) and wasn't even empathetic over it. This pizza joint is hit and miss. This time it was a fail...",a year ago,Open,1000840876
Oved Rojas,1.0,"Wasn't offered breadsticks when purchasing a pizza so I asked for the free breadsticks offer that is clearly on the front of the register and was replied with ""we dont have that promotion going on anymore""... if that is so why would you still have the promotion showing in the front? Second time this happens to me.",a year ago,Open,1000840876
Robert Big Dawg,1.0,You call they hang up 10xs went and advised employee she said she dont care im notifying GM in morning,a year ago,Open,1000840876
Janice Waite,4.0,Pizza good and  staff nice!,a year ago,Open,1000840876
Agatha Leyva,5.0,This place is great for buying cheap delicious pizza.The wait time is not long and the employees here have good customer service.,a year ago,Open,1000840876
Stephie M.,1.0,"Wow.... this used to be so fast and customer friendly. Slowwwwww up to the point they mess up on your order. Even an older gentleman that works there walked out on them. The ""adult"" that seems like the manager is a child. Good luck at this franchise location!!!..",2 years ago,Open,1000840876
Autosport Driving School,5.0,"Great pizza, and great prices",10 months ago,Open,1000840876
Eduardo Perez,5.0,It's a lot better now alot  better thank you,a year ago,Open,1000840876
Kimbery Carder,4.0,Great spot for good pizza with friends and family! Can't go wrong,2 years ago,Open,1000840876
Drone_us abergrichard,3.0,Kind attention,5 months ago,Open,1000840876
Edwin Curet,5.0,Iservice isvvreat Ndpployees Re great,a year ago,Open,1000840876
THERESA MURPHY,1.0,Very rude the woman at the cashier.  It's ashame because I have been going there since they opened up,a year ago,Open,1000840876
Mike Nichols,5.0,Great staff and wish for gluten free menu,a year ago,Open,1000840876
JokerTheArtist,1.0,I went to pick up my pizza which I ordered over the phone and once I picked up went home to a 1 and a half eaten pepperoni pizza slice in my box. Going back would have been pointless. …More,a year ago,Open,1000840876
Caleb Denis,1.0,"THEY NEED TO REMOVE THE TERM ""HOT AND READY"". IT IS NEVER READY!!!!! THEY TAKE TOO LONG TO ANSWER THEIR PHONE. THEY FORGET ORDERS. IF YOU ARE IN A RUSH FOR PIZZA, DONT COME TO THIS ONE.",2 years ago,Open,1000840876
Joseph Ramos,5.0,Had to wait a while but good,a year ago,Open,1000840876
Angel Villegas,5.0,Fast and best price for a good pizza!!!,a year ago,Open,1000840876
Vanessa Spradlin,1.0,"Now I know never to come here again I really hope other people read this. The young short dark skin girl at the cash register who said her name is ""Angel"", which I highly doubt because she acts like a demon, got an attitude with me when I …More",4 years ago,Open,1000840876
Sativa Fever,3.0,Not the best pizza but not the worst. Make sure to check special orders as they mess those up frequently.,a year ago,Open,1000840876
Nita Tyler,1.0,It's was not even three o'clock and the ran out of everything and told the customer's where close,a year ago,Open,1000840876
Victoria Aguirre,1.0,35 min wait for pizza?? What happened to hot and ready? Terrible experience,2 years ago,Open,1000840876
Jonathan Alvarez,4.0,Good pizza and service,9 months ago,Open,1000840876
Gary Seymour,4.0,Price is right.   New renovations.,9 months ago,Open,1000840876
Mott Marvin Kornicki,5.0,Consistent - Good and Fast!,a year ago,Open,1000840876
Darlene Lewis,4.0,"This is a Fast food pizza restaurant..The prices are from$5.00 up to $9.00 per pizza.. Customers can also get a deal witch including soda, Sauces,wing's or Crazy Bread..The parking lot has many spots for the customer..",2 years ago,Open,1000840876
PERLA RUIZ,5.0,THE GUY N THE GIRL TONITE WERE VERY NICE N VERY ATTENTIVE TO OUR ORDER,2 years ago,Open,1000840876
Mario fernandez pena,1.0,This isn't the little ceasers I go to but the one I go to is horrible are they all like that?,2 years ago,Open,1000840876
Charlie James,1.0,"Waited longer then was told I would have to for them to tell me they forgot to make one of my pizzas, I chose to wait as it was the one my son wanted. After waiting an additional 20mins, I inquired about what was going on to be told it had …More",a year ago,Open,1000840876
Meyling Diaz,5.0,I love the think crust pizza very hot and juicy. 👍👍,a year ago,Open,1000840876
Carlos Urrego,4.0,Not my favorite but is good for a quick meal,2 years ago,Open,1000840876
Corenza Glenn,5.0,Fresh made pizza at great price6,a year ago,Open,1000840876
Mr305Maxxx,1.0,Dirt cheap ingredients for dirt cheap food.,9 months ago,Open,1000840876
Gladys Torres,5.0,Always short staffed but the food is amazing,a year ago,Open,1000840876
Anthony Caballero,2.0,Took very long pizza tasted great though,a year ago,Open,1000840876
Fred P1977,2.0,Cant go wrong w 5bux pizza,a year ago,Open,1000840876
Michael All Nite White,3.0,Has to wait on a ultimate supreme Pizza for 15 minutes they should have a few ready like they do the pepperoni pizzas.,2 years ago,Open,1000840876
saygnite gracie,4.0,Great service. Great ppl behind the counter.,2 years ago,Open,1000840876
Turismo con Alex Uribe,5.0,The best pizza to enjoy and visit,a year ago,Open,1000840876
Blaine P-Turtle,5.0,Great pizza but we had to wait like 15 minutes for them to make it.,2 years ago,Open,1000840876
Mauricio Montoya,5.0,"Perfect flavor, perfect price. Personally recomend you the five meats pizza!!!",2 years ago,Open,1000840876
Sunshine johns,5.0,Friendly fast and cheap,a year ago,Open,1000840876
Lautaro Silva,5.0,Customer service was excellent only Wait Almost 2 minutes customer service was very good they probably only need more employees managers was always on the floor and employees always aware that attention to service and an excellent presentation keep up with a good service,2 years ago,Open,1000840876
Juan Carlos Holguin,4.0,Sometimes you have to wait a little but flavor never disappoints you.,2 years ago,Open,1000840876
Jamir Johnson,5.0,"Great energy, good drinks, great food no complaints",2 years ago,Open,1000840876
Juan Fernandez,5.0,I love that bacon wrapped pizza,a year ago,Open,1000840876
William Rodriguez,5.0,"Great place to find good pizza at great price, clean please, good costumer service. Big parking space.",2 years ago,Open,1000840876
gabriel conde,5.0,They renew the way to order and is very simple and easy.,2 years ago,Open,1000840876
Jorge Rodriguez,1.0,"The wait time was disgusting for items that suppose to be hot n ready all day long!! I was there for about 40-50 minutes waiting just for 2 pizzas and chicken wings, makes no sense i can make my own pizza in that freaking time.",3 years ago,Open,1000840876
The Illustrious One,1.0,"Terrible service, I'm beginning to think this company abuses it's employees a great deal because they're all absolutely abysmal with service",a year ago,Open,1000840876
Luis Cordero,1.0,"This place is the worse. Not only I had to wait for my order which was made online but they keep wandering and not one of them knew what was going on. If you’re going to order at the store be prepared for be there for more than half hour. And if you order ahead, it will be the same.",2 years ago,Open,1000840876
dwayne clinkscale,5.0,Easy way to feed the kids,a year ago,Open,1000840876
Jenny Rodríguez,5.0,Se tarda un poco but the service is so god and have so nice people,2 years ago,Open,1000840876
Stephanie Donnis,1.0,Had to wait for a long time to receive my pizzas even though I called ahead with my order. Terrible service,a year ago,Open,1000840876
Vladimir Delgado,5.0,Fast attention and very good pizzas,a year ago,Open,1000840876
anabel ramirez,5.0,Good,5 months ago,Open,1000840876
Carlos Maurici,1.0,"if you want something quick this is not the place to go. The first time i went to get a hot n READY when i got there they had to make the pizza, it took 30 mins for them to give it to me, three people before me were waiting for pizzas too …More",2 years ago,Open,1000840876
Sandra Lampariello,4.0,Fair pizza for that low price,a year ago,Open,1000840876
Golden Crown Deb,4.0,For a quick & cheap for the night it's good.,2 years ago,Open,1000840876
Alison Rivera,4.0,Great and busy,a year ago,Open,1000840876
Carlos Barreras,5.0,Great customer service and very smooth process....,2 years ago,Open,1000840876
louispwch,4.0,Friendly and excellent customer service food were all so great.,2 years ago,Open,1000840876
Carlos Heredia,5.0,Hell yea $5 😁 ..,a year ago,Open,1000840876
Jeanluis Aguilar,5.0,"Good pizza, it only takes 10-15 minutes to have a delicious pizza ready for you.",3 years ago,Open,1000840876
RAFAEL GOMEZ,1.0,This place is SLOW WITH SERVICE,a year ago,Open,1000840876
Jhon Florez,5.0,"This might be little ceasars, but it's a BIG deal! Thank You Little Ceasars Pizza 🍕 for the small things in life. I love you.",3 years ago,Open,1000840876
Aron Zeraus,1.0,The place was full and very short staffed. I found cardboard pieces inside my 2 pizzas. I ordered 2 cheese pizzas and 1 pepperoni. They gave me 2 pepperoni and 1 cheese. This has not been the 1st time that this has happened. The service has changed and not for the better.,3 years ago,Open,1000840876
Diana,5.0,"I ordered a veggie pizza, no cheese + pineapple, yes a weird order, and even like that the people there were super Nice and they made the Best pizza I ever had in all the little Ceasars. Thanks guys!",4 years ago,Open,1000840876
Buy Herbalife Nutrition,1.0,They mess up every single time I come here. This time I tried to place an order over the phone and they never made it so I decided to wait for an HOT N READY which is supposed to be READY but I waited 15 minutes and no signals of my pizza being ready so I left. Never coming back,2 years ago,Open,1000840876
Tricia Lindsay,4.0,The service was awesome. My pizza was delicious.,3 years ago,Open,1000840876
Daniel James,1.0,First review: late july... Dude cooking the food is walking around with his headphones on... and aside from crazy bread they don't have anything hot n ready... at 7pm... isn't that their whole thing now? …More,4 years ago,Open,1000840876
freddie pierre,5.0,Great customer service,a year ago,Open,1000840876
Jose Velasquez,5.0,I loved the pizza . Also my family bought the  pizza and had so much cheese that I ate the whole tasty pizza :-),5 years ago,Open,1000840876
Maribel Valdes,1.0,****Horrible service!!!!**** Order is ALWAYS wrong and pizza portal is NEVER on time. Staff is incredibly rude. Save your money and go somewhere else.,a year ago,Open,1000840876
jay black,2.0,Not very clean but ok service,a year ago,Open,1000840876
Erik Pérez,1.0,"Pizza is good and cheap, however, the customer service is terrible. Worst experience ever.",4 years ago,Open,1000840876
Smitty Dorsainvil,5.0,Cause it is tasty and cheaper to eat my favorite pepperoni and cheese yesterday...,3 years ago,Open,1000840876
Msdulie Msdulie,5.0,Fresh and hot pizza at all time with awesome customer service,3 years ago,Open,1000840876
Wallyne Volcy,4.0,Great place to grab a quick pizza and great service.,3 years ago,Open,1000840876
Elijah Eliassaint,5.0,very fast services,a year ago,Open,1000840876
Lexy Jean,1.0,It has delicious pizza but they said we could get free crazy bread and my granny asked for one and said it cost cash then after we got the pizza she said next time try to catch em and my granny rudely said oh i will i think that is rude …More,3 years ago,Open,1000840876
Yves Celestin,4.0,Good bread sticks,a year ago,Open,1000840876
Edward Henry,4.0,Pizza is almost always fresh as it's such a busy location.,3 years ago,Open,1000840876
FERNANDO AGUIRRE,1.0,"I called to order  Deep Dish pizza  with extra cheese en extra peperoni, they say They don't have cheese
They really suck",4 years ago,Open,1000840876
Kevin Jones,1.0,Good food but horrible customer service. I don't eat there when I see that overweight African American lady. She's there during the week around noon,5 years ago,Open,1000840876
Evens Renard,5.0,This place was nice and it's not bad,3 years ago,Open,1000840876
alex a,1.0,Horrible service 30 minutes for them to make a pizza. Poor management,2 years ago,Open,1000840876
Juanca Robles,1.0,"You have to wait a lot and the customer service is horrible !!!!! If could put ""0""....I would!!!",3 years ago,Open,1000840876
Cheryl Comery,5.0,Very good prices,a year ago,Open,1000840876
paola cortes,5.0,"Very friendly employees, pizza was great!",2 years ago,Open,1000840876
Joey Garcia,1.0,Very very poor service they gave him a new look and now the place is slower the employees don't care,2 years ago,Open,1000840876
dany Perez,1.0,im a regular customer I come every friday. But today I ordered by phone and they told me go come in 15 Mins so and the pizza wasnt ready so they told wait a few mins longer so i did 25 Mins later I found out that one of the ladies made me …More,5 years ago,Open,1000840876
Kyla Wilcox,5.0,Good cheap pizza,2 years ago,Open,1000840876
Richard Rondon,5.0,Berg good,a year ago,Open,1000840876
Angelzu. Torres,1.0,"This location is HORRIBLE the costumbre service is the WORST EVER, the Store smell like weed, all the employes are eating and talking on their phones, and they talk to the costumer really bad must of then looks like they are using drugs Durango they are working",4 years ago,Open,1000840876
rabson senat,3.0,Customer service is a bit questionable,a year ago,Open,1000840876
Natalia Johnson,4.0,Great location!,a year ago,Open,1000840876
Franklin Vargas,1.0,"This location is the worst, worst customer service and the phone orders they sey ok in 10 min is not true never are ready. I like this pizza but I'm very desappointing for it, same my friends and we all the time buy other kind of pizza.",5 years ago,Open,1000840876
Magenelle Silverblade,5.0,Love the Italian Cheese Bread here!,3 years ago,Open,1000840876
John Chicas,5.0,"When, a new cashier still in training can't be alone at the counter she always needs someone at her side, especially if she doesn't have a code to sign in.",a year ago,Open,1000840876
Leo Mendez,1.0,The new promotions never are ready ....always   say can u wait 15min...come on..the ads say 4to 8pm always ready.....the worse service little caesars 1812......the owner must change employers....,3 years ago,Open,1000840876
Paul Cruz,5.0,Fast and friendly,2 years ago,Open,1000840876
Ciara mills,5.0,The pizza was super hot and fresh,3 years ago,Open,1000840876
Juan Grullon,4.0,Good place,a year ago,Open,1000840876
Luna Mateo Family,1.0,"my 2 kids got sick after eating there....

1st and last time i buy pizza there, may be the cheese was bad or something , i will stick to my regular pizza places",2 years ago,Open,1000840876
Jasmine Rosa,5.0,Fast and fresh.,a year ago,Open,1000840876
Hans Mahecha,1.0,They don't  have anything ready and they won't do more of any product. Customer service is horrible,4 years ago,Open,1000840876
Firoz Ali,5.0,OK & EXELLENT,a year ago,Open,1000840876
Dominic Nicolau,2.0,"Faster than this place you won't find
No more now you are ignored for minutes and then you have to wait more time to get the fast and ready pizza",a year ago,Open,1000840876
Omar Gog,1.0,No cheese alot of suace half way cook,5 years ago,Open,1000840876
Lucia Rodriguez,4.0,Good,9 months ago,Open,1000840876
Yadira R.,1.0,They are the worse little Caesars franchise in Miami.,a year ago,Open,1000840876
Luis Giraudy,4.0,Great and quick food,3 years ago,Open,1000840876
Francisco Miralles,5.0,Good food,a year ago,Open,1000840876
C Pas,3.0,Amatur staff,a year ago,Open,1000840876
Dr. Natasha Allen,2.0,Slow. Nothing hot or ready at 2:30pm smh,2 years ago,Open,1000840876
Carlos Mendoza,2.0,the employees are very slow,a year ago,Open,1000840876
Alex Anillo,1.0,"30 minutes to get a pizza, first and last time going there.",2 years ago,Open,1000840876
Omar Samman,5.0,I.  Like.     Food,a year ago,Open,1000840876
Van Brooke,1.0,Wrost customer service in all NMB.,3 years ago,Open,1000840876
ali perez,1.0,"This location is the worst, worst customer service and the phone orders they sey ok in 10 min is not true never are ready.",3 years ago,Open,1000840876
Roger Cruz,2.0,"This pizza is not made well, it was with a lot of bubbles and the mass it was too thin,not right, I will never going there again to purchase it.",a year ago,Open,1000840876
Art Breckow Jr,1.0,"Left me on hold.phone on counter for 20 min.got to store and informed them im on hold.kid who says is manager,just said "" my bad"".then wanted me to apologize to him because i told him to pick up The damn phone.some service..",2 years ago,Open,1000840876
Dimitri Baptiste,5.0,Amazing,a year ago,Open,1000840876
Luis Tobon,5.0,quick service,a year ago,Open,1000840876
Carlos López,4.0,I like it,a year ago,Open,1000840876
jesshe,2.0,Sunday no pizza ? Slow service,2 years ago,Open,1000840876
Luciano Paredes,4.0,The pizzas are cheap and big.,2 years ago,Open,1000840876
Carlos Duty’s,4.0,To slow to take the orders,2 years ago,Open,1000840876
Aurelia Pizarro,5.0,Excellent Pizza Place!!!!Great fast service!!!!Must go!!!!Very Highly Recommended!!!!,5 months ago,Open,1000840876
Alessandro Balsamo,1.0,Did not get the call,a year ago,Open,1000840876
Sean Uccello,4.0,Good pizza for $5.35,3 years ago,Open,1000840876
Maria Oria,5.0,Good pizza,2 years ago,Open,1000840876
Raul Gonzalez,1.0,Wait time for pizza was horrible poor management,2 years ago,Open,1000840876
RubRubi Ruiz,5.0,Fast on the clock,a year ago,Open,1000840876
Armando Lopez,3.0,Good Pizza to go,a year ago,Open,1000840876
Valeria Nunez,3.0,Service is slow,a year ago,Open,1000840876
Dulce Borje,1.0,Never ready,2 years ago,Open,1000840876
Hee Hoo,5.0,Yum,a year ago,Open,1000840876
