name,stars,text,timeSince,openStatus,key
Maria Gonzalez,5.0,"My family and I are not from around here. The owner was very nice and explain the menue well. Anyways we love the Pizza 🍕 the cheese tasted different from what I usually eat in Houston, will definitely come back when I am out here again. I do recommend it.",3 months ago,Closed,1000927383
Dustin Heck,5.0,Very good! first time here. super clean and very nice people. Very big baked potatoes! Will definitely be back. Thanks,a year ago,Closed,1000927383
Jennifer Cools,5.0,"Great place for pizza, subs, baked potatoes, wings, and more! The owner and staff are very friendly and they will let you customize your order any way you want, as long as they have the ingredients. Very good!",2 months ago,Closed,1000927383
John Powers,1.0,"Worst place to order from.  Horrible customer service.  They will never get my business again.
Hung up on me and told me to order somewhere else because he didn't like the way I placed my order.",3 weeks ago,Closed,1000927383
Sarah Barnett,5.0,"Between Louisiana and Texas on 84 there isn't much to choose from and absolutely no pizza places and especially not one open on a Sunday night. This pizza place was an answer to my kids prayers. The food was good, the staff was even better. …More",2 years ago,Closed,1000927383
Lil Happy Lil Sad,5.0,"Really Really Really  nice people, makes you feel like family,  good food. Always satisfies, they work hard i recommend this place, wont be disappointed!",6 months ago,Closed,1000927383
Shinenna Pierson,5.0,Great food!! Mr. Jeremy & his niece were the best! Pizza Pro has the best Strawberry Cheesecake Sno Cone! I'll be back soon.,7 months ago,Closed,1000927383
Mykeal Smith,5.0,"They make the best pizza, I have ever had! And that is saying something! They are extremely friendly, and treat their customers with respect! Located In Mt. Enterprise Texas, I highly recommend!",a year ago,Closed,1000927383
785Crew 20,5.0,I ordered a pizza here and pizza was OK. My ratings are for the service and pizza combined. The gentleman and young lady working the shop with him were kind and down to earth. I recommend coming here for a quick bite/cold drink. They do …More,2 years ago,Closed,1000927383
Chance Lindsey,5.0,"Great pizza and service, you have to try the cheese sticks! We always order ahead when we are driving through the area.",11 months ago,Closed,1000927383
Tony Chiaia,5.0,An excellent experience on our many visits. The staff make you feel like family and its always a joy to visit.,9 months ago,Closed,1000927383
Chuck Rollins,5.0,"Really polite, great service, good food, fair price !",a year ago,Closed,1000927383
cyberhex gaming,4.0,Really good pizza just needs to be cheaper and deliver to more places,a year ago,Closed,1000927383
Austin Dukes,5.0,Dang good food! SUPERB!,a year ago,Closed,1000927383
Robbie Prentice,5.0,Pizza and service was great!,a year ago,Closed,1000927383
Jeff Rector,5.0,Enjoyed a GREAT BBQ-stuffed potato served by sweet Reagan. Thumbs up!,2 years ago,Closed,1000927383
Irma Resendiz,5.0,The food is very good and the people are welcomeing and nice.,a year ago,Closed,1000927383
Brittani Garcia,5.0,Great people. Awesome food and a fun environment.  They make everybody feel welcome.  And snowcones are GREAT!!👍👍👍👍,3 years ago,Closed,1000927383
Lawrence Gill,5.0,"Super great people, and the thin crust pizza was the perfect amount of crisp. Flavor was off the charts. Go see Rex!",3 years ago,Closed,1000927383
D king,5.0,Very good pizza and friendly service,2 years ago,Closed,1000927383
Suni Alexander,5.0,Family owned great people fantadtic food,2 years ago,Closed,1000927383
Chad Smith,5.0,Super friendly folks and the food is great!  They offer much more than pizza. Go check them out!,4 years ago,Closed,1000927383
Mckenzie Windham,3.0,Not bad.  Could be better.  People that own and run it are super nice!,5 years ago,Closed,1000927383
2001 Pontiac Firebird V6,4.0,Verry nice! Has great snow cones however place is small and pizza is mediocre,2 years ago,Closed,1000927383
Sydney Pierce,5.0,Great food! Great Service! Bery nice people!,4 years ago,Closed,1000927383
Kenneth Atkins,4.0,Great food🍴🍕🍔,a year ago,Closed,1000927383
Beverly Herring,3.0,It the only place to get pizza in Mount enterprises,a year ago,Closed,1000927383
Rene Cates,4.0,Fresh hot and good pizza.. staff is awesome,3 years ago,Closed,1000927383
Dave Cronkrite,5.0,Great little Pizza Pro.,2 years ago,Closed,1000927383
Thom Long,5.0,Love this place and these people,2 years ago,Closed,1000927383
ruth Ramirez,5.0,Always great fast service,3 years ago,Closed,1000927383
Misty K,5.0,owners are friendly and super nice !!!! great pizza best in town !!!!!!,3 years ago,Closed,1000927383
Jassi Kambo,5.0,,a year ago,Closed,1000927383
Andrew May,5.0,,3 years ago,Closed,1000927383
Lonnie Boyette,5.0,,a year ago,Closed,1000927383
Leticia Perez,5.0,,7 months ago,Closed,1000927383
Javon Yarbrough,4.0,,a year ago,Closed,1000927383
Lucy Canchola,5.0,,4 years ago,Closed,1000927383
Jason Roberts,5.0,,2 years ago,Closed,1000927383
misha morley,5.0,,a year ago,Closed,1000927383
sharrod tipps,5.0,,a month ago,Closed,1000927383
Rocky Otwell,5.0,,11 months ago,Closed,1000927383
Autumn Stewart,5.0,,2 years ago,Closed,1000927383
Daryl Silkwood,4.0,,2 years ago,Closed,1000927383
