name,stars,text,timeSince,openStatus,key
VaKyra VaKyra,5.0,"The Best Pizza in the City! Friendly staff, great prices. Jade was very helpful in the process of building my pizza. Taste & Quality is amazing!",a week ago,Open,49
Joseph Connor,4.0,"First time ever experiencing it, needed a quick bite after having delivered our son to Ohio State. Very convenient to campus and affordable. Got it to go, but the feel of the restaurant was great. Need to buy more than a few to fill up as …More",a year ago,Open,49
Haley McCrory,1.0,"the slowest restaurant on high street. really good food, don’t get me wrong. I go weekly and each time I can count on it taking AT LEAST 45 minutes to get my food- even if I am the only person in line. Note: I only order a simple pie!!! …More",2 weeks ago,Open,49
classic toy Queen my channel Johnson,5.0,"They are very nice people and always have my orders ready on time.....fast friendly service, great food too...",2 weeks ago,Open,49
Tashina Jones,5.0,I went to Blaze for the 1st time Sunday night. I ordered online and arrived a few minutes after the time it told me to pick up. When I arrived I saw the young lady boxing my 1st pizza. We ordered 2 take 2 specials with the mozzarella salad. …More,2 months ago,Open,49
Shayanna Hinkle-Moore,5.0,"I love this restaurant! The food is always good, the establishment is clean, and the employees are always friendly! Today I was helped by Liyah and she made the experience amazing! I’ll definitely be back.  :)",a month ago,Open,49
Will Eaton,4.0,"Pretty great for the most part. The only issue is how slow they are at processing online orders. Not the end of the world, but it can be pretty bad.",a month ago,Open,49
anthony copa,4.0,Outstanding pizza... Thin crust holds up to toppings... Place needs deep deep  cleaning otherwise would have been a 5,a year ago,Open,49
Carrie,5.0,Love this build your own pizza!! Better if you eat there while it's still hot;),3 weeks ago,Open,49
cornelius ramsey,5.0,Deci was awesome her customer service blew me away. Plus this is my first time being able to go some where to eat since corona started. Thanks young lady. Keep up the cheerfulness,2 months ago,Open,49
Owen Milnes,5.0,"A great experience, the person who made my pizza, Day-see did a great job and was incredibly kind and personable. A quality experience and I highly recommend this restaurant!",a month ago,Open,49
Deep Patel,5.0,The pizza was amazing. Jade was very helpful in making my order.,a week ago,Open,49
Daniela Warner,5.0,Pizza and the setting at this place is excellent. I love this place always quality food & service. The bill was reasonable I would say.,2 months ago,Open,49
Chad Frazier,5.0,A fav spot for delicious pizza. Everyone at our table was very satisfied. The service was very friendly and kind. The bill was fair I would say.,2 months ago,Open,49
Emma Atkins,5.0,"This was my first time at Blaze and it was incredible!!! Fast, amazing costumer service with the nicest works and the pizza was to die for!!! Kevin was the best by the way!",a month ago,Open,49
Alex Brooks,5.0,This place has the best pizza I have ever ate in town. The staff is wonderful.,a month ago,Open,49
Andrew Hopson,2.0,Ordered from here through postmates. it took almost 3 hours to get the pizza. pizza was cold and not very good. the delivery driver blamed blaze pizza saying they gave our pizza to someone else and had to remake it while he waited. I don't …More,2 weeks ago,Open,49
Kelly Vandervort,4.0,"Traveling through the area, we were THRILLED to find a Blaze Pizza! You just can't beat the personal size build your own pizza for just under $9. …More",a year ago,Open,49
Chase Moran,5.0,Deci was wonderful and the rest of the staff were polite and quick. Good food,a month ago,Open,49
Olaniyi Gaiusbayode,5.0,Shout to Jade for making two bomb pizzas. Also she kept informed on what's going on with door dash which I appreciate.,3 weeks ago,Open,49
Julia Sophia,5.0,Kevin was so kind and made sure I felt comfortable — as it was my first time at Blaze Pizza. The pizza was phenomenal and I can’t wait until my next time here! Great experience.,4 months ago,Open,49
HD Exteriors LLP,5.0,"GREAT food, GREAT staff, GREAT service. Highly recommend !!! And did I mention great food?",a month ago,Open,49
Stacey Li,5.0,Just went there for the first time - food was good and service was excellent. Shoutout to Liyah for helping us out!,a month ago,Open,49
Shrenik Jain,5.0,The manager Jade was amazing! She helped me make my pizza and assisted me with all my queries as well!,a week ago,Open,49
Jevon R,1.0,I ordered 3 pizzas through uber eats and 2 of them were so burnt they were black underneath and the third was just barely edible! Not to mention the WHOLE garlic cloves thrown onto the pizza when i asked for roasted garlic. I'll never eat here again,3 months ago,Open,49
Peter Amundson,4.0,Pizza is good. S’mores pie is a rip off... don’t get it. Will be back!,a month ago,Open,49
Nicholas Christopher Hood,5.0,"VEGANS! This review is for you. I have eaten at Blaze a few times. I’ve been very pleased every time! Just ate a cauliflower crust, grain base cheese and soy based chorizo with spicy tomato cause and a drizzle of barbecue on top. It was …More",4 months ago,Open,49
Rayven Juanengo,5.0,Kevin is an excellent employee! He seemed to be training two people while running the restaurant AND making pizzas all at the same time. He was super friendly and made sure we were taken care of even though the store was busy. My husband …More,8 months ago,Open,49
Gigi Vollmer,5.0,Kevin was the bomb- so helpful and super good pizza.  I had never been there and he guided me through everything! Love this place.,4 months ago,Open,49
Roy Aguilera,4.0,"Never tried Blaze and we gave it a shot, I tried a custom built pizza adding all the extra.  They tossed into the oven and we each had our own individual pizzas. We loved the pizzas. Definitely try this out if you like thin crust pizza.",2 years ago,Open,49
Kyle Ratajczak,3.0,Fast food pizza places are popping up all over Columbus but unfortunately Blaze is near the bottom. The interior is nice enough and their focus on quality ingredients is appreciated but the pizza itself mediocre at best. The pie size is …More,2 years ago,Open,49
Holly Frederick,5.0,It was actually really good. Ive had rapid fire in kent and it was gross. Go for the white sauce brings the flavor out more. IMO. And def add the garlic. It made it that much better. Great suggestions by the worker. I'll b back,8 months ago,Open,49
Kelly Cruse,5.0,"This is the first time I've tried it, and it's AMAZING. You tell them all you want on it and they make up your pizza right in front of you. It's also really quick. Make sure you have them add pesto sauce, across the top, after they take it …More",2 years ago,Open,49
Stoke Loc,5.0,Damn good pizza man !!! And its affordable I'll be back..😁😁,2 months ago,Open,49
Ms Alexander,5.0,One of my Favorite pizzas 🍕 so good,a month ago,Open,49
Sam Meyers,5.0,The employees were amazing!! Food came out perfect. We even ordered a couple of pizzas to take home and bake and they were very accommodating to get the pizzas ready for us. Great vegan/vegetarian options!,10 months ago,Open,49
Drusilla Jackson,2.0,Unprofessional when it comes to dealing with customer's. I know everybody has a long day and gets tired but the server's were very rude this particular night also very argumentative on sunday August 30th around 10:30pm whatever crew that …More,2 months ago,Open,49
Gabriella Reyes,5.0,"Kevin is extremely friendly and was so inviting when I came to get pizza! He handles all customers well, even children! He makes blaze welcoming to everyone. I love blaze and definitely will be coming back! Thanks Kevin for an amazing experience!",8 months ago,Open,49
Douaa Bennani,4.0,Very delicious and fast service,a month ago,Open,49
matt rivers,5.0,"Kevin is awesome, super friendly and superb customer service. Come back weekly just because of my guy Kevin!! #1",4 months ago,Open,49
Vic SaL,5.0,Best pizza and customer service everrrrr!!!,a week ago,Open,49
Jessica E,5.0,I'm so happy this is in Columbus! I lived in florida for 5 years and was super excited to find a blaze pizza in ohio! I turned my boyfriend into a fan as well! they now offer vegan chorizo and its AMAZING!!,a year ago,Open,49
Phill Camick,5.0,"""Build your own"" is a great deal! My wife (vegan) got the cauliflower crust and says it's the best she's had anywhere.  Highly recommend this place.  Oh,  and try the root best.  They use real sugar and it's the best I've had anyplace!",11 months ago,Open,49
Kala S,5.0,My mom and I were visiting Columbus from Mansfield--just spending the day walking around & looking at the shops around High St--and my uncle recommended this place to us. The pizza was prepared right there & cooked in a woodfire stove. I …More,2 years ago,Open,49
Miriam Aggrey,5.0,The workers were really nice and my pizza was amazing! I always love going to blaze and the prices can’t be beat. Andy was especially awesome.,9 months ago,Open,49
Terrell Frasier,5.0,Great pizza and great toppings...definitely will be coming back,3 months ago,Open,49
J.J. Saunders,5.0,"Been to this location plenty of time. Staff is always great, an the pizza and garlic knots are great.",4 months ago,Open,49
Chandrika White,5.0,Kevin was great! Quick service and really fun to talk to. I love coming here after a long day of classes because everyone is so friendly,8 months ago,Open,49
Holly Carlson,1.0,I’ve literally never been somewhere with slower service and I’ve eaten at steak and shake,2 weeks ago,Open,49
Raynor Lehr,5.0,This place is worth the trip every time. I drive 35mi to get my pizza.  U gotta try this place.,a year ago,Open,49
KC EPIC,3.0,Good pizza but a long wait.,2 months ago,Open,49
S P,1.0,"Always looking to try new places especially with gluten free pizza. However, was VERY disappointed with this experience. Both pizzas were cold to the touch when we received them & the gluten free one was as hard as a cracker & tough to chew.",6 months ago,Open,49
Nate Seawell,5.0,Great service and friendly staff!,a month ago,Open,49
Katherine Waldron,5.0,Great service and staff at Worthington location. Ingredients were fresh. Many healthy crusts and cheese choices. Need more locations in Columbus!,9 months ago,Open,49
Jaehla Meacham,4.0,"It was pretty good. It was my first time going to this place and I got the barbeque chicken pizza. It tasted good, was priced pretty well and they have good lemonade too. I will go back for sure!",9 months ago,Open,49
Brian Wynne,1.0,"Slowest service I have ever seen at this location. During prime dinner time, on National Pizza Day, only had one staff member preparing pizzas. Too much time was spent trying to organize the online orders, which were prioritized over people …More",8 months ago,Open,49
Breana Smith,5.0,Blaze is my favorite build your own pizza. Although sometimes you get a pizza that's a little burnt and soggy at the same time. I think when they are busy they turn out this way. It still is good but I've noticed that when a manager is …More,3 years ago,Open,49
Kamini Soni,5.0,Awesome 👌 🆒️  with smile we get yummy pizzas,4 months ago,Open,49
Kyle Murray,5.0,They make the pizza in front of you so it’s fresh. The crust is fairly small which is what I personally like. Plus the price is very low considering you are getting a whole pizza. Good for a quick bite at the end of the day.,a year ago,Open,49
kasey johnson,5.0,"The staff in this restaurant was amazing!  Attentive, personable and just fun!  Wonderful experience.",7 months ago,Open,49
Jacob Harmon,5.0,"Wonderfull staff, delicious pizza. Kevin knows just how to treat a pie in the oven and works magic with his topings",6 months ago,Open,49
Olivia Trianfo,5.0,Kevin and ozone were so kind!! They slayed the pizza game and they were the definition of customer service,4 months ago,Open,49
Kay Cline,4.0,"The wait was a little long to get our order in, but once they put it in the oven, it was ready very quickly. They seemed to be short staffed, however it was a Wednesday evening around 6:00. They serve coke products and different flavors of …More",10 months ago,Open,49
Taquilla Matthews,5.0,This pizza is the best pizza around. Great taste great salads. And the price is amazing and the best part is that its allergy free,11 months ago,Open,49
Xuhui Su,4.0,The environment is pretty nice. The service is fast. The taste is OK.,2 years ago,Open,49
Jon Rogers,3.0,"The pizza was OK, very average, I expected it to be much better considering all the high reviews. The staff was friendly, but the pizza was underwhelming. The ""dough knots"" were just not good, could have been way better. With the other …More",10 months ago,Open,49
Zach Ahern,5.0,They have good pizza,a month ago,Open,49
Edward Son,5.0,My main man Kevin is a dawg amazing service all around place. Recommend 10/10,8 months ago,Open,49
Paul Feshchenko,5.0,"Affordable, quick, and high quality pizza. As a New Yorker, those are the qualities that matter most, and are definitely being displayed by the Blaze Franchise. I look forward to seeing more and more of these around the country.",3 years ago,Open,49
Mandy Tantarelli,1.0,"Got home to find our pizza completely burnt. I should have checked when I picked it up, but seriously??? Didn't they notice when they boxed it?",5 months ago,Open,49
Shakia Mitchell,4.0,The pizza was great and the staff was nice and professional.,4 months ago,Open,49
David Li,5.0,"Fast food pizza, but different. I liked it.",2 years ago,Open,49
Luke Maymir,5.0,Best pizza around Ohio State's campus by far. There are a ton of options for toppings and the staff is always fantastic. It's my go-to spot for pizza!,11 months ago,Open,49
Lizaaa,5.0,I got the Green stripe and my fiance got the hott link and added pesto and bbq sauce. It was amazing!!,8 months ago,Open,49
Jamison Law,1.0,"Heard a lot of good things, but pretty disappointed. I ordered a meat eater online and there is not one shred of meat on this pizza and the crust on the bottom was burnt. They should probably pay more attention.",3 years ago,Open,49
mzentko,5.0,"good ingredients, love the gluten free crust options like cauliflower crust.
reminds me of another chain I have near home- Pyro's. …More",a year ago,Open,49
Marshall Price,5.0,Kevin has awesome customer service! Always a pleasure when he’s around,8 months ago,Open,49
King Kwan,5.0,The best customer service is Kevin..nice to talk to and very professional 👍👍,7 months ago,Open,49
Tim Fulton,4.0,"I live in Ohio State's North Campus district and am surrounded by pizza parlors. College kids love pizza, but college men can't metabolize all those dead carbs in the crust. Blaze has cauliflower crust, problem solved!",10 months ago,Open,49
Colin Roy,5.0,Kevin is the man! Big time recommend!,4 months ago,Open,49
Robert Lloyd Yurisko,5.0,"Excellent establishment.  Where else can you make your own pizza for such a great value.  They have vegan options and all natural soda on tap, too!  I love their black cherry cola the best!",a year ago,Open,49
Ben Kleindorfer,5.0,Great pizza! Always is a nice place for a fast but good pizza.,8 months ago,Open,49
Rachel Marie,5.0,"Good pizza, not too expensive. Sometimes the delivery is hit or miss, but overall it's a good experience.  Pizza rewards are nice!",a year ago,Open,49
1 Gonzo,1.0,"Only ok pizza at best. My friend had never been before and they treated him rudely. They talked bad about the competition even though it was their other store up north, which by the way is very good. The young man bragged about coming from …More",10 months ago,Open,49
Noah Wakser,5.0,Great pizza and great service. Andy and Kevin are fantastic workers,9 months ago,Open,49
Skrit Ohio,3.0,Good food and service. Made to order pizzas that are fired in an hearth based oven for 3-5 minutes. I usually go on late Saturday night and there's a bit of a wait. I give this place 3.5 🌟 for the overall experience for a quick pizza …More,a year ago,Open,49
Michael George,5.0,Great pizza that comes out fresh and quickly. Lots of variety and a helpful staff,3 years ago,Open,49
Sakeenah Akram,5.0,"Kevin was the only reason why this place was alive when I went. He clearly understands what it takes to be a leader, and leads his team with confidence.",8 months ago,Open,49
Joe,4.0,Friendly staff on my first visit here.  I found the pizza to be very good and will probably visit again.,2 years ago,Open,49
Paul Sackett,3.0,This a basically subway but with pizza. The pizza is ok. For what it is its a bit pricey. I wouldn't go back. In an area this big you can do a lot better.,a year ago,Open,49
Mike Grigsby,5.0,Great customer service,a month ago,Open,49
Ambarish G,5.0,"Absolute bomb make your own pizza. They even have keto and gluten free options.
I would recommend against the mango drink they have, instead go for the strawberry or blood orange lemonade.",a year ago,Open,49
Tiffani Rusler,2.0,"I had this pizza 1 other time and it was so good. Got it today and they didnt put on 5 of the toppings that I asked for. Instead put on mushrooms, tomatoes and what looks to be huge pieces of lettuce. Super annoyed.",9 months ago,Open,49
Reginald Weaver,1.0,Filthy and no sign of leadership.,a month ago,Open,49
Amy Sisterman,4.0,Fast service n good pizza,4 months ago,Open,49
Marquis Gaines,5.0,"Kevin,Deonte And Anthony great customer service, making it feel like family every time I come in to get food. Really appreciate it",a year ago,Open,49
Me,5.0,Andy and kevin were amazing and very trusting people!,9 months ago,Open,49
Grace,5.0,"Blaze Pizza is a great chain. I've been to a few different ones, and the pizza seems to be consistently delicious and satisfying. You can build your own, perfect pizza and they bake it in their stone oven right away. I love topping mine with fresh roasted garlic and basil. Definitely a good place for pizza lovers",a year ago,Open,49
Denish Patel,5.0,Accidentally messed up my pizza but Andy replaced it right away! Great customer service.,8 months ago,Open,49
Derquan Thompson,5.0,"Andy,Kevin, Daci, Ozone, Aliyah was very respectful and had good customer service good staff.",9 months ago,Open,49
Josh Scarborough,5.0,Open late and the best pizza you can make!,8 months ago,Open,49
Liz Homer,1.0,"Ordered 2 vegan pizza, one arrived completely wrong with bacon, sausage, and pepperoni on it. Customer service was terrible when I called; the guy I spoke to had the nerve to blame the Postmates driver for the error, and did not once apologize. Will never eat from here again. Extremely disrespectful.",7 months ago,Open,49
Joseph Leitz,5.0,"This is one of my favorite pizza joints in Cbus! Love the thin crust and value for the pizza. I always get the ""build your own"", because you get unlimited toppings for less than $9! Deserts here are pretty good too. …More",a year ago,Open,49
Matt McGuire,1.0,"Messed up my order didn’t make it right, awful customer service. I ordered a pepperoni pizza  doughnuts and drinks and desert. they delivered a plain crust with no marinara, no cheese, no pepperoni! It’s a joke!",10 months ago,Open,49
john childress,5.0,Keto crust is awesome best I’ve had.,9 months ago,Open,49
jerome smigla,5.0,Fast friendly service. Good pizza,10 months ago,Open,49
Eshan Bhatt,4.0,Employees don’t exactly consistently bake the pizza with the same quality. Some days it’s great. Some days you get a charred rock...,a year ago,Open,49
Mike G,5.0,Andy was spectacular. Nice and fast,9 months ago,Open,49
Sophie Chang,4.0,Generally good service and quality - good place for a quick bite or late snack.,3 years ago,Open,49
Chris Sweet,5.0,I love Blaze!! I have celiac disease - so the gluten free dough is great! (And it actually tastes good!) I work near this one and come often! It's nice that the staff recognizes me! Kate is really great at making the pizza just the way I …More,3 years ago,Open,49
Jacob Andrews,3.0,"Employee named Jax was super kind and enthusiastic with customer service. However, pizza was delayed and I spent an extra half hour waiting for my order.",a year ago,Open,49
Julian Mejia,5.0,"In terms of pizza I would say is one of the healthiest around, not oily.",a year ago,Open,49
Alice Gardner,4.0,"Good food. Create your own pizza, Subway or Chipotle style. Garlic knots are great.  Pop and lemonade are unique to them. Lemonade is great.",a year ago,Open,49
Shane Edwards,5.0,Fast cheap food but pretty good pizza,8 months ago,Open,49
Clay Borchers,5.0,Kevin Andy Deci Ozon Great pizza,9 months ago,Open,49
Tammy Dials,5.0,"I Love Pizza, and they got some good stuff.",9 months ago,Open,49
iVxchii,5.0,Kevin has really good customer service.,9 months ago,Open,49
Trent Jutte,5.0,Excellent service! Kevin was especially great. Using the hooked app for this location saves you $4.50 with the purchase of a drink and pizza!,a year ago,Open,49
Pamela Chaidez,4.0,"Pizza was really good, tasted very similar to sbarro. It was done quick. Inside of business was nicely decorated but the noise level was high, just because of concrete floors and no carpeting. The employees not too upbeat or overly friendly …More",a year ago,Open,49
Tory Geismar,5.0,"Andy’s the man, great customer service. Would blaze all day.",9 months ago,Open,49
Amanda Degeneres,5.0,"Ms. Angie is absolutely amazing with customer service and more than accommodating with any particular needs or requests. Not only will my family be returning frequently, but I will also be recommending this restaurant particularly due to her outstanding management and staff . Can't wait to come back!",a year ago,Open,49
Ace Ravenscar,4.0,Blaze Pizza in my humble opinion is one of the best places to get pizza I've ever been to the pizzas or flat price you can add as many toppings as you want and when I say as many I mean up to four me six Cheese's 16 vegetables and four …More,a year ago,Open,49
Alex Short,5.0,"Clean, quick, and always good. The same 4 guys are always working when I’m in there and and they’re all great.",a year ago,Open,49
Casey McBeath,5.0,This was a great pizza place. Very quick service and great taste. The price wasn’t bad either. You can build your own pizza with as many toppings as you want for $8. Would definitely recommend.,2 years ago,Open,49
Steady5,5.0,First visit for a Great keto pizza! Definitely will be coming back. Lots of meats and veggies!,a year ago,Open,49
Asia Guleed,5.0,"Omg Kevin was the best, he took his time with my pizza and had great conversation with me. Amazing custom service. Someone give this man a raise!!!",a year ago,Open,49
Chris Anderson,5.0,Great selection of toppings and you can add any extra toppings you want at no extra charge!,a year ago,Open,49
Jae Perk,5.0,Very good pizza. Great service. Great toppings. Tasted so good.,a year ago,Open,49
CAPITAL CITY MOBILE AUTO DETAILING,5.0,Great pizza,a month ago,Open,49
Ryan Smith,1.0,Honestly I have been recently disappointed in this place. My girlfriend has the blaze iphone app and one night we ordered pizza from this place through their app that said they were still open. It not only charged her credit card but was …More,a year ago,Open,49
Zach King,5.0,"Not only is the pizza amazing, but they also go above and beyond with their service. Another customer left the store with my pizza, thinking it was theirs. After I realized this, Blaze staff remade my pizza quickly and even gave me a cookie for my wait. They’ve definitely earned my business!",a year ago,Open,49
A T,5.0,Kevin hooked my pizza up! Always great food and service.  Best pizza place on campus. Check it out,a year ago,Open,49
Daniel Dawson,5.0,Delicious pizza. Good service.,11 months ago,Open,49
Nathan Martin,1.0,"Can not get a real person to take my order over the phone, the app will not accept any promo codes, the app will only let you place an order using credit card.
This place looks like they have good pizza, but I will never know because this place sucks!",a year ago,Open,49
Anaya Anjah,5.0,Andy’s Service was absolutely amazing.,9 months ago,Open,49
Peter Folz,5.0,Pizza was cooked to perfection. Better than any other blaze I’ve had,11 months ago,Open,49
Noah Teller,5.0,To my horror and dismay I dropped my pizza before having eaten it and Andy very graciously remade it for me at no charge and it was the best the best pizza I’ve ever had.,8 months ago,Open,49
Derek Boyer,3.0,Great pizza but sometimes takes extremely long to get food or your order,a year ago,Open,49
Paul Burney,5.0,"Great pizza, even better service. Fast and at a reasonable price",a year ago,Open,49
Abdul Kedir,5.0,"Great customer service , they are so friendly and they make you feel comfortable and full,  for the first timers like me. The pizza was delicious, Kelvin (our server ) was amazing , he even came over and help us cleanup once we done eating !",a year ago,Open,49
Mara Johnson,5.0,Fresh pizza? Who doesnt love that!,9 months ago,Open,49
J M,5.0,Best pizza I've found on campus.,a year ago,Open,49
J. Grant Mathis,5.0,"Really good pizza at a reasonable price. We ordered for pick up, it was ready when we arrived. It is hard to find a brick oven pizza at a good price. Will definitely go there again.",2 years ago,Open,49
Donna Johnson,4.0,Very nice people work here!,11 months ago,Open,49
Sriram Natarajan,5.0,Amazing concept - choosing the ingredients for your pizza. Superb taste and very prompt.  Absolute winner,a year ago,Open,49
Vernice B,5.0,Great pizza! Customized to your liking and cooked to perfection. Everytime I’ve went I’ve been extremely satisfied with my order. The pizza tastes super fresh and has a wonderful crust as well. I’d reccomend this place to anyone.,a year ago,Open,49
Kelly Law,5.0,Thin yummy pizza that hits the spot!,11 months ago,Open,49
