name,stars,text,timeSince,openStatus,key
lauren valenzuela,5.0,Great service from Sara. I was dining on the patio with my son when Sara came outside and asked if she could get me a high chair since she saw I was struggling with my son in a regular chair. She brought out the high chair and also a bowl …More,a month ago,Open,40
Daisy,5.0,One of the biggest Blaze Pizza locations I’ve been to. I got the Green Stripe pizza (the one topped with arugula) and I customized it with onion & cilantro. The pineapple pizza is a build-your-own high rise pizza. I think the high rise dough is thicker than the regular dough.,a year ago,Open,40
Lauren Burman,5.0,Great friday evening pizza! This was our first experience dining out in a while and we were very impressed by how clean the place was. Staff and manager were very welcoming and nice. Will be returning!,4 months ago,Open,40
Mike Hawk,5.0,Pizza was cooked perfectly. Employees were nice.,a week ago,Open,40
Guy Gilboa,1.0,I used to come here at list twice a week and always enjoyed. Today it’s a different experience. The pizza was less than average . The manager are not nice at all and made or at list that how she looks like. really not welcoming at all. I …More,4 months ago,Open,40
William B,5.0,"Although it's considered a fast fired pizza place the quality of the pie is much better then all of its competition. Crust is always cooked to perfection. No cost four sides of ranch, marinara, etc",a year ago,Open,40
Melissa Robles,5.0,"pizza was great, patio was clean, employees were awesome! will be back",a month ago,Open,40
josh levesque,5.0,Excellent  crew people were awesome,2 months ago,Open,40
Elly Diego,5.0,Simple. A lot of toppings to choose from.,6 days ago,Open,40
Jeniffer Lozano,5.0,great pizza. great service. very clean,3 months ago,Open,40
David Mormann,5.0,"Good value, order it how you like it and add a little more without feeling guilty with some great customer service being the counter.",a year ago,Open,40
David Quintana,5.0,Great selection of toppings that you could add to your pizzas. Whether you enjoy little toppings on your pizza or dozens of them you will definitely be proud you came to blaze pizza because they will definitely make sure you enjoy their …More,11 months ago,Open,40
aerialpracticenow,5.0,"Crunchy, Savory, Delicious pizza. Stretchy cheese, and flavorful toppings.",4 months ago,Open,40
hashem alhashemi,5.0,"Best pizza in the US, second best in the world after Italy that is. Would definitely go whenever I’m in the US.",7 months ago,Open,40
Shelley Gastelo,5.0,"Pizza was delicious as always.  Fast service,  friendly people.  Great choices.  Love the cauliflower crust.",10 months ago,Open,40
Natasha Bindon,5.0,"I've traveled a good bit and grew up in Boston. I've had a lot of pizza and have to say this is my favorite pizza place. It was so good, I went back a second time. So fresh, great crust, love the build your own pizza and totally wonderful. …More",a year ago,Open,40
David Hughes,3.0,"The eople were very helpful (but not really friendly) the atmosphere was kind of mechanical fast foodesh. But i was disappointed with the pizza, it was pretty bla it had a lot of flavor in the sauce, not necessarily good and I think to …More",3 years ago,Open,40
Camila Habibi,5.0,"So good! Was my first time at  Blaze Pizza and I have to say I'm hooked! Fresh pizza dough makes all the difference, they have a great selection of toppings and sauces. The ingredients were all fresh and the service was very fast. Also the …More",2 years ago,Open,40
Arman Goshtasbe,5.0,"Great location. Very large seating area inside. Part of Victoria Gardens.

They also have great veggie and vegan pizza options! If you're a T-Rex (meat eaters) you'll definitely like it too, probably more.",a year ago,Open,40
Hyoju Lee,4.0,So fresh ingredients and cleanness of the place are wonderful!,2 years ago,Open,40
Joumana Sassine,5.0,We kindly ask them to make a pizza with all the ingrediens on and they do it.  thumbs up forr your exquisit pizzas,3 years ago,Open,40
Steve Hernandez,5.0,The pizzas are made quickly and they are so good!,10 months ago,Open,40
Deborah Young,5.0,Order this on postmates. They're great!!,6 months ago,Open,40
Margaret Penelope,5.0,"Love Blaze pizza, it's made to suit your taste. Many toppings to choose from, there are sauces, cheeses, fresh veggies and meats.",a year ago,Open,40
Doerte Sennecke-Chow,4.0,"We like this place because the restaurant is very spacious as compared to the one on PCH in Torrance.
Parking is in the West Terrace Garage. The evGo charging station is on Level 1.",11 months ago,Open,40
Angelica,4.0,"I had came here & was helped by a very kind, extremely helpful , & friendly employee. Than I came to this Blaze pizza another day & One of the employees was rude while making my pizza and even made a comment . The manager was being rude …More",a year ago,Open,40
Arriele,5.0,My mom got keto crust and it was incredibly good. Great costumer service+attractive staff(lol). Clean and organized environment. Perfect from all angles,a year ago,Open,40
Karen McKee,4.0,It was really good with quality toppings. I've had better but I enjoyed this a lot. My husband reached about the flavored ice tea.,a year ago,Open,40
Michelle Fields,5.0,"Very nice and quick, lemonade is recommended.",a year ago,Open,40
Mitch Morris,5.0,"Always consistent and tastey, quick bite.",11 months ago,Open,40
carol bracamontes,5.0,"The services was great , the time that it took to make the pizza was great , n the quality , simply delicious...",10 months ago,Open,40
Naima Norrise,5.0,"Nice, comfortable and welcoming environment. Plenty of places to sit. Fairly quick, delicious pizza! Love the super thin crust and all the veggie toppings🤗",a year ago,Open,40
Colby Wakeman,5.0,Fast friendly service!,a year ago,Open,40
Sarah huntley,5.0,"This restaurant is conveniently located in Victoria Gardens, offering delicious pizza during your shopping visit. This pizza parlour offers easy to choose, classical recipies as well as build your own, offering a variety of meats and …More",a year ago,Open,40
Marii G,5.0,Delicious Pizza! And pleasant Drink's... High recommend this place,a year ago,Open,40
Maria Duran,5.0,Such friendly service!  I’m vegan and wanted to try a salad unfortunately the salads had cheese but the employee was more than happy to make me a salad with out cheese! So happy and very satisfied that she would go out of her way to help me! Definitely will come back!.,a year ago,Open,40
Angie Perez,5.0,"First time here and very happy with the service I received!!! Even busy they were friendly and cleaning up tables and even offered to throw my trash away, and were very giving with the toppings when I asked for extra! Definitely coming back.",a year ago,Open,40
Brenda Moncayo,5.0,Repeat visitor. Fast service,8 months ago,Open,40
Brianna Alvarez,5.0,Best pizza topping selections,10 months ago,Open,40
Lucy Dyer,5.0,You can build your own 🍕 &also available for vegans delicious!!,a year ago,Open,40
Damien Peteet,5.0,I love blaze cause of the customisations. I also like how the oven heat produces a crispy crust. The smores are excellent as well.,a year ago,Open,40
Erick Diaz,1.0,"Garbage service! @13:25 hours.
Never ever again will I ever enter B.P or recommend this particular restaurant.",a year ago,Open,40
Frank Bachman,5.0,love this place! Great food + friendly service!,a year ago,Open,40
Erasmo Rodriguez,3.0,Great pizza but the manager has a really bad manners. They need to hire more friendly people.,11 months ago,Open,40
Thomas Christiansen,5.0,"The best all natural, no preservatives pizza around
The folks at Victoria Gardens are the bomb.",a year ago,Open,40
Netanel Cosby,4.0,"Great quality ingredients for your pizza, tables were somewhat clean. Staff was more interested in each other than the customer.. The pizza tasted great 👍🏼",2 years ago,Open,40
Alexandra L,5.0,"one of my favorite pizza places! you can build your own customized pie. they also offer vegan / gluten free options! the size of the pie is also reasonable for one person, and everything has great quality.",2 years ago,Open,40
Hermin Massoud,5.0,"Amazing idea to create your own pizza .... Ingredients are multiple,fresh and delicious.",a year ago,Open,40
Karina S,1.0,"Employees were talking to each other while I was ordering, Didn't pay attention to what toppings I wanted and how I wanted them. Burnt the bottom of pizza, which threw it off. I like the Ontario mills better.",a year ago,Open,40
Scarlett Cross,5.0,I didn't know they have craft beer on tap! That was a pleasant surprise. Good prices too. I hadn't been to a Blaze in years.,a year ago,Open,40
Brooke Delgado,5.0,We held a fundraiser here at Balze for our school marching band and I must say it was such a success!! They were so nice and welcoming and very attentive to us! They would even check on us and throw away our trash! Really happy and will definitely be holding more fundraiser with this blaze!,2 years ago,Open,40
irang kim,5.0,Yummy pizza what ever we can order the toppings,a year ago,Open,40
George Hernandez,5.0,"Best Blaze in town!! Been to a few locations and this one definitely gets an A in my book. While others seem to burn my pizza or have some unfriendly employees,  I've made this my go to blaze since I can count on them to make me happy with both. Not to mention the place is always clean and well maintained. Can't wait to be back soon!!!",2 years ago,Open,40
Jaden Simis,4.0,"Fast, pizza was good, lots of choices!",8 months ago,Open,40
Jacob Valdez,4.0,It tasted really great and the establishment itself was clean. My only thing was the girl who helped me never smiled and kind of made me feel like a burden. The other employees were super amazing however and very nice.,a year ago,Open,40
guillermo PT,5.0,"Awesome place to enjoy with the family, delicious pizza and atmosphere, place clean and very helpful and friendly staff, keep up with the good work guys!!!",a year ago,Open,40
Jules Gomez,5.0,Awesome service!! Very friendly girl I think her name was Lauren! Pizza was tasty.,a year ago,Open,40
lauren faco,5.0,"tasty pizza, friendly staff!",8 months ago,Open,40
Ken Dinsmore,4.0,Service was fast. Pizza was good as were the bread knots,a year ago,Open,40
Steve Harshberger,4.0,"Always order ""make your own"" and put whatever you want on it. Gals making pizza for you put as much or as little toppings, cheese and whatever you want on it.",a year ago,Open,40
Juan Duran,5.0,Keto crust is great! Nice selection of toppings.,a year ago,Open,40
Silvija A.,4.0,"It's good, clean and fresh. Regular pizza taste, and they do offer vegan cheese here.",a year ago,Open,40
Sheila Sandoval,2.0,"Overpriced pizza, salad & beverages",10 months ago,Open,40
iluvCriminalMinds,1.0,"The pizza was really good. I really enjoyed it. However, mistake after mistake when I first ordered. I ordered 2 pizzas and they only gave me one. I got one of the pizzas with vegan cheese and when I went to pick them up, the pizza didn't …More",2 years ago,Open,40
aG anthony Gomes,5.0,Always the best,3 months ago,Open,40
Ashley Gutierrez,5.0,Having a big dog is a issue when going out to eat but here at this blaze I always get great service and they always give my dog a water container despite the mess he leaves behind in the patio lol very nice and accommodating.,a year ago,Open,40
Hector Hernandez,5.0,Love making my own pizza. Unlimited toppings.,a year ago,Open,40
Karen Sexton,4.0,"Blaze pizza in the Gardens has been consistently good since they opened. Staff is well trained and friendly, your food is cooked quickly to order, and their frescas are always full bodied and sweet. Highly recommend for a quick bite.",2 years ago,Open,40
Alyssa Gomez,5.0,Awesome service! Really great pizza and Amy was super friendly! Definitely coming back,2 years ago,Open,40
Martha Garcia,5.0,Great place to stop by and eat some fresh build your own pizza.,a year ago,Open,40
Ingrid Obregon,5.0,"My best friend told me about blaze, and I must say it’s soooo much better than mod and all the other ones! I work in the mall and they even give half pizzas for happy hour! This is GREAT!",2 years ago,Open,40
Lizbeth Romero,5.0,"First I must start with the pizza here is delicious!! Always love it! Secondly!! This past Tuesday they were having free pizza and I’m reading the comments below and I was in the dine enjoying my free pizza with my husband and two kids, …More",2 years ago,Open,40
Elisa Mora,5.0,"Really great tasting pizza, the drink selection is amazing, especially their lemonades and aguas frescas, awesome ingredients. Cant say enough good things. Awesome pizza place.",a year ago,Open,40
Luann Suber,1.0,Hair in pizza.,2 months ago,Open,40
Martin Fernandez,5.0,Build your own is the way to go if you like a lot of topping Really nice girl Krol helped my daughter and was patient with her great service.,a year ago,Open,40
Emily Harris,5.0,The Pizza was so good and they have vegan options!,a year ago,Open,40
Thomas Robertson,5.0,Came here around lunch time and I loved the concept. Really great pizza at a reasonable price and toppings unlimited!!! Whoaaaa definitely will be back. Pizza was fire!!,2 years ago,Open,40
Andrew Billings,5.0,"Great food, nice atmosphere.",a year ago,Open,40
Claudia Aguilar,4.0,You make it your own way,a year ago,Open,40
Mina Mar,1.0,"Edit for the Blaze Pizza team who responded: I already emailed you first, as did my mom and my neighbor. None of us have seen responses. …More",2 years ago,Open,40
Devi San Martin,5.0,Always a good place to build your own pizza. This time we tried no gluten dough. Great!,2 years ago,Open,40
Alex Burton,1.0,This review is directly ties in to the manager that was on duty today (4/2/17 at1105am).  I caught the tell end of a conversation with a manager and my wife where he was upsetting her during the paying of the bill.  I heard the manager tell …More,3 years ago,Open,40
Lucas Keserich,4.0,"Good place with nice staff. If you been to one, you know what to expect. If not, think Subway for pizza.",a year ago,Open,40
Nicky Sandoval,5.0,A must try if you are in VG. Glad they are offering a special $5 for half the pizza during lunch time. I hated walking around the mall carrying my leftovers but this works as I am never able to finish the whole thing. Super good!!!,2 years ago,Open,40
Derek Reyes,5.0,Great store and i like the selection of stuff they have for my dog.,a year ago,Open,40
Jp Yuen,3.0,food was good service was ok,a year ago,Open,40
Jason Launer,5.0,Became our regular lunch break. Can't get better,a year ago,Open,40
Michael A Maldonado,5.0,"Build. your Own W/ aCeasar Salad !!😳surprise your taste buds with this duo.
-MM-",a year ago,Open,40
Derek Cortez,4.0,Fast service great food,a year ago,Open,40
patrick apodaca,5.0,Great Service and pretty darn good pizza at a great price!,a year ago,Open,40
Juan Gomez,5.0,"Awesome great service, felt very welcomed, definitely recommend.",a year ago,Open,40
j d,3.0,They have significantly raised prices... many of the table's had trash and need wiping and they were not cleaned during the duration of visit,a year ago,Open,40
steve Dang,4.0,"Great tasting pizza, you get to choose whatever topping you want",a year ago,Open,40
Sabrina W,5.0,Affordable prices great value I really nice customer service,a year ago,Open,40
Daniel Rivera,4.0,"Quick, fast, tasty thin crust.",a year ago,Open,40
Denise Abbott,4.0,Great place to order your own personal pizza. Pricing is perfect.,a year ago,Open,40
Jason Carrillo,5.0,I love pizza. You could build your own pizza and the staff is really nice. They have their own Agua Frescas and theyre so good,a year ago,Open,40
Jose Lopez,5.0,Friendly service and always fast! Food is always fresh.,a year ago,Open,40
Sonny Davis,5.0,Quality Pizza priced right,a year ago,Open,40
Yuri Andropov,5.0,I always love going to create my masterpiece!...,a year ago,Open,40
Andrew Tang,4.0,Good 🍕. Customize you own toppings.,a year ago,Open,40
Lorina Bravo,5.0,Very good food and very good service,a year ago,Open,40
Jeffrey Oliver,4.0,Good fresh made food. Can custom order anything you want on a pizza.,2 years ago,Open,40
Julian Mejia,5.0,Great pizza and  customer service,a year ago,Open,40
Veronica coon,5.0,Omg what a great pizza you can make your own.,a year ago,Open,40
ILEANA H.,5.0,Great pizza!!! Fresh and the prices are reasonable .,a year ago,Open,40
Chris Biedenbach,2.0,"Food was ok, customer service was horrendous. The workers seemed more interested in socializing and joking with each other than with helping the line of people.",a year ago,Open,40
Genesis Gomez,5.0,Super freidndly staff and great pizza the girl Karlolina was so nice and she definitely hooked up my pizza thanks girl!,a year ago,Open,40
Maria Ruiz,5.0,"Delicious, economic and fast. Also love the great service.",a year ago,Open,40
jeff fraka,4.0,"Good stuff, fastest pizza in the west",a year ago,Open,40
Rachel Serrano,5.0,Good fast pizza.,a year ago,Open,40
Neo R.,5.0,Love this place,7 months ago,Open,40
Jay Torres,5.0,Always fast! Very convenient when you work at the mall.,2 years ago,Open,40
Nancy Muralles,5.0,"Love coming here, they always ask me how it looks and never complain when I ask for more! Great pizza!",2 years ago,Open,40
Quentin Fife,5.0,They have the best pizza around! It's like subway for pizza you get to design your own individual pizza with a ton of choices for toppings. & it's the perfect amount of pizza really fills you up,4 years ago,Open,40
Barbara Delgado,5.0,Pizza was delicious,2 months ago,Open,40
Juliano Trujillo,5.0,"Love this place and Mods Pizza! If they had one closer to me it'd be better. Pieology doesn't compare! Staff and management is on top of everything, they keep things going smoothly so I don't have to wait long to order!",4 years ago,Open,40
Erica Castaneda,4.0,Great customer service and food!,a year ago,Open,40
John Isiah,5.0,Never disappointed with my order...  mamas pepper are a must on my pizza.,2 years ago,Open,40
Hans Tyrolt,5.0,Great customization and taste.,a year ago,Open,40
Xaviera Sterling,5.0,Great food!,11 months ago,Open,40
Osiris Zoran,5.0,Love the black cherry soda,a year ago,Open,40
Rosa b,5.0,First time trying this place out and it was delicious,a year ago,Open,40
Brenda M. Lewis,3.0,Service was excellent. The pizza was disappointing.,a year ago,Open,40
Daren Alghawas,5.0,Best pizza ever!!! Has vegan options 💜,a year ago,Open,40
Carlos Aguilar,1.0,A young lady by the name of natalie was very rude to me,a year ago,Open,40
Abdullah Alrashoud,5.0,"The best pizza place to visit in the area. Professional, taste, and economic lol. Worth stopping by and grab a delicious one.",3 years ago,Open,40
Ben C,5.0,"Custom pizza! The staff are friendly, the dining area is clean and the blood orange lemonade is a welcome surprise. The prices are about average, but the food is excellent. Let's hope they can keep this momentum going!",5 years ago,Open,40
Arabelle von Theissen,5.0,My favorite Blaze location...clean friendly staff...and good pizza.,2 years ago,Open,40
Steven Rockney,1.0,Go to Pieology instead.  Better food.,a year ago,Open,40
D Hall,3.0,"The concrete makes the whole place so loud!

Can't hear your order and the dining experience is like dining in rush hour …More",4 years ago,Open,40
Yasmeen Mustafa,5.0,Delicious gluten pizza with plenty of toppings,a year ago,Open,40
Brian Somerville,4.0,The pizza was delicious,a year ago,Open,40
April Salazar,5.0,"awesome pizza, very nice staff! will be returning",2 years ago,Open,40
Brian Francisco,5.0,Blaze pizza is a better quality and organized pizza than pieology. They actually organize the toppings you select as opposed to just throwing them on randomly. The staff is very friendly as well.,4 years ago,Open,40
JENNY SANDOVAL,2.0,They are so right with their ingredients. Ur lucky of every slice has a pepperoni,2 years ago,Open,40
Martin Mendez,5.0,"Great pizza, and love the blood orange .",2 years ago,Open,40
Jackie Rivera,5.0,"Every time I come, they never fail to amaze me. Do delicious and great service!",2 years ago,Open,40
Martha De La Paz Castro,5.0,My favorite place to come a get a quick delicious pizza. 10/10,2 years ago,Open,40
Juan Garcia,5.0,It is like Pieology but they have good cookies. It's spacious and the pizza comes out good although I would like a bigger selection for sauces.,4 years ago,Open,40
Leonardo Sevilla,5.0,Very good pizza has a variety of toppings and sauces and it's a good size serving a for a good price,3 years ago,Open,40
Edgar Soto,1.0,"Pizza was delicious, until I bit into a little ball of dirt that was on the arugula but still good they just need to wash their produce.",4 years ago,Open,40
Yedur KJ,4.0,you can build your own pizza and also they have good ready options on the menu.,3 years ago,Open,40
ANTHONY ACOSTA,3.0,Excellent pizza,a year ago,Open,40
The Real Mike,3.0,Blaze Pizza serves freshly made pizzas that are piping hot and made to order. The concept is like Pieology -- you build your own personal pizza and it's quickly cooked in a hot oven within minutes. The ingredients were average quality. …More,4 years ago,Open,40
James Barno,5.0,Good pizza for the price and the staff super friendly.,4 years ago,Open,40
Vast Lee,4.0,"Blaze is really good. I still think Pieology is better, but only very marginally.",4 years ago,Open,40
Kai Yu,5.0,"It's some great pizza at an awesome price. Truly a great deal, it's fresh, and delicious.",5 years ago,Open,40
mia jones,4.0,For $8.25 I am able to get a pizza with as many ingredients as I want and the customer service was very friendly and personal,3 years ago,Open,40
Karl Verhelst,4.0,"Super friendly staff, even let us eat on the patio once they were about to close it. Pizza was ok, I prefer pieology.",4 years ago,Open,40
J. Andrade,5.0,Excellent don't forget to mix chicken ham sausage turkey meatballs basil cilantro mushrooms mozarella cheese roasted garlic onions and if you want it spicy add some jalapeños .... thumbs up !,5 years ago,Open,40
Nick Burciagi,5.0,Bomb!!! I was hooked on pielogy before checking out Blaze but something about blaze has me wanting to go back..I don’t think I’ll be visiting pieology anymore.  Blaze all the way baby!!!,2 years ago,Open,40
jazzy love,5.0,Too good love it,3 years ago,Open,40
Koren Mcpheeters,5.0,Staff is gr8 everyone is nice,a year ago,Open,40
Jonathan Souza,5.0,For $8.25 I am able to get a pizza with as many ingredients as I want and the customer service was very friendly and personal,3 years ago,Open,40
Adam Zahner,5.0,"Quick, efficient, and delicious. You only have yourself to blame if you don't like the pizza that you tell them to make.",4 years ago,Open,40
David De la Cruz,5.0,"First time here, Love the pizza!",2 years ago,Open,40
Zahra Naqvi Bukhari,4.0,I enjoy this place and the pizza here staff is friendly!,4 years ago,Open,40
Christopher Juarez,5.0,Good food,a year ago,Open,40
Joanne Barrera,5.0,Prices & Pizza is Great!,3 years ago,Open,40
Amanda Herrera,5.0,My personal favorite pizza!,2 years ago,Open,40
Ramón Parra,5.0,Just loved it!!,11 months ago,Open,40
Troy Holland,5.0,Great. Only thing better is round table.,4 years ago,Open,40
Azucena Ilacad,4.0,Good pizza,a year ago,Open,40
Abdulrahman Alzahrani,5.0,Hot and amazing place with variety choices. Must visit every week at least once,5 years ago,Open,40
Brian Fernandez,5.0,Great fast pizza,a year ago,Open,40
Joseph,5.0,Great service!,a year ago,Open,40
Ken Cousens,5.0,Good pizza.,a year ago,Open,40
Maria Duran,5.0,Best pizza ever!! Friendly staff!,2 years ago,Open,40
Sonny Bernal,5.0,"Awesome , polite service and quick service",a year ago,Open,40
sophia bravo,2.0,There was hair in my whole pizza super nasty,a year ago,Open,40
Nicole Terrill,5.0,So very very good,a year ago,Open,40
Robert Barton,1.0,One bad pizza can not believe a pizza can taste so bad and one star is too many for this place...felt sick after eating there and I was not alone my date said the same thing as we shared the same pizza...would never go back even if it was free that day it was that bad...,2 years ago,Open,40
Evangelina Gonzalez,5.0,Always love Blaze pizza!,2 years ago,Open,40
Elizabeth Roberts,4.0,Really good. Try their smores,4 years ago,Open,40
Chads Forever,5.0,The manager is so nice he is the best,5 years ago,Open,40
D. Pollard,5.0,Good pizza,a year ago,Open,40
Manuel Burgos,5.0,Great pizza!,a year ago,Open,40
veni perez,5.0,Keto crust,a year ago,Open,40
Austin Moore,5.0,Fast and good.,2 years ago,Open,40
James Winstead,2.0,Pizza was burnt,a year ago,Open,40
Lidia Martinez,5.0,Amazing pizza,a year ago,Open,40
Leilahney Beverly,5.0,It was so good,2 years ago,Open,40
update u,5.0,Fast Service,2 years ago,Open,40
Sozy Fares,1.0,"It's very bad service, this is was the first time I went to this location and it's last time too, the staff over there treated us so bad, even no manager or supervisor was available!!!",2 years ago,Open,40
Cornell Wallace,5.0,Awsome dining experience,3 years ago,Open,40
Hashmat Rasooli,5.0,Friendly costumer service,a year ago,Open,40
Tony Rivera,2.0,I'll stick to microwave pizza,2 years ago,Open,40
Nestor Rodriguez,5.0,This place rocks! Great pizza!,4 years ago,Open,40
Hector Becerra,5.0,The water is good.,3 years ago,Open,40
bhargav vyas,4.0,Good servuce,2 years ago,Open,40
Natalie Carlin,5.0,Bomb,2 years ago,Open,40
Ismael Beltran,5.0,"The first time I when to try any pizza, just imagine how the teats really impress me",3 years ago,Open,40
Ryan O'Connor,5.0,Great pizza 🍕,3 years ago,Open,40
Johnny Ray,4.0,Perfect,3 years ago,Open,40
Aries Arreola,5.0,AMAZING PIZZA💕,3 years ago,Open,40
mlfinley33,3.0,Cheese,4 years ago,Open,40
Julio Flores,2.0,Pizza was good but the employees were very rude,4 years ago,Open,40
Runrofl 1,1.0,Don't come here during the night because the employees are rude.,4 years ago,Open,40
