name,stars,text,timeSince,openStatus,key
Jason Spangenberg,5.0,I have eaten here maybe five times now and have yet to have a poor experience; the pizza great!,2 years ago,Open,47
Skye Graham,4.0,Loved the pizza overwhelming with all they have to put on their yummy pizza,2 years ago,Open,47
Patti Tirpak,5.0,Can't wait to go back! This was awesome!,2 years ago,Open,47
george FAGAN,5.0,Best GLUTEN FREE pizza around. Had twice and they offer to Change gloves. Today the cheese was very light a little skimpy but next time I will ask for more.,3 years ago,Open,47
Clarks 101,3.0,"The pizza was good but, one of the workers was rude when we asked to pay because one of our pizzas was done. ( one other pizza was cooking.) We didn't want our other pizza to get cold. The workers barely cut the pizza and it was hard to eat!",2 years ago,Open,47
kimber gav,4.0,Great service and good food,a year ago,Open,47
Cherish Thomson,5.0,"I only just discovered this place in April and I average once a week visits here since. My boyfriend and I love to pile toppings ona build your own and split it for our date nights. Yummm, genious concept.",2 years ago,Open,47
Robert Vignere,5.0,First time here. Very impressed.  Pizza was awesome.,2 years ago,Open,47
Joe Bobula,5.0,Really good pizza. Despite long lines they move pretty quick. Currently my favorite pizza in Erie.,2 years ago,Open,47
Jamie Arseneault,5.0,"Great pizza and crusts, online ordering. As close as you can get to a Whole30 compatible pizza (not fully compatible but close).",2 years ago,Open,47
Fred Puchany,5.0,"This place is AWESOME!
Made to order pizza...YUM!",2 years ago,Open,47
Rachel Woznicki,5.0,They have the best pizza!!!,a year ago,Open,47
Sharyl Sumner,5.0,"Internet apps need help, they don't work so great.",2 years ago,Open,47
Thomas Scriven,5.0,Great service even when busy on a Friday night. Gluten free pizza really tastes good!,2 years ago,Open,47
Megan Wolf,5.0,"Employees were really nice and the pizza was really good, mostly because the ingredients were all fresh. I do think it is priced a little high for what it is, but I will keep going back!",a year ago,Open,47
Amy Buettner,5.0,Quick service. Great choices. One of our favorite places,2 years ago,Open,47
Wanda Graham,5.0,Wonderful. Always great food.,a year ago,Open,47
Alexis Musolff-Carney,5.0,Awesome vegan pizza,a year ago,Open,47
Jo Suchar,5.0,Great pizza,8 months ago,Open,47
Veronica Fulton,5.0,Excellent.  But very busy.,a year ago,Open,47
Alyssa Young,5.0,Kind and aware employees that make good food even better.,2 years ago,Open,47
Rich Nahra,4.0,Fast and good!,11 months ago,Open,47
Cherie Manzano,5.0,Excellent food and service. They have a large number of ingredients to top your pizza with at no extra charge.,2 years ago,Open,47
Charles Wise,5.0,"What fun, great food",a year ago,Open,47
Sheryll Hardesty,5.0,"Great pizza, always fresh and a great selection of toppings.",a year ago,Open,47
Becky Brookhouser,4.0,Unique. Pricey. Good food clean,2 years ago,Open,47
Derek Kruse,5.0,Excellent food and excellent service.,a year ago,Open,47
Claire Anthony,5.0,Great service! Great pizza! Great management!,2 years ago,Open,47
K C,2.0,Food was ok. But one of the ladies was very rude. Plus my daughter and I felt nauseous after.,2 years ago,Open,47
Brandy Donovan,4.0,Yummo!! Love this place!!  It is a great idea for pizza lovers!!!  So many options!!,a year ago,Open,47
Coal 501st,5.0,where I sat it was a bit cramped but theres tons of different places to sit I'm just dumb.,a year ago,Open,47
Ahmed Yousof,5.0,"The pizza is freshly backed and toasted. The service is pretty fast. In addition, the pizza tastes yummy",2 years ago,Open,47
Kenny Watkins,5.0,Yummy but I'm sure you know that,2 years ago,Open,47
Jehdrid auditore,5.0,Best pizza I've had in america.,a year ago,Open,47
Nikki Rodgers,5.0,Delicious pizza and really nice staff!,2 years ago,Open,47
Daniel Marx,5.0,Had a wonderful date night and Mikey on the pizza oven cooked our pizzas to perfection!!,2 years ago,Open,47
Lenka Burns,3.0,The guy in line helping make my pizza knocked off what would be an entire slice a couple inches down from the crust and did NOT even offer to replace it all..........I really like their pizza but when you are paying a premium..........you want what you pay for,2 years ago,Open,47
stephen maynard,5.0,Super fun place to eat at and visit. You'll love it just go there.,2 years ago,Open,47
Katt Knight,5.0,"Blaze pizza is definitely the best pizza, will definitely be going back. Yummy to the tummy.",2 years ago,Open,47
Trish Michael,3.0,Great service and the pizza wasn't what I expected,2 years ago,Open,47
Ed Haefele,5.0,Delicious fresh pizza made your way,2 years ago,Open,47
John Bennett,5.0,"Always a good meal, good staff too",2 years ago,Open,47
Mary Moore,5.0,Great place to eat my first time here was delious plus found out they have Hilton free dough also made fresh daily hard to find at first but its in a new plaza that's not on map yet but is here,2 years ago,Open,47
Dalton Scott,5.0,Amazing food even when the place is busy they move through the line fairly quickly.,2 years ago,Open,47
Joseph Fox,4.0,Be sure to ask that your pizza is cut evenly.. Mine was very unevenly cut but still good the same,3 years ago,Open,47
Lindsey Shatto,5.0,"Always a great experience at Blaze!!! Food is great, the blood orange lemonade is bomb and the staff is always friendly!!!",2 years ago,Open,47
Douglas,5.0,Good inexpensive food,a year ago,Open,47
Bryan Park,4.0,Really good pizza for after the Erie marathon,a year ago,Open,47
Sara Balogh,4.0,"Very good pizza, overpriced but good for a different pizza treat!",2 years ago,Open,47
Millie Wetzel,2.0,Went there tonight. Ingredients were definitely fresh but quite disappointed.  Asked for the thicker crust and was way too thin plus too hard. Overdone. The size of the pizzas were small. No choice of size. Came home hungry.,3 years ago,Open,47
axtionjd1,5.0,I love their pizza!,a year ago,Open,47
Ryan Schuster,3.0,Great pizza.  To busy for me.,a year ago,Open,47
Smstec77,3.0,Not a fan of thin crust pizza...it was just ok.,a year ago,Open,47
Justin,5.0,"Great pizza, price is good if you build your own.",2 years ago,Open,47
Teal Dragon21,5.0,"OMG , this place has the best pizza and the best service and the people are super nice and helpful",2 years ago,Open,47
Bethany Schrock,5.0,"First time here and hope to be back! ""Build your own pizza"" was fun and extremely good! Perfect size of pizza 👍🏼",3 years ago,Open,47
Jennifer Keverline,5.0,Good pizza but a little stingy on the toppings.,a year ago,Open,47
BethAnn Lang,5.0,Amazing pizza. Only thin crust. So 1 pizza is like a serving.,2 years ago,Open,47
Sherri Roth,5.0,They have fresh ingredients and gluten free dough!  We will definitely be back!  Delicious!,3 years ago,Open,47
Wendy Payne,5.0,"Always fresh, always delicious! Best pizza in town!",2 years ago,Open,47
Matthew Joyce,5.0,Loved the food,10 months ago,Open,47
Pam Bortner-Adsit,5.0,The pizza crust was delicious toppings were perfect!,2 years ago,Open,47
David Southwick,5.0,Great as always#,a year ago,Open,47
Don Duberow,5.0,Great people and great food.,a year ago,Open,47
Kris Snyder,2.0,Under cooked !! Rather other places!,a year ago,Open,47
Charles Binney,5.0,Good pizza fast and affordable the way you want it.,2 years ago,Open,47
g l,5.0,"Love the options, fast and cheap",a year ago,Open,47
Khalifah Muhammad,5.0,Great Place to eat,2 years ago,Open,47
Jessica Sanner,5.0,Had the gluten free pizza. It was delicious. Love that they have a gluten free option!,3 years ago,Open,47
Jim Wood,5.0,"Great place, served quick with great pizza",a year ago,Open,47
Deborah Steves,5.0,"Delicious, fresh food.  Super friendly employees. What more can I say?",3 years ago,Open,47
William Jones,5.0,Vegan pizza that tastes awesome..need I say more?,2 years ago,Open,47
Geo Leis,5.0,Vegan and gluten free. Amazing,2 years ago,Open,47
Larissa Taylor,5.0,First time here! Best pizza I have EVER HAD! (I've eaten my fair sh,2 years ago,Open,47
scott dumeyer,5.0,Consistantly good and a reasonably priced healthy option!,2 years ago,Open,47
Jodie O'Connor,3.0,We enjoy coming to Blaze...however tonight as everyone is gathering around to collect their pizza the female attendant was SHOUTING everyone's name as their pizza came out.  The experience seemed hostile...especially because everyone …More,3 years ago,Open,47
Ihor Luhovyy,5.0,"A bit noisy, but it suites this place. Endless variations of ""Fire'd"" pizza. VERY FAST and FRIENDLY stuff! Liked it!",2 years ago,Open,47
Matthew White,5.0,The food is good and the price is better!,2 years ago,Open,47
Randall Haberern,5.0,Quick and efficient service; great pizza on the go or to dine in!,2 years ago,Open,47
Bitter Bug,4.0,"I thought it was amazing best place to get pizza, but the music is a little loud.",3 years ago,Open,47
Troy Parrett,5.0,Best pizza in town.,a year ago,Open,47
Billy Sechrist,5.0,Was just there. Love the staff. Highly recommended!,2 years ago,Open,47
Joshua Brass,5.0,"Good as usual, had a problem but it was resolved will be back thanks",a year ago,Open,47
Kevin Boxer,5.0,Service was great and the food was delicious. It was a fantastic experience.,3 years ago,Open,47
Rachel Mingoy,5.0,The food was great and despite how busy it was they were fast,2 years ago,Open,47
Shannon Hannah,5.0,I love this place reminds me of Moe's but its Pizza,2 years ago,Open,47
Scott Wasson,5.0,Love it. Best pizza around. Unique. A must try if you like pizza.,3 years ago,Open,47
Heather Anderson,5.0,15 minutes or less for a custom made pizza. What a good experience we had.,2 years ago,Open,47
Jeff Wayne,5.0,Never had a bad experience there.,a year ago,Open,47
Karina Ayala,5.0,"Come here a couple of times now and still love it ! Love the people who work there. Don't let a long line scare you, they're fast !!",3 years ago,Open,47
Joshua Conrady,5.0,Great staff and wonderful pizza! Fun atmosphere and food.,3 years ago,Open,47
Wenus Wenus,5.0,"Always fresh, deliciousness, very friendly quick workers!",2 years ago,Open,47
devildogRJ PA,5.0,A nice St Louis pizza to order at a reasonable price. Bueno!,2 years ago,Open,47
Zack Deimel,5.0,👌,11 months ago,Open,47
Douglas Valerio,5.0,ARTLOVER FOR LIFE,a year ago,Open,47
Ashray Aggarwal,5.0,"Fresh, great tasting customizable pizza at a really good price",2 years ago,Open,47
Jennifer Baker,5.0,Always a favorite! I love the concept and the pizza is always really delicious!,2 years ago,Open,47
tanya besnier,5.0,"I've had an excellent experience everyone I've been here!!! Delicious pizza, great service, and many options!!!! Five star for sure!!!",3 years ago,Open,47
Alexandra DeMarall,5.0,Pizza is great. Made however you like.,2 years ago,Open,47
Melissa Brown,5.0,"First visit, food was excellent!",2 years ago,Open,47
Looking,3.0,Awesome food but they never answer their phone. Been trying to call them with questions for 45 min now and only get a busy signal,3 years ago,Open,47
Jordynn Sanford,5.0,"Amazing service, and amazing food!",2 years ago,Open,47
Justin Williams,5.0,Hands down one of the best places in Erie and VERY reasonable for what you get!!,3 years ago,Open,47
Carolann Kunka,5.0,Impossibly good. The Art lover is my favorite.,2 years ago,Open,47
Gregg Simmonsen,5.0,"Good prices, good service, reasonable wait times, and great pizza.",3 years ago,Open,47
Steven Krauza,5.0,"Gluten free dough,  spicy red sauce,  gorgonzola cheese,  goat cheese,  fresh basil , fresh spinach,  jalapenos, tomatoes,  and grilled chicken = awesome.",3 years ago,Open,47
Eli King,5.0,"Best place to get pizza, best prices, quality ingredients,  nice staff. Also this is by far the best place to eat if you're gluten n dairy free, they're very professional about cross contamination.",3 years ago,Open,47
Rob Webster,5.0,Pizza version of subway! So good.. so many options! Great price!,3 years ago,Open,47
Emily Shreve,4.0,"Food was great, but The tables were not maintained well, making it difficult to find a spot to sit and enjoy the meal.",3 years ago,Open,47
Donald Pearce,4.0,"Really good pizza, really fast. It's like Moe's, but with pizza instead of tex-mex.",3 years ago,Open,47
shawn gwin,5.0,great flavor... amazing service,2 years ago,Open,47
Mary Nupp,5.0,Come on- it's Blaze! Delicious!,a year ago,Open,47
Laura Hinkle,5.0,Best pizza ever. Loved it,2 years ago,Open,47
John Shirley,5.0,"Fresh ingredients, excellent staff and delicious pizza!",2 years ago,Open,47
Bay City Tattoo Company BCTC,5.0,Best place to get the pizza U want!,2 years ago,Open,47
Denise Malcolm-Hall,5.0,Fresh salad is the besttttt,a year ago,Open,47
Wayne H.,4.0,😋,a year ago,Open,47
Diane Casey,5.0,"Excellent pizza,,,and you can add anything you want and as much as you want! Great tasting!",3 years ago,Open,47
Nettie J,5.0,I love their pizza,a year ago,Open,47
Stacey McCoy,5.0,Fun concept and great pizza!!,a year ago,Open,47
Katy Merriam,5.0,"Yummy fresh pizza FAST, one price for unlimited toppings.",3 years ago,Open,47
Dan Caldwell,5.0,"Good pizza, get the app and get some coupons!",2 years ago,Open,47
Ozias Sanchez,5.0,Pretty impressed! Enough food to define fill you up! :),2 years ago,Open,47
JD Laird,5.0,Great pizza and fast  service,2 years ago,Open,47
gerald silkworth,5.0,Awesome food very accommodating,a year ago,Open,47
Dylan Gorski,5.0,The employees were really friendly and the pizza was perfect!,2 years ago,Open,47
Tim Helsley,5.0,"Great pizza! Add what you want, and it's ready in a few min",3 years ago,Open,47
Gary Kaschak,5.0,Awesome pizza made to order your way.,2 years ago,Open,47
kyle frost,5.0,Banging toppings as many as I want for no extra charge,3 years ago,Open,47
Bud Guth,5.0,"Very good pizza with unlimited toppings, very nice price,",3 years ago,Open,47
Holo Faydren,5.0,Best pizza ever for the price,2 years ago,Open,47
Diane MacWilliams,5.0,Awesome thin crust pizza and great service!,3 years ago,Open,47
Mandy Deyarmin,5.0,"Here to support Orphan Angels!!!  Pizza is amazing and the fact that they are helping the
kitties is a bonus to eating here🐱🐱💜💜💜!",2 years ago,Open,47
Ben Trabold,5.0,"Fast service, great food",2 years ago,Open,47
Desiree Gabel,4.0,Love Blaze. Prices keep going up though.,2 years ago,Open,47
Ginny Haraldson,5.0,I absolutely love Blaze Pizza!  Best 🍕 ever!!,2 years ago,Open,47
Heather Cole,5.0,Fantastic pizza. You choose everything and it is made in front of you.,3 years ago,Open,47
Kevin Koppes,5.0,So tasty!,a year ago,Open,47
Maria Bartell,5.0,The workers and service are always top notch!,2 years ago,Open,47
Jean Bomboy,5.0,Love this place best pizza around!,2 years ago,Open,47
Dave Phillips,5.0,Some of the best pizza in Erie,a year ago,Open,47
Shiben Naik,5.0,Best pizza in Buffalo area,a year ago,Open,47
Brian Peters,2.0,"Its ok,im a seveoes pizza lover",3 years ago,Open,47
Lucian Spalla,5.0,Excellent quality!,a year ago,Open,47
Juanca Rodriguez2,5.0,Such good pizza.,a year ago,Open,47
Kristen Ritter,5.0,"Amazing! Fresh ingredients,  great options,  10/10!",2 years ago,Open,47
Pat Durkin,3.0,"It's like a ""SUBWAY"" shop,  but with pizza.",2 years ago,Open,47
Lee Jones,4.0,Food was overall very good salad kinda lacking but not by much definitely 4.5 stars.,2 years ago,Open,47
Josiah Keeley,5.0,Great pizza,a year ago,Open,47
Katie Ruf,5.0,Always amazing!  Great & friendly staff!,3 years ago,Open,47
dave higham,5.0,Great pizza low cost,a year ago,Open,47
Rebecca Ramm,5.0,I love blaze! People ans the food,3 years ago,Open,47
Pauline M,5.0,Great place!! Great food!! Will return!!,2 years ago,Open,47
Brian Edwards,4.0,Good experience,a year ago,Open,47
Joe Kozar,5.0,Great food and service,2 years ago,Open,47
Jason Jimerson,4.0,Love the fresh baked personal pizzas.,2 years ago,Open,47
China Kay,5.0,"Best pizza I’ve had in Erie, hands down. 🙂",2 years ago,Open,47
Nicole Wodarski,5.0,Love their pizza,a year ago,Open,47
Angie Ritz,4.0,Very awesome pizza.  Great concept.,3 years ago,Open,47
Sue Rugar,5.0,Fantastic,9 months ago,Open,47
Kayla Smith,2.0,Fast and fresh but some of the worst pizza I've ever had right next to alfies and luchettis,3 years ago,Open,47
Maggie V,5.0,Delicious. Chipotle style pizza place,2 years ago,Open,47
J Carver,5.0,Good pizza with fast friendly services.,3 years ago,Open,47
Janice Thompson,2.0,Overrated. Not impressed and very expensive.,a year ago,Open,47
Steven Ferringer,5.0,This is my favorite pizza place!  Great quality and good prices!,2 years ago,Open,47
Ginny Golab,4.0,"Love the BIG selection of toppings, very friendly",2 years ago,Open,47
Mikki Bort,5.0,Gluten Free crust is delicious!!,2 years ago,Open,47
Brandie Plonski,5.0,Love the food and the staff.,2 years ago,Open,47
Kevin Foreman,5.0,Fun and delicious place to eat!,3 years ago,Open,47
Michael Furey,5.0,Best pizza place in Erie!,a year ago,Open,47
Wanda Claudio,5.0,"Great pizza, great options...",2 years ago,Open,47
Alex Alex,5.0,Finally we have real thin crust pizza!!! Best one so far in town!!! A+,3 years ago,Open,47
Lisa Robertson,5.0,Best pizza ever,a year ago,Open,47
Joseph Fischer,5.0,The line gets long around dinner time.,a year ago,Open,47
Austin George,5.0,Great pizza at a great price.,3 years ago,Open,47
Jim Theisen,5.0,Crazy good. Crazy amount of toppings!,2 years ago,Open,47
L Harcourt,5.0,"Great Vegan Friendly Pizza, Fantastic Employees!",2 years ago,Open,47
shannon held,5.0,Love the crust,a year ago,Open,47
Dottie Blaylock,5.0,So gooooooood!!!!,11 months ago,Open,47
Mike Mannarino,4.0,Great,8 months ago,Open,47
Beverly Myers,5.0,Loved it. Choices for vegans.,2 years ago,Open,47
JP Worley,1.0,Burned my fingers on the METAL plate the pizza comes on... who didn't think this through?,2 years ago,Open,47
Lil Mnz,4.0,Love their pizza!!!,a year ago,Open,47
Karen Gregory,5.0,Excellent pizza and service!,3 years ago,Open,47
Kayla Gonzalez,5.0,"Great pizza,  great service!",3 years ago,Open,47
Stephany Anderson,4.0,Green stripe pizza is AMAZING,2 years ago,Open,47
Leah Hargnor O,5.0,Jalapeno popper pizza is my favorite,2 years ago,Open,47
L Young,5.0,Always bangin.,a year ago,Open,47
Zackary Zimmer,5.0,Delicious pizza,a year ago,Open,47
Amy Hepfner,5.0,Pizza was amazing,8 months ago,Open,47
Chrissy Earley,5.0,A bit pricy but so yummy,2 years ago,Open,47
Anthony Bailey,5.0,Great service 👍,a year ago,Open,47
austin alloway,5.0,Great pizza fast fire'd,2 years ago,Open,47
Thomas Fetcho,3.0,Don't eat pizza,a year ago,Open,47
heidi hess,5.0,Best pizza ever,2 years ago,Open,47
Chelsea Brown,5.0,Good pizza,a year ago,Open,47
Elizabeth Foster,5.0,Yum!,a year ago,Open,47
Joseph Thornburg,5.0,Love this place,2 years ago,Open,47
rick simpson,5.0,Subway of pizza,a year ago,Open,47
Jayla Metzler,5.0,Amazing,a year ago,Open,47
Steven Woollett,5.0,Great pizza best in Erie,a year ago,Open,47
Rita Weryha,5.0,"Wonderful, wonderful!",a year ago,Open,47
Albert H,5.0,Surprisingly good,2 years ago,Open,47
tom demitras,5.0,Moe's for pizza. What's not to love?,2 years ago,Open,47
James Rothrock,5.0,"Great pizza, fast!",2 years ago,Open,47
Daniel Rayner,5.0,Blaze is amazing because the pizza is blazing,2 years ago,Open,47
Wyatt Spellman,5.0,Really yummy,a year ago,Open,47
Sue Merva,5.0,Yummm yum!!!,a year ago,Open,47
James Samonsky,5.0,Fresh crust and toppings.,a year ago,Open,47
Eric Anderson,5.0,Fast and tasty,a year ago,Open,47
Daren B,5.0,"Good, fast and cheap",3 years ago,Open,47
Pia Hayes,4.0,They have fanaminal pizza 😍 I recommed it,3 years ago,Open,47
David Kensinger,5.0,Best i ever had,2 years ago,Open,47
Jamie Pugh,5.0,Great pizza!,a year ago,Open,47
Matt Marino,5.0,This pizza is incredible.,a year ago,Open,47
Cheryl Boyd,5.0,So good!,a year ago,Open,47
Krystal Taylor,2.0,"I ordered a white top pizza, and the employee that put my cheese on left an entirely blank area. When I asked for more, she told me no. I asked her for more again, she told me no a second time. Then when I got my pizza there was a whole …More",3 years ago,Open,47
Jamie Shatto,5.0,Love this place!,a year ago,Open,47
Laurie Brown,5.0,Great pizza!!!,a year ago,Open,47
Devon Hall,5.0,This pizza tastes better than beating the 73-win Warriors with a 3-1 disadvantage,3 years ago,Open,47
Garrett Schloss,5.0,Good stuff,a year ago,Open,47
Kurt Richter,3.0,Workers are a bit rude.,a year ago,Open,47
ravi shankar,5.0,Best place for pizza in ERIE,2 years ago,Open,47
Melissa Swift,3.0,Always hit and miss depends on the staff.,a year ago,Open,47
Scott Twoey,2.0,Horrible,a year ago,Open,47
Lauren Locke,5.0,"Great, fresh, pizza. Friendly staff.",3 years ago,Open,47
Darin Hayes,5.0,Awesome smells and tastes.,2 years ago,Open,47
Justin Tippen,5.0,Excellent pizza,a year ago,Open,47
Sarah Cooler,5.0,Axing pizza a staff was friendly,2 years ago,Open,47
Bobbie Fenno,5.0,Super delicious!,a year ago,Open,47
Barbara Albert,1.0,Unhappy that they won't take a phone order for pick up.  We had 8 pizzas to order.  Guess they don't want our business.,3 years ago,Open,47
Charlie Pregler,3.0,Decent but not great.,2 years ago,Open,47
Marc Lawson,5.0,Food,a year ago,Open,47
Jeri Zeigler,5.0,"Best pizza in Erie, never been disappointed!",3 years ago,Open,47
Leo Ferko,4.0,Good food clean just a little expensive. Worth it though,2 years ago,Open,47
Daniel Gavin,5.0,Greast!!!!!,a year ago,Open,47
Donald Ott,3.0,Average fare.,a year ago,Open,47
Thomas Martin,5.0,Fantastic!!!!!!!!,a year ago,Open,47
diane Salter,5.0,Delicious,a year ago,Open,47
linda brumagin,4.0,Pizza was good,a year ago,Open,47
Bao-Han Ng,4.0,Delicious,a year ago,Open,47
Latonya Walker,5.0,GREAT!,2 years ago,Open,47
Rebecca Dearborn,2.0,Overrated,2 years ago,Open,47
Roger Salzillo,5.0,Good Pizza,2 years ago,Open,47
Cody Brace,5.0,Boom,a year ago,Open,47
Keith Hough,5.0,Best pizza in Erie,a year ago,Open,47
Mark Comi,5.0,Great,2 years ago,Open,47
Sarah Rodgers,5.0,Yummy 🍕,a year ago,Open,47
Kimberly Daugherty,5.0,Awesome Pizza.,2 years ago,Open,47
David A,2.0,"good idea, but bad, salty pizza.",2 years ago,Open,47
Steven Stafford,5.0,Awesome,2 years ago,Open,47
Jennifer Ramsey,5.0,Great pizza,2 years ago,Open,47
Michael Young,5.0,Excellent pizza,2 years ago,Open,47
Marc Cerasani,5.0,Great!,2 years ago,Open,47
Akash,5.0,Good food,2 years ago,Open,47
Katie Snow,5.0,AMAZING!,2 years ago,Open,47
Mike C,5.0,Great pizza!,a year ago,Open,47
Douglass Jeff,5.0,Amazing atmosphere,2 years ago,Open,47
Eric C,5.0,Great atmosphere,2 years ago,Open,47
Cheryl Pierce,5.0,Awesomeness!!!!,2 years ago,Open,47
Nate Eckelberger,5.0,Excellent,2 years ago,Open,47
Tracy F,5.0,Yummy,2 years ago,Open,47
Greg Clement,5.0,Excellent pizza,a year ago,Open,47
Darlene Liebel,5.0,Excellent pizza as always,2 years ago,Open,47
Kris Diehl,5.0,Delicious,2 years ago,Open,47
Nicole Gipe,5.0,Hands downs delicious!,2 years ago,Open,47
Sporta Kiss,5.0,I absolutely love this pizza!!!!!,2 years ago,Open,47
Sharyl Sumner,5.0,Great place!!!,2 years ago,Open,47
Robert Morrison,5.0,Good fast pizza!,3 years ago,Open,47
Paul Fillak,5.0,Best pizza in town,2 years ago,Open,47
Robert Lawrence,5.0,Best place to get pizza in Erie.,2 years ago,Open,47
TheKingEmoji,5.0,Best pizza around! Must stop in Erie!,3 years ago,Open,47
J G,5.0,Love the pizzas!,3 years ago,Open,47
Deb Brock,5.0,AWESOME!,3 years ago,Open,47
Ryan Palmer,5.0,Great pizza!,3 years ago,Open,47
Wm P Fox,4.0,Fast tasty pizza,2 years ago,Open,47
ERIC ESTERLY,5.0,Awesome. My son loved it.,2 years ago,Open,47
Bruce Curtiss,5.0,Awesome Pizza......,3 years ago,Open,47
Richard Gawlinski,5.0,Best experience at a restaurant in years!!!,3 years ago,Open,47
Robin Herman,5.0,Good pizza,3 years ago,Open,47
William Zimmer,4.0,Good and fast,3 years ago,Open,47
Armand Rocco,4.0,Great concept!,3 years ago,Open,47
Anne Maas,5.0,GREAT GREAT pizza!!,3 years ago,Open,47
Greg Wurst,4.0,Fast and tasty,3 years ago,Open,47
John Sawtelle,4.0,Good,3 years ago,Open,47
onsiden music,5.0,amazing pizza. vegan options!,3 years ago,Open,47
Dennis Sears,5.0,Very busy but worth it.,3 years ago,Open,47
Joe Mangini,5.0,You can't beat it ....5.50 for a fresh sm pie,3 years ago,Open,47
Tim Randall,5.0,"Friendly, fast and good pizza.",2 years ago,Open,47
Terry Brown,5.0,Fantastic! They even have vegan stuff!,3 years ago,Open,47
Dr. Dustybottom,5.0,It's lit fam.,2 years ago,Open,47
Geoffrey Lang,5.0,Amazing fast pizza.,2 years ago,Open,47
Nasser alqahtani,5.0,good pizza,2 years ago,Open,47
small world,4.0,"Great concept,   great ingredients,  great pizza experience",3 years ago,Open,47
Matt Malinowski,4.0,"Pizza is great, fresh toppings!",3 years ago,Open,47
edi1f3,5.0,Fresh 2 death,3 years ago,Open,47
Jamie Miller,1.0,Order online or walk in rude girl answers phone this place won't last long,3 years ago,Open,47
JEREMY BOLL,5.0,Great fast pizza!,3 years ago,Open,47
michael conard,5.0,"(Translated by Google) Yummmm!

(Original)
Yummmm!",a month ago,Open,47
Anonymous,5.0,"(Translated by Google) mmmmmmmmmm

(Original)
mmmmmmmmmm",3 months ago,Open,47
Joe Nemet,5.0,"(Translated by Google) MTO pizza!

(Original)
MTO pizza!",a year ago,Open,47
Garima Parker,5.0,"(Translated by Google) Yummmm

(Original)
Yummmm",2 years ago,Open,47
Michael Schmitt,4.0,,a year ago,Open,47
Tj Mc,5.0,,a year ago,Open,47
Lauren Baldauf,5.0,,a year ago,Open,47
Suzana Laus,4.0,,2 years ago,Open,47
Chris Manley,5.0,,a year ago,Open,47
Becca Crilley,5.0,,a year ago,Open,47
Kevin Torres,1.0,,2 years ago,Open,47
Jermaine Collins,5.0,,4 months ago,Open,47
Brooke Manafo-McKissock,5.0,,2 years ago,Open,47
Michael Engro,5.0,,2 years ago,Open,47
Tricia Buchleitner,5.0,,3 years ago,Open,47
Cristina Leuschen,5.0,,2 years ago,Open,47
Gretchen,4.0,,a year ago,Open,47
Julie Ann Cella,5.0,,2 years ago,Open,47
BAMA Bam,5.0,,9 months ago,Open,47
renee schonthaler,5.0,,2 years ago,Open,47
Robert Herman,5.0,,2 years ago,Open,47
Jerry Dz,5.0,,2 years ago,Open,47
Chris Paszko,5.0,,8 months ago,Open,47
