name,stars,text,timeSince,openStatus,key
Joe Sanchez,5.0,"Best pizza, I love it!",7 months ago,Open,49
Jonathan Alexander,5.0,build your own is an insane value of youre like me and want basically everything,11 months ago,Open,49
Amanda Beebe,5.0,My daughter brought me in last night. It was amazing.  People and the food were great.,a year ago,Open,49
Maxahoy,5.0,Excellent employees! Lots of ingredient options & relatively affordable for what you get. I particularly appreciate that they have so many cheese options available.,a year ago,Open,49
Joe Pannullo,5.0,Blaze is awesome! They have goat cheese.,a year ago,Open,49
Edward Lui,5.0,"Firs time, Great pizza",6 months ago,Open,49
Derek Carter,5.0,Great for a quick pizza on campus for a decent price,a year ago,Open,49
Jaylen Stokes,3.0,"The food was good and the service was alright nothing left and impression on me other than the food which is definitely fresh and made with good ingredients. Overall the atmosphere is nice to be with friends in and talk, or maybe as a chill date, otherwise there are better pizza places.",a year ago,Open,49
Linda Capito,5.0,"Delicious pizza made from scratch. The dough is freshly made, and you can tell by the taste. If there isn't a big wait, then you'll get your pizza three minutes after ordering, which is awesome! If you want to make your own pizza or buy a signature pizza, you pay the same, which is also super convenient!",2 years ago,Open,49
Spencer Hauck,5.0,Great thin crust pizza. Make your own or order off of the menu. I highly recommend the  in house make drinks like blood orange lemonade that are simply delicious. The place is called blaze because they put your pizza into a flame oven once your order is complete.,2 years ago,Open,49
Ralph Martins,5.0,"Usually a long line, but it's worth the wait.",a year ago,Open,49
Jack Morris,5.0,Kevin got good service,8 months ago,Open,49
Farow Yusuf,5.0,omg kevin makes the best pizza and he is so amazing. GREAT COSTUMER SERVICE!! somebody give this man a raise!,a year ago,Open,49
Myles Deacon,4.0,"Good quick pie, but I like Mod Pizza better.",a year ago,Open,49
hackn3y,5.0,"Really good pizza with create your own options, their oven cooks the pizza fast and the crust was very crunchy. Lots of vegan options with nutrition info. The vegan cheese, which from my understanding is Daiya, wouldn't be my first choice, but its fine and a nice option to have. Oh and basically unlimited toppings at a fair price btw!",a year ago,Open,49
Foos Ayanlè,5.0,"Kevin showed great customer service, he was really nice. A true team player",a year ago,Open,49
Tommy Balaj,5.0,Kevin is very friendly,a month ago,Open,49
Dominique Shisler,2.0,Went to see our roommate but the experience was not good. I'm allergic to tomatoes so we tried the Alfredo sauce and we wanted it well done but we ended up with just a burnt pizza. Then the s'mores pies are over cooked. Just not what I was looking for,a year ago,Open,49
David Denzy,5.0,Shoutout to my man Kevin behind the counter tossing the best dough in the business,a year ago,Open,49
Samantha Coss,4.0,Good pizza pretty fast. Okay vegetarian options. Trendy atmosphere. Good ingredients. Would recommend for a quick lunch!,2 years ago,Open,49
Anna Borsick,5.0,Best vegan with vegan chorizo was 🔥....,10 months ago,Open,49
Caroline Wahl,5.0,"I love Blaze, it's my favorite place to get a vegan pizza. They are so vegan/gluten-free/vegetarian friendly. They have so many topping options and the price isn't bad for what you get. Sometimes the pizza cutter slacks and doesn't cut the pizza all the way through but overall I would rate it 5 stars.",3 years ago,Open,49
Joseph Suhayda,5.0,Great food... Staff was even better.,a year ago,Open,49
Greg Nagy,5.0,My favorite of the make your own pizza chains!,a year ago,Open,49
Stephen Cassidy,5.0,"Great for lunch, allows you to pick what toppings you want and customize to your heart's content. The dough is pretty good. Overall the pizza won't blow your mind, but it's a very good thinner style crust that's lighter and great for lunch.",2 years ago,Open,49
Toyota Lexus,5.0,"There was misunderstanding about my hooked app coupon i was upset about but the manager at this location made up for it, i was very thankful for that. Food was excellent but the customer service was even better. Will come back because of how the manager handled the situation.",a year ago,Open,49
Tiffany Washko,2.0,Been here to pick up pre-ordered pizza twice. Both times the two male cooks ignored me completely. Not bothering to ask my name or update me on my order status. Very rude!,a year ago,Open,49
Danijel Miletic,5.0,"Really great service, open people and one of the best pizza's I have got to eat",a year ago,Open,49
LiLi Salt,5.0,"Great service here! I had the Link In specialty pizza and it was absolutely delicious! So many intriguing toppings, I will definitely be back to try some more! Note: restaurant is loud.",3 years ago,Open,49
Maeve,5.0,"Dillan served me today at Blaze and I was completely blown away by his work ethic. He is professional, efficient, and  as he cut and served pizza to customers. His customer service skills are unmatched. Thanks for a good experience.",2 years ago,Open,49
Tony Maggio,4.0,"Good fast pizza. Its what you expect for a quick service, make-your-own style joint. Nice drink selections.",2 years ago,Open,49
Kyle Harvey,4.0,It was okay cuz you can make your own pizza. But I've had better it was still pretty tasty.,a year ago,Open,49
Tim Fulton,5.0,I could eat their cauliflower crust pizza all day.,10 months ago,Open,49
Brittney Haywood,5.0,"L order from them on doordash at least once a week, it's a secret obsession of mines, I'd recommend this to anyone looking for a quick pizza that decently priced and super delicious. For $8 you can add as many toppings as you'd like and …More",a year ago,Open,49
James Hallas,5.0,"Robust pizza design options, and a legitimate dedication to providing a Gluten free Pizza option that is safe to eat for a Celiac's sufferer, combined with great prices and a clean and visually pleasing environment, make for a top tier experience.",a year ago,Open,49
Madison Prudente,1.0,Rude workers who harrass their customers! Never going there again!,11 months ago,Open,49
Saamia M.,5.0,Kevin was amazing! Great customer service.,a year ago,Open,49
Paul Williams,5.0,Kevin has a great attitude and I wanted to say thanks for the great service,a year ago,Open,49
Waldotorr,5.0,"Probably the best idea for pizza I have ever experienced. This place is great if you can't decided what pizza to get between friends. Fast, friendly, and delicious! Blaze will most likely be the next big thing in the US!",4 years ago,Open,49
Noskcidd,3.0,The pizza isn't bad at all. The smell of old mop water... that's another story.,a year ago,Open,49
Kristen Morrow,5.0,"Great food and great service! They had a long line, but had great attitudes and were very fast to get everyone through the line. Jered did a great job explaining the menu and helping me out for my first time.  Will definitely come back and recommend to friends!",2 years ago,Open,49
Clair Bullock,5.0,"Great food, friendly folks, Kevin and Sam make a 10/10 pizza",a year ago,Open,49
Brandon Little,5.0,This is the best pizza i have ever had. Tkme and time again I am impressed!,a year ago,Open,49
Elijah Howell,5.0,Delicious and SUPER fast 😋.,a year ago,Open,49
Alyssa Roese,1.0,"This is the worst place I’ve ever been downtown. Rude employees , slow workers, and gave me the completely wrong order and refused to fix",a year ago,Open,49
AP,5.0,"Blaze is the best pizza near OSU in my opinion!  I'm really happy to hear that they opened one back home in Pittsburgh because I think Blaze might have some of the highest quality pizzas I've had in a long time, which is really surprising …More",3 years ago,Open,49
Mark Bishop,5.0,Good crust and sauce with unlimited toppings for a reasonable price. Load these pizzas up!,a year ago,Open,49
Lucas Jackson,5.0,"Favorite pizza place on high street, great atmosphere! Toni is great!",a year ago,Open,49
cmeonbmx,5.0,Pizza was awesome!!! I enjoyed the build it in front of you style!! Great job will return,a year ago,Open,49
Aaron Jones,5.0,"Always poppin' off on the weekend, but always prompt and efficient. Tasty 🍕",a year ago,Open,49
Douglas Carl,5.0,Great food and service,8 months ago,Open,49
Linda Perez,5.0,"Awesome service :)))
Angie Perez is very Professional and greets everyone with a smile. Makes great recommendations on choices as well!
OSU Blaze rocks!!",a year ago,Open,49
Tatiana Hood,5.0,Amazing fresh great customer service beautiful people,a year ago,Open,49
Chris Bartos,4.0,"Pizza is good. 3/14, also known as Pi Day has a whole pizza for $3.14. Can you beat this price? They also advertise the calorie content of their pizzas for good measure. I am giving this place 4 stars because my breath ends up being a enormous garlic fart afterwards. Maybe skip the date night here?",3 years ago,Open,49
Beth,1.0,"So I've only been to this restaurant a few times, and never really had a problem with the food or customer service. However, I was absolutely taken aback when the cashier made an unwarranted remark about my monetary balance on my debit …More",3 years ago,Open,49
Mike Holt,5.0,That guy Kevin is the best transfer that’s happened in the company,a year ago,Open,49
Neytiri Shanelle,5.0,"This place is wonderful. Excellent choices, reasonable prices, fast speed, and delicious pizza. I came and was served by Dylan. He provided me phenomenal customer service. He made me fresh dough. He allowed me to taste the lemonade. And he …More",2 years ago,Open,49
Manuel Jose Hernandez,5.0,"Wow. I really recommend this place. It has very good pizza and you have the opportunity to select every single ingredient. Apart from that, your pizza will not take more than 5 minutes to be ready.",2 years ago,Open,49
Samantha Kearney,5.0,A build your own pizza place that has TONS of options. Even for a vegan like myself. They also have the option to order online and pickup later (I ordered mine at like 11 to pick up around 5 for dinner). It's also super close to campus.,2 years ago,Open,49
Shelby Schroeder,5.0,Loved it. My entire family that can never decide what to put in a pizza for every one can put whatever they want on theirs and everyone is happy. Never EVER had a problem with the service. Members are always friend and funny. Never had a problem with my pizza. Delicious every time. Definitely would recommend to anyone.,4 years ago,Open,49
ClayMiA OniTunes,1.0,They just close whenever don’t follow the posted schedule and they also hand out orders to the wrong people and leave you screwed,a year ago,Open,49
Aine Mooney,1.0,Won’t give water even with purchase.,11 months ago,Open,49
Mary Ball-Swartwout,5.0,Good pizza and super excited that they have vegan cheese!,a year ago,Open,49
David Harris-Santos,1.0,"Horrible, horrible, horrible stated they where closed 1 hr before posted closing time and refused to serve me when they had other people inside. And completely rude. This location just horrible.",2 years ago,Open,49
Lora Jury,4.0,Reasonably priced and the pizzas Havr a great crust,a year ago,Open,49
Jay,4.0,Pizza always fresh worth the wait!,a year ago,Open,49
Wesley Roberts,5.0,Good place to get pizza quickly. Friendly staff.,a year ago,Open,49
Mark Barnes,5.0,Campus is my favorite Blaze pizza Dani and Angie made my day making me the best pizza ever with friendly smiles as usual. Go Bucks.,a year ago,Open,49
Chad Eichhorn,4.0,The experience (pizza) is extraordinary. Only 4 stars because they raised their prices since last year.,a year ago,Open,49
Lauren Johnson,1.0,They refuse to give paying customers access to water,10 months ago,Open,49
Jason Chapman,5.0,"Delicious pizza always, staff is friendly above and beyond quick service standards.  Highly recommend.",2 years ago,Open,49
David Workum,5.0,"Very good!  Surprised me-quick food, good quality pizza.  LeBron smart to invest in this!",a year ago,Open,49
melayeller,5.0,"Always delish. Super fast, friendly people!",a year ago,Open,49
ella willis,1.0,Ordered from Blaze on doordash last night... only received one of the pizzas. Dasher didn’t know we were supposed to get two until we asked about it and he looked on the receipt and saw we payed for two. He said that there was one pizza …More,a year ago,Open,49
Cole Toler,5.0,Everything seems high quality and the taste is great. The service was friendly and quick as well. I would recommend!,2 years ago,Open,49
Tyler Wriston,4.0,As many toppings as you want.  Great idea.,a year ago,Open,49
Ks M,4.0,Food was good but they should have salads all the time!,a year ago,Open,49
Matt Hovey,5.0,"Kramer was ahead of his time. Make your own pizza is an awesome concept. Reasonably priced with quality toppings a respectable thin crust all will enjoy. Smart considerations for all dietary needs from vegan, gluten free and even picky kids.",4 years ago,Open,49
Chris A,4.0,"Great service and food.  The pizza could be fantastic or awful, it all depends on what you chose to put on it.  Have fun experimenting!",2 years ago,Open,49
Kro DaJuggalo,5.0,"LOVE IT!!! Best pizza you could ask for and it's always so good! The only time it's not so great is of its made by a college student who doesn't care, they're just there cause they want money which is sad... ruins the rep of the world's best pizza sometimes...",3 years ago,Open,49
Foluso Alli,5.0,Great place for pizza if your looking for healthy option.,a year ago,Open,49
bido jones,4.0,Fresh food friendly staff I'll be back,a year ago,Open,49
Charles DePoyster,5.0,Great people and great food at a good price,a year ago,Open,49
Sufiy James,5.0,Yum! this was our first time going and my daughter's mouth was burned because we had no idea the pesto sauce was loaded with a hot spice. It was really hot.,a year ago,Open,49
PersonofNat,1.0,"Somehow managed to mix my pizza up with another one and got it to go, so nice surprise when I got home",a year ago,Open,49
Robert Valentine,5.0,"Best pie in Columbus. Cool employees and Ohio state students are the coolest students I've ever met
On cota bus and near Wexner.",2 years ago,Open,49
Bri Mitchell,4.0,This was me and my mom's first time here. The wait was very long but worth it! Once you get up to the person who takes your order it's very fast from there. You can get any/all the toppings you want for a decent price. Basically subway for …More,4 years ago,Open,49
Sam Coyle,5.0,"Great service, great pizza, and surprisingly low calorie!",a year ago,Open,49
Cam,5.0,Fresh food made in front of your face. Made the way you want. Fairly priced.,2 years ago,Open,49
razersharp2,5.0,Kevin was fire,a month ago,Open,49
Stephen Houston,2.0,Very mean customer service and slow service,8 months ago,Open,49
Annie Hornyak,2.0,"I got a half cheese half pepperoni pizza and my pizza only had 3 pepperonis on it. And I told them that I was unsatisfied with the end result and they told me that, that was the correct portion size for half cheese half pepperoni pizza. …More",3 years ago,Open,49
Brooks F,5.0,This place is amazing and I always try to make a stop here when I'm in Columbus.,a year ago,Open,49
Travis Nedrow,5.0,"Great pizza and Toni was amazing, so nice and helpful!",a year ago,Open,49
Noah Street,5.0,This place has the best pizza,a year ago,Open,49
Doug Heiing,4.0,Good brick oven pizza.,a year ago,Open,49
Nicole Pascucci,5.0,"Great tasting affordable pizza, made super fast and with all the toppings you want for ONE price. Unbeatable. Add a trendy relaxed college feel and this place is bomb for grabbing pizza, eat in or take out.",3 years ago,Open,49
Matt Burns,5.0,Service has always been high quality every time I head in. Fair amount of seats inside to eat as well as really high quality pizza.,a year ago,Open,49
Mike Harris,5.0,"Great pizza great variety of drinks, different drinks than other common fast food restuarants.",a year ago,Open,49
Adam Rayne,5.0,It's like the chipotle of pizza. Reasonable prices and it tastes AMAZING!!,a year ago,Open,49
Sweetheart Princess,1.0,"The worst experience of my life. I was a proud blaze worker and took pride in what I did. It was absolutely the worst thing I've ever seen. The atmosphere was gross, the workers act as if they didn't care. My food wasn't cooked at all. A …More",3 years ago,Open,49
Trina Lashawn,4.0,Fast. Hot. Yum. Fun and friendly staff. Dining room wasn't very clean.,a year ago,Open,49
Garrett Minnich,5.0,"Awesome food and the staff ask you if each item looks like enough and if it “looks good”
Great customer service!!!",2 years ago,Open,49
Tierney Renat,5.0,Love this place. All the workers are kind and helpful.,a year ago,Open,49
Lucas Rhonemus,4.0,"A unique pizza place. Fairly fast, custom pizza or a standard pizza from their menu. They have vegetarian and gluten free options.",2 years ago,Open,49
Brian Waibl Polania,5.0,It was great customer service. David helped me order my pie and also informed of the great new blaze app. I will definitely be returning soon.,4 years ago,Open,49
Aaron Kemp,5.0,I love places like this. $8.45 gets you a pizza with whatever toppings you want. Pizza is great. Will definitely be back.,2 years ago,Open,49
Otaku Raider,5.0,It was amazing pizza was hot and tasty customer service was fast no long wait in line,a year ago,Open,49
Gregory Eberwine,4.0,"Decent price, awesome pizza. The selection of toppings is pretty good, although occasionally they'll be out of something on the line and won't check in the back. Lack of front facing sign can make it hard to find sometimes, and there's no parking at all. But it is definitely one of the best pizza places in the OSU area.",2 years ago,Open,49
jim hoffman,5.0,Great pizza. You can order from the menu or make your own. Bakes quickly too!,2 years ago,Open,49
Jamie Conners,4.0,I love this place; I usually good every week or every other week. Build your own is 7.50; you get a medium size pizza. I go so much I think they're starting to notice 😂😂 …More,3 years ago,Open,49
Craig Ramsey,4.0,The pizza is pretty good but not great. I do like the setup and the speed for sure. Good for a quick lunch or dinner.,3 years ago,Open,49
Steven Shaw,3.0,LBJ wouldn't approve of this campus location. ☹,a year ago,Open,49
Emmett Jesrani,3.0,"It's decent pizza, but it's not the best in its price range.",a year ago,Open,49
Gus Workman,5.0,"The food here is great. It is a Chipotle-style restaurant, but for pizza! How neat is that? You would think that such a process would take a while, but it really doesn't. Only two minutes or so after you pay and get through the line, you …More",3 years ago,Open,49
Shahadat Sohel,5.0,Great pizza place ...  You can choose from signatures or make your own!,2 years ago,Open,49
Ross Schwartz,2.0,"I have been to this location many times and the pizza is generally good. I did have a problem with my most recent experience however. I was ordering a veg pizza and decided to get pepperoni on it and one the staff called me a ""loser"" out of …More",2 years ago,Open,49
Helen He,4.0,Good pizza for the price. Quality of ingredients are low,a year ago,Open,49
Joe Kovacs,4.0,Great price..get the build your own for 9.00,a year ago,Open,49
Leslie R. Gore,5.0,I really can’t say enough good things about this place. The ingredients are fresh and there so many choices. They have  signature pizzas or you can build your own. They also have several different salad choices to choose from or BYO. I am a …More,2 years ago,Open,49
decendium,5.0,"delicious pizza, would come again :D",a year ago,Open,49
Davia Mills,4.0,Needs to put more topping s on the orders.,a year ago,Open,49
Navneet Kala,4.0,Good pizza! Decent customer service. Would be 5 stars if employees created a more exciting experience.,3 years ago,Open,49
Sighle Denier,4.0,"I was at a conference at OSU and we went here for lunch. I really liked the atmosphere, received excellent service and good pizza. I like a lot of different toppings on my pizza and enjoyed that I could add what I wanted without a price per …More",4 years ago,Open,49
Thomas Blake,5.0,Best pizza,2 years ago,Open,49
Zafar Shaik,3.0,"The food was good, but the staff looked like the didn't want to be there.",a year ago,Open,49
Srujan Tripathi,5.0,"Hands down the best thin-crust pizza I have ever had. Service is snappy, quick, and friendly, and the ability to customize your pizza and watch it be made is amazing. 10/10 would definitely recommend.",4 years ago,Open,49
Luke DeBruin,4.0,Lines get crazy long here on the weekends campus is in session.. mostly because drunk students need late night goodies! The pizza here is fully customizable and it's tasty too. I like the staff as well,3 years ago,Open,49
Ranjani Vijayakumar,5.0,I love the art lovers pizza! This place is clean and the customer service is fast!,2 years ago,Open,49
Mike Yahraus,4.0,You pick the dough and toppings. Ten minutes later you get a fire oven baked 10 inch pizza. Price is slightly above average. Pizza was very good.,3 years ago,Open,49
Luis Delos Santos,2.0,"This place used to be pretty great, but its prices seem to constantly go up all the time. Plus, they seem to put less toppings than they used to. Last time I went, my pizza was served to me soggy on top and the crust halfway uncooked. I'll try again, but this place seems to become less and less impressive the more I go.",3 years ago,Open,49
Kisha Smith,3.0,"It was clean and new. Pizza was made to order. Taste was good, but I was expecting so much more.",2 years ago,Open,49
Carter Williams,5.0,"This is my favorite pizza place. You can have them make yiur pizza however you want and they make it and then cook it in an open fire oven right in front of you, it's great!",2 years ago,Open,49
James Covey,5.0,"Great food and very quick, especially with the crowd after the game",a year ago,Open,49
RyanKMFDM,5.0,They offer free crust and gluten free water.,a year ago,Open,49
Allie beck,5.0,"Angie is a terrific manager, great service!",a year ago,Open,49
John Dunham,5.0,"A king James business,  fair priced.",a year ago,Open,49
Nicholas Canavan,5.0,For a 4 min pizza it tastes better than most full on pizzerias. Quality ingredients. Pizza made your way. Excellent experience.,3 years ago,Open,49
Elizabeth Gilbert,5.0,"Blaze has great pizza and drink options. It's fun to have a personal pizza tailor made for you, but beware of coming at peak hours when the line fills the whole store.",3 years ago,Open,49
Wilson Lo,1.0,This is the worst red lobster I've been to. No one greeted me and I had to find my own table.,2 years ago,Open,49
Nicholas Radabaugh,5.0,Great pizza and a great staff! Toni’s also a cutie ;),a year ago,Open,49
Nick Merchant,5.0,"There are 2 fast casual fired-cooked pizza places in the area. This is the one you want.
The toppings are flavorful, the crust is perfect, and the staff are all so …More",4 years ago,Open,49
Janel Niska,5.0,Food made very quickly and very yummy!,2 years ago,Open,49
Earlene Wallace,4.0,"Thin crust, stone oven baked with premium toppings... delicious. Even better the next day!",2 years ago,Open,49
Elizabeth Stillion,4.0,My go to pizza on campus not to much grease and a good variety for their build your own pizza.,a year ago,Open,49
Bobby Bob,5.0,I definitely didn't get stabbed here,2 years ago,Open,49
Christy Amatos,3.0,Service was a bit odd but the pizza was delicious!,2 years ago,Open,49
William Tappan Kenny,5.0,Blaze pizza is amazing. Under $9 for a pizza with as many toppings as I want and all the ingredients seem super fresh. They even have vegan cheese so my lactose-intolerant wife can get it as well!,3 years ago,Open,49
David Bozman,1.0,Worst pizza I have ever had,a year ago,Open,49
Ashley Beatty,1.0,"I had pizza rev last week and loved the style of pizza, so a close friend told me that i would love blaze. WRONG!!! From the moment I came in to the moment I left, I got HORRIBLE service and an ok pizza. The woman that made my pizza down …More",3 years ago,Open,49
Sabra Bruss,5.0,Pretty Sweet*,8 months ago,Open,49
swiftshift06,4.0,"This place is good.

It has a modern feel and decor, friendly staff and a good selection of …More",2 years ago,Open,49
starr stylez,5.0,Best pizza ever,a year ago,Open,49
David Corey,5.0,"Good food, lots of options. Try the lemonade!",2 years ago,Open,49
Misti Minott,3.0,"It was ok. I was on a low carb diet at the time  and they said they couldn't do anything for me. I had to get a salad, which is cool, but the workers were not very friendly or helpful. They all looked pretty miserable.",2 years ago,Open,49
Gumby2008 Gale,5.0,"Excellent food.  A great selection of sauces, cheese's, meats and veggies.  I recommend the B.Y.O.P.",3 years ago,Open,49
Jennie Bertke,3.0,Not recommended before a show...,a year ago,Open,49
Alex Andrei,5.0,Best pizza you can get for the price. Build your own pizza like you would a sub at Subway or a burrito at Chipotle! Staff is also very friendly!,4 years ago,Open,49
Elijah Craig,5.0,Excellent food. Pizza topped to order. Huge selection of toppings. Offers gluten free crust. Very quick pizza.,3 years ago,Open,49
Erin Small,3.0,"The food was good, but one of the people at my table found a long, black hair in her pizza, between the crust and cheese...",3 years ago,Open,49
Jodi Zatezalo,5.0,"Great pizza for the college budget, kind employees",2 years ago,Open,49
Jesse Varney,3.0,College pizza joint. Hard to find parking everytime ive been,a year ago,Open,49
Abigail Davis,4.0,"Decent build-your-own pizza, feels a little pricey for what you get. I don't think there's much that makes it stand out from other similar restaurants.",2 years ago,Open,49
john sack,5.0,"I only eat pizza once a month and this place is the best...fresh toppings, fresh dough and flavourful sauce. I would highly recommend this place to anyone. -NS",4 years ago,Open,49
