name,stars,text,timeSince,openStatus,key
Vivid Epiphany,5.0,Pizza is soooo good and reasonably priced,7 months ago,Open,47
simone white,5.0,This is a great place to go with your family there food is amazing and their staff is very friendly i highly recommend it!!!!,a year ago,Open,47
Brittany Vactor,5.0,First time eating here and might I say their pizza was really good. Definitely coming back here again! Staff was really nice and I didn't even have to wait long for my pizza👏👏👌👌😋😋,2 years ago,Open,47
Naji Music Library,4.0,"Great options and flavors, speedy service and a nice rewards system! I'd definitely go back again :)",a year ago,Open,47
Autumn Potter,5.0,Delicious!!  So fun to build our own pizzas!  We found a new favorite pizza place!,2 years ago,Open,47
Kelly Schultz,4.0,"Place is nice and clean, and the ""make your own"" bar is great for those who have a taste for less ""popular"" toppings (even has gluten free and vegan options). One star off because the place has terrible acoustics, making it so loud, even though there were only a half dozen people there.",a year ago,Open,47
Laura Jean,5.0,Great pizza and so many choices. It's like the Subway of pizza shops!,a year ago,Open,47
Megan Mayhue,5.0,My FAVORITE pizza place in Erie! Love the thin crust and that I can customize my pizza however I want without it costing a million dollars! The staff has always been super friendly and I have never had to wait long for anything!,2 years ago,Open,47
Venkat Muthu,4.0,Good place for fresh pizzas 🍕,10 months ago,Open,47
Jacob Niedergall,5.0,The service was very pleasant and the staff were very friendly. The ingredients looked fresh and the line moved quick. Though looks like the place could get busy pretty easily. All in all food was excellent. I would recommend,2 years ago,Open,47
Michael Woodring,5.0,Awesome food and great service! My new hot spot!,a year ago,Open,47
Back Ribs,5.0,"It was so good that we went two days in a row.  We saw the reviews and have it a try and we were so glad we did. Super impressed by the fresh ingredients, the thin crust pizza, the salads and the friendly customer service.  Normally the …More",3 years ago,Open,47
Elissa A,5.0,Love blaze! The number of toppings is fantastic. And no matter what you choose to put on your pizza it's somehow always turns out good :) the teas and frescas are so refreshing.,a year ago,Open,47
Mandy Couse,5.0,"Ordered online,  done right on time!",7 months ago,Open,47
Tucker Schulz,5.0,Love the thin crust best pizza I had in while.,a year ago,Open,47
Tim Robison,4.0,"Great pizza, it's kinda a younger crowd so it gets loud. It's like a sub way for pizza. They do have a gluten free pizza. Everything happens really quick so make sure you know what you want before you get to the counter. I really enjoy …More",2 years ago,Open,47
Tiffany Bowes,1.0,The food is great. Great quality and options. But I have yet to have a positive experience at this location. The employees could care less about what's going on. They are consistently ignorant and even higher management will let them ignore …More,2 years ago,Open,47
eric longley,5.0,"Awesome personal pizza, get the build your own and load it up, also like the drink selection better then just the standard Coke or Pepsi products.",a year ago,Open,47
Rockin Robin,2.0,Greasey and pricey.  Did not taste good.,a year ago,Open,47
Matthew Scowden,5.0,Amazing.... they have a great keto pizza... loved it,a year ago,Open,47
Marvin Jones,4.0,Best pizza I have had in a long time. And you can build your own!!! At a low price,a year ago,Open,47
Dana Lingenfelter,5.0,"Yummy, always good- cali-crust surprise",a year ago,Open,47
Avril Reigns,5.0,My first night out to the place and the pizza was great. Seating was a bit full of course. I would recommend this place to anyone.,a year ago,Open,47
Jessica Niemeyer,5.0,Delicious and absolutely loved the vegan options.,10 months ago,Open,47
Patrick Fowler,5.0,Ordered a gluten free pizza and tasted delicious. Even kind enough to change their gloves although cross contamination is likely because the same ingredients are used. Girlfriend enjoyed her normal pizza very much. Reasonably priced and …More,3 years ago,Open,47
Squirrel Fury,5.0,"Excellent pizza, great variety of sauces, toppings, etc. Always tasty. Pretty quick given the constraints of cooking times, crowds, etc. Clean facility, kept up well by staff.",a year ago,Open,47
Daniel Getz,4.0,Really good pizza.   Need 1 per person though.  Even my 3yr old can eat an entire pie.  Online pickup is confusing during rush time.  Great staff,a year ago,Open,47
Steven Harrah,4.0,First time at Blaze great varieties and flavor quick curtis service fare price,a year ago,Open,47
Kristi West,5.0,First time trying will definitely be back. Pizza was awesome the staff was hard working and friendly. Came out after a crazy rush to see how we liked our food.,2 years ago,Open,47
B Y,5.0,The pizza was awesome and the service was great. My husband got ricotta cheese on his pizza and really liked it.,a year ago,Open,47
Christopher Fiske,5.0,Always a great experience and great food. High quality with good service and relatively quick. Would recommend highly!,a year ago,Open,47
reynoldscraig38,5.0,Good food and good service.,a year ago,Open,47
Jennifer Conway,4.0,"First time going here, it's fun 🎉 picking out the toppings for your pizza🍕",a year ago,Open,47
Kobi Grabowski,1.0,My family and I came here shortly after it opened and the pizza was awesome. This time customer service was poor and the pizza was burnt.,a year ago,Open,47
Katie Santry,5.0,Great pizza and friendly staff,8 months ago,Open,47
Miranda Dudenhoefer,3.0,Price is high there but the customization is fun,a year ago,Open,47
Joe Harr,5.0,"Nice people, good service.  Some say the pizza is small.  Great size for 1 if you are hungry.  Great size for 2 for a snack.  If it is for one and too small you are probably fat or an extreme athlete.  Eating pizza, I will guess fat.",3 years ago,Open,47
Grant Williams,5.0,Food and service was great!,a year ago,Open,47
joshua uhlig,5.0,"Delicious! This was my first time eating here, so I didn't know what to expect. But the staff was very helpful and friendly to explain what the menu was and to make recommendations of what to get. It's a twist on traditional pizza, a …More",3 years ago,Open,47
Katelyn Davis,5.0,"The pizzas are cooked extremely fast and although there is usually a fairly long line it is ok because you only have to wait a few minutes for your food. The pizzas are very thin and can be shared by two people,or eaten by one depending on how hungry you are.",a year ago,Open,47
D Locke,5.0,Awesome fresh brick oven baked pizza! Reminds me of when i lived in Italy! A must visit if you're in Erie,a year ago,Open,47
Claudio Olivieri,5.0,"Good as usual, straws are behind the counter, the whales will thank you.",a year ago,Open,47
Matt Allen,1.0,"Not a good gluten free option.  They  do have GF pizza dough...but plenty of  cross contamination.  Guy pulling pizza from oven even tossed a regular pizza on top of a GF one.  Clearly not versed in food safety/allergens, or just didn't …More",a year ago,Open,47
Dan Stevenson,4.0,Good place to go for fresh pizza. A variety of toppings and can put as much as you want for the same price with build your own. Always clean and friendly service,2 years ago,Open,47
michelle sorsby,5.0,Big Thumbs up to the Erie location. Cyd got my gliten free pizzas cooked xyra crispy to perfection. I noticed she really paid special attention to turn the pizza constantly so it didn’t burn.That’s important to me. I drive an hour to Erie …More,a year ago,Open,47
Thom as,4.0,"Very good place for pizza. Only shortcoming for me is there is no thick crust. They have a 'thicker' crust option, but it's still pretty thin. The 'make your own' is wonderful.",2 years ago,Open,47
Lance Thornton,4.0,"Okay pizza, liked the speed and options.",9 months ago,Open,47
Steven Lynch,5.0,"This is an awesome place! Line ordering like chipotle or subway and then they ""fast fire"" it. Tons of ways to customize it and tastes delicious! Pretty fast too I think my pizza was done in 5 minutes. Perfect size and I love that they give the calorie count on the pizzas!",3 years ago,Open,47
John Tinelli,5.0,Amazing food. I live over two hours away. Now I make it a point to stop there if I pass through. It's awesome.,2 years ago,Open,47
Scott Gabel,5.0,Need I say anything .....if you haven't ate here you are missing out !!!!,8 months ago,Open,47
Dawn Eschweiler,4.0,"Very cool concept, ordering is simple, the menu is small and uncomplicated, but has something for everyone. The pizza was super fresh and hot. Everything was very tasty.",2 years ago,Open,47
Eric Laughery,5.0,This place was alot better than I expected.   Thin crust 1\2 pizza was great with a 1\2 salad.  Salad was good in its own right.  Will definitely go back...,2 years ago,Open,47
Chris Heck,5.0,Cool place. Darn good pizza,a year ago,Open,47
Jamesha White,5.0,The pizza is great. Fresh. You can order your pizza with as many topppings as you want at no extra charge...love this place. I recommend it to everyone who is shopping in Summit and wants a restaurant feel but quick service with a pizza done just the way you l like it.,2 years ago,Open,47
Tammy Harrington,5.0,Love the build your own pizza option! Great pizza. Ready in no time at all!,a year ago,Open,47
Annette Woodward,5.0,"Blaze pizza is the best! I have severe food intolerance and they offer both gluten free crust and vegan cheese,  with a glove change!! As well as great customer service.  If recommend Blaze to anyone !!",2 years ago,Open,47
Melissa Marzka,4.0,Choose your own toppings pizza bar. Neat! Pizza was good. I liked that they offered allergy friendly options!,2 years ago,Open,47
Logan Bell,5.0,They have very tasty pizza. they let you pick the toppings if you want or you can choose a pizza from the menu. They fire it in the oven right in front of you. Just around $10.00 for a pizza and a drink.,a year ago,Open,47
Heidi Crissman,5.0,The best fire baked pizza I've ever had. Period.,a year ago,Open,47
Shannon Jones,5.0,Im in love. Best Pizza Ever,a year ago,Open,47
Dareen HJ,5.0,The pizza is amazing and the price is just right. I highly recommend this place to all pizza lovers.,a year ago,Open,47
Johnny Carvalho,4.0,Great delicious pizza. Feel it's slightly over priced for a personal pie,a year ago,Open,47
James Carlisi,5.0,"Best in class, 5 stairs",8 months ago,Open,47
Oberyn Viper,4.0,"Always super busy, so I usually pass it up. Drove by and was really craving pizza so I decided to stop by. I got the barbeque pizza which was pretty good just a little on the pricey side. Id definitely come back and try it again.",2 years ago,Open,47
Trisha Schreiber,5.0,"Love this place! Even on the busiest day of the year for them, they are extremely efficient.",a year ago,Open,47
Michele Cape,5.0,Loved it! Red Vine!,a year ago,Open,47
Henry Wei,5.0,"Clean establishment, courteous and efficient staff, and delicious pizzas.",a year ago,Open,47
Tree Lee,5.0,Great place to eat. Can't go wrong making your own pizza.,a year ago,Open,47
David Donikowski,2.0,Pizza was good but didn't get my free dessert that I scanned for.,a year ago,Open,47
Melissa Field,5.0,Absolutely delicious as usual!! Even the baby loves 😍 the pizza 🍕 at Blaze!! 🔥,a year ago,Open,47
Kristina Burfield,5.0,Great customer ! The older gentleman that was there (I believe the manager) was very informative and talked me into getting something that I normally wouldn’t. I ended up loving it! Check this place out if you’re in the area ! Thanks for the great service ! We will be back !,2 years ago,Open,47
Guy Vanderhoof,5.0,Great pizza fast. Great place if u need in and out,a year ago,Open,47
Lex Patraj,4.0,"Quick and tasty, great value",a year ago,Open,47
Jeffrey Kinnear,4.0,Service was good. Plenty of options. Quality of food was good also.,a year ago,Open,47
Dave B,5.0,"Delicious pizza made in minutes build your own with unlimited toppings or get the signature pies, either way its awesome.",a year ago,Open,47
stephanie mason,4.0,"It's ok. Definitely not my favorite pizza place, but it's a nice place to go when we have a BOGO coupon, so we can all get our own pizzas with our own toppings. …More",2 years ago,Open,47
JM Fetsko,5.0,"Great, like the idea of making own pizza",a year ago,Open,47
Donald Hullenbaugh,5.0,Great first time experience!  The pizza was awesome!,a year ago,Open,47
Robert Wilt,5.0,"Great pizza! Far the Best Pizza I've eaten in years. Plus, you can create any type of pizza with their many different ingredients.",2 years ago,Open,47
Bill Nelson,5.0,Very unique Pizza Restaurant. You pick what you want & don't get charge extra for each additional topping. Made fresh right in front of you from fresh dough all the way to open fire oven. Very delicious & good price.,3 years ago,Open,47
Krista pessia,5.0,My husband and I have traveled all over the country trying different foods and this place is by far the best pizza place that we have ever been too. The manager I believe his name is Glen was very polite and helpful in explaining how …More,2 years ago,Open,47
Deb Evatt,5.0,Always top-notch,a year ago,Open,47
AOTTO614,1.0,Way to over priced,8 months ago,Open,47
Justin Vickers,5.0,"I swear they make the best pizza ever in Erie, I love this place and the prices are pretty decent, the staff is so friendly as well.",a year ago,Open,47
Sid Vasey,5.0,"Great pizza, great topping selections and they get you fresh pizza without a long wait. Also, they're great and working with local organizations for fundraising events. Definitely give it a try.",2 years ago,Open,47
Alex Tillman,5.0,Fantastic!!! No corgi's though :( :( :(,8 months ago,Open,47
Iffi Abdu,5.0,"First experience at a Blaze Pizza spot! The employee named Chase was very kind and thoroughly explained the menu. I had the BBQ chicken with added ricotta. I enjoyed the fresh and delicious taste ,as well as, the attentive and  nice staff. I would definitely recommend this place!",2 years ago,Open,47
Hailey,5.0,Build your own pizza- who doesn't like that?,a year ago,Open,47
Jennifer Davis,5.0,"Excellent pizza! Excellent variety of toppings, sauces and cheeses. Extremely friendly staff. Wonderful!",2 years ago,Open,47
reasmom1,5.0,"Good food! A couple of the men we encountered that worked there were so nice and friendly. The other staff, not so much. That was my only complaint.",2 years ago,Open,47
pamela Heinz,5.0,Something for everyone! Yummy!,a year ago,Open,47
Reaper79 Gaming,5.0,Like the roasted garlic and fresh mozzarella cheese.,a year ago,Open,47
tom eakin,3.0,"Pizza was ok. Didn't compare to Johny Wildwoods . Not very kid friendly. No plates to cut up a little ones pizza. No booster or high chairs.   I drove 20 miles 1way just to try it. Probably won't do that again,but if I'm in the area I'll probably stop again. Good service from staff tho.",2 years ago,Open,47
Tricia Goodrich,5.0,Always good but be prepared to wait at least 5 minute because they make your stuff to order. Worth the wait.,2 years ago,Open,47
Robert Louder,5.0,It was and is a awesome place. Kudos out to Glenn Conner thank you so much,a year ago,Open,47
Mark Laughs,5.0,"Personal Pizzas are very tasty, staff is helpful and nice lunch environment",a year ago,Open,47
Tom Carney,5.0,"Very good pizza, make it the way you want, very fast",a year ago,Open,47
Brad Wingler,5.0,What is better than having your pizza mad exactly how you want it? Love this place!,2 years ago,Open,47
Jill Long,4.0,I love the concept. The service is great and the quality of the food is excellent. It would be 5 stars if the crust wasn't so thin. It can't support the toppings!,3 years ago,Open,47
Rob Prindle,2.0,Good enough pizza. Lots of toppings. Cafeteria like ordering system with many different pizza customization options that leads to Long line. Not inexpensive. Probably too loud because of the design - all hard materials with no sound …More,2 years ago,Open,47
Eric Rhoads,5.0,Solid fresh made pizza. If you are familiar with Chipotle and Panda Express style restaurants then the format will be familiar. Pick your crust and toppings and your pie is fired and ready in ~5-10 min. Will set you back $6-10. They also have a decent signature line of pizzas if you're indecisive.,2 years ago,Open,47
Alan Ulicny,5.0,"Great, fast pizza in a fun atmosphere. Lots of variations get you whatever you want. Definitely stopping the next time we're in Erie. Can't wait for the one in Buffalo, NY.",3 years ago,Open,47
Mindy Rice,5.0,Treshest salad and fire cooked pizza you could ask for! It was AMAZING!!!,a year ago,Open,47
Danielle J,4.0,Very good. Fast service. Can get noisy,a year ago,Open,47
J.W. Hupp,5.0,Great pizza. 'Build Your Own' is the way to go. Lots of options.,a year ago,Open,47
Matthew Wade,4.0,"It's just like Chipotle, but for pizza. Great price for unlimited toppings.",a year ago,Open,47
Shawn Chelton,5.0,Great as always! Awesome value.,a year ago,Open,47
Nathen Plonski,5.0,Great food amazing price would recomebd,a year ago,Open,47
Louise Best,5.0,"Good pizza,any way you like it",a year ago,Open,47
Sara Lucky,5.0,"Good pizza, doesn't take long to make your pizza at all (depends on how much you out on it). The best part is it only takes 3 mins to cook, it's sooo good and fast.. great atmosphere.",2 years ago,Open,47
Devin Phelps,4.0,"Amazing pizza and amazing service, but can get a little packed",2 years ago,Open,47
BSfromCS,5.0,"For the speed, you would expect subpar ingredients, but that just isn't the case. High quality, with great customer service =)",2 years ago,Open,47
John Pearson,5.0,"Excellent Pizza experience, which was evident by the large line to order.  Is a made to order Pizza, with the thin crust and hot ovens, it only takes them 2 or 3 minutes to cook it.  This place is as close to fast food that a custom made pizza to order can get.",3 years ago,Open,47
David West,5.0,A professionally done fast pizza thing with good decor. It's a chain but feels comfortable and a bit nicer. If you're keto it's possible to avoid the carbs and get a large salad with meat and fatty dressing so you can hang with carboholics …More,2 years ago,Open,47
Mr Oizo,5.0,Best pizza ever!,11 months ago,Open,47
Jason Seiler,5.0,"This place was amazing. Plus, their allergy free options were so good!  Gluten free and dairy free!",2 years ago,Open,47
Dylan Ramey,4.0,I mean its Blaze pizza. Its pretty good pizza and very good service. Nothing special but pretty good,2 years ago,Open,47
Lila Uraraka,5.0,This place is amazing! The pizza is amazing! my personal favorite is the ham and pineapple. I rate this place a 10/10.,2 years ago,Open,47
Matt Naeger,5.0,Love this place.  Nothing like fresh pizza made to order and the ingredients are all fresh too.,2 years ago,Open,47
Raegin Irwin,5.0,"Amazing pizza, wish they would put one downtown!",a year ago,Open,47
dean Cantu,4.0,Good tasting pizxa,11 months ago,Open,47
Karen Teed,5.0,First experience at Blaze pizza. Helpful and great pizza.,a year ago,Open,47
James Fesmire,4.0,Very good pizza fast and friendly service. The iced tea are great blood orange is the bomb.,2 years ago,Open,47
Rohit Bharwani,3.0,"Though a good idea, MTO pizza similar to Subway or Chipotle, the staff haphazardly made two pizzas poorly - and it was not even busy! To be more precise, a veggie pizza with no sauce & a BBQ chicken pizza with little chicken and without BBQ …More",2 years ago,Open,47
Karen Anderson,1.0,I also will no longer be visiting Blaze pizza due to their disloyalty to patrons.. Don't change the rules in the middle of the game.. Buy one get one free til 12/1/18 doesn't mean for 3 months it's ok and now it's a one time use. Was told a printing error.. sorry not buying that bull!!!,2 years ago,Open,47
DarkStarWelder,5.0,Good pizza. Stone oven fired is the greatest way to make pizza and they do a fantastic job with it. Really really great pizza.,2 years ago,Open,47
Chris Filkins,5.0,"Good food, great value, friendly staff",a year ago,Open,47
Mike H,5.0,Great tasting pizza fast,a year ago,Open,47
Mike D,5.0,Great place to customize your personal pizza,a year ago,Open,47
jim luschini,5.0,"Best pizza ever, great addition to the Erie area.
7/10/19.
Blaze's no longer serves gluten free pizza in order to serve cauliflower …More",a year ago,Open,47
Frani Lechtner,3.0,"love love love the pizza! but I was there yesterday with my son, the place was absolutely filthy, floors, counter where sodas are, garbage can areas were overflowing! weren't busy , employees were screwing off! no manager?",a year ago,Open,47
Chris Kercheval,5.0,"Chipotle meets a pizza place.
Fresh ingredients, great toppings, and fired oven yields a fantastic pie in minutes.
Absolutely delicious!",2 years ago,Open,47
Asmr bedtime,5.0,Stars say it all they are good,a year ago,Open,47
Cindy Plizga,5.0,Just love the build your own pizza option,a year ago,Open,47
Joseph Oneill,5.0,"Great place to grab lunch. The pizza was excellent, and you can build your own. Great atmosphere.",2 years ago,Open,47
Kelly Fox,5.0,Best pizza place I've been in for years! Love. Love. Love.,a year ago,Open,47
Nick Hrytzik,5.0,Great pizza. It's like the chipotle but with pizza. Their craft sodas are good too,2 years ago,Open,47
Kenny VanWormer Jr.,5.0,"Fantastico. Great variety, great price, great taste.",a year ago,Open,47
Robin Howell,5.0,"You pivk the toppings, thin crust, healthy, delicious!",a year ago,Open,47
Christian Zazado,5.0,"Great food, great service.  My first time there and they walked me through it.  Love the gluten free crust.  Definitely going again.",3 years ago,Open,47
Gregory Roberts,5.0,So good that we're going to see if they have catering options for our wedding,2 years ago,Open,47
Rachel Bourne,5.0,Pizza is delicious. Always quick service even when busy. The app is akso very nice to use and easy to pickup.,2 years ago,Open,47
Larry Wolfe,5.0,I was very intoxicated on alcohol when I went here. In fact I drove here drunk. But the food was very good. I'm from NYC and have had some good pizza. This pizza was very good value for the price and the wait time is shorter than for most …More,2 years ago,Open,47
Rikki Lee Pfeiffer-Carr,5.0,Huge salads and excellent pizza!,a year ago,Open,47
Bo Scruggs,2.0,Over priced and over doing it... order delivery from one of your other typical commercial pizza joints or go to an actual pizzeria,a year ago,Open,47
Robert Heck,5.0,Awesome to be able to put next to anything on the pie n it's a thin crust I actually like!!,2 years ago,Open,47
Jonny C,5.0,Amazing concept for fast wood fired pizza.  Perfect spot for lunch!,2 years ago,Open,47
Joanna Testi,5.0,This place is so good! Staff is friendly and establishment is clean.,a year ago,Open,47
Haley Piper,4.0,This is a pretty cool make your own pizza place,a year ago,Open,47
Drew Dennington,5.0,Quick service,6 months ago,Open,47
Jason Baker,5.0,Great place very clean. Amazing pizza,a year ago,Open,47
Alissa McClosky,5.0,Friendly employees and super fast tasty pizza,2 years ago,Open,47
Bradley Miller,5.0,Best pizza hands down,a year ago,Open,47
Phil Vasold,5.0,"Amazing pizza, and the recipe pizzas on the menu are all good",a year ago,Open,47
Ginger Kester,5.0,Awesome pizza. They have thin crust and white sauce.  Yum,2 years ago,Open,47
Anthony Martinez,5.0,1st time here what an awesome place. Pizza taste very good.  Great staff as well.,2 years ago,Open,47
Edwin Cardona,5.0,Fresh out of the oven with fresh ingredients that you don't normally get at big chain pizza joints,2 years ago,Open,47
Aki nmytua,5.0,It's just really good pizza. Also good for gluten free. Separate utensils and glove change.,2 years ago,Open,47
David Exler,5.0,"A little more pricey than the same sized pizza anywhere else, but the unlimited toppings make up for it. I would not pay this much for a pepperoni and mushroom pizza but certainly would for a chicken, pesto, fresh mozzarella, goat cheese, roasted garlic cloves, red onion, and tomato with a balsamic glaze.",2 years ago,Open,47
Jessica Cz,5.0,We have to stop in here everytime we visit Erie! Quick service. They even have vegan cheese,2 years ago,Open,47
Devil Dog 82 Gaming,4.0,"Great pizza,  got to customize a pizza for each person.",a year ago,Open,47
jean marie laughlin,5.0,Awesome service awesome pizza. Definitely build your own!!!,2 years ago,Open,47
Mike Yeaney,3.0,My service was awful. The guy who made my pizza ignored me while I was talking to him. The food was good though.,2 years ago,Open,47
Carrie Bowersox,4.0,Great friendly staff very helpful..a little pricey but worth it,2 years ago,Open,47
Timothy Burns,5.0,This is a great place for pizza. So many great options and they have a great selection of drink choices.,2 years ago,Open,47
Lacey Lydic,5.0,"Just tried Blaze Pizza for the first time and it was great. All of the ingredients tasted so fresh, it doesn't feel heavy like most pizza around here does. The sauce was probably the best part, because it didn't overpower the toppings. Definetly will be going back.",3 years ago,Open,47
B FOSTER,5.0,"Their pizzas are the best. You get to pick what sauce and topping you like, and the prices are great.",2 years ago,Open,47
Wraslin For The Boys Show,5.0,The best place to get pizza. You can pretty much get what ever you want on it.,2 years ago,Open,47
Lori Green,5.0,Great Pizza!,5 months ago,Open,47
Games Bookstore,3.0,"A nice build your own pizza place,  large cafeteria style seating , went with standard cheeze and pepperoni on a pan style crust. Wood burning pizza oven took about 10-15 mins, good cook thru, little bit smaller than a medium. For three of use it was a little over 30 dollars, so about 10 to 12 dollars per person.",2 years ago,Open,47
