name,stars,text,timeSince,openStatus,key
Gill Jatt,1.0,Girl named Nyaa was extremely rude while making my pizza.  I  understand people have bad days but who wants to be talked to like that.,a year ago,Open,36
Tochukwu Brian,3.0,The pizza was good,8 months ago,Open,36
Yvonne Kloiber,5.0,"This is One of my favorite Pizza places in town!! one of their specials called white top s my personal favorite!!
Keep in mind that it gets really crowded during lunch time (many companies …More",2 years ago,Open,36
Janmejay Vyas,4.0,"Can't recommend this place enough. Great concept, a very buzzing location and attentive staff who are very patient with their customers. There was just this one time when I did not have a great experience with the employee making my pizza buts that 1 out of almost 10 times I've been there.",2 years ago,Open,36
Emerson Cloud,5.0,Lines moves fast. Reasonably priced pies.,a year ago,Open,36
Emily Salmon,5.0,"Awesome pizza, made right in front of you. Super fast, friendly staff, and delicious",a year ago,Open,36
Brown Eyes,5.0,Different good ways,10 months ago,Open,36
Lana Lieman,5.0,"Be prepared to be amazed as you prepare your own pie, give gluten free a try. It's all set for you as you pick your favorite toppings ablaze with flavor. Do not forget dessert like a warm s'mores and mix up your own beverage from a …More",2 years ago,Open,36
Bob McCaffrey,5.0,Good fresh pizza and lots of variety to build your own pie,a year ago,Open,36
Pat Lowe,4.0,Great place for people with food allergies!,11 months ago,Open,36
Tamisha Hills,5.0,Pizza was awesome because I built my own lol. Server who helped us was a bit rushed,a year ago,Open,36
Jessie J,5.0,Delicious pizza for a very reasonable price!! My family and I were in town for a basketball camp and stumbled across your location. The service was top notch!!,3 years ago,Open,36
Rebecca Rodriguez,1.0,Poor service. Great pizza but employees don't seem to know what they are doing. Plus there is a lot of profanity used by the employees in front of guests,a year ago,Open,36
Elizabeth Guynn,5.0,GREAT fast pizza! Unlimited toppings on a build your own for $8. Gluten free crust option is delicious! Customer service is also fantastic. Perfect sized portion for lunch or dinner.,4 years ago,Open,36
Owen Oconnor,4.0,Good homemade pizzas. You can pick from a variety of toppings and it was not too expensive. Under 10$ which is generally pretty good for kendall square area. Would recommend.,2 years ago,Open,36
Rafael Peña,3.0,"The concept is solid like the Agua frescas but you shouldnt get a personal pan pizza and feel hungrier after eating it then when you arrived. For the amount you pay, a bit more cheese and toppings wouldn't hurt anyone. …More",a year ago,Open,36
Maria Loza,4.0,Made before your eyes. Chose a specialty pizza and add more to it for same price (great deal ). Definitely  add salt. Only problem i had was it desperately  needed salt. They make the pizza  in 5 min or so saucy  and delicious,3 years ago,Open,36
Shane Bogue,5.0,Best pizza I ever had,a year ago,Open,36
Christian Brown,5.0,First time at a Blaze and I'm very satisfied! Me and my girlfriend thoroughly enjoyed our pizzas and were impressed at the speed they were cooked while still retaining good quality. Will be coming back.,3 years ago,Open,36
Kaiko Manson,3.0,"Great pizza, horrible service. Ordered a gluten free pizza online and they didn’t find it necessary to call me and told me they ran out of gf crust. Instead I showed up to no pizza and nothing to show for the 15 minutes I waited for them to notice me. The employees here need to re-evaluate their lives and decisions.",a year ago,Open,36
chris gillespie,1.0,"Sort of fun when it first opened, but the quality and experience has diminished significantly since. Increasingly stingy with toppings, and the service is pretty slow - surprising since the whole concept suggests otherwise.  Let's be …More",2 years ago,Open,36
Dhaval Doshi,5.0,"Great topping options, vegetarian and vegan friendly",3 years ago,Open,36
Prachetas Kanisetty,5.0,Best pizza I've ever had. Period. Not even exaggerating.,a year ago,Open,36
Chastity Arnelle,5.0,I walked in today to build my own pizza and when I took MBTA to Park Street and completely dropped my pizza but when I called & let the store know they immediately offered to make me a new one on the House no questions asked. I truly appreciate the customer service & this is why I’ll continue to come back.,2 years ago,Open,36
The Addict Of Gaming,5.0,"Great Pizza, Great Customer Service.",a year ago,Open,36
tik68,3.0,Its ok not the best. Go 4 to 6 its 4 dollar pizza,a year ago,Open,36
Deepak Abraham,4.0,"Great authentic Italian pizzas which are light on the stomach and the pocket. Courteous staff, lemonade you get is fantastic as well",2 years ago,Open,36
Randy H,1.0,"Got my order wrong. They remade it, which made the blazing fast pizza claim seem more like slow lane pizza",a year ago,Open,36
Joanna Marcotte,5.0,Great price and delicious pizza,a year ago,Open,36
MrImfamouss1,4.0,"Very good pizza,prices are okay, pizza are personal size but delicious",a year ago,Open,36
J Falk,4.0,First time there and it's good.. I'll go back.,a year ago,Open,36
Alejandra G. Maldonado,4.0,"I like the place, but they should improve their customer service.",a year ago,Open,36
Nicolay Doytchev,5.0,"These folks have got thin crust pizza down to science. The whole process, from the dough flattening and pre-baking machines to using metal tags during baking, it's just brilliant. The result is 80% from a proper hand-made napolitan pizza …More",2 years ago,Open,36
Teddy Cleveland,5.0,"Really quick, solid lunch. Would highly recommend getting the high-rise dough. It's a lesser know option but makes great, fluffy pizza.",3 years ago,Open,36
Dariel,5.0,"Finally! It's about time we got a Blaze in Boston! I tried Blaze for the first time in New Orleans last year and I was hooked right away. This is definitely the future of pizza, can't believe there are people still ordering Domino's and …More",3 years ago,Open,36
Karen MC,5.0,"Excellent customer service, fantastic pizza! Choose from several, different, awesome toppings! You must experience this place! 😁",2 years ago,Open,36
Mustafa Karaca,5.0,"Clean,good service and nice pizza",a year ago,Open,36
Alfredo CrazyFreddy Rivera,5.0,Bomb blazepizza... My favorite places to go and grab to go...,2 years ago,Open,36
Al Sh,3.0,"Took long time to get food, like 20-25 mins, for mediocre food",a year ago,Open,36
Kyle M,5.0,"If there were 6 or 7 stars I would give it.

I called Blaze for a catering type order when my 160 person conference was one …More",4 years ago,Open,36
Stephen Cornell,3.0,Blaze is great. Food is awesome. The service here is not the best.,2 years ago,Open,36
Dor Amram,5.0,"I love them. While it's far from the best pizza you've ever had, the combination of a variety of toppings, sauces and garnishes with a great fixed price is fantastic. Their app and rewards program are great too.",3 years ago,Open,36
Naved Ansari,5.0,"Make your own pizza here just like in subway. The staff is very friendly and happy, and the pizza is tasty! Love this place.",3 years ago,Open,36
Ellen Wittler,4.0,"SO HAPPY I FOUND THIS PLACE
I eat gluten-free and dairy-free. It is very hard to find a restaurant that can accommodate food sensitivity, but this is one of the best! The food was very …More",4 years ago,Open,36
Sam Hirbod,3.0,"Only ok, the gluten free pizza is better made (crispier) than the soggy regular. Service is great most of the time.",a year ago,Open,36
Jeff Houle,4.0,"This can be seen as a SubWay that makes quality pizza rather than plain sandwiches. The ingredients are fresh, and the staff have friendly attitudes while they keep the line moving. The only issue I have here is the difficulty in hearing one's order being announced when ready.",2 years ago,Open,36
Lívia Duarte Barbosa,5.0,Great pizza and salad!,a year ago,Open,36
Madeleine Conway,4.0,Gluten free pizza at a make your own place,2 years ago,Open,36
Liz Merrigan,4.0,Really slow when we went but good pizza (we had the art lover).,2 years ago,Open,36
Francesca Gordini,4.0,"Pizza are individual sizes. You decide what to put on it among a wide list of ingredients. The whole thin crust pie is then cook in a contemporary wood burning oven. It's  not the real Italian pizza but it is a good compromise, specially if …More",3 years ago,Open,36
Matthew Burckardt,5.0,"I'm a big fan of their happy-hour  style discount: from 4-6, you can get a plain cheese pizza for just $4! Service isn't particularly fast, but nothing to complain about especially since it's only three minutes for your pizza to cook once you're through the line.",3 years ago,Open,36
Steve Lindquist,4.0,For my first time at this place I was pretty impressed.,2 years ago,Open,36
Shreyas Dube,1.0,"After having tried this for over 20+ orders, their pizza is still good if done right, but their process needs a lot of improvement. Something is always broken every time I go there - pizza is cold, too crisp, undercooked, missing finishes, …More",3 years ago,Open,36
Mandy Liao,4.0,Great price and great pizza! Like Chipotle but for pizza! Would have liked more quantity of toppings added on top. Service could have been a little friendlier too. Smores pie was overpriced for what it actually was. Would be 4.5 stars if I could give it!,3 years ago,Open,36
Jason McInerney,5.0,"Very good place and very reasonably priced.  They have some very interesting specials and they are pretty darned good.  BUT it's their customer service, atleast on this day,  that separates them. …More",2 years ago,Open,36
Alexander Rosa,5.0,"This place is amazing. They let me sample the sauces, it's a pick-your-own toppings type of deal so it's comparable to both Chipotle and Subway. First time here and it was delicious, I'd definitely come back. Price isn't too steep for a …More",4 years ago,Open,36
Jayden Butts,5.0,"Keep coming back here, great pizza and nice restaurant environment",a year ago,Open,36
Patanjali Shearer,4.0,"Great concept, no pizza by the slice here, think Chipotle meets personal pizza. Pick from a healthy selection of toppings (and a salad if you're in the mood) they pop it in the oven and you're on you're way. Bear in mind, waiting for a …More",3 years ago,Open,36
Siddharth,5.0,Good pizzas and also good salad!,a year ago,Open,36
Jyoti Shankar,5.0,"Blaze pizza serves a wide variety of flavourful toppings on a thin crispy crust pizza for a very reasonable price. We went to the place for lunch and built our own pizza from scratch.  Our pizza came fresh out of the oven with pesto, spicy …More",4 years ago,Open,36
Craig Dement Myers,1.0,I usually like Blaze but this last visit was a bad one! Got a simple pie and for some stupid reason the girl LOADED it with salt!!!  It sucked soooooo bad but I took it out so I didn't want to go all the way back to complain.  And the heartburn last night was unbearable. Needless to say I'm am OVER Blaze.,2 years ago,Open,36
Lisa White,5.0,"Fast, efficient, and flavorful.  Plus they offer the calorie count which is helpful.",2 years ago,Open,36
srishti arora,5.0,I love their pizza! They have lots of options for toppings. High rise crust is one of favorite! A good place for a quick bite.,3 years ago,Open,36
DiCE v,5.0,Pizzas are small but amazing and affordable.,2 years ago,Open,36
Nelson Feliciano,4.0,"New pizza place. Affordable, easy to find, easy to order (custom or signature pizzas), basic yet tasty sweets, a few delicious salads and great outdoor seating! Good for lunch while at work on the area or stop in after shopping at the Cambridge side galleria.",4 years ago,Open,36
Letia Beverly,4.0,Fun place. Great seating. Amazing pizza & desserts. Employees don't always wash hands. Yay for gloves.,3 years ago,Open,36
Ikmal Maharon,4.0,"Wonderful pizza place, the staff are very friendly. Love that you can customize the pizza. One star off as there was no seafood option like Tuna or Salmon",4 years ago,Open,36
Linda C,1.0,Today I experienced the worse customer service in my life. This guy with name tag John rudely yelled at me for being on the phone while ordering pizza. He had an awful attitude that made me left the location to go have lunch someone else …More,2 years ago,Open,36
David Kircheis,2.0,"Fake ""friendly"" service. If you like charcoal,  this is your place! Top of pizza tastes amazing while the crust is a cinder. Should be called Bottom Burned Pizzas! P.s. wasn't just my pie, every pizza I saw in the place was burned like that.",4 years ago,Open,36
Jodyann Hanson,4.0,Like their pizza. I wish they had larger ones though,a year ago,Open,36
Lucas Lira Gomes,3.0,"They have a nice concept, with a mix all the toppings you want kind of pizza, but the dough leaves something to be desired. In contrast, service was one of the best I've seen for a chain fast food place.",2 years ago,Open,36
David Mason,5.0,Pizzas on the smaller side but with noticability high quality ingredients. If your a fan of true margaretta pizza then get it here. Everywhere else in the Cambridge area can't make it.,2 years ago,Open,36
Michael Butler,4.0,Great food. But at times slow staff.,a year ago,Open,36
Jason Garrabrant,4.0,"Quick pizza, prety good. Not good new york style, but for a quick pizza it is reasonable. Good toppings and friendly staff.",3 years ago,Open,36
Calvin Vandor,5.0,first time here. super friendly and welcoming. the guy on the oven was killing it.,2 years ago,Open,36
Ankur Misra,5.0,Chipotle style pizza!!,a year ago,Open,36
Sandra Mejia,5.0,Staff is super nice and will help you with any request you may have,2 years ago,Open,36
Chad Martin,3.0,Food was good but staff seemed very confused. I didn't get exactly what I ordered but it was still tasty.,2 years ago,Open,36
Alex Borrero,5.0,"Ingredients are fresh and delicious! Clean, helpful staff, good music",2 years ago,Open,36
Garrett Corsi,5.0,Amazing food and even better customer service!! Overall great experience,2 years ago,Open,36
Pedro Dias,5.0,"Quick easy and delicious, always fun to expirement with flavors",2 years ago,Open,36
William Albert,1.0,"Horrible customer service.  Attendant was rude and abrasive, totally ignoring customer requests.  Also, beware, online orders will ""cut in line"" even if you are standing at the counter!  This is a very poor business practice.",2 years ago,Open,36
Royry Walker,5.0,It's very tasty and the fastest pizza made in front of me. I love them enormously.,2 years ago,Open,36
JamieLinkz,5.0,Really delicious pizza. I haven't tried the salad yet.,2 years ago,Open,36
Anupam Jena,5.0,Simply the best!,a year ago,Open,36
Lukas Isenberg,5.0,An awesome experience... 10/10 I’d go there again,a year ago,Open,36
Kate Willard,4.0,Great personal pizza you can make however you want!,2 years ago,Open,36
Praneeth Namburi,4.0,This place is good if you're into customizing your pizza. It has good vegetarian options.,3 years ago,Open,36
Mashhood Ishaque,1.0,"Ah, the pizza tastes great but the staff is very careless how they handle pizzas—mixing ingredients between different orders. I won’t recommend if you don’t eat meat.",2 years ago,Open,36
Erin Cyr,4.0,"Nice customer service, gluten free options, delicious fountain drinks.  The prices are a really good value.",3 years ago,Open,36
kovit nisar,4.0,nice concept. spicy red sauce is amazing..didnt like d pesto sauce tough,2 years ago,Open,36
Venkatesh Kl,5.0,Very good place where u can build your pizza with the toppings u like,2 years ago,Open,36
Rick James,4.0,"Took my son there to try it out, VERY Friendly Staff, Fresh Dough, and very good pizza.
Better than average, I would try something other than plain cheese though, their …More",3 years ago,Open,36
Ian Swett,5.0,Very good pizza with nice thin crust and very fast.  Much better than Oath.,2 years ago,Open,36
Nicholas White,5.0,I love the service. Also the fact that i can make my pizza any way that i desire is awesome,3 years ago,Open,36
Brin Wassenberg,4.0,Service was good. Pizza wasn't bad either.,2 years ago,Open,36
Natassha Deepest Love,5.0,The best pizza and customer service I had in years! I love this place,3 years ago,Open,36
Mybaby Bestbuy,5.0,"So friendly staff, nice place",2 years ago,Open,36
Jeff Rodowicz,5.0,"Food is fast, flavorful and cheap. They also do a great job of accommodating allergies",2 years ago,Open,36
VM Vm,4.0,Great pizza!,a year ago,Open,36
Maria BESANTA,5.0,Super tasty,a year ago,Open,36
Alan Malek,4.0,"Cheap and fast custom pizzas. Don't expect fancy, but they are $8.",2 years ago,Open,36
Alexander Bontempo,4.0,Good cheap pizza even not that big,2 years ago,Open,36
Cypress Frankenfeld,5.0,Very very friendly staff! Such good service. Also good prices and good pizza.,3 years ago,Open,36
John Burr,5.0,Great flavour great value fast food.,2 years ago,Open,36
Richard McCreedy,4.0,Great thin crust pizza at a cheap price,2 years ago,Open,36
Jessica Faust,5.0,Great place and all employees were amazing . food was delicious .,2 years ago,Open,36
Samarth Merwah,5.0,Delicious thin crust pizza.,2 years ago,Open,36
Rajat Subhra Das,5.0,Great taste if you can personalize your pizza,2 years ago,Open,36
sharkisha Bish,5.0,This place is very neat and very nice and helpful and they work to together and no fight and the food is very good and there is a lot if option and they make sure ur okay and confirmed that ur comfy and that ur good is amazing,2 years ago,Open,36
Gregory Burnett,2.0,My son got sick.  But will return.,a year ago,Open,36
Kathie Kelly,5.0,I Love Blaze!!!,10 months ago,Open,36
Cesar Guevara,4.0,"Nice place, the pizza is prepared in front of you and you can see how is prepared thru a glass. The have some non nice fountain drink flavors and free refills.",2 years ago,Open,36
carl greenler,5.0,"Good pizza, very cheap!",2 years ago,Open,36
Ashley Berner-Potts,5.0,Amazing pizza and perfect sizes.,2 years ago,Open,36
Connor Prisby,5.0,You'll wanna pizza this 🍕,a year ago,Open,36
Yonas W,2.0,I like the pizza it’s my place but not the canal park Cambridge side customer service . I was there on Sunday 3/24/19 afternoon . I’m worry to be there again not all Blaze just Cambridge side,a year ago,Open,36
anum gull,5.0,I dint like the dough. It was overcooked !! Otherwise it was okay,a year ago,Open,36
Kelly Russell,5.0,I love Blaze Pizza! It's fast and delicious!!,2 years ago,Open,36
Andrew Desmarais,3.0,"Pizza was OK, but it took forever in line.",a year ago,Open,36
Javier Ikemiyashiro,4.0,"Fast service, a lot of choices",a year ago,Open,36
Jennifer Helfer,5.0,"Like a subway but for pizza. New lunch and dinner spot near Lechmere. Gets really busy (i.e. long lines) and crowded at lunch on weekdays. You can order ahead, but they will not cook your pizza till you get there. Lots of staff working …More",4 years ago,Open,36
Mii Afonso,5.0,"I'm often the last person to order before the close up shop, and they still make it with a smile and great attitudes!",2 years ago,Open,36
Abhishek Dey,5.0,"Quick, fresh, tasty way to have your customized pizza..",2 years ago,Open,36
George Banis,5.0,Great pizza. I highly recommend ordering online if you plan on going there during the lunch rush hour.,3 years ago,Open,36
Anthony Pion,4.0,Good for a fast Pizza and the price was right. Friendly staff!!,3 years ago,Open,36
Tucka Smith,4.0,Not bad,a year ago,Open,36
Eduardo Quinones,5.0,Perfect thin crust pizza quick service and good taste.,2 years ago,Open,36
Francisco Pinto,5.0,Very delicious pizza and freshly made.  The environment is great too with amazing staff,3 years ago,Open,36
Ed Dennison,5.0,"Wide variety, inexpensive, great pizza.",2 years ago,Open,36
Leopoldo Alamo,4.0,Gluten free option,a year ago,Open,36
Milagros Salas,5.0,Best pizza ever! People and service are really kind,2 years ago,Open,36
עדי שחר,5.0,Amazing place! Have to go,2 years ago,Open,36
Mladen Milosevic,5.0,"Great pizza, especially if you like your own combination.",2 years ago,Open,36
SSS,4.0,Super tasty pizza spot. If you can think of it you can make it into a pizza. If you are not feeling inspired you can always go with one of their suggested pizzas 🔥🍕🔥,4 years ago,Open,36
Yavuz Karaman,5.0,Delicious thin crust pizza in 15 mins.,2 years ago,Open,36
Caroline Lucas,5.0,A great place for a quick bit to eat - delicious pizza & salads. Very friendly staff and very clean.,3 years ago,Open,36
Henry,4.0,The staff has a positive attitude in making sure your order is done correctly,3 years ago,Open,36
Kay E,5.0,Awesome place a must see  Disney Springs was a perfect place to visit and blaze pizza was icing on the cake !!,2 years ago,Open,36
Samir Z,1.0,I asked the guy who takes care of the oven if I can have a little bit of hot sauce on my pizza. He just sprayed the whole bottle on my pizza and made not eatable anymore. I don't know if he hates his job or he felt like if he was a maid or …More,3 years ago,Open,36
Laner AL D,5.0,"Friendly staff, customizable pizzas at a reasonable price",2 years ago,Open,36
Patrick Requena,5.0,"Very modern, good selection of ingredients, nice atmosphere! Good prices too.",4 years ago,Open,36
Sean McNelis,3.0,Great food where's the parking lot better but still good pizza,3 years ago,Open,36
Kim Robert,5.0,Love build your own pizza. Great customer service.,3 years ago,Open,36
Emilia Nobrega,4.0,Fast service and pretty good pizza.,3 years ago,Open,36
Kassy Lassy,5.0,"Excellent pizzas, loads of ingredients to choose from, and a quickly cooked",2 years ago,Open,36
Michael Leete,5.0,Enjoy building my own. This location is more expensive than ones in Orlando,3 years ago,Open,36
Yashar Razavi,5.0,"Great location, great pizza and friendly staff.",2 years ago,Open,36
Ahmed Elgailani,5.0,One of the best pizza I have tried.,2 years ago,Open,36
Adam E,5.0,It’s a good one,a year ago,Open,36
Katy Gero,5.0,"The Chipotle of pizza, this place has tons of top notch toppings to choose from. A single pie is more than enough for a single sitting, though not quite enough for two.",4 years ago,Open,36
Ishmael Sharif,5.0,Excellent quality of the price. Employees were friendly and it was suprisingly affordable and just the perfect amount,4 years ago,Open,36
Tee T,5.0,This is good add everything your pizza for one low price,3 years ago,Open,36
swarna dass,5.0,Best taste in whole Boston..hightly recommend it,2 years ago,Open,36
bhavin v,5.0,"The best pizza ever, very good staff and you almost always get a table",3 years ago,Open,36
Steve Michelsen,4.0,Cheap good made to order pizza,2 years ago,Open,36
Houssam BENNA,5.0,One of the best services and pizza I've ever had!,3 years ago,Open,36
Dharam Maniar,5.0,Love their make your own concept !,2 years ago,Open,36
Alicia Ouyang,5.0,"Love how you can add as many toppings as you want, little wait time, and pizza is fresh! Boyfriend was skeptical when I brought him the first time, now he begs to go, and he's the picky eater :P",4 years ago,Open,36
Anthony Bissell,4.0,Ok food.Ok prices. Very similar to other made to order pizza places.,3 years ago,Open,36
Ray Saeidi,5.0,Very good place to eat.,2 years ago,Open,36
nadim dayoub,5.0,Amazing pizza. Wish I had a spot like this in PA.,2 years ago,Open,36
Dr. Mario Iannuzzelli,4.0,"Very good pizza , the build your own is the best way to go , but please ask for the rise dough its bigger is 2 more dollars but its worth it because the normal is too thin if you are use to regular pizza .",3 years ago,Open,36
Piyush Madan,5.0,"Blaze has lots of pizza options. There crust is great (not amazing). Infact, last time my pizza was little burnt.
I would give it 4.5 stars.",3 years ago,Open,36
Nishant Kelkar,5.0,"Great place, ample seating, smiling and courteous staff",3 years ago,Open,36
Gail Terman,5.0,"This place is a little slow, but the quality of the result is worth it. Delicious pizza.",2 years ago,Open,36
Glenn Li,5.0,Friendly staff great prices great food,3 years ago,Open,36
Ju Lim,5.0,Great customer made to order pizza. Always a pleaser!,2 years ago,Open,36
Christhian Alejandro Cano Guerra,5.0,"Really good pizzas, the best attention and place.",2 years ago,Open,36
Ana Alvarez,5.0,Very good pizza and cheap!,2 years ago,Open,36
David Pearlman,4.0,"For $7.95, you get a personal pizza with your choice of toppings--as many or as few as you want. This is an exploding sector of the fast food market, with a number of competitors. Blaze is one. (Started by the same people who brought you …More",4 years ago,Open,36
Navid Abedzadeh,5.0,Great pizza for an affordable price,2 years ago,Open,36
Jared Knowles,5.0,"Great inexpensive pizza, healthier than the mall options next more and delicious with great service.",3 years ago,Open,36
Vivek Shah,4.0,Good pizza and cheap!,2 years ago,Open,36
P. C. Battle,4.0,Great idea!,a year ago,Open,36
Dave Hartung,5.0,Like a Chipotle for pizza. Lots of good toppings to choose from and pretty fast.,3 years ago,Open,36
Rodney Johnson,5.0,Great service and the best pizza that I have tasted.,3 years ago,Open,36
Nita J,4.0,Fun place to eat. Nice employees,3 years ago,Open,36
hiram vargas,5.0,Awesome pizza.,3 years ago,Open,36
Arthur Larm,4.0,Nice to custom build your own pizza.,3 years ago,Open,36
William LeBlanc,5.0,They have an amazing way of cooking pizza,2 years ago,Open,36
Alexandra Perkins,5.0,So good!,a year ago,Open,36
Shailesh Kapadia,4.0,Nice...,a year ago,Open,36
Patrick Varin,5.0,Great make your own pizza place!,3 years ago,Open,36
Manuel Gonzalez,3.0,Not bad,a year ago,Open,36
Juan Martins Mahon,1.0,"My pizza came burned, like a coal, I asked to change, I made a new pizza and they simply disappeared with the pizza and gave me another one, I said that it was wrong and again they gave me a burnt pizza.",a year ago,Open,36
