name,stars,text,timeSince,openStatus,key
Aaron Williams-Mele,3.0,"I love Blaze, the pizza is great and I really like building my own. I don’t know what’s going on lately though, seems like morale is down. Today it seemed like everyone was on edge about something. Talk to your employees and figure out what’s going on or it’s going to really start affecting your business.",a week ago,Open,294
Calleigh Mahan,1.0,"I ordered a gluten free cheese pizza for my daughter and this is what we got. There is hardly any cheese on it, mostly sauce, and what cheese is on it is burnt. I’m not exactly sure how someone can look at this and confidently put it in a box to serve to a customer.",2 months ago,Open,294
Jessica Evans,5.0,"Blaze is my favorite build your-own-pizza place! I could eat here everyday! They have plenty of sauces, cheeses, and toppings to choose from and they even have additional toppings and sauces for your pizza after it comes out of the oven! I love arugula and pesto drizzle on top of mine.",a year ago,Open,294
Terry Johnson,1.0,This was my first time trying it and my very last time. Could not get through the poor customer service. I ordered by phone through the Call Center and they stated that it would take 18 minutes for pickup. This was 10:10 PM. I arrived …More,4 months ago,Open,294
John Panko,4.0,"Very good, quick pizza place.  The ""DOUGH KNOTS""  were delicious!",a month ago,Open,294
Anthony Couillard,4.0,"Good staff and quick, especially for lunch.  Pizza is good, little doughy for my taste, but think that may be just how the fire cooks it.  I asked them to cook a little longer to make crispy, which I'm sure they did, but was still not …More",a year ago,Open,294
Ashlee R,5.0,"Love this location. Great pizza, friendly staff, and clean location. What more could you ask for? Loyalty program is also fantastic.",4 months ago,Open,294
David Stewart,5.0,great pizza at great price and it's so fast just walk in and in 8 minutes or less you got your pizzas,a year ago,Open,294
Wilson Dowdy,3.0,I went by Blaze Pizza today for Pi Day.  Any pizza for $3.14.  It was my very first time at a Blaze Pizza.  I downloaded the application and signed up for the rewards program too. I got a free fountain drink.  The concept of Blaze Pizza is …More,a year ago,Open,294
Yvonne Marbury,5.0,"Im so happy that Blaze Pizza is Vegan friendly. I love pizza and since I'm a new vegan so its painful to me to not have pizza with cheese on it, so imagine my surprise to see that not only do they have vegan cheese, but now they also have a …More",4 months ago,Open,294
Yashica Arora,1.0,"Thought of having pizza in this pandemic time, went to blaze pizza. We ordered our pizza and waiting for it to be done. we look around to check if it is ready and pizza was on table and someone is sweeping floor next to it. When we went …More",2 months ago,Open,294
Kim Miller,5.0,My daughter suggested Blaze Pizza for her annual birthday dinner because they had a keto crust pizza. It was our first time visiting and we were both extremely impressed. The price was phenomenal and the food was exceptional. I will definitely be returning when I want a quality pizza at a great price!,11 months ago,Open,294
John Boyce,5.0,"My son and I have made many Covid Spring and Summer bike trips to visit Blaze Pizza and it has truly became our favourite. Be it the Take Two with Greek or Ceaser slalad options, the Amazing Garlic knots we dip in Marinara or the vegan …More",3 months ago,Open,294
bharath reddy,1.0,"I visit almost twice a week to this blaze pizza. It is used to be my favorite pizza spot in Richmond, not anymore.I ordered cauli crust pizza, this was my worst experience in blaze pizza. Dudes who are working at not at all professional …More",8 months ago,Open,294
Kelvin Fleming,4.0,I went to Blaze for the first time since the Covid-19 out brake. I though that the workers should be wearing a mask. I love the pizza and will return. Just my observation. They were wearing gloves. Note: best  pizza in town so I want them to succeed,6 months ago,Open,294
Robert. Mantia,5.0,Fast and very fresh and one of the best pies I have had in a long time,4 months ago,Open,294
Kristina Balducci,1.0,"Absolutely the worst customer service I’ve ever experienced. I walked in around 8:45pm (they don’t close until 10pm) and before I was even fully through the door, I was greeted by being snapped at with the question “are you picking up?”. I …More",8 months ago,Open,294
Melissa Weaver,5.0,"PI day was handled by this team effortlessly. Prompt service,  tasty product in a well managed clean restaurant.",a year ago,Open,294
Audrey Walker,4.0,From entry to exiting the people were nice and very enthusiastic about what they were doing. My only issue is they added arugula when I asked for them to hold it.,a year ago,Open,294
T D,5.0,"Absolutely amazing. Delicious, and fair-priced. I wish the seating was larger, but so far I have been able to secure a seat. However, as good as this place is, there should be lines out the door soon. Hip atmosphere, music and food in a booming location is always a winning combination.",2 years ago,Open,294
Amy Riccadonna,1.0,"Absoultey pointless waste of time. App is horrible. No option to select your crust, though they brag having keto and gluten free options... takes you all the way through your order to transfer you to ""third party delivery."" If you call you …More",4 months ago,Open,294
Anthony Decker,1.0,"We received a coupon in the mail for a free 14 inch pizza for delivery or carry out, as long as we ordered online. When we tried, it recognized the coupon code, but did not apply said coupon. We called and the automated system gave us a …More",a year ago,Open,294
Jeni Boyce,5.0,Great people.  Great pizza.,a year ago,Open,294
Christopher Kennis,5.0,"Went to Richmond for the first time, and have only been to a Blaze pizza in FL. This location is AWESOME, I will definitely be back to visit again. Blaze is amazing if you want a really good personal pizza made in front of you how you like, and it cooks fast, it's a must try!!! The staff was great!!!",11 months ago,Open,294
Will Hensley,5.0,I just recently found out about this place and have nothing but good things to say. If you're not familiar with the restaurant just imagine a Subway style restaurant for pizza. Basically you walk through a line where you order a personal …More,11 months ago,Open,294
Mike Laverman,5.0,First time and it was awesome! Lots of toppings to pick from and salad was fresh.,7 months ago,Open,294
Simone Fisher,5.0,I didn’t get anyones name but whatever guys were working Thursday Jan 23rd 2020 around 1:15 were great! Super polite and attentive!!... Pizza was great too!,9 months ago,Open,294
Darlene Burrell,5.0,My granddaughter enjoy the process of watching from dough to finished pizza,4 months ago,Open,294
mariko mukai,4.0,Good deal quick pizza!🍕,2 years ago,Open,294
Phenomenal Me,5.0,Love this place. Best vegan pizza choices around. Good prices.,2 years ago,Open,294
Rick McClure,5.0,"This is a very unusual pizza place.  I really enjoy being able to walk down the line and pick the toppings for my pizza. Unlimited. No additional cost. Fast, easy, and great taste.  And, you can't beat the price.",a year ago,Open,294
Amanda Tipton,3.0,The service is great but I don't like the sauce.,7 months ago,Open,294
Scott Newby,5.0,Quick as we were in the early side of lunch - friendly staff and had my points for free pizza and even had a free small drink.  Like that they offer lower calorie choices in the drink section.  Clean place - delicious food as normal.,a year ago,Open,294
Mark Stoddart,4.0,"First time there. I got a ""build your own"". The menu was a bit confusing, but after talking with the woman taking orders was comfortable enough. Next time will be much easier. I got there at the start of lunch, so our pizza had to wait a …More",a year ago,Open,294
Tara,1.0,"I decided to try this place since they're similar to a place in Philly. I ordered my build your own pizza to go. I noticed the worker scraping something off the bottom of a pizza. Well, when I got home, my pizza was burned to a crisp on the …More",2 years ago,Open,294
Swetha Y,5.0,Love the pizza here. Very very reasonable prices. They have Keto and cauliflower crusts too. With personalized pizza option you can choose unlimited toppings. Their fried garlic topping is to die for. Recommend this place over the other pizza places.,a year ago,Open,294
Jo Bu,5.0,The staff always greets with a smile! And the fresh toppings have made this spot a regular for me! The price and portions are very reasonable.,10 months ago,Open,294
nicole knight,5.0,Great atmosphere food was really good,a year ago,Open,294
FromDaCluhouse Music,5.0,Real good personal pizzas! Prices are reasonable!,a year ago,Open,294
Stephanie White,5.0,"Love this place. Delicious, fresh and hot pizza. Top notch service from the manager, John, and his team.",a year ago,Open,294
Courtney Henning,5.0,"Crispy, chronic pizza. It's absolutely amazing how crispy the deep dish style crust pizza is. Legitimately my favorite pizza spot in town.",a year ago,Open,294
shag ostrich,5.0,"Good pizza, friendly employees who care. Even when extremely busy they are on top of things and keep the line moving at a steady pace. Interesting drink choices lots of fruity fresh juice and organic sodas. Gluten free friendly as well. I personally love that they have fresh mozzarella as an option.",a year ago,Open,294
michael smith,4.0,"Great idea.
A Chipotle style pizza spot. …More",11 months ago,Open,294
Sharon Faith Graves,5.0,I go to Blaze about once a week. The pizza is made to order with high quality ingredients. The pepperoni has such a good flavor and doesn’t taste processed like at some other pizza chains. The app works well for quick ordering to save time. …More,a year ago,Open,294
Marwan,5.0,"Good pizza and service, quick turnaround. Great lunch spot",2 years ago,Open,294
Fred Hornberger Jr,5.0,"Service is always great here and the pizza is fantastic.  They even have 3 different GF crusts.  It was very busy, but only took 10 min to get my pizza.",a year ago,Open,294
Sundari v,4.0,You should know what toppings to add else it will be a disappointing experience. Roasted garlic and brussels I would like it stand alone. Ricotta was blah and bland on art lover. Know what cheese you like. This place has potential for it's freshness and quick service. Menu needs simplified combination for pizza dummies,a year ago,Open,294
Erika Di Natale,4.0,"The cauliflower pizza was thin and crispy, just how I like it! Asked for a tad bit extra on the toppings with no extra charge. Clean and crew was ready to listen. Will come again",a year ago,Open,294
Jesyka Rolland,5.0,"Recently discovered that I have a gluten and dairy allergy. My friend said Blaze Pizza had options for me. It was awesome! As soon as I asked for the cauliflower crust and vegan cheese, I was asked if it was for allergy reasons. They …More",a year ago,Open,294
irrelevanttangent,4.0,I loved the pizza and their Agua Fresca was delicious! only dropped them down a star bc the employees weren't very helpful and a bit short with me when I came in for the first time. but the restaurant was clean and had a good fast-paced casual dining atmosphere.,a year ago,Open,294
Jason Cooper,5.0,"Great food, good prices.  Need a better flow. Myself and everyone I saw who came in didn't know which side of the line to go to.",a year ago,Open,294
varun devaraj,5.0,Great place. Very nice pizza. Tried build your own pizza loved the garlic pesto option they had and it was great.,2 years ago,Open,294
Jared Grodensky,4.0,"This is my first time revisiting Blaze after trying it when it opened.  I did not like it originally, but my mind was certainly changed.  This is why I give places a second chance.  The first visit the pizza was flimsy which made it oily …More",a year ago,Open,294
Marcelle Cox,5.0,I should've taken pictures! I don't do many reviews. Meh... This location is a must visit. All of the employees are awesome and have different but positive and energetic attitudes and personalities! The food makes you want to eat until you …More,a year ago,Open,294
Kat Cassil,5.0,Have to admit I was a loyal Pie5 customer.......then I tried Blaze pizza and WOW! THIS is the Best- quick - full feeling- great for your money- tasting pizza! Hands down! ( or up for Hallelujah! ),2 years ago,Open,294
Subba D,5.0,Loved the freshness and variety of toppings. Infact Fixed pricing for unlimited toppings. That's great.,a year ago,Open,294
Kelly,5.0,The pizza was great and the staff very helpful and knowledgeable,9 months ago,Open,294
Mike Cannizzaro,2.0,"The pizza create your own was great all meats were great, but as usual I asked not to have it over cooked or burnt so out of the 3 I ordered in the same way I was able to eat only one of the three and the rest were trashed at home",a year ago,Open,294
Kate Bruce,5.0,Best vegan pizza in Richmond! Unlimited toppings on a high crust pizza for $10. Staff is very friendly too. Thanks Lebron!,a year ago,Open,294
Tina Harris,4.0,Fast service,a week ago,Open,294
Jay E,5.0,Great place to eat.  Keto crust is delicious.,11 months ago,Open,294
Victoria Lua,5.0,"Their pizza is delicious!! They build your pizza to your specifications and everything I've had there is so good! Very little wait time, even during busy times.",a year ago,Open,294
Anna Nelson,5.0,"Good personal pizzas, and really fast for a wood fired pizza. Plus GF , Vegan, vegetarian and keto options. Staff is friendly, chill place to eat, or take with.",a year ago,Open,294
Stefanie Croson,5.0,Their gluten free crust is delicious as well as the vegan chorizo.,a year ago,Open,294
Dwayne Dunlap,5.0,"Cleanest, healthiest pizza in town. Certainly will be better. Great prices",a year ago,Open,294
EG Dunc,3.0,"I found the pizza to be average tasting, though it was nice to custom make the pizza.",a year ago,Open,294
Floyd Mills,5.0,Create your own pizza is excellent.,8 months ago,Open,294
Samuel Hoepner,3.0,"Tried a keto crust pizza and it was just okay. Grew tired of its blandness before I finished my half. Realizing what it is(keto friendly) , it's a good option,  even though my homemade pizza on low carb tortillas are just as good of an option.",a year ago,Open,294
N Green,3.0,Ok. Been better every other visit. Today was an off day.,11 months ago,Open,294
Girish Khandelwal,5.0,"Best pizza in the city, can't resist to go over again and again...",a year ago,Open,294
Chris A.,4.0,"A build your own pizza place, and they cook them in a real blazing pizza oven. It took quite awhile to get ours the time we went. They offer a gluten free crust, but it’s not that good. Their regular crust is quite yummy as long as it …More",2 years ago,Open,294
JuzJS,4.0,Luv fresh pizza made in front of you. Pleasant youthful staff are very patient with first time customers. This was my second visit and consistent experience. Love the different pizza options and the perfect size for one. Could use better …More,2 years ago,Open,294
Jill Watson,5.0,Get it anyway u want! Ingredients not offered elsewhere! Great service staff!! Flexible & customer service top notch! THANK U BLAZE!!,a year ago,Open,294
Lachecia Caine,4.0,"The menu has changed in ways I don't really like, but the food still tastes great. I am particularly not happy with the removal of the BYO salad. I prefer to choose what is in my salad.",a year ago,Open,294
Temple In The Woods,5.0,Perfect pizza,a month ago,Open,294
S Black,2.0,"Someone at work recommended it as better than Pie 5 across the street. I must say I disagree. The spicy marinara was very good, and there were numerous toppings for a good price. However it was cooked inconsistently, with parts of the crust …More",2 years ago,Open,294
Gail Dent,3.0,Pizza wasn't bad. But service was a different story.  I was placing an order while staff was too busy playing around.  Manager was right their,a year ago,Open,294
Joe Daff,3.0,Staff was great! Pizza is kind of lacking in flavor. Hence the 3 stars.,a year ago,Open,294
Alan Douglas,3.0,"Go through the line to pick your own ingredients and crust and toppings and just a few minutes later the super heated oven props it out.  The pizza is fast and actually pretty good,  better than those from similar concept competition Pie Five, but not in the top ten for Richmond.  Check their app for deals.",2 years ago,Open,294
David Bice,5.0,I love blaze pizza. I get exact what I want and get to watch them make it.,a year ago,Open,294
Pamela Harrell,5.0,Delicious food at a great price.,a year ago,Open,294
Jeff Lee,5.0,The best! Vegan options,10 months ago,Open,294
Bob Jacobs,5.0,Line moves fast. The people that work there are accommodating and the pizza is amazing. I usually get the meat eater and my wife gets the art lover. We like the root beer drink as well. Best root beer I’ve ever had. Highly recommend.,2 years ago,Open,294
Trey Wentz,4.0,I like the concept and they did better then pie five which closed. Pretty tasty stuff with a lot of options.,a year ago,Open,294
rachael coleman,5.0,First time here.  Great pizza. Will definitely be back!,a year ago,Open,294
Ashley Woodson,1.0,"Ordered delivery and never received food and they didn't refund our money. We went back and forth with the General Manager to get our money back for over a month and still have not gotten it, so unprofessional! Never again will we spend our money here.",a year ago,Open,294
Sharvell Williams,3.0,"The pizza was decent, it wasnt the best ive had . Also the person calling out when the pizza was ready was a little rude as well.",a year ago,Open,294
Paul Busse,3.0,"The service was excellent - everyone there was courteous and focused on their job.  I was very disappointed with the quantity of toppings used. The pie five across Broad Street from them has closed, so I guess I'll have to drive to Willow Lawn to get a pizza that meets my expectations.",2 years ago,Open,294
Sonya Owen,5.0,Pick your toppings or choose an option from their menu. Then? Watch your pizza get expertly placed in a fiery brick oven. The music can be a little loud but there is usually plenty of open tables and a fairly big parking lot helps too 😀,a year ago,Open,294
Alan Byrd,5.0,So glad to have found a Blaze Pizza on my trip to Virginia. Love to create my own...,a year ago,Open,294
Vince O,3.0,Quick.  High rise crust is still a bit thin compare to other thick crust pizza competitors.,a year ago,Open,294
Robert Elliott,5.0,"Excellent service, their Employee Tony is definitely a good person to have you can tell he loves his job and is passionate about customer service, Kudos!",a year ago,Open,294
Sasiekumar Shanmugam,5.0,"The quick grab pizza shop who allows me to customize my pizza with whatever I want, I have the unique taste towards pizza and I always prefer to customize my food and this restaurant understands my need.",a year ago,Open,294
Pamela McCoy,5.0,Wonderful pizza and salad.,9 months ago,Open,294
Rafael Dietsch,5.0,"Pizza was tasty and ingredients fresh. Try the mozarella rolls, they come in 4 and 6 and they are very good!",a year ago,Open,294
Victor Burgdoerfer,4.0,"Tons of toppings to choose from ,but not a humongous fan of the marinara sauce. Quick and convenient though, and a terrific value!!!!",a year ago,Open,294
Julio Pedroza,5.0,I went there for the first time last week and oh man have I been missing out! The pizza is great for a decent prize. Ingredients are always fresh. Aguas Frescas are also very refreshing! The staff is always very friendly and welcoming! Will definitely by my go to for lunch from here on out!,a year ago,Open,294
Jessie Purtell,3.0,Good pizza with lots of options but they almost always get our orders wrong.,a year ago,Open,294
Bubbles81,5.0,"Pizza is good, staff very nice, Byo Salad was very fulfilling. My favorite dressing is the balsamic vinaigrette sweetness was just right. The meal was very light and not so heavy on the tummy!",a year ago,Open,294
sean Fields,5.0,Customer service is very good and they will do what it takes if you arent satisfied,a year ago,Open,294
William Testerman,4.0,"Fast service, fresh ingredients. I appreciate the staff asking multiple times if my order is correct before cooking. Price for lunch is comparable to other restaurants in the area. Ample parking.",2 years ago,Open,294
Jan Mayes,5.0,Excellent tasting pizza and salad!  My husband and I loved our dinner.,a year ago,Open,294
Crystal Bennetch,5.0,"All of the crew and managers at this location are super friendly and cheerful and have a great sense of humor! The pizza is fast and delicious, one of my favorite places to get pizza in Richmond!",a year ago,Open,294
Blake Peterson,1.0,"Had two good experiences, but today the guy who made my pizza had the worst manners of anyone I've ever seen work at one of the these fast casual restaurants.  He barely made eye contact with me, scowled and looked at the floor as he …More",2 years ago,Open,294
Sonya Marsh,5.0,"Food was good, employees needed to pay attention more.",a year ago,Open,294
Alvina Gilliam,5.0,The service and my pizza was just perfect! For my first time visiting....,a year ago,Open,294
Tin Nguyen,4.0,"Not your average pizza, so come in with an open mind.  Overall, it’s very good. The dough is very thin, toppings are fresh.  Can build your own or go with the signature.  Price is reasonable.  Would go back.",2 years ago,Open,294
Chick Nonya,1.0,This place is a joke. The employees couldn’t care less about their job. This is the second time in a week I’ve had to come back because my to go order was wrong. The app shuts down constantly. The gluten free pizza is good. That’s the only …More,2 years ago,Open,294
Brenden Murphy,4.0,"Quick, cheap, convenient, tasty.

Not much else to say.",a year ago,Open,294
Don Chandler,4.0,"Quick, friendly and affordable. Wish had more seating sometimes.",a year ago,Open,294
Lauren Ruiz,2.0,"Eh. I was disappointed. Pizza crust wadnt great, chicken had absolutely no seasoning. Portion size is good and staff were friendly and helpful but for the price there are several other pizza restaurants in the area that are way better. 2 …More",2 years ago,Open,294
Adam R,5.0,Dope pizza for good prices,a year ago,Open,294
Yankee Diamond21,1.0,Poor online website,2 months ago,Open,294
David Sims,4.0,Custom Pizza what can you say for a good price. Even my son who is a bit picky liked the new dough options.,a year ago,Open,294
Taryn MacKinnon,5.0,I had an amazing experience with my mom. My mom has a dairy allergy and wanted to make sure the vegan cheese was dairy free. So the young man took the time to look at the ingredients of the cheese to confirm it was dairy free. This has been …More,2 years ago,Open,294
Matthew January,2.0,The only reason I give Blaze Pizza two stars instead of one is because of the pizza. The food itself taste good but having to wait 15 minutes to get your pizza when it's supposed to be a 180 seconds from start to finish is definitely the …More,2 years ago,Open,294
WALTER ALAN SCOTT,5.0,Just like the one in Chicago and I loved it and will be back.  Do not sleep on this place.,a year ago,Open,294
Clint Clemons,1.0,"My sister, brother-in-law and I walked in at 9 pm on Sunday, February 18, 2018 and were greeted with we’re closed. The pizza was made and it was actually really good, but the guy behind the counter was extremely rude. The guy behind us …More",2 years ago,Open,294
Sheryl Jordan,5.0,Keto crust 6 carbs!,a year ago,Open,294
Elke Ivic,5.0,"Fast, delicious, customizable, good prices. Love it.",a year ago,Open,294
Kevin Irby,4.0,"Fast food pizza done right using a ""build your own"" assembly line like Chipotle.  The crust is crisp on the outside, with great char, but chewy and airy on the inside.  A touch pricy, but great as a once in awhile treat.  If you've got some calories to spare in your daily diet, try the blood orange lemonade.  It's crazy good.",2 years ago,Open,294
Kimberlee Whisonant,5.0,Very good pizza and good customer service,a year ago,Open,294
Christopher Malak,5.0,"Pretty good pizza options, though they could use some better kids meals. Remarkably similar to Pie Five in execution and design, except the pizzas are traditional oven fired",2 years ago,Open,294
Roberto Borja,5.0,Absolutely love the pizza here. Gluten free and vegan options! Much better value than &pizza from the DMV region.,2 years ago,Open,294
David Howard,5.0,"Good price, good pizza.  Can order online and skip the wait.",a year ago,Open,294
girish khandelwal,5.0,Best fresh and delicious pizza in city,a year ago,Open,294
Larry Peteet,5.0,Good Pizza and Friendly Employees!,a year ago,Open,294
vikash sarraf,4.0,One of the best pizza served in the area. I would highly recommend taking their garlic knots too. Its too delicious!!,2 years ago,Open,294
Aaryan Asthana,4.0,Make your own pizza featuring a variety of options and tasty oven baked pizza,a year ago,Open,294
B C,1.0,"I heard about Blaze pizza in Chesterfield a year ago and was excited to try it tonight now that there is one near short pump. However I just wasted $10 on pizza I won't be eating due to improper use of gloves, health safety and sanitation …More",2 years ago,Open,294
Greg Schneider,5.0,Great food with pleasant atmosphere and staff.,a year ago,Open,294
James Sumpter,4.0,Good portions. Fair prices. Cool fountain drink selection. Good pizza,2 years ago,Open,294
Dan Ridenour,4.0,The thing I like about this place is the build your own pizza. You can literally get as many toppings as you like for about $10. Cook time for a standard thickness pizza is about 10 minutes usually.,2 years ago,Open,294
