name,stars,text,timeSince,openStatus,key
Josh Struck,4.0,Pretty good place to eat. However I witnessed something interesting during my visit. Above the trashcans there is a recycling shelf and one of the workers took all of the bottles and threw them in the trash. Pretty triggered honestly but …More,a year ago,Open,136
Jason Valenzuela,5.0,"Dang good pizza, more people should know about this place!",a year ago,Open,136
Mischievous Kitty,5.0,"They are a really nice place to get a custom built pizza, they can be slow at times but they are pretty good at getting everyone through at a decent pace.",a year ago,Open,136
Vivian Shuffield,5.0,"Wow! It was amazing! We never been to a place like that . It was like subway style but hand made and baked pizzas instead of toasted subs. Great salad choices too, and deserts looked yummy. We skipped the deserts though. …More",7 months ago,Open,136
Dell Bahe,1.0,Slow service.,a week ago,Open,136
Nick Masters,5.0,"5 Stars.   Really good thin crust gourmet style pizza, SUPERB price to quality ratio.   Good and friendly service.   Pizza in fast-casual style, like Chipotle.    My wife and I shared a delicious pizza, salad, and 16oz beer for about 16 …More",a year ago,Open,136
KarrosJ,5.0,"Nothing like the freshest and customized pizza from Blaze! Really love the service and staff of this location. If you see a line, don't be discouraged. This crew is on point.",a year ago,Open,136
Alicia Ch,4.0,Love blaze pizza. It’s like a subway for pizza. You have build your own pie or choose a menu pie option. They have vegan cheese and the crust is vegan. They also have a gluten free crust. None of salads are not vegan. The staff is always friendly and ready to have a good conversation. Quick service.,2 years ago,Open,136
Larry Ziegler,5.0,"Great pizza , its because of its wide assortment of fresh toppings and a great location. Oh! by the way its reasonably priced right.",a year ago,Open,136
Jason Kramer,5.0,"Very cool place, amazing staff, and some really good pizza.",a year ago,Open,136
Gavin D,5.0,"Red vine is top of the line, will recommend. Awesome combo choices. Go eat at this place. Use your money at this pizzeria.",a year ago,Open,136
Delfina Garcia,4.0,Pizza was great! Service was good! Salad was blah.,a year ago,Open,136
Vicente Alirez,5.0,Amazing food at amazing price. Staff is awesome,a year ago,Open,136
Michael Han,5.0,It's very similar to Subway but for a pizza. The price is perfect and ingredients seem super fresh. Loved the experience.,a year ago,Open,136
Kim Kuhlman,4.0,"This particular Blaze was a bit disappointing.  Pizza was great, but the service was glacial.  Always bothers me when employees are just standing around and don’t seem to care about the customers.  The “not my job” thing.  I’ve seen it at …More",a year ago,Open,136
Elizabeth Hill,5.0,"Thankful that my husband & I got a free pizza offer; what a great way to introduce a business. We went on Friday, December 28th. We really like your delicious pizza, because of the thin crust & all the variety of sauces & toppings. We only …More",2 years ago,Open,136
Nathan D,2.0,Pizza and salad are delicious. The only problem is everyone we go they mess up the order. They dont make the salad or they only made one of the pizzas or they forget the dough knots. Something always messes up. I think the problem starts …More,a year ago,Open,136
Jonathan Wolf,5.0,Very customer oriented. Super friendly.  Pizza is awesome.,a year ago,Open,136
Lori,3.0,Good pizza but poor customer  service,a year ago,Open,136
Carley Sedillo,5.0,Really good custom pizza. It's ready quickly and the staff are always friendly! I waited in line for maybe two minutes and every staff member I interacted with(there were five in total) each personally made sure that my pizza was how I wanted from the toppings to how cooked it was. I will definitely be returning.,2 years ago,Open,136
Ariel M,4.0,"Excellent food and service, good portions and good drinks all for a decent price. I highly suggest trying it out, I know I'll definitely be going there again.",a year ago,Open,136
Janice Lowery,4.0,Good pizza good price. Great option to build your own pizza!,a year ago,Open,136
Robert Contreras,5.0,"I love subway, I love pizza! Best of both worlds. It tasted amazing!!",a year ago,Open,136
Damian Gallegos,5.0,I came here with my grandma and we shared a classic pizza it was a good pizza and the whole crust was crispy. It was very reasonable and tasty!,a year ago,Open,136
Sandra Abeyta,4.0,Good pizza (if you like thin crust).,a year ago,Open,136
Samantha Madrid,2.0,"Great food!  Alexa is rude!  She didn't smile and when I asked for spinach she abruptly told me it goes last!!! I like this place and i normally get good service here.  I will come again,  if service does not improve I may change locations.  Alexa,  if you don't like people, Don't work in a customer service environment!",2 years ago,Open,136
danielle aguilar,1.0,"We went out to get Blaze Pizza today. We called before my family and I went down there, and they confirmed they were open, we get there and there is another customer walking out with bags of pizzas, as we approach the door it is locked, the …More",a year ago,Open,136
Chris Cruz,3.0,Loved. But for the price the pizza is small,a year ago,Open,136
Jarrett Smalley,5.0,"Fun way of creating your own pizza with an abundance of different toppings and other options. The team was quite informative and friendly, thoroughly enjoyed coming by here.",a year ago,Open,136
Karin T,2.0,"Underwhelming, to say the least. Very expensive, and they burned both of our cheese pizzas. I'll stick with Dion's or Domino's, for that matter.",a year ago,Open,136
Donovan Greathouse,4.0,This pizza is amazing...make it your way,a year ago,Open,136
Linda Sanchez,2.0,Dont bother ordering online. 2nd time this has happened. Get there ready to pick up my order and they are in the process of making it (not even in the overn yet). Might as well just get in line and order from there. I obviously did an …More,a year ago,Open,136
Matthew Luther,3.0,The restaurant was a nice place to come an eat at. Food was good especially when you want a fast an quick bite to eat..,a year ago,Open,136
Mary Burak,5.0,"They have gluten-free dough, and with a ""glove change"", they'll use a separate pan of sauce and utensils.  Plus, you get unlimited toppings! …More",9 months ago,Open,136
Anthony Munoz,1.0,If I could leave 0 stars I would it is horrible to eat here there’s flys everywhere It smells like  sewer comming from the back it seems like none of the managers know what they are doing all the managers are very rude except Julia she is …More,a year ago,Open,136
Larry Reyes,5.0,Pizza was great. The service was excellent. We'll be back soon.,a year ago,Open,136
J T,5.0,Great place to eat. Pizzas were amazing.,a year ago,Open,136
Lulu,1.0,"Don't go late at night. The employees complain about being tired (which I get) but also give atitude, burn the pizza, and lazy in making BBQ sauce. I am not going back which makes me sad cause it is good food when done right.",a year ago,Open,136
shawn jaramillo,5.0,"EVER SINCE IT HAS OPENED, THEY HAVE PUT DEAL AFTER DEAL OUT, THEY ARE KIND. YOU CAN PUT ANYTHING IT IS WIN/WIN.",a year ago,Open,136
Cameron Riggs,4.0,"Blaze is a unique pizza place that shows you them making the pizza right in front of you. Instead of simply ordering a specific name, they take the dough down a line similar to chipotle, where they have different sauces, cheeses, and toppings. Its pretty cheap too, as you get a decent sized pizza for as little s $6.",2 years ago,Open,136
kyle aragon,4.0,"Great, fast pizza...wish they had a bigger pie size🤣😀",a year ago,Open,136
Nathan Lovato,5.0,Best place to grab a bite. Amazing pizza and the staff are super nice. This is one of my favorite spots to come. I'd recommend you give it a try.,2 years ago,Open,136
Logan Todd,1.0,Waited in line for 10 minutes with no one in front of me and an employee took an order from the customers behind me and still didn’t ask me what I wanted won’t be back or recommend. Seems like staff doesn’t want to work at all. The restaurant sauce up the street is amazing,2 years ago,Open,136
Andrea Angle,5.0,"Great atmosphere, clean and cozy restaurant, delicious pizza. The staff were very friendly and the food was perfect!",a year ago,Open,136
Karla Lopez,2.0,They miss half of the final topping most of the time.,a year ago,Open,136
Unknown,1.0,Number isn’t correct to order pizza!! Was ordered in lake Geneva Wisconsin. How the hell did that happen!! Went to pick up my order and to my avail...no order ever existed. Moments later I get a call from Wisconsin stating I have pizza ready for pickup. Update your phone directory Blaze Pizza!!!!,a year ago,Open,136
gavin mckay,5.0,Great place to get a brick  oven like pizza love the fact that you can top your pizza with any additional  toppings.,a year ago,Open,136
Jeffery Ladmirault,3.0,Good food.  Took long time to place order.  Once ordered food comes quickly,a year ago,Open,136
Rory Garcia,5.0,Pizza was delicious. Customer service was great. Love the concept. That juice though! Will be back.,2 years ago,Open,136
Mario Rodriguez,4.0,A place to have good pizza!..,a year ago,Open,136
Michele Hill,5.0,Love love love!,4 months ago,Open,136
Garth Wilson,5.0,Great pizza friendly service.,8 months ago,Open,136
Amanda Cedillos,5.0,"I thought this pizza was amazing. High quality ingredients, friendly & accommodating staff. I'm thrilled that they had vegan cheese. I order the thicker crust & it tasted delicious.",2 years ago,Open,136
Bina Thompkins,5.0,Love the options,2 months ago,Open,136
Evelyn Cavit,5.0,Love their pizza. Great atmosphere. Fresh ingredients!,a year ago,Open,136
Amanda Lopez,5.0,Great food a d friendly employee's,a year ago,Open,136
Steph Pérez,5.0,The price was moderate and the pizza was delicious! You could taste the quality in the pizza and the service was on point with it's level of friendliness and well trained staff. …More,2 years ago,Open,136
Jarvis Barnes,3.0,"Like the concept but quality of pizzas are compromised due to the build-your-own pizza craze. I get it, it's more modern and more appealing then just average pick a pizza and get what's on it. But the quick bake just doesn't put any love into it.",2 years ago,Open,136
austine quintana,3.0,I love this place!! I’m just upset I talked all the boys at my work on getting a few pizzas so they could try them. So I went on my lunch.. it’s kinda a far drive from my work but I told them it was worth it!! The pizza was good!! But when …More,2 years ago,Open,136
Alex Evans,4.0,Good pizza at a good price. You can build whatever (personal) pizza you want for a fixed price ($7.95). The staff is always friendly and service is generally pretty fast. The pizza is also made with hight quality ingredients.,2 years ago,Open,136
Freeman Pascal,5.0,Always good pizza. The place can get a little loud during lunch but the food is worth it.,a year ago,Open,136
Teresa,3.0,Food is good but working station is dirty.,a year ago,Open,136
Matt Skogen,5.0,Great fast casual pizza for $8 can't beat the price and the build your own option!,a year ago,Open,136
Kay Haines,1.0,TERRIBLE SERVICE,3 weeks ago,Open,136
Jonah Mauldin,1.0,"The pizza is decent, but Julia, one of the managers, is one of the most rude people I have ever had to deal with. She was very snappy with me and also seemed to be even more rude to her employees. She scolded her employee right in front of …More",2 years ago,Open,136
Dolores Soto,5.0,Really good pizza it was my first time there I was very impressed people were really nice it was good place to,a year ago,Open,136
Wendy Rodriguez,5.0,I honestly didn't think I would like it but I ended up loving it!,a year ago,Open,136
Judi Sena,1.0,Service was slow and employees were rude. They don't acknowledge their customers with a hello how can I help you. Or a I'll be right with you. I will not return to this establishment.,a year ago,Open,136
Felina,5.0,Pick you own and very affordable!,a year ago,Open,136
Pat Schutte,3.0,"New looking establishment, friendly staff.  Cleanliness questionable: stopped in at 1:30 on a Saturday and saw lots of garbage and food on the floor under the tables of booths and round tables and walkways. Floors did get swept an hour …More",a year ago,Open,136
Jeannie F,5.0,"The pizza was made fresh right in front of me. Good flavor, thin crust,  flame fire in the oven. Excellent - I will go again and again.",2 years ago,Open,136
Jeff Cowen,3.0,"Being from NYC I'm hard to please when it comes to pizza. This is a passable version of a Neapolitan style pie. While the best pizzas aren't made assembly line fashion and the very best are either wood fired brick ovens or coal ovens, blaze …More",2 years ago,Open,136
sasuke sakura,5.0,"It’s a build your own pizza place, and for 7.95, you get unlimited toppings! That right there is awesome. Had great service, the pizza and brownies were tasty , and they even serve alcoholic beverages! Nice place to eat after shopping!",2 years ago,Open,136
Nick Macias,5.0,Love this pizza. Great food and cool drink selection. Best craft pizza in my opinion,2 years ago,Open,136
Eddie Thomas,4.0,Good pizza reasonably priced can get super busy in the evening,a year ago,Open,136
Dawn Goodrum,5.0,The pizza is amazing. I love that you can add toppings as you want.,a year ago,Open,136
David M King,5.0,"Great pizza, friendly staff, beer.",a year ago,Open,136
Johnathan McDonnell,4.0,Terrific pizza and great service!!!,a year ago,Open,136
Ira Shelton,5.0,Good place for custom pizza,10 months ago,Open,136
d'Wolfe pup,5.0,Best pizza place ever! Very affordable!,a year ago,Open,136
colorWIRED,2.0,"I had post a poor review after visiting this restaurant and it was removed so I'll try again, the staff was rude and not attending to the line of customers waiting in a timely manner. The dining area was a mess and was also being ignored by …More",2 years ago,Open,136
Lotus Sarephim DeCadence,5.0,"This place is just great. Serious. It's a fun experience. Awesome customizable pies, salads, awesome drink see took. With classic drink faves, plus a few new varieties of flavors I've not ever seen anyplace else! The staff are welcoming, …More",a year ago,Open,136
David Edgar,4.0,Good stuff. Coronado location seems to have the better crew. Vs.. paseo location. They tend to have more ingredients in stock.,2 years ago,Open,136
Roe Bearz,5.0,"Yummo! Pizza made my way, great customer service and a cold Fanta. Count me in!",a year ago,Open,136
Wanda Castillo,5.0,Custom orders that can be made vegetarian or vegan!,a year ago,Open,136
Alex Herman,5.0,"Great option for vegan pizza in ABQ. You can customize your pizza to be pretty much anything you want it to be. If you order online, you can pick up your pizza with no wait.",a year ago,Open,136
Elliot Christopher,3.0,"Food was great. The staff had some opportunity. The majority of the staff was friendly and easy to make conversation with. On the other hand, when you hear one of them conversate with their peer and begin to complain about people walking through the door at 11:40 A.M. it makes me want to take my business somewhere else.",2 years ago,Open,136
Joseph Gonzales,5.0,Have nothing except good things to say about Blaze Pizza.  Have been to both stores and have been treated with respect at both places equally well.  Glad the owner is about Customer Service.  Love this place!,2 years ago,Open,136
Shari Dotson,4.0,First time got take out green stripe pizza. Pizza was cooked well and tasted good but they left off the arugula. I was looking forward to the arugula. Sad since it's a signature pizza. I will try again hoping they can get their basic menu right next time.,2 years ago,Open,136
M Foster,5.0,"Staff is really friendly and helpful, pizza tastes great (good thin crust without being cracker-like), and they've got calorie counts! And lots of options!",a year ago,Open,136
Jorge Gallardo,5.0,Great food and service Wisepies has a competitor,a year ago,Open,136
Christian Dunn,1.0,"If you are an east coast pizza purist as am I, stay away. The NM fusion does not work. The marinara is bland and the toppings are not right. Too much reliance on chili which is not congruent with pizza. I am glad I tried it so I know to never go back.",a year ago,Open,136
adam schaer,4.0,Tried to order ahead and the woman that answered could not figure out how to process my order and then refused to make our pizza before we arrived citing company policy.  Once I arrived staff was nice and found out when you call ahead you …More,2 years ago,Open,136
Heather Swingle,4.0,Decided to go there for lunch this afternoon. I was very surprised. The pizza was delicious and we didnt need to sit and wait for 20 or 30 minutes for it to be cooked. The staff were very friendly and welcoming. He explained how the …More,2 years ago,Open,136
Edward Sánchez,5.0,Better than wise pies! Good portions for a good price! And good drinks!,2 years ago,Open,136
Tim Duran,3.0,Great service. Pizza is good and comes out fast.,a year ago,Open,136
Lori Williams,5.0,Delicious  pizza.  Fast service!,a year ago,Open,136
Chris Davis,5.0,"Love this place, great keto pizza.",a year ago,Open,136
Brandon Holt,5.0,"Hot dang, it’s Delicious!",2 years ago,Open,136
Amy DeLong,3.0,Seating could be better.,11 months ago,Open,136
Clark Ensz,5.0,Really good pizza,9 months ago,Open,136
Daniel Grauer,4.0,Like the set up. Pizza is good and they have vegan cheese for their pizzas.,a year ago,Open,136
Blu Otero,5.0,The food here is fantastic! I love coming here and it’s all very reasonably priced. Staff is friendly and quick too!,2 years ago,Open,136
Paul Seals,3.0,"Food is great, but they are very sllooowwww.",a year ago,Open,136
Shaunna Justus,5.0,Awesome! I looove the selection its so good.,a year ago,Open,136
Daniel Daniel,3.0,Decided to try Blaze Pizza tonight and noticed a few things they could work on like cleanliness.  Prep space is limited but keeping that clean is important for sanitation and to prevent cross food contamination.  Also observed an employee …More,2 years ago,Open,136
Tommy Wong,4.0,"Decent pizza. Quick, 1st time trying.  I was happy with my food.",2 years ago,Open,136
Michelle Jimenez,5.0,"The pizza here is so good and so freaking cheap. It’s about 8$ for a personal build-your-own-pizza, and you can put anything in there.",2 years ago,Open,136
Duh nay Diaz,5.0,First time here and i was pleasantly suprised,a year ago,Open,136
Catherine Hsieh,5.0,Friendly service and responsive.   When I notified them that one of their soft drinks needed to be refilled they did it fairly quickly even though they were busy.,2 years ago,Open,136
Marissa Sanchez,5.0,Great pizza at a good price. Sign up for their rewards program for free pizza!!,a year ago,Open,136
traingirl2926 traingeekforlife,5.0,Awesome pizza and lovely staff,a year ago,Open,136
Michelle Doran,4.0,"My online order wasn't ready when I got there, which is almost good because who wants cold pizza, but it was ready shortly after. The garlic knots are very good, but they need to work on consistency.",2 years ago,Open,136
RAQUEL GARCIA,5.0,The pizza is delicious and I absolutely love their blood orange lemonade!,2 years ago,Open,136
Robert Pete Minto,5.0,"Super Good. Better prices then ""home of the brick oven"" build your pizza on a assembly line. Great date night, Alcohol provided.",2 years ago,Open,136
Carlos Lopez,5.0,Dope place especially with kids at a good price,2 years ago,Open,136
Mars Hall,4.0,Great pizza and great service!,a year ago,Open,136
kevin fredekind,3.0,"Keto crust,,, wilty salad",a year ago,Open,136
Mamma Boo,3.0,Sad to say the pizza is getting oilier n crisper unlike when they first opened but the best blood orange lemonade,2 years ago,Open,136
Michelle Pacheco,5.0,Pizza is delicious and a great price,a year ago,Open,136
Nanaurias19@gmail.com Nemopenny,2.0,"My pizza crust was burnt. I ate my toppings, but not the crust.",a year ago,Open,136
Tony R. Sedillo,5.0,Great Pizza for a great price,a year ago,Open,136
Denise Ervin,3.0,Pizza was ok.  Nothing memorable.  2 pizzas made incorrectly 1 was caught and remade the other was not.  Caesar salad ok.  Establishment was clean and staff very friendly,2 years ago,Open,136
Louis de la Verité,5.0,I like assembling my own toppings.,a year ago,Open,136
David S,5.0,Get ready for some of the besy combinations on your 12 inch pizza. Fresh ingredients that you watch put on your pizza.,2 years ago,Open,136
Rayricekingriceking,5.0,Fresh pizza made in front of you . It doesn't get any better than that.,a year ago,Open,136
Julie Ellison,2.0,Placed a small online order for lunch. I came 10 minutes after they said it would be ready. When I got there they told me my pizza was still being made. I sat in the dining room for an additional 15 minutes. I was late to work. Don’t go here for lunch it take 30-45 minutes.,2 years ago,Open,136
Mer lin,5.0,Great pizza. Wonderful staff,a year ago,Open,136
John Heckendorn,5.0,Great pizza with the toppings you want,a year ago,Open,136
Devin Myers,4.0,Place was cool - like subway of good pizza- staff was nice- I had the white top pizza- my kids loved it- they had aqua frescas on tap- all the pizzas are $8- I will be returning here sometime- good job Blaze- good family spot,2 years ago,Open,136
Erick Smith,5.0,This place is amazing this pizza is twice as better than wise pies you guys need to build one on the west side somewhere close to Central and Unser,2 years ago,Open,136
Douglas Mallary,5.0,Fast service and good food.,a year ago,Open,136
Erik Lewis,2.0,Not very good. For the price you can get better quality elsewhere,2 years ago,Open,136
Ryan Blaha,5.0,The pizza was very good.,a year ago,Open,136
Ronda Winter,5.0,"Variety is great, helpful staff, and nice clean spot",a year ago,Open,136
Kris Vaughan,5.0,Grateful that they have vegan cheese.,a year ago,Open,136
Lori Scalia,5.0,"Fast, hot and custom made to order with fresh, quality ingredients, will definitely be coming back",2 years ago,Open,136
Chantelle chasteen,5.0,Love this place drive all the way from Rio Rancho for a pizza with vegan cheese.,2 years ago,Open,136
James Robinson,1.0,"The pizza was good, took the family and the staff burnt 3 out of 5 pizzas, one of them twice... My pizza came out first and I was the last to get mine, I see a lot of potential for the store and wish them luck, at the time of our visit I saw a lot of waisted food and unhappy people, as we were not the only ones
not satisfied.",2 years ago,Open,136
Nadine Estrada,4.0,"Cool experience making your own pizza, relatively cheap too",2 years ago,Open,136
Brent Bolen,5.0,"Best pizza around.  Really missed it after moving west.  There are local pizza places that do the same sort of small pies, but they are just not the same.",2 years ago,Open,136
Matt Benz,5.0,Mmmm goood,a year ago,Open,136
Sally Ramirez,5.0,The best pizza in town. Always delicious and friendly staff.,2 years ago,Open,136
Marco Diaz,1.0,Employees do not know what they are doing I had to repeat my order multiple time they are lost,a year ago,Open,136
Milagro Hernandez,5.0,The people working the line were up beat and very accommodating! Great service.,2 years ago,Open,136
michael wilson,5.0,The pizza was outstandingly pleasing😋😋🌠best thin-crust I've had🍕love the side salads they have,2 years ago,Open,136
Kevin Garcia,5.0,Great Keto Pizza,8 months ago,Open,136
Christina E,3.0,"Pizza is good, but the workers are rude. They gave us sighs and moans when we asked for extra green chili, like it was coming out of their pocket.",2 years ago,Open,136
Angelica Holmes,5.0,The pizza is big for the price and they have so many delicious toppings to put on your pizza!,2 years ago,Open,136
lomprieta101789,5.0,"Excellent price, excellent pizza.",a year ago,Open,136
Yasmin Verastegui,5.0,Really good pizza,a year ago,Open,136
Carlos Jimenez,4.0,"Good place for a quick lunch, pizza is very good and  prices are reasonable.  They have Aguas frescas and Blue Sky sodas on fountain, bottled beer and some varieties like Marble, Shock Top and Happy Camper on tap.",2 years ago,Open,136
Joey Caliendo,5.0,"Great food, made quickly. The only thing that was weird was that there were chunks of cheese in my partners cup of beer.",2 years ago,Open,136
John Von,5.0,The only place I know if I can get a vegan pizza. Added as super delicious.,2 years ago,Open,136
Carol Chan,5.0,Good quick pizza. Friendly staff. Clean.,2 years ago,Open,136
Nezam Jalal,5.0,Very delicious pizza,11 months ago,Open,136
Justin Jaramillo,4.0,"Great pizza, solid crust. Build your own, ome and 1 topping options",2 years ago,Open,136
Randy Unruh,4.0,Good prices for a full size build your own pizza.,2 years ago,Open,136
Wendy Neill,5.0,Excellent service and great build-your-own pizza.,2 years ago,Open,136
James Burkart,5.0,"Good selection, tastes great, fast service, great value!",2 years ago,Open,136
Frank Garcia,4.0,Great place good pizza made to order at good price.,2 years ago,Open,136
Jonathon Brearley,5.0,Really good deal on personalized fresh made pizza. Beers in bottle and tap!,2 years ago,Open,136
Klent Foster,2.0,"Food is good but their reward system is broken so don't bother coming often or being a loyal patron, I've been here at least 16 times but the rewards app says I've only been 9, conveniently one less than I need to get a free pizza that I've more than earned.",2 years ago,Open,136
Rich Williams,5.0,Took my grandson there for dinner staff was awesome even though we got there late at 10 till closing very happy happy and took very good care of us would recommend to anybody and good food at the same time,2 years ago,Open,136
Paul Catasca,4.0,Good pizza like the prices to flat rate buid your own kinda like subway definitely going back,2 years ago,Open,136
