name,stars,text,timeSince,openStatus,key
Wendy Call,5.0,"I love that we can get whatever we want on our pizza.  This time I was surprised at the perfect crispness of the crust.  Sometimes the edges are burnt and the center is soggy, but not this time.  What's better is that I had a deal on the app.  I got a free drink with my pizza.  It can't get better than that!",a week ago,Open,258
Kara Scanlon,5.0,"This is one of the best locations in the area because it's not super full and has lots of seating! I love all the choices especially the spicy sauce and artichokes. The staff is super friendly here, too!",a year ago,Open,258
Rob Rodriguez,5.0,Great pizza .....don't know any other restaurants that have my favorite beer Shiner Bock..and the manager aways goes out of her way to make us feel welcome,a week ago,Open,258
Gayle Rose,4.0,One of the best pizza places in the city. I am never disappointed with the food and service is good! Fun environment. Great casual place with excellent food.,4 weeks ago,Open,258
Reece Lemmon,4.0,"The pizzas here are delicious. They are assembled in front of you so everyone can get exactly what they want. The crust and ingredients are fresh. The service was fast and friendly, but the prep area was a little messy and the crew seemed …More",a year ago,Open,258
James William,4.0,"It's all its cracked up to be. Authentic  food, authentic service.  All fresh ingredients.  It doesn't get any better in North Beach. There may be ""just as good"" at some of the other premium North  Beach eateries. But this one is definitely up for your To Do do list.",a month ago,Open,258
Brian Ramirez,2.0,Every single time I order through postmates they mess something up. Ordered a BYO w/ 3 toppings and oregano and they only gave me 2 of the toppings and no oregano. If it was a one time thing I wouldnt really care but this happens every time …More,a month ago,Open,258
Memo Villalobos,1.0,Horrible Management!!! Waiting almost and hour to get a Pizza.  There was a few people in the restaurant trying to get there food but had to wait for the online orders to go first.  A huge amount of pizzas outside the oven waiting to be put in the oven with all the toppings going bad.  Wouldn't be surprised if we all get sick!,6 days ago,Open,258
Lexie LaBo,1.0,"did an online order, all 3 pizzas missing half of the toppings/have ones on them we didn’t order. when we arrived they said they ran out of garlic knots to fill our order, only offered one brownie for each order (which I can only guess are …More",a month ago,Open,258
Jason Sim,5.0,Exceptional service makes this place my favorite over other blaze pizzas. Food is awesome. And pizza fire baked and hot out of the oven. Edgar provided exceptional service following all the requests I had for my customizable pizza. I like …More,a year ago,Open,258
Abdiel Maravilla,5.0,Quick and easy service and very friendly staff and make sure you leave satisfied,a month ago,Open,258
Caty Wagner,5.0,"Blaze is the best pizza chain in California. I'm from New Haven and I know pizza. If I'm going to eat pizza on the west coast, this is all I will eat.",2 months ago,Open,258
Amanda Blackmore,4.0,AMAZING PIZZA! I unfortunately was painfully unaware that cauliflower crust has cow dairy in it. I should have gone with the other gluten free bread. I wasn’t even able to finish eating my pizza upon this discovery. So I spent $20 to scrape …More,5 months ago,Open,258
Alex Arias,1.0,"Very poor customer service, micro management, rude staff and incompetent. Lack of training or common sense",a month ago,Open,258
Graciela De Choch,3.0,My order was cold and burn. They need to be more careful with the clients and orders.,a month ago,Open,258
Paul C,5.0,Consistently great pizza and love the new seasonal vegetable they offer. We always build our own pizza. The line moves fast. Enjoy the beer options. Rewards program well worth it.,9 months ago,Open,258
Paul Maple,5.0,"This pizza place is great. They serve good pizza plus good price. The pizza gets ready quick and tastes great 👍🏽, for sure coming back soon 👏 highly recommended",2 years ago,Open,258
S C,5.0,Ate here after a long day of sightseeing. So good!,4 months ago,Open,258
coco cook,4.0,Clean and fast. I love the concept and the execution.,3 months ago,Open,258
Kevin Sewell,5.0,"Consistent is not a ""bad"" word and it's why I go to Blaze. The quality ingredients and now they offer multiple crusts from keto to cauliflower! Good stuff! This location has abundant seating and good service.",10 months ago,Open,258
Brandon Lau,5.0,"Friendly staff, always love coming here for an easy lunch/dinner. Love that you can build your own pizza and add anything to it.  Great for groups or families since is a big dining area! Im really loving their pear cucumber agua fresca rn.  But their blood ora ge lemonade is classic and so good!",10 months ago,Open,258
Erskine Painter,4.0,Would have giving 5 stars but getting what you want on a pizza is like pulling teeth. I get you have to put a certain measured amount but like when I have to ask three times for more onions there is a disconnect between the training and …More,a year ago,Open,258
Sahndra Fon Dufe,5.0,"All natural $8.65 Signature Pizza baked RIGHT before your eyes🍕 and theeeeeen CUSTOMIZABLE?!!!!! Weeeeeeeet? I said, wuuuuut! That’s me right now. In south pas, waiting anxiously for my Red Vine Signature Pizza and ovalini mozzarella: …More",2 years ago,Open,258
Solomon Yu,5.0,"Finest food, friendly staff, consistently good mood. They charge fair prices and the food quality is awesome. 5 stars.",11 months ago,Open,258
Katie Hraban,5.0,"Awesome keto, gluten free and vegan options for all! And for the less adventurous pizza they have amazing regular pizza too😉 available fast with  friendly service!",8 months ago,Open,258
I Am Among You All,5.0,I luv flat pizza and I luv their build your owns! Tastes real good 🍕🍕,8 months ago,Open,258
Kata,3.0,"This site has been been hit or miss depending on staff.   Today's service and product was excellent.  Last time I stopped by it was a totally different staff, none of whom knew how to take a customer's order, put ingredients on a pizza, …More",11 months ago,Open,258
Miss. Elena L,5.0,Its a place where ypu build ypur own pizza with as many topping as you want. So if you dont like  your pizza your the one to blame for it. Hey ypu made it your own way.,2 years ago,Open,258
Priscilla Cardona,5.0,Pizza is so good since you do get to choose your own products! Usually gets a bit of a line but it is often fast thanks to the staff,10 months ago,Open,258
Le'Andre LNR,5.0,"There were so many staff members available to help. Great customer service and the food was as I ordered. We ordered a salad it wasn't delicious but they gave us my gift card for free pizza, that was awesome. But I would come back for the pizza",a year ago,Open,258
Christina Castillo,5.0,"Great food, great service!",a year ago,Open,258
Mrs Ocampo,2.0,Employees did not even analogue us wile we were in line. When we were standing in line for 10 min they were arguing who will take the order. Come on really. They need better customer service. Will not come here again.,a year ago,Open,258
Natalie Lucero,2.0,"The food was good and ready fast, but it was made sloppy and the customer service left much to be desired. All of the employees looked mad and seemed distracted. The pineapple on for my pizza was first sprinkled on my husband's then plucked …More",11 months ago,Open,258
nancy,1.0,"Well, on the weekends i dont really recommend to come to this location. The service is bad. There is a long line to order and there  is only one person preparing the pizza  not only that but he or she has to replace the trays very terrible the food is good but the service very poor.",a year ago,Open,258
robert schneider,5.0,"Great service,  excellent pizzas",2 months ago,Open,258
consuelamister lemon pledge,2.0,"Extra cheese? How about no cheese? What is this, when I asked for more they said I had plenty and wouldn't give extra I'm extremely disappointed I've been coming here for months but I think today is my last.",2 years ago,Open,258
paul verdugo,1.0,Don't oder online. They ignore online orders to take care of walk in customers. Waited over 20 minutes before I asked and then they started making the pizzas for me and a woman who said they told her her pizza would be ready for pickup at …More,a year ago,Open,258
Gabriela Cazares,5.0,Delicious and fast pizza!! Salads are yummy too.. 🍕🍕,9 months ago,Open,258
Milena Popovich,5.0,"Best place ever,and best pizza. People are amazing, very friendly ♥️🤗 Manager is so freaking great. Customers comes first always 👍😘",a year ago,Open,258
Ron,4.0,"So many options, go bare minimum or fancy feast! I usually get a double dough well done with whatever toppings. I eat half and have the other half the next day. Employees are very friendly and the restaurant is clean. …More",a year ago,Open,258
Teddy Espino,5.0,Loved it you get to build your own pizza and the price is very reasonable,9 months ago,Open,258
Alex Lysikhina,5.0,A super nice pizza place with great vegan options!,9 months ago,Open,258
René Melancon,5.0,"Very delicious, great customer service",4 months ago,Open,258
Joy Nicole,4.0,Great made to order pizzas. Customize it yourself or try one of their flavors/creations. The wait time depends on how many/how large of orders in front of yours. Usually friendly staff. Everything is pretty fresh. The salads are made to order as well. Gluten free crust available.,a year ago,Open,258
Linda Co,5.0,"The pizza were absolutely delicious!  They were thin crusted, fresh, hot, nicely crispy pizza just the way you like it.  The ingredients and toppings were fresh.  Thank you!",a year ago,Open,258
Cesar Delatorre,5.0,Love gluten free pizza!!,3 months ago,Open,258
Brad Schaider,4.0,"This place is a garlic lovers dream!! Look at my photo, that whole pile of garlic was on half of a pizza. Sadly for me, that's way too much garlic. I placed my order online, all my ingredients were correct, except someone decided I wanted …More",a year ago,Open,258
Lee Ellen La Madrid,2.0,"When they first opened was fantastic, but slowly has dropped in quality. But they got fantastic fluffy ice.",a year ago,Open,258
David Randall,1.0,"the pizza is good but good LORT the wait. I've ordered pizza twice the last few weeks but every time the pizza isn't ready, even way past the estimated time of pickup. I'll usually show up five minutes after estimated time wherever I go, …More",a year ago,Open,258
Mark Puglisi,5.0,"Tried the Keto pizza which was great. Wish Blaze would incorporate more Keto friendly ingredients and other options, like vinager for their salad and keto friendly beer like Corona Premier.",10 months ago,Open,258
Molee Hong,4.0,"Drinks are soooo good! The lemonade and pomegranate were my fav.
1 pizza is enough to share if you aren’t too hungry amongst 2 ppl.",a year ago,Open,258
ED 5000,5.0,Good pizza will come back again. Service was busy and slow but they were very accommodating and helped.,11 months ago,Open,258
Virginia Camarillo,2.0,"Was not good today,  my vegetables were still cold and just wasn't cooked long enough.",5 months ago,Open,258
Paul Bingham,4.0,"Fairly reliable oven-fired thin crust pizzas. Eat in or carry out, simple orders prepared right most of the time. When staff maintain focus the food can be very good but service levels vary at this location. Free parking in own lot and on …More",2 years ago,Open,258
Boboy Sumulong,5.0,"Great place for a quick bite. Would recommend the thin crust, build your own pizza. It won't disappoint. Service was warm and friendly. Quite spacious for a pizza place.",a year ago,Open,258
Oscar Gutierrez,5.0,I actually love Blaze Pizza all the ingredients for fresh all the ingredients for organic and all the ingredients put together we're done over the internet I didn't have to go there to order it I paid for over my app I downloaded the app …More,11 months ago,Open,258
Philippe Faucon,5.0,A typical new pizza restaurant were you can choose your toppings in a Subway kind of way. They pop the pizza in the oven an 5 minutes later they bring the pizza to your table... Quite nice.,a year ago,Open,258
Joel Zucker,4.0,"Blaze is always a consistent experience offering an individual customized dining option (difficult finding conventionally at pizza joints with two kiddos that only ever eat the same type of pizza) and the restaurant is open, casual, and …More",a year ago,Open,258
Christina Stewart,1.0,"I’ve never had to wait so long at any Blaze pizza before. If you go here, just beware if you order online your order will take an additional 30 minutes.",10 months ago,Open,258
Karina Carmona,5.0,Love it!! Like that I can choose my ingredients and crust.,a year ago,Open,258
Jon ly,5.0,Blaze pizza has the best build your own pizza. You must try it if you never had.,a year ago,Open,258
Jesse Nunez,5.0,"For a Quick and Delicious meal, BLAZE CAN'T BE BEAT!! I LOVE THE SOUTH PASADENA CREW!! They're all Great though. Check'em out. I doubt you'll be disappointed. I recommend the Red Vine!! Enjoy",a year ago,Open,258
Logan Romeo,1.0,The lady is glasses is very rude was not friendly would not come back to here,5 months ago,Open,258
jon doe,4.0,I like to take advantage of the build your own action. Hope you guys grated a few blocks of cheese cause we're about to make sure you lose money on this pizza! Hahahahahaha!,a year ago,Open,258
Mark Simpson,4.0,"Good food. Could be cleaner. Sun coming in at 6:30 pm was too much, needs some shades.",a year ago,Open,258
Nancy Balsach,5.0,Great place pick all the health topping you want!! What fun!,a year ago,Open,258
Lisa Buser,3.0,"The food is good, but they don't really want customers to come in. They take online orders ahead of customers in line. We waited in line with people behind us while all of the employees worked on online or GribHub orders. And this is not the first time it's happened. We probably won't be back.",a year ago,Open,258
Scott Ross,4.0,"Good pizza, good salads, family-friendly and fast",11 months ago,Open,258
Cullen Andrews,4.0,"It's an up to par Blaze location, nothing to complain about here.

Blaze offers quick cooked pizza made in front of you. Most notably, they offer gluten free pizza with glove changes and separate ovens.",a year ago,Open,258
Brian Garcia,5.0,"Great addition to South Pasadena. Of course the papa Johns up the street bailed before Blaze opened. It was a smart choice by them because Blaze is everything you can ask for in a pizza. Great flavor, great toppings, and very nice staff. The place doesn't get too packed either.",2 years ago,Open,258
Katherin Morris,1.0,I thought that I would like this place but I was very wrong. We bought two pizzas and neither one had any flavor. I bought a pizza with pinapple and the pineapple had NO FLAVOR. What is that about? Leave it in the juice and it will have …More,a year ago,Open,258
Kree Thatisme,5.0,South Pasadena's BLAZE Pizza is a BEST KEPT SECRET. Sooo good. Staff and Pizza are Great!,a year ago,Open,258
Olive Allen,3.0,Great idea! This is a great concept but the line would move more efficiently if they would hire few more people. We waited a long time to get our pizza along with the others.,2 years ago,Open,258
Jono Major,5.0,Great for quick service pizza. Get the build your own and pile as much as you want on it.,a year ago,Open,258
Jeff H,4.0,"I like the ability to customize your own pizza without having to pay extraordinary add-on fees.  This location has a tiny parking lot so you should expect to park on the street during busy hours. Speaking of busy hours, it can get super crazy Saturday evenings, and they always seem to be short staffed by one or two people.",a year ago,Open,258
Robert Yan,2.0,"Food is good, employees are friendly. Sunday store manager is horrible. She does not now how to speak to customers. Very disrespectful. Will not hand out pizza and asks many questions after pizza is ordered and paid for.",a year ago,Open,258
Samantha Sanchez,5.0,Always satisfying.  Had pepperoni with spicy sauce and the BBQ Chicken.,2 years ago,Open,258
darryl day,1.0,Lady manager very rude I will not go back.,7 months ago,Open,258
Dr. Moo,4.0,"Good prices, good ingredients, good service, good time. Glad that old blockbuster got replaced with a restaurant with such a good atmosphere.",a year ago,Open,258
Art O,4.0,This location is not as crowded. Great pizza.,a year ago,Open,258
Maria Henriquez,5.0,"I tried this place out for the first time a couple weeks ago, and it was great. They have a great helpful and friendly staff. The pizzas have an amazing flavor at a good price. They don't take that long to make. It was a great place to grab a bite.",2 years ago,Open,258
Graham Vickers,5.0,"Great pizza, lots of options, vegan options are fantastic. Get the popcorn chixn or soyrizo!",a year ago,Open,258
W Basurto,3.0,Price is good and help is great,7 months ago,Open,258
Derek Walker,5.0,"Great service, and the food was well prepared.",a year ago,Open,258
May Visor,5.0,Good pizza and they are open late!,a year ago,Open,258
Karl Herbst,3.0,Good pizza small size and way over priced.,8 months ago,Open,258
happysmash27,5.0,"Delicious, and not one, but two vegan protein options!",a year ago,Open,258
Innovative Constructions,5.0,Blaze is blazing great. The employees make it easy going and fun to be there. How much better can it get to get a custom pizza only for a fraction what other places would charge? A really great place to eat!,2 years ago,Open,258
han lee,3.0,The service was terribly slow when I was the only customer and their POS system was malfunctioning as well.,a year ago,Open,258
Dylan Littlefield,4.0,"The pizza was pretty amazing.  It was tasty and made to order.  It was packed when we got here, but it looks like this place runs like a well oiled machine.  The line was to the door, but the wait was not awful. …More",2 years ago,Open,258
Dr. Ar,4.0,Pitza was good and staff were nice. I like the option of adding as many toppings as you want.,a year ago,Open,258
Rob,5.0,Likely the most spacious Blaze Pizza in the area and the largest I have personally been to. Ample seating inside and some outside. Parking lot is small but decent amount of street parking available.,2 years ago,Open,258
Jared Hardy,2.0,"They were completely out of the only crust I can eat there (cauliflower), and even the balsamic vinaigrette salad dressing (the least carby option they have) was way too sweet.",a year ago,Open,258
Allena Allen,5.0,Good kid food.,10 months ago,Open,258
Darby Whipple,3.0,"Super basic menu,  no flavored crusts, only sides are salads. Staff must get a lot of coaching about talking to customers,  but they could use some about actually listening to the answers to the questions. Overall food was good, wish there was more options.",2 years ago,Open,258
lisa mt,5.0,We went on a Friday evening and it was busy. I loved that I could add some extra vegetables to my pizza without any additional cost. They use a thin crust so don't pile too much on but the pizza was really delicious and my son loved his as well. Good prices also. AAAAAA in my book.,2 years ago,Open,258
Elisabeth Beutler,4.0,"The pizza tastes good but just FYI- the deal where you get 2 pepperoni pizzas for $10, you are getting 2 very small pizzas- like just slightly bigger than a personal pan pizza. So while it seems like a great deal, you’re not getting much.",a year ago,Open,258
Valerie Torres,5.0,Delicious pizza and great beverages try thr blood lemonade.,a year ago,Open,258
BotMegee225,5.0,Good,a month ago,Open,258
Peter B,4.0,Really enjoyed the pizza here I recommend,a year ago,Open,258
Matthew Whaling,5.0,As a Blaze Pizza connesier I can tell you this is a good location. It also has floor to ceiling windows so you can watch the sunset over the city as you eat.,a year ago,Open,258
William Naylor,5.0,My favorite pizza place,7 months ago,Open,258
Ryan Jensen,5.0,"Welp its been two weeks and I have already been twice. It’s nice to have something cheap and high quality in South Pasadena. If you like blaze this place is good. Don’t worry about the line, it moves very quick. Just be sure to get what you …More",2 years ago,Open,258
Samantha Meneses,5.0,Came here with 3 adults 2 teens and a child and everyone was pleased with their own pizza. They have a great variety of lemonades.,2 years ago,Open,258
Maria Angulo,5.0,Love this South Pasadena Blaze! Fast service and always has tables/chairs available unlike Alhambra location.,2 years ago,Open,258
Sandy Pukay,5.0,Loved it. First time there. Or soon suggested it. Very good and fast.,a year ago,Open,258
Jack Vivirito,2.0,This was my second visit to this Blaze and twice I was disappointed. I'm not sure who is training these people but some of them seem clueless and they certainly don't work in sync with each other. The worst part came when my pizza came out …More,2 years ago,Open,258
Stephen Tully,5.0,"Blaze makes great pizzas. This is a new location, so the staff is a little slow while they learn how to do things. Also a bit crowded, but reasonable considering how fast they can cook the pizzas.",2 years ago,Open,258
Israel Ventura,5.0,Good place to eat pizza,11 months ago,Open,258
Annette D'Amato,4.0,"Great place to relax, liked the music choices although, volume could be turned down quite a bit. Pizzas and drinks delicious. Variety of toppings and preferences to choose from. :  )",2 years ago,Open,258
Esteban Luna,4.0,"Staff very helpful with questions and polite, returning soon!!",a year ago,Open,258
TK I,5.0,I like blaze pizza! i like Build your own make my pizza~~~,a year ago,Open,258
Vahe Ghevandian,5.0,"Great service, good and fast pizza",a year ago,Open,258
Jayne Osborne,5.0,"First time going to Blaze Pizza.  They just opened up in my neighborhood and they sent me two for one coupon in the mail.  Great service, great food very quickly served and nice atmosphere and very fresh lemonade!",2 years ago,Open,258
Tiona Wierman,5.0,Best pizza ever plus great salads !,a year ago,Open,258
Ashley Robinson,5.0,Staff is friendly and those garlic knots are addicting,a year ago,Open,258
Jee Han Hwang,4.0,Very good and it tastes like homemade. Giving it a 4 star for it is kind of salty,2 years ago,Open,258
Diego Galtieri,5.0,"Great place for pizza custom made to fit your taste. Ambiance is modern. Plenty of options of crust and toppings. Lines could be long, so I recommend to order in advance using their app. They have salads as well and good options for beverages such as lemonades and aguas frescas.",2 years ago,Open,258
Janis Frame,4.0,Good for a pretty quick meal. Nice selection of toppings. Very nice staff.,2 years ago,Open,258
Angeles Alegre,2.0,"I love Blaze but today was not a good experience, I usually go to the other location but since these one is closer to me I decided to give it a try. I went in with the intention of getting my free pizza once I open my app my free pizza had …More",2 years ago,Open,258
Victor Saldivar,2.0,Service is awful. Kid working the oven is just bad. Pizza was almost burnt. Asked for the smores I ordered and the employee pretty much ignored me. Had to ask twice. Rather take my money elsewhere.,a year ago,Open,258
Armando Gutierrez,5.0,Off the charts good,9 months ago,Open,258
Miguel Juarez,5.0,"A big and spacious locale, with friendly staff.",a year ago,Open,258
daijiyea,5.0,This place have very fast service and big dining area,a year ago,Open,258
Joseph Lam,5.0,Staff is incredible. For a new store I expected the workers to be slow but they were very quick! Was greeted by almost every employee as soon as I walked in. The line is long but moves quick. The managers stand around to delegate rather …More,2 years ago,Open,258
TINA,5.0,the pizza is good and their service is awesome,a year ago,Open,258
Amanda Storey,4.0,"Nice spot chipotle style service and quality ingredients just for pizza. It was good, nice spot for a lunch.",2 years ago,Open,258
Stephanie Pickford,4.0,"Good pizza, nice open airy dining. Parking a bit rough but not unmanageable.",2 years ago,Open,258
David Johnston,4.0,"This is a nice Blaze. So glad something was finally done after so long afyer ablockbusster went out of business. This is the best kind of. Uild your own pizza, where an extra topping here or there won't end up costing an arm and a leg. Try …More",2 years ago,Open,258
Paul Mac,1.0,I have just left the South Pasadena Blaze pizza.  It was one of the most horrendous experiences I have had with a restaurant.  I had a coupon for buy one pizza and get one free.  When I arrived at Blaze pizza there was a line wrapping …More,2 years ago,Open,258
Daniel Kim,5.0,"There is a lot of competition nearby, but this is the best place ever!",2 years ago,Open,258
Matt Bragg,2.0,Losing its quality the staff is not organized,a year ago,Open,258
Alex Matlock,5.0,"Delicious, made to order pizza with plenty of toppings for everyone.",a year ago,Open,258
A. O.,4.0,Very friendly staff and prompt service.,a year ago,Open,258
William Naylor,5.0,The only pizza I want to eat,11 months ago,Open,258
Dennis del Castillo,4.0,Good pizza. Nice thin crust. One cashier was not too friendly.,2 years ago,Open,258
Brian Murphy,5.0,Epic spicy vegan chorizo!,a year ago,Open,258
Bob Betz,4.0,The food was great,11 months ago,Open,258
MrDjjustice24,5.0,Yes I use to have to go to Alhambra now there's one for us in South Pasadena!! Great food and really quick service. 8 beers on tap what more could you ask for. No TV's to watch the games tho.,2 years ago,Open,258
Will Z,5.0,This is your standard Blaze custom pizza experience in a modern loft-style space - great combo!,2 years ago,Open,258
alonna woodlin,4.0,good vegan option,a year ago,Open,258
