name,stars,text,timeSince,openStatus,key
Dee Gladney,5.0,Hands down best quick pizza joint in town. I love the build your own pizza bc I can get as many toppings as I want. Great place!,a year ago,Open,188
Dworin Cole,5.0,The veggie Run Pizza is very good.,8 months ago,Open,188
Rhonda McCoy,5.0,Food is good and good customer service,a year ago,Open,188
Cali Chriss,5.0,Wow this place was life changing! I am on a journey of Veganism this place made me fall back in love with food... they have keto crust and cauliflower! Mmm the vegan was out but i went with the cauliflower crust and omg... so good! I got a …More,a year ago,Open,188
Yvette Taylor,5.0,"Fresh, delicious, hot, fast and affordable. Need I say more. Except for YUMMY 😋",a year ago,Open,188
Avery Rucker,4.0,"Great pizza, quick turnaround from order to being served. Fresh ingredients. Only drawback is it's a little expensive. Paid over 35 dollars for 3 pizzas. Overall recommend if you're in the area.",2 years ago,Open,188
Nichelle Peters,4.0,Customer service was good and the pizza was great,a year ago,Open,188
Monica Thomas,5.0,Great customer service. Food is outstanding!! First time visiting today. Will definitely visit again. Please try the blood orange lemonade!!! Yumminess,a year ago,Open,188
Chloe Panagiotatos,3.0,"Pizza was great, until we noticed a little fly baked right into the side of one of our pizzas 🤢",a year ago,Open,188
Debra Tyson,5.0,"I ❤️ this place. The staff, atmosphere and price point are great.",a year ago,Open,188
Matt Campbell,4.0,"Always a delightful experience, and the ciatomade pizzas are  wonderful!",a year ago,Open,188
YaBoi Ky,5.0,All good options!!!,3 months ago,Open,188
Freddy Hernandez,4.0,Good deals on customized let pizzas,11 months ago,Open,188
alvin hatcher,5.0,Pizza is made fast and the ingredients are fresh and flavorful.  Some of the best pizza I ever had!!,a year ago,Open,188
Mary Gillespie,5.0,"Fast, delicious pizza. I love brick oven pizza, this is the best experience. With a build your own line like subway or chipotle and the taste of a sit down brick oven pizza restuarant. Can't wait to go back.",a year ago,Open,188
Tiara Smith,5.0,I love Blaze!!! There is nothing better than paying 1 price to get whatever toppings you want on your pizza. We stopped ordering pizza from delivery places because of the cost compared to going to Blaze for a better quality pizza for less price.,2 years ago,Open,188
Mushroom Button,5.0,"There are always exceptions. Poor & rude service is not pleasant.
Well this time turned out to be an exception. I was grateful for poor service.
My wife and I visited a well known pizza franchise on 2 Notch, and once again …More",2 years ago,Open,188
Kirstin Aldridge,4.0,Very good pizza and tea.,8 months ago,Open,188
Iris Brown,5.0,Fast service. Good pizza. Fresh ingredients. Good drinks,a year ago,Open,188
Douglas Lucas,5.0,Great pizza,3 months ago,Open,188
Joey Theriault,5.0,Awesome service... Great food! Really have it your way.,a year ago,Open,188
Edmund Lavesh,5.0,Excellent build your own pizza.  Pick unlimited toppings for a price.  I find the thicker crust is worth the extra money as it is more filling and makes the pizza more than one meal. …More,2 years ago,Open,188
Eric Nielsen,1.0,"I used to go regularly, but NEVER again. Ordered a pizza and ended up getting horrible food poisoning that turned into a bowel obstruction with extremely painful stomach extension and regular vomiting over three days. Spent a week in the …More",a year ago,Open,188
KIMCHI GODDESS,5.0,It's absolutely AMAZING!!!!! they even have vegan choices!! The vegan spicy chorizo is SOOOOO good😋,a year ago,Open,188
Kelly Kay Presents,4.0,"Great food...customer service is hit and miss. Sometimes excellent very courteous. Other times unprofessional , sloppy and unfriendly.",a year ago,Open,188
Hope Spiker,2.0,This is the second time I've tried blaze  🍕 hi didn't enjoy it too much the first time so I thought I would give it a second chance to prove itself and I still stand I don't enjoy this pizza if it's not eating very very hot it is not so …More,2 years ago,Open,188
Shawn Leenerts,5.0,Pick your own toppings and have your personal pizza created quickly. One of the best for this type of pizza restaurant.,a year ago,Open,188
April Barr,5.0,Love this place. That pesto drizzle is amazing,a year ago,Open,188
Sammy Davis,5.0,Love there pizza pies with the freshly selected toping by me,a year ago,Open,188
Victor Collins,5.0,Good brick fired pizza. Me and my wife like the red vine. Very tomatoey!,a year ago,Open,188
Beverly Anderson,1.0,"The Sunday crew working on March 31 2019 between 1:30-2:00 was terrible! I normally enjoy my veg out pizza here, but today it was ruined by the young lady that didn't bother to ask if I wanted any final toppings, yet proceeded to box my …More",a year ago,Open,188
Tawana McDaniel,5.0,"Very very very good pizza!!! I love how all the ingredients are fresh and the staff use your name to greet you, ask what toppings you would like, and to pick up your pizza. It is a very personalized experience. All you have to do is ask for …More",3 years ago,Open,188
Jessica Shiffner,5.0,Great great place to eat. Nice staff & they take the gluten allergy very seriously which is greatly appreciated.,a year ago,Open,188
Thomas Sykes,5.0,Very good. make your own toppings,a year ago,Open,188
Orental Woodruff,5.0,Great food and exexcellent customer service,a year ago,Open,188
Wendy W,5.0,Can't go wrong with building your own pizza. Fast service and great food. A bit loud when busy.,2 years ago,Open,188
Rico Graves,4.0,Great service and pizza!,a year ago,Open,188
Kara Palmer,4.0,Fast cheesy pizza. Got it free with a coupon!,10 months ago,Open,188
Rameka Reed,5.0,Great customer service today.,a year ago,Open,188
Teri Meehan,5.0,Great pizza great customer service,a year ago,Open,188
Kelsey Andrus,2.0,"Like a Chipotle, except with pizza. The salad dressings (even the greek vinaigrette) are sickly sweet, but the service is quick and the pizza's alright.",a year ago,Open,188
April Rayon,3.0,"Not the best place for vegan options. Tried a veggie pizza with vegan cheese and the cheese melted like a tasteless goo. It made the whole pizza gooey. I couldn’t enjoy it. But for none vegan options, the other pizza options usually really good.",a year ago,Open,188
Anne-Marie Beighley,3.0,"The staff was amazing, the restaurant it was really clean, and the food was decent but not remarkable. It was a little bit overpriced but they did have a good selection of beer considering that they're not a big chain.",a year ago,Open,188
Sheena Cox,5.0,"This place is amazing!!! Friendly staff, super quick, and a decent price!!!",a year ago,Open,188
Samantha Matthews,5.0,"Went early for national PI day, good thing i did the line was out the door. Pizza was phenomenal i had the red vine and i added artichoke hearts and fell in love. Everything is fresh and the team in there is awesome. Line moves fairly quickly. No ruah at the table and had a great experience.",2 years ago,Open,188
Thelma Austin,5.0,Wow!! My first time and I'm still talking about it. Great place!!,a year ago,Open,188
rohan allwood,5.0,Awesome. great pizza and fast.,9 months ago,Open,188
Dollis Peters,5.0,Absolutely love this place! Great Pizza.,a year ago,Open,188
Kimberly Hampton,5.0,"I like that I can build my own pizza. With the amount of toppings and sauces, the possibilities are endless.",a year ago,Open,188
Brianna Kennedy,5.0,"I expressed my food allergy after ordering the gluten-free crust, and everyone was absolutely amazing taking care that my pizza was handled differently from the other orders. And the employee that made my pizza, it was beautiful! I asked my …More",3 years ago,Open,188
Steve Humphries,5.0,Extra meaty pizzas,9 months ago,Open,188
D H Z,4.0,Yummy pizza- cooked to order.  Service is a little slow but worth the wait!,a year ago,Open,188
Lakshman Siruvolu,4.0,Good place.. fast service,a year ago,Open,188
Steve Hardman,5.0,"Best service and pizza. Love to build my own, they don't scrimp on the toppings. Salads are outstanding",2 years ago,Open,188
vanche woods,5.0,Real good pizza make it how you want it nice!,a year ago,Open,188
Josh Trotter,5.0,Best pizza in town!,11 months ago,Open,188
Cambry Singleton,5.0,"Prices are great, pizza is always good, and the environment is always friendly👌🏾couldn’t ask for more. The manager named Neisse always gives excellent customer service.",a year ago,Open,188
Terreka C,5.0,I love this pizza place! I have been in Columbia South Carolina for a little over 3 years now and I have not had great pizza until I discovered this spot. For the price you definitely get your money's worth and you can order whatever you …More,2 years ago,Open,188
Ozzymandian,5.0,"Good place, fast service",10 months ago,Open,188
Nick Parker,3.0,"Blaze Pizza...
I sit here to write this review whilst gnoshing on a slice of, what is a rather chewy piece of flatbread-style pizza. …More",a year ago,Open,188
Tameka Dove,5.0,"You can build a pizza a foot tall (wouldn't suggest it, but you could) for the same $8.75 as a pepperoni pepper pizza! Today the servers were best ever. Everyone of them speaking and smiling. There are lots of toppings and sauces to chose …More",2 years ago,Open,188
Bob Shope,4.0,Have been going for quite a while now. Last two visits were not the greatest. Service as always is excellent and the staff very friendly. Toppings were very good but the crust was burnt around the edges and there was a lot of burnt cornmeal on the bottom like maybe the bottom of the oven needs cleaning. Will continue to come back.,2 years ago,Open,188
Robert Robo Ruvalcaba,5.0,"Best pizza.  Ever. And now they have half pizza orders to go with a half salad,  so the best just got better.",2 years ago,Open,188
Sandra Swarts,5.0,Fast pizza cooked in a fire oven. Reasonably priced personal pizza. Staff is very friendly and helpful.,2 years ago,Open,188
Bryn Evans,5.0,"I really like this place, kinda a pizza version of Subway. It's fast and good and they serve beer. What's not to like?",2 years ago,Open,188
Herman White,5.0,The pizza is always made to order hot and 😋 delicious.,a year ago,Open,188
Jessica Fullmer,5.0,Blaze is our favorite! Great pizza for a great price!,a year ago,Open,188
Mother Nature,5.0,It's easy and delicious,a year ago,Open,188
terry caulder,5.0,The best pizza.,a year ago,Open,188
Lashown Sanders,4.0,I ordered the build your own pizza and it was tasty and the customer service was good.,a year ago,Open,188
Brittany Larry,4.0,Love the Pizza! I think this location should work on making the salads fresh so the lettuce is not wilted and keeping the prep area clean.,2 years ago,Open,188
Jeremy Laughead,4.0,"Fantastic pizza! You get to build your own, from an impressive assortment of ingredients culminating in exactly the pizza that you want.",2 years ago,Open,188
Jason Bellotto,5.0,Amazing pizzas. Amazing salads. Amazing service. Blaze is the only Pizza place for me!,2 years ago,Open,188
TOXIC,5.0,Awesome!! Staff was friendly facility is clean lots of ingredients to choose from to put on your pizza.. everything's fresh I recommend this place!,a year ago,Open,188
Kamaria Hatten,4.0,This was my first time coming to Blaze pizza. The food is good. I will be back.,a year ago,Open,188
Tyrell Lewis,5.0,"Pizza was great, service was polite fast and efficient!",a year ago,Open,188
Jalen Hammett,5.0,Muffin is a wonderful pizza maker would recommend this place to anyone,a year ago,Open,188
Tra Mc,4.0,Always good but if you like crunchy crust ask for your pizza to be cooked 'well done',a year ago,Open,188
alan smith,4.0,It was good pizza you make it the way you want it,a year ago,Open,188
Bettine Riggs,5.0,Love Blaze Pizza! I get to have my pizza my way and now you can get 1/2 pizza and side salad 😃. Only issue I have is music can be too loud.,a year ago,Open,188
Danny,4.0,Nothing special. Although good specials! So that's special;),a year ago,Open,188
Terrence Maulana,5.0,Always quick clean and friendly. My kids remember the staff because they always give a warm greeting.,2 years ago,Open,188
Barbara Shaw,4.0,Vvery good finally a decent gluten free pizza.,a year ago,Open,188
Timothy Burnell,4.0,Great gourmet pizza that is also pocket friendly.,a year ago,Open,188
Li Cai,3.0,Great pizza terrible service. The lady at front desk taking orders seems no nothing about their pizzas and was very impatient to answer our questions,a year ago,Open,188
Alexander Cotton,4.0,"Was pretty good pizza, had a decent variety as well",a year ago,Open,188
Carla Williams,5.0,Nova fresh toppings service what's great at the counter,a year ago,Open,188
A Marie,5.0,Excellent pizza and topping selections!,a year ago,Open,188
Heyward Gadsden,4.0,Always good. Fresh ingredients,a year ago,Open,188
Curtis Collins,5.0,I love this place,8 months ago,Open,188
Ray Gillespie,5.0,It is so cool when they remember you not being by lately.  Always friendly!,2 years ago,Open,188
Ella Hill,5.0,I love Blaze Pizza because I can have it my way no matter what different combination I want,2 years ago,Open,188
Kendrick Johnson,1.0,No order in the slightest behind the counter. Took 15 plus minutes to get our order even started.,a year ago,Open,188
Corrie Doud,5.0,"Calm atmosphere with friendly employees. This was my first visit, and the first employee I met (Anthony) explained the ordering process to me. This place has several drink options,  including natural lemonades.",3 years ago,Open,188
Darren,5.0,"Fresh , I stack that pizza up with a bunch of fresh ingredients( you don't pay for extra toppings anything you want) wow. artichoke hearts rule. This is the next step in Pizza evolution. Woodfire, high, heat unbelievable Pizza. Get some",2 years ago,Open,188
Bridget Trapp,3.0,MOD is better.,11 months ago,Open,188
Angela Fowler,5.0,Great food and excellent service 👍,a year ago,Open,188
Radu Raileanu,5.0,Great gourmet pizza. The toppings are fresh and the selection is awesome.,2 years ago,Open,188
Martha Eubanks,4.0,Great service and good Pizza👍🏼,a year ago,Open,188
Aric Dickey,5.0,Consistently good!,7 months ago,Open,188
Rhonda Caldwell,5.0,"always a great place to eat
fresh food and drinks",a year ago,Open,188
Chris Gibson,1.0,Can't order the Keto crust online for delivery :(,a year ago,Open,188
Olena Gordillo,5.0,"Fresh made very tasty, friendly personal.",a year ago,Open,188
Mary J.,5.0,Best fire pizza,11 months ago,Open,188
Select 40USA,4.0,Understaffed causing crowd. Food was good.,a year ago,Open,188
Delroy Scott,5.0,"Very similar to Mods, I love the concept of picking out my own ingredients.",2 years ago,Open,188
Ellipse Rad,5.0,The pizza is great and the staff is friendly,a year ago,Open,188
toya e,5.0,"Great pizza made your way.  Staff, please remember hygiene when handling food! Other than that.... I really enjoyed the pizza!!!",3 years ago,Open,188
Terri White,4.0,"Blaze Pizza is great the workers are top notch
Pooh has a great personality and I want to say Slim is her name she came and offer to refill my drink and if I needed a carry out box. This place is a great place to take your family to eat I give that crew a thumbs up.",3 years ago,Open,188
Ramonda Pollard,5.0,Great food and great service!,a year ago,Open,188
Arielle Mazique,5.0,Very good pizza short line nice staff and fast service.,2 years ago,Open,188
Carson Thomas,5.0,"Love the pizza made to order, cool beverage selection, and even plant based plastics for cups and straws",2 years ago,Open,188
Anthony Daniels,5.0,I LOVE THIS PLACE.,a year ago,Open,188
Vonda Washington,5.0,Best pizza joint in town! Love Blaze!💚,a year ago,Open,188
John McDougald,5.0,"Very good pizza, many toppings to choose from, reasonably priced.",a year ago,Open,188
Brett Ellis,5.0,Fantastic pizza! It's even better than MOD.,2 years ago,Open,188
Winfred Reese,5.0,Can't beat getting it like you want it!!!,a year ago,Open,188
Victoria C,5.0,"The passion fruit agua fresca was the Bomb! I also enjoy the chocolate sea salt cookies and the brownie isn't bad. Oh yeah, the customized pizza is always good and Fast.... blazingly at that 😁",2 years ago,Open,188
Anita Dubuque,4.0,Good food!,11 months ago,Open,188
Mr Underrated,5.0,"Great service the employees were very nice especially,  mrs. Waldo, and mrs. Neshia... I gave them a little bit of a hard time, because I'm new their and they helped me out a lot. Those 2 girls need a raise or even better a management position thanks a lot. I will definitely be coming back for more :).",2 years ago,Open,188
Henri Major,5.0,Great place even better customer service pizza was fresh and very good,2 years ago,Open,188
Todd Rix,5.0,"Very well run franchise, with friendly staff. Think Moe's or Chipotle but with pizza.",a year ago,Open,188
Ed Currey,5.0,Excellent build your own pizza with healthy choices.,2 years ago,Open,188
Tina R,5.0,Always good experience. Food & staff on point.,a year ago,Open,188
Melissa Robinson,5.0,Great service great pizza 😀😁🍕🍕,2 years ago,Open,188
Angie Jay,5.0,Yummy stuff. Excellent customer service.,2 years ago,Open,188
Gail Crissinger,3.0,It was okay but my hubby didnt care for it so we will not go back,a year ago,Open,188
Robin Taylor,5.0,Best pizza and service in town!,a year ago,Open,188
Mike Smith,4.0,Great Pizza for the price. Quick service!!,2 years ago,Open,188
Chase Thomas,5.0,Good pizzas always fresh,a year ago,Open,188
Rhett Kelly,4.0,"Good, fresh, and fast.. friendly staff, and restaurant was clean.",a year ago,Open,188
Top Of The Mountain Christian Ministries Ministries,5.0,Pizza has been great from the first time we placed an order,2 years ago,Open,188
Mike Sanford,5.0,Great pizza & salads with as many fresh toppings as you want!,2 years ago,Open,188
Celena Williams,2.0,"Twice now (over the span of a few months) my mother has ordered a gluten-free pizza and it's been undercooked, doughy, and inedible. If you order gluten-free, be sure to check your pizza is cooked thoroughly.",2 years ago,Open,188
DONALD BROWN,5.0,The subway of pizza with a great price,a year ago,Open,188
BK Kerai,5.0,Love the idea that you can customize your own pizza,2 years ago,Open,188
Larry Long,5.0,Love this place.  My parents came in and specifically requested that we go back after a previous good experience.,2 years ago,Open,188
Jackson Williamson,2.0,Pizza was crazy rubbery.  One of their sell points is that the food is fast but it tasted undercooked.,a year ago,Open,188
Anna Edmonds,3.0,"Music is too loud for conversation. The staff is friendly, polite and helpful",2 years ago,Open,188
Barbara Rudolf,5.0,Friendly staff & fresh ingredients,2 years ago,Open,188
zana edmonds,5.0,Brandon is the absolute best!!! My pizza was amazing...,2 years ago,Open,188
Anthony B,1.0,Customer service is lacking,9 months ago,Open,188
Sharmaine Simmons,5.0,Love the pizza! Staff is very nice as well!,2 years ago,Open,188
Jennifer Garmany,5.0,Great food,11 months ago,Open,188
Dianna Hillebrand,5.0,Delicious pizza made the way you want it.,2 years ago,Open,188
Kelly Craig,4.0,Great place to eat!,a year ago,Open,188
Trina Morales,5.0,The pizza and service is excellent!!!,a year ago,Open,188
Vanessa Anderson,5.0,Pizza and customer service is awesome!,a year ago,Open,188
Cathy Hardman,5.0,Love designing my own pizza,a year ago,Open,188
Eunicea Custis,5.0,Really good food and excellent service,2 years ago,Open,188
Lara Dixon,3.0,Pizza is great. Atmosphere is terrible.,a year ago,Open,188
Ramon Rivera,5.0,Great place and better atmosphere,a year ago,Open,188
Benjamin Cook,5.0,"Super nice staff, tasty, a bargain!",2 years ago,Open,188
Whit Whit,5.0,"Affordable, flavorful, quick, fresh and as many options as my mind (tastebuds) can come up with for the ingredients available.",2 years ago,Open,188
LaShone Chavis,4.0,It was good will eat there again,2 years ago,Open,188
Lindsey Lawton,4.0,Very good pizza would recommend,a year ago,Open,188
Christian Kelly,5.0,Just had a really good art lovers pizza.,2 years ago,Open,188
leslie frierson,5.0,"I recently went to Blaze pizza for the first time after trying "" Mod's Pizza "" , and I have to say Blaze is WAY ! better ... From the food , to the environment , down to the staff . It's this one individual who kindly welcomed me took my …More",3 years ago,Open,188
reel_ammo,4.0,Awesome crust and quick service.,a year ago,Open,188
- Kdunski -,5.0,Absolutely beats any other pizza place... in taste and how fast and accurately they build it.,3 years ago,Open,188
Jannise Brown,5.0,Best pizza ever,a year ago,Open,188
madonna S,1.0,"I like the concept...but I was getting ready to order when I got to the counter and the guy who was taking the order was writing on the piece of paper YOUR PIZZA will go on after it cooks, the sweat inside his gloves were dripping out of …More",3 years ago,Open,188
W Wonder,4.0,One of my fave pizza places in the area,2 years ago,Open,188
Felicia Orange,4.0,Food is great but the customer service most times is not good.,a year ago,Open,188
Kila M,3.0,Good service but I didn’t really like the pizza or the salad. ...but that’s just my opinion.,2 years ago,Open,188
Reggie Ratcliff,4.0,Favorite fast pizza place,a year ago,Open,188
Nika Livingston,5.0,Very friendly and helpful,a year ago,Open,188
Tejas Patel,4.0,Everything was good except the preparation table which was dirty with all kinds of cheese.,2 years ago,Open,188
Nick Underwood,5.0,Excellent Pizza and Service,8 months ago,Open,188
Brian Miles,5.0,The Subway of pizza. Get how you like it,2 years ago,Open,188
Gene McAvoy,5.0,Be careful not to pick too many toppings... it's easy to overload.  It was fantastic!,2 years ago,Open,188
Jeff West,5.0,"Friendly staff, plus tasty, customized, pizza at a fair price, equals a great dining experience.",3 years ago,Open,188
Ashley Pearson,5.0,Amazing pizza!,a year ago,Open,188
Azsane Saunders,1.0,"Disgusting, Distasteful and Unmanageable, are the only words that come to mind to describe my unprofessional experience at Blaze Pizza today. This will be my last time ever eating at Blaze pizza, as we entered there was no greeting, no …More",2 years ago,Open,188
Harlan Williams,3.0,"Pizza is decent, the fresca's are awesome",a year ago,Open,188
Karen Bay,5.0,"Okay, this place is awesome! Picking everything you want from crust to toppings. How fun!! And sooooo good!!",3 years ago,Open,188
Thomas Bell,1.0,This place is so nasty.,a year ago,Open,188
Bee Rimi,3.0,I first went to Blaze at their Disney Springs location and loved it. The style pizza is one of my favorites and the price was reasonable. I am a Disney Annual Passholder and go very often. …More,2 years ago,Open,188
sherry holmes,5.0,Love thee make your own. Very friendly staff!,2 years ago,Open,188
Kendra Miles,5.0,One of my favorites. They always get it right.,2 years ago,Open,188
T123tyler 123,5.0,Great place and fast service,a year ago,Open,188
Erica Moon,5.0,Love their pizza 😊,a year ago,Open,188
C3 Lo,5.0,One word just Awesome,a year ago,Open,188
Satin Ribbons,4.0,I had the pepperoni and cheese and it was okay👍,a year ago,Open,188
Judith C Vereen,5.0,The pizza was really good. A little pricey though.,2 years ago,Open,188
joye carr-gore,5.0,"Nice atmosphere, the food Is great and I love the concept.",3 years ago,Open,188
Mia Joy,3.0,Slow beyond belief. The pizza was good.,2 years ago,Open,188
Benjiman Green,4.0,Blazin,10 months ago,Open,188
Natasha Aiken,5.0,"Great pizza, great prices. Try the Blue Sky beverages.",3 years ago,Open,188
Lanicia McNeil,5.0,Awesome food!,a year ago,Open,188
R W,5.0,This has become my favorite pizza of others out there.,2 years ago,Open,188
Allysa Robinson,5.0,Yum!,2 months ago,Open,188
"Elvis Impersonator, Tribute Artist Jim Reiser",5.0,Great Brick Oven Pizza!,a year ago,Open,188
Dan Mauro,4.0,Good place.,a year ago,Open,188
Cat Eyes,5.0,Taste great,a year ago,Open,188
Graziano Toninelli,1.0,The pizza have to be make by men,a year ago,Open,188
F ALI,1.0,"Very dirty,never seen clean any pizza cutters",2 years ago,Open,188
Shanta Townsend,5.0,Food and ingredients were awesome!,2 years ago,Open,188
Randi Conniffe,5.0,Very tasty pizza!,a year ago,Open,188
Chuck G,5.0,"Lots of choice, reasonably priced, quick, and yummy.",2 years ago,Open,188
Yuhanna Muhammad,3.0,Nothing special really great place to bring the kids to eat pizza.,a year ago,Open,188
J G,4.0,The only thing missing was CAYG! Clean as you go.,2 years ago,Open,188
DirtyHarry44,5.0,Always good and fast service,2 years ago,Open,188
Shane Duncan,5.0,Great Pizza and service.  I will be coming back.,3 years ago,Open,188
Susan Keltner,5.0,Great pizza,11 months ago,Open,188
AMBI1212 Brown,4.0,Great pizza fast,a year ago,Open,188
Matt Ryan,5.0,Amazing pizza! Great concept!,3 years ago,Open,188
Niki,4.0,Wish you had cilantro.,2 years ago,Open,188
Pea Parks,5.0,I come here twice a week.,a year ago,Open,188
Tom Tanner,5.0,"Similar to MOD Pizza. I prefer Blaze, the family prefers MOD.",3 years ago,Open,188
Tyeneisha Robinson,5.0,Loved the customer service!,2 years ago,Open,188
Odilon Garcia,5.0,Great place to eat,a year ago,Open,188
Jeff Blanchard,5.0,Great food,a year ago,Open,188
Carol Trakas,4.0,"It's ok, love the cheese",2 years ago,Open,188
Rudy Rolle,5.0,Loving Blaze Always,a year ago,Open,188
Brian Roessler,5.0,Always a good pie,a year ago,Open,188
Ricky Rivers,5.0,Love this place,a year ago,Open,188
Marsha Fields,5.0,Excellent pizza,a year ago,Open,188
Aaron Noel,5.0,Great food! Great prices!,3 years ago,Open,188
Paula Vinson,4.0,Love it.,a year ago,Open,188
Lashondia Hunt-Anderson,5.0,Great time I normally come here on lunch break,2 years ago,Open,188
Jason McLean,5.0,Always great pizza,a year ago,Open,188
Iamjah Iamhallgang,5.0,Great pizza.,a year ago,Open,188
Ernestine Johnson,4.0,Love it,8 months ago,Open,188
Ashley Fisher,5.0,Blaze is always great!!,a year ago,Open,188
