name,stars,text,timeSince,openStatus,key
Mr Adams,4.0,"Blaze is really good. Have a nice selection of meats and cheeses. The lemonade options are great. Haven't tried them but from what I observed, a customer who taste tested them was very impressed. I was impressed by the BlackBerry basil lemonade.  I think the process of the drinks are too high but overall it is a good establishment.",2 months ago,Open,188
George Monroe,5.0,"Pizza places, you either love them or hate them.  I have eaten pizzas throughout 25 different countries.  Blaze Pizza make their food on point.  It is a fun place for the family as each pie gets put together on an assembly line.  Design your own pie!",a year ago,Open,188
Dan Raymond,5.0,"Vegan/vegetarian friendly with great customer service. The fact you can ""build your own,"" with plant-based crust and not have ""normal"" cheese, keeps me coming back. Not to be overlooked is their friendly and accommodating customer service; …More",a week ago,Open,188
Robert Higgins,5.0,One of the best pizzas I've ever eaten and that's real you make your own pizza pie anyway you want awesome,2 days ago,Open,188
Traci Epting,5.0,"Absolutely love Blaze Pizza. The staff is always wonderful and super helpful and the food great Everytime we go. I love how you can make your own pizza and it is made right in front of your eyes. I had a pepperoni pizza and my husband built his own pizza with pepperoni, bacon, ham, chicken and Italian sausage.",a year ago,Open,188
Dominic Galloway,5.0,Employees are super nice and helpful. I haven't had a bad pizza from here either. The guy who is usually there manning the stove and cutting the pizzas does a good job and is super cool. Never had a burnt pizza from this location.,a month ago,Open,188
Tavander P,5.0,Terrible experience with my delivery because of door dash. But Blaze Pizza is awesome love the pizza. Will return but will never order delivery again. They were so nice when I returned with the pizza. I had no problem getting my order corrected. Very professional. Thanks,a month ago,Open,188
Patrick Tribbey,5.0,"Our first time to try their pizza.  All of the employees were very courteous and helpful.  We ordered a ""build your own"" pizza rather than a standard run of the mill.  Talk about a variety of ingredients - - - they have them.  A wide …More",3 months ago,Open,188
Nyasia B,5.0,Love the many different toppings they have. Vegan chorizo is amazing. The pizza is made fresh and fast.,4 weeks ago,Open,188
Linda Velilla,5.0,A new fave go-to where everyone gets exactly what they want!,3 weeks ago,Open,188
Alice Barker,5.0,"""The staff, atmosphere and price point are great.""",a week ago,Open,188
Jarrod Washington,5.0,They use fresh information and the pizza had very good flavor.,a month ago,Open,188
Luis Lopez Jr.,5.0,A friend of mine had told me about it a few weeks ago I keep saying I was gonna go I was going to go. So my family and I went  On Father's Day now clearly my girlfriend and her kids have been here before I had not. The menu is a little …More,4 months ago,Open,188
Ethan Whitehead,5.0,Neisha ..... was probably the best manager i have ever seen. Her attention to detail and drive made the team at Blaze excell through dinner service and gave my wife and I a pleasurable experience. Please keep up the good work.,3 months ago,Open,188
Kristian James,5.0,NEISHA AND RYAN ARE AMAZING!! They both took care of my food needs and provided amazing customer service!!!,2 months ago,Open,188
jack hurst,4.0,A food was good the service pretty good but they would not allow you to get your own drinks in that was a very big inconvenience you had to wait in a crowd to get your drink when all's they have to do is allow you to get your own just wear a glove and a mask,2 months ago,Open,188
Jamiyla Goodwin,5.0,Delicious 😋 great and very very good. The prices are great.,2 months ago,Open,188
Vinnie G,1.0,Too expensive and taste like ellios box pizza. Won't go again.,2 weeks ago,Open,188
Katy Montes,5.0,"The staff was incredibly friendly. My pizza was made just the way I like it. It was fast, hot, and delicious. Shout out to Zy for making this an awesome experience!",8 months ago,Open,188
Martha Milien,5.0,My first time seeing a Pizza Place like this. It's sat up like Subway. You see your 🍕 made and put into the Oven..Love It!!!,3 months ago,Open,188
tommy bryant,5.0,Always fast service and friendly,a month ago,Open,188
Stephanie A,5.0,"This place was amazing!! I loved the stuff, they gave us an outstanding customer service. 100% recommend!! The people at this location really care for their customers. The flavor is great, fresh and crisp ingredients, if you are looking to …More",2 years ago,Open,188
Samuel Mazzaro,5.0,"I loved they business set up! My first time today! The quality is great! You can make your own pizza!!!! Wide variety of toppings!!! The staff was awesome!!! Some young people who have a good time working there, very professional and respectful!. They also have MILITARY DISCOUNT!!!! ITS A MUST GO TO place!",9 months ago,Open,188
Parish Brown,4.0,The food was good and fresh!😉,a week ago,Open,188
malcolm muhammad,5.0,The employees are so nice each staff member played a part in my order answered questions they wasnt afraid to say they didnt know but they went and found the answer I would go again .if you are here definitely try the build your own pizza,4 months ago,Open,188
Joslyn Potts-Blakely,5.0,"First time coming here and definitely won’t be the last! Customer service is great and everything is fast! Pick all the toppings you want and only one size pizza, makes everything easy! The pizza is put in a huge fire oven and it’s done by the time you get your drink and find a table! Highly recommend!",3 years ago,Open,188
MISTY FLETCHER,5.0,"Blaze at Sandhills is my absolute favorite place around for pizza right now.  They have fantastic pizza and an awesome Caesar salad.  The employees are impressively well-mannered and helpful, especially Zykel, Siarah, Amir, Ryan, Josten, and Zach - who are excellently managed by Neisha.  Thank you for serving your customers so well.",3 months ago,Open,188
Reneé Foxxx Hair,5.0,I will definitely be back!!!! I had the veg out and my friend got the meateaters it was delicious! The customer service was also outstanding,11 months ago,Open,188
L Marsh,5.0,"Raven and the rest of the staff are awesome, made sure our order was perfect and made us laugh.",3 months ago,Open,188
Jonathan Gantt,5.0,My first time at a Blaze Pizza and it was fantastic.  Alexis made really nice keto crust pie and was very friendly and helpful.  When you build your own pizza there's no limit on the toppings.  I will definitely search for more Blaze's an d hope that they are as good as this one. Thanks again for a great and quick pizza Alexis.,9 months ago,Open,188
Kathryn Archer,5.0,"Delicious pizza! I loved all the topping options and the outside patio is lovely on a nice day. I tried Brussels sprouts on mine, after a suggestion from one of the workers and it tasted amazing!",9 months ago,Open,188
Steven Etheredge,5.0,Excellent any way you want it style pizza!,a year ago,Open,188
Jordan Cowles,5.0,Pizza was amazing. And the staff was super nice and helpful with ordering the correct pizza for my taste buds.,4 months ago,Open,188
Ernest Nicholson,5.0,Pizzas were AMAZING! Outstanding service and delivery too...Great job!!,4 months ago,Open,188
Joshua Mcgainey,4.0,Fast service. Great pizza!,3 months ago,Open,188
Gil Pipes,5.0,"Best pizza in town!  Great service, very friendly staff, a must try!",4 months ago,Open,188
Andrea Zavislak,5.0,Quality and a very fair price. Love their pizza,5 months ago,Open,188
Melissa Rogers,5.0,"Friendly atmosphere, good pizza we love their blood orange.",4 months ago,Open,188
Jake Burns,4.0,I like The Blaze Pizza for sure! I just hope the Garlic Knots are a bit bigger next time.,2 months ago,Open,188
Tricia Kelley,5.0,"Tried this Blaze Pizza, after frequenting the one off of Bower Pkwy. The pizza is fantastic. The crust is crispy, not burnt and the cheeses get perfectly melted. They have unique, fresh and flavorful toppings and they don't cost extra. And …More",2 years ago,Open,188
fred simpson,4.0,Their pizza is top hut the young people working inside tend to mess stuff up,2 weeks ago,Open,188
Amy Connell,5.0,"Who can turn down making your pizza the way you like it? Quick on the go pizza, with a glass of wine or beer. Great service. Wonderful place before the movies or shopping.",a year ago,Open,188
michelle hite,5.0,We had keto crust. It was a little too crispy but still taste good. A good way to eat what want and still diet.,7 months ago,Open,188
Caprice Slade,2.0,"TERRIBLE
I had someone go to this location and place my order and the employee apparently got upset by my relative asking for extra toppings. When it came time to put …More",a year ago,Open,188
elizabeth hoover,5.0,Pizza just the way I love it.,2 months ago,Open,188
Nia J,3.0,Pizza and various options are pretty good if you’re looking for something affordable. …More,9 months ago,Open,188
Reid smallwood,5.0,Very good food and a courteous staff.,3 months ago,Open,188
Andrea Stinnett,5.0,Husband and I went for the first time today and loved it. The people working there were super friendly and very helpful.,7 months ago,Open,188
Sheray Jones,5.0,Awesome pizza!!! Friendly and courteous staff.,4 months ago,Open,188
Valentina Amor,5.0,I really like this place.  They create the pizza in front of you.  You customize everything from toppings to cheese to sauce. They have some set recipes like their BBQ chicken pizza if you don't want to make your own. Staff was very …More,a year ago,Open,188
Arkadiusz Broczkowski,1.0,My Pizza was burnt at the bottom and raw on the inside a bunch of kids with no leader using the same gloves to scratch their neck etc and handle the food disgusting,3 months ago,Open,188
Jimmy Grecheski,4.0,A little clean as you go behind the service counter is all that's missing. The staff were very pleasant.,2 years ago,Open,188
Gaia D,5.0,"As a vegan, this place is phenomenal. My boyfriend and I love to come here every few weeks for lunch or anytime we see a movie at Regal. There is plenty of parking behind the shop but not as much outside of it. Honestly.. If you're looking …More",a year ago,Open,188
Brooke Beckman-Rader,5.0,Super awesome! Wonderful service!!,3 months ago,Open,188
Candice Gordon,5.0,First time customers. The crew was fantastic and the pizza was delicious.  I highly recommend this place.,8 months ago,Open,188
Carla Medley,4.0,The pizza is good. Lots of options to customize. And I love the blood orange lemonade. Employees don't seem to want to be there.,10 months ago,Open,188
Stephen Chisolm,5.0,The food and service was excellent!,3 months ago,Open,188
Danny Jr,2.0,Just go to MODS. You'll thank me later.,2 months ago,Open,188
Rose Corbett,4.0,"I ordinarily like thicker crust pizzas, but my daughter wanted me to try this place and I was very favorably impressed.  We shared a green stripe pizza and the flavor combination of the toppings was fabulous.  It was fresh-tasting and …More",a year ago,Open,188
Panda Marquis,4.0,It was pretty good thin crust pizza. Sauce is something to talk about if they ever did a rising crust pizza I think it would be something to spread,a year ago,Open,188
Michelle C.,5.0,"I had a great experience here. I’m always on the lookout for restaurants that are vegan-friendly and don’t make you jump through any hoops. That’s just what this is. If you get the build your own, you can cusuromize it just the way you want …More",11 months ago,Open,188
Trevor Colborn,5.0,Unbelievable pizza. So good. And with the option to build your own pizza subway-style it's unbeatable!,3 years ago,Open,188
Aubrie Jones,5.0,"We love this place. You can get really picky about your toppings, and they're all great! They have gluten free and vegan options too. You can easily spend less than $20 for two people here. Their juice is also delicious (weird but seriously it's great juice)",a year ago,Open,188
Mami 16_,1.0,The pizza is good but the people that work behind the desk are just nasty.,7 months ago,Open,188
The Only One,4.0,"First time visiting this location (Village at Sandhills) in northeast Columbia,  very good product, I've been there twice, you can get a 2-topping ($7.50), 3-topping ($8.75), or build your own (5 or more ingredients.   Very healthy to eat …More",2 years ago,Open,188
Local Runner,5.0,This was my second visit to a Blaze and it is totally Pizza Heaven!!! Hands down this is the best pizza I’ve even ate. I have a gluten allergy so pizza is something that seldom get but they have gluten free crust along with lots of other …More,a year ago,Open,188
Ashley Smith,1.0,"I love the pizza here, but the place is always so filthy. Sticky on the floors. Drink spills in chairs. Never a clean table. It’s awful. They need to hire someone strictly responsible for keeping the eating area maintained. I shouldn’t have to clean up after someone else just to eat my food.",a year ago,Open,188
Brandon Flynt,4.0,Good concept. The atmosphere is too loud though.,7 months ago,Open,188
Monica S,4.0,Fast friendly service. The cashier was very helpful with the different crust and topping options.,10 months ago,Open,188
Marvin Brunson,5.0,"BYO is the way to go, service was good",4 months ago,Open,188
Randolph Carino,5.0,Excellent service and food. Clean establishment and they give generous servings.,11 months ago,Open,188
Khalil,4.0,Pizza is light yet still delicious,3 months ago,Open,188
Marco Torres,1.0,"Started out good but now skimpy on everything + overpriced. Burnt 🍕 and the crew is oblivious and/or just have no skills on how to make a delicious 🍕. Dough, sauce, tops then burnt in oven. Super skimpy on cheese. Me + 5 will not be back!   Better Pizza @ Sam's Club!",2 years ago,Open,188
Amleht Alston,1.0,I wish I could give my experience today a zero! Staff lacks professionalism including the manager Anthony! The customer was inconvenienced because of the lack of training. I have ordered from here many times however today was awful! I …More,a year ago,Open,188
Ricardo Sherard,5.0,"An awesome fresh variety of toppings, sauces and cheeses! Love the lunch specials! My wife likes the vegan cheese. We will return!",a year ago,Open,188
Scott Moeck,4.0,Nice that they have lots of options for those with dietary restrictions. They don't get the gluten free pizza crust done quite right though.,10 months ago,Open,188
Brandon Law,1.0,2 of 3 Times ordering and have totally botched the order.  Can’t call.  Can’t let them know they’ve duped ya.  Done with the company. They are unfortunately cheap and not on the customer’s side.,6 months ago,Open,188
Jay Y,4.0,"Love blaze, custom pizza, unlimited toppings all for the same price... And it's cooked right in front of you minus the 15-20 minute wait at other pizza places... Great place",a year ago,Open,188
Tom Harmon,5.0,Very good food and service.  They also serve Lo Mein w dinner.  Lots of places have stopped this.,a year ago,Open,188
Ben Costy,5.0,"Bespoke pizza joint in the Village. Always has fresh and interesting ingredients, friendly staff and good drinks. Prices are great too.",a year ago,Open,188
John Hoxworth,1.0,"Manager Neisha was incredibly rude to my family. She kept rushing to make the pizza on the line and made it super messy. Pizza was burned twice and I was refused a refund. She took it into her own hands to cook it the second time and kept mumbling to herself ""I don't f***ing burn pizza. I dont burn pizza"" and then she burned it.",9 months ago,Open,188
Samantha Matthews,5.0,Love this place! Pizza is made fresh right in front of you with all the toppings you can pick from. The blood orange lemonade is to die for as well. Some of the staff is great and there are a couple that need some courtious knocked into …More,10 months ago,Open,188
Trevor Madison,4.0,"Great pizza! There seems to be a decent turnover of employees, but the quality of the food is already great.",a year ago,Open,188
Stephen Mitchell,5.0,"Had an issue with the app, but regardless of the shoddiness of the rewards app, the employees at this location were more than happy to accommodate me. I really appreciate it guys, keep it up :)",11 months ago,Open,188
Clint Holland,5.0,Love the pizza here. Get the keto crust if you are watching your carbs. It doesn't crisp up as well as the regular crust but you won't notice a taste difference and might drop a pound or two.,11 months ago,Open,188
Ivy Sherard,5.0,My husband and I ate during the lunch special hours and it was great! We truly enjoyed the different types of  toppings to choose from and most of all I could have dairy free cheese. Not your normal pizza place! We will return,a year ago,Open,188
Tonya Ward,2.0,"The pizza tonight was horrible, I ordered the BYO and requested the spicy sauce. The guy put wayy to much sauce then looked crazy when I told him it was too much. …More",a year ago,Open,188
Vinson Lathan,5.0,This place was great. The staff was friendly and pizZa made fresh in front of my eyes. This is now on my regular stop list.,a year ago,Open,188
Vincent McClinton,2.0,The food is great but the customer service is lacking sometimes. There is one girl(the one with the weave and super long eyelashes) in there that never listens the first time you tell her something and rushes to finish your order. I never …More,9 months ago,Open,188
daniel soledad,5.0,Quick and professional service and great no fuss casual pizza!,2 years ago,Open,188
arischa conner,3.0,I love the idea of Blaze Pizza.  Quick delicious pizza in a hurry.  The salad and drinks were good.  I had the Greek salad and the strawberry and Blood orange drink. Delish.  What I didn't like was the robotic indifference of the staff. …More,a year ago,Open,188
Henry Devereux,5.0,Excellent pizza fast! You're able to customize the pizza with as many toppings as you like for only $8.75!  Customer service was terrific!,a year ago,Open,188
Henry Duarte,5.0,The staff is so hot. daddy alert!. food is amazing and the staff is nice. This one hot guy who works there could bake me all day and all night. Okurr,a year ago,Open,188
Darryl Montgomery,5.0,Enjoyed creating my own pizza. The way I like it,11 months ago,Open,188
Dharmendra Patadia,4.0,It's fun to place order they love to load it,10 months ago,Open,188
brian pittman,5.0,"Blaze has keto friendly crust now. Very tasty. Had the hot link pizza for lunch (and again for breakfast). Great, quick lunch option.",a year ago,Open,188
KING Zion,1.0,worst  employers  here one of the workers here don't not make my food right  these young kids  don't take  there job  seriously and its sad,5 months ago,Open,188
Marcus Carrillo,5.0,Amazing pizza always on point,4 months ago,Open,188
Robert Williams,5.0,Always great,3 weeks ago,Open,188
Shaunda McDonald,5.0,"Great pizza, fresh toppings",4 months ago,Open,188
Brian Goulette,4.0,"I enjoyed the atmosphere and was impressed with the selection of ingredients available to throw on your pizza. There’s even an option to have a pizza with a gluten free, cauliflower, or Keto crust. Unfortunately, I was less impressed with …More",a year ago,Open,188
Sonja McFarlan,5.0,"The pizza and service were good. My group had four different pizzas and everyone enjoyed their pizza. Each pizza is made to order with the crust, sauce and toppings of your choice.",a year ago,Open,188
Mary Westgate,5.0,Favorite place great food and service,6 months ago,Open,188
Robert Wilber,3.0,Staff was great...like the concept of make your own...but the pizza was just ok for us.,a year ago,Open,188
Lauren Tate,4.0,"Neat little place. Food is good, but it is only pizza and salads. It is made to order and it can take a bit of time to order and to get the food. They do serve beer and wine, and desserts. They have a small uncovered outdoor patio which is …More",2 years ago,Open,188
Danielle Pence,5.0,1st time there!  I will be back,4 months ago,Open,188
Dayne Peterson,1.0,They changed the menu and gluten free options. And the place was a mess and the service was not up to what we have come to expect. Manager was trumping around like someone stole his cookie.,a year ago,Open,188
Kat Robinson,2.0,"Blaze usually has excellent food... Unfortunately the bottom of our pizzas were burnt, and unlike the restaurant on Harbison they don't put any sugar in their Blood Orange lemonade. Very disappointed",10 months ago,Open,188
Jannie Bostick,4.0,Having the new keto crust is super amazing thanks for that. Other places dont try new things and customers health and diet into mind but this place from 3 locations were all great,a year ago,Open,188
Gladys Zeno,5.0,This was my first time visiting this pizza place and I must say it did not disappoint. I had the most tastiest personal pan pizza. The staff was very friendly and humorous as it was my first time visiting. They helped me decide on which topping I should try. Loved it.,a year ago,Open,188
Konan smith,4.0,Good food. Customer service at this location used to be horrible. The customer service has improved greatly. This restaurant serves good food the customer service is now good the restaurant stays pretty clean and it's not too expensive either,2 years ago,Open,188
Samantha Montgomery,5.0,One of my favorite pizza places! Nice relaxed atmosphere and good food.,a year ago,Open,188
Courtney Richardson,1.0,very unprofessional. lacks customer service. very rude so sarcastic and dry.  i will never come back to this one. please hire mature people ! if you don’t like your  job find a new one .. simple. Don’t recommend !,a year ago,Open,188
Kenya Carmichael,5.0,Great pizza! You're able to customize your pizza exactly to your liking. It was a nice spot for a family or date night and the staff was friendly and professional.,a year ago,Open,188
Melissa Burgess,5.0,The service was extremely fast and the food was awesome.   I was really impressed with how nice the staff was.  The place was extremely busy .  I  will definitely go back.,a year ago,Open,188
Sadia Pollard,5.0,I love that they will charge you less if you get a pizza with just cheese or one toping. They have vegan cheese and great toppings for after you pizza comes from the oven. Also the half pizza and salad is a great idea,a year ago,Open,188
Edna Velazquez,5.0,"Located in Sandhills. Plenty of parking.Plenty of seating.You choose the crust, sauce, and toppings. Many toppings to choose from. Gluten free and wheat crust available. Sells beer. Fast service. Only thin crust available. Personal size. Reasonably priced. Friendly staff.",a year ago,Open,188
Denise Pfaff,3.0,It's a fast food pizza.  Not bad but I wasn't particularly crazy about the sauce.,a year ago,Open,188
John Schon,5.0,"Great pizza at a great price with really amazing choices. Starting with crust,the sauce, the cheeses, meats, and veggies. Choice is the word. At every station there are multiple options and the ingredients are high quality and widely varied …More",2 years ago,Open,188
Kim Roper,5.0,Always good and fresh for great price,a year ago,Open,188
Gateway Plumbing,5.0,Love the pizzas from here... great selections!!!,8 months ago,Open,188
Taquanna Thomas,5.0,Love it!!! I never have any problems when I come here. And occasionally I'll get a drink on the house with my pizza.,a year ago,Open,188
Allannah Esaw,5.0,So if you've ever heard of Mods Pizza its kinda like that but in my opinion Blaze is better. One because the Pizza is thicker and Two because it's very fast. I  really like going to this place to get Pizza just so good,a year ago,Open,188
Lorenzo Parker,4.0,My favorite pizza place. Fresh toppings.,11 months ago,Open,188
Christian Jacome,5.0,"As far as chain restaurants go, this is the best one. Blaze is crucial. The staff is cool and helpful. The pizza is great for the pricepoint and amount of options. I also recommend the pizza salad and the fresh juices by the fountain drinks. I always get at least three refills.",2 years ago,Open,188
Stanley Reed,5.0,"Ayionna, Niesha, Trell, and Kelsea were a great help today and were very knowledgeable about the menu. Outstanding service!",a year ago,Open,188
Steve Morris,1.0,Horrible experience.   Don't download the app or you may not get the free drink promised to you.   They may call the mall police on you if you ask for it,a year ago,Open,188
Alex Dewsbury,5.0,"Fast, personal size pizza with lots of customization options.",a year ago,Open,188
robert greene,4.0,Great place for good self pizza pie,a year ago,Open,188
OCon Shell,5.0,Cauliflower crust is amazing.. Thanks for making healthier options for dieting people..,a year ago,Open,188
Jayson Drury,4.0,Decent pizza and service for the price,a year ago,Open,188
Steve Beaudry,5.0,A+++ great pizza!!!,3 months ago,Open,188
Gerald Williams,5.0,The pizzas are just downright awesome!!!!!!,4 months ago,Open,188
Lisa Duell,3.0,"Service was slow but food was good
No keto crust",a year ago,Open,188
Wendell Cook,2.0,"They normally do very well, but on the day I went was only my second time going and my piza was undercooked and the cheese tasted ""off"" can't describe it. I ended up not being able to enjoy my pizza. …More",a year ago,Open,188
touseef ahmad,5.0,Great place for a quality and affordable pizza.,9 months ago,Open,188
Brandon McDowell,5.0,I usually come to this establishment often and one day for some reason my online order did not go through and they never had it prepared and ended up cancelling because I was on lunch but it was never reflected on my bank account. Came in …More,2 years ago,Open,188
Fabrienne Payne,4.0,"The food and service is almost always great; however, because I don't eat bacon, during my last visit I did have to bring to the attention of the young lady preparing my pizza that bacon was in the chicken container.",a year ago,Open,188
