name,stars,text,timeSince,openStatus,key
Anayeltzy Ruiz,1.0,Ordered the other night from Postmates. Ordered 2 larger pizzas thinking we were getting a deal but ended up throwing away one whole pizza and half of the other one. The pizzas were completely burnt. And the flavor was just not there. The …More,a week ago,Open,36
Kacper Jarecki,1.0,"I came with my friends to Boston after a long drive and we wanted to grab a quick bite to eat. There was nobody on line but I spent over 10 minutes in front of the counter and nobody said anything or acknowledged me, so I left. They also …More",2 months ago,Open,36
Prajwal Agrawal,4.0,Its a good place to have a custom made pizza.,4 days ago,Open,36
Viv L,3.0,The quality has definitely went down. Even the employee make u feel like that they dont want you there. I was on line myself for 5 minutes before finally one employee took break from goofing around to ask what do u want.,a year ago,Open,36
Veena Bala,4.0,"Excellent pizzas and very quick too! We tried the ""build your own"" BYO and the dough knots... delicious! A whole pizza is good for one very hungry person or can be shared by two not so hungry people :D",2 years ago,Open,36
Lisa Kurtz,5.0,"I really love their pizzas, they're delicious and fresh, the prices are moderate and the delivery is fast.",2 months ago,Open,36
Nowell Newcomb,5.0,"Great pizza that comes at a great pricepoint,would highly recommend this place to anyone looking for good pizza!",2 months ago,Open,36
kunal shah,4.0,"It’s like chipotle but for pizza. You start with choosing the base, then sauce and then cheese and the toppings. They will bake it in front of you which is cool. You can add extra sauce on top once it is baked too. Everything is amazing if you choose the right ingredients. 1 star less as the staff is sometimes rude.",2 years ago,Open,36
Nancy Casco,5.0,exelen food good service,a week ago,Open,36
Leanne d'Entremont,5.0,"My first time here.  I had "" Build your own pizza'"" and it was delicious!  Friendly staff,  great food and affordable!  I'll be back.",2 years ago,Open,36
Shruti P,5.0,My all time favorite! Never been disappointed!,a year ago,Open,36
Kelly Corrigan,5.0,"Quick, personal pizza(I think 2 or maybe 3 people) would be satisfied.  You can customize or they have some great suggestions. Salads were good too. Fresh,  due to the volume of business. Lots of delivery. Everyone was pleasant. Clean bathrooms and seating. Nice to eat outside too. Not fancy, just a great pizza joint.",a year ago,Open,36
Stacie A. Banks- Edwards,5.0,Awesome! My husband and I love this place!,2 months ago,Open,36
Daz Aylward,5.0,Think Subway with pizzas! Create your own and have it baked in front of you. Good value and courteous staff.,8 months ago,Open,36
G J,5.0,"This place is excellent! Great pizza, friendly staff, quick service. 5 star experience. …More",5 months ago,Open,36
Sean Ryan,3.0,"Good food, which is what matters.  I didn't like that they were working so fast that they didn't even ask if I wanted my pizza customized. There was a long line, and my pizza was finished cooking well before I was up to the register.  Three stars because I still had a positive experience.",a year ago,Open,36
tilak balu,5.0,Loved it. I get my own pizza by customizing in and out,6 months ago,Open,36
Kevin Brown,5.0,"Good pizza, decent service, acceptable prices.

You can get a personal size pizza made right in front of you for a decent price. …More",11 months ago,Open,36
Ranga Deshpande,3.0,"Food and ambience are the same, but nothing else lives up to the Blaze brand name. Inattentive staff who dint make pizza customized as requested; bathroom had no soap or paper towels.",9 months ago,Open,36
Scott Craig,4.0,When I walked in I thought it looked like another typical chain pizza place...with an enthusiastic set of employees. After I ate the pizza I realized the taste was great and the value was really great. I'll be going back.,2 years ago,Open,36
james Sherman,4.0,"The pizza was good, service was fast. When I went they were still learning the pizza was not cooked long enough so the ingredients that were chilled were still cold. I took it back to the counter, they were able to correct the problem …More",2 years ago,Open,36
Andrew Martin,2.0,"Maybe I held my expectations too high and that's why I was so disappointed.  The crust is very ""frozen pizza"" like and the staff not very helpful.  If you need a fast-food pizza, this is the place.  But if you want tasty food, try elsewhere.",11 months ago,Open,36
RW Kwong,5.0,"Fantastic pizza, great prices. They offer larger pizzas online and there is a happy hour special.",8 months ago,Open,36
edythe copeland,5.0,Pizza was very tasty. Staff was very friendly and helpful.  Quick service .I only eat at blaze near  Cambridge  galleria.,10 months ago,Open,36
Erich Haberman,5.0,Quick a la carte single serving when you're ambitious. Never disappointed because it's all made right in front of me.,10 months ago,Open,36
The6 Fam,4.0,Great pizza. Large pizza enough for one,4 months ago,Open,36
Jonathan Rebelo,5.0,Surprisingly good pizza made on the spot and the pear cucumber water is very refreshing.,7 months ago,Open,36
Lucia De Nile,5.0,Quick service and tasty pizza. Great for lunch.,2 years ago,Open,36
Jennifer Leason,5.0,Such great pizza friendly staff,4 months ago,Open,36
Paige Tears-Gladstone,1.0,"Was in the area last night (Friday) with a friend. We were both pretty hungry and saw the place had good reviews so we thought it might be a fun idea for dinner. The place was pretty busy when we walked in, after waiting in line a few …More",a year ago,Open,36
Katherine Irizarry,5.0,"Amazing pizza! Loved it, first time there and have a really good experience. My girls loved the pizza too",a year ago,Open,36
Elide Canario,5.0,Nyaleysha was great very professional and took care of the order correctly after a misunderstanding from an order calm down her co-worker great asset to your team,6 months ago,Open,36
Thuấn Anh Võ,3.0,It's ok and comfortable for tourist.,a year ago,Open,36
Michael Spencer,3.0,Toppings were decent but not a fan of their crust. YMMV.,8 months ago,Open,36
Jonni Albetta,5.0,There is a woman that works here at the Cambridge location and I believe her name is Beston? she is so welcoming and makes me feel right at home when I come to eat here! Not to mention the food is sooooo good!,10 months ago,Open,36
Matt S,5.0,You make your own pizza kind of like Subway but pizza and it was super good.,9 months ago,Open,36
Ariana Hodsdon,5.0,"Quick service, amazing pizza. Fresh and delicious",8 months ago,Open,36
Devon Whitley,4.0,The dough tasted like a croissant😋,4 months ago,Open,36
Ben Marshall,4.0,"Friendly people, order was made up quick. Pizza is smaller than I pictured, but tasted great",2 years ago,Open,36
Nicolas Fernandez,4.0,Really good pizza. The customazationn options are plentiful and the prices aren't bad for good pizza. The lines can get long sometimes and cook time can also be long so try to come with time. The staff is friendly and the process is easy. Overall a solid place for pizza.,a year ago,Open,36
Cindy Edge,5.0,Great Pizza place for a date,2 months ago,Open,36
Averyl Ace McDaniels,5.0,Excellent specialized pizzas!! Place is always packed. Sho be ready to wait a few extra minutes. But it's worth the wait!!,11 months ago,Open,36
Yousra Oufa,5.0,Blaze pizza is always amazing... I like the service and I enjoy the pizza 😁😋... Delicious,9 months ago,Open,36
Gabby R,1.0,"I love Blaze, but this location is disappointing.
The employees clearly do not want to be there and it shows in the way they treat their customers. …More",a year ago,Open,36
Keke P,5.0,Love this place always great,4 months ago,Open,36
Coco Chanel,4.0,Lines are too long sometimes but food is made pretty quickly.,9 months ago,Open,36
Benjamin Munyan,4.0,"Went here on a Monday night and the place was chaos. The guy manning the oven had no idea what he was doing, burned pizzas and was putting pizzas on top of each other to cool. Don’t do drugs, kids. …More",a year ago,Open,36
C S,2.0,"Let me start of saying I'm a big fan of blaze pizza.  However, I will not be back to this specific location.  The staff is horrendous in the evenings. The manager yells at their employees around customers and the employees deliver the worst blaze experience around.  My pizza has come out burnt or undercooked everytime I've been.  Beware.",10 months ago,Open,36
Holden Mills,5.0,Great place! Staff is friendly and accommodating while the food is good and fast. Their soda/drink selection is good too. What more could you want?,a year ago,Open,36
Avishek Banerjee,5.0,"Blaze is the Mc Donald's of Pizzas, just a 100 times better. The ingredients are crazy fresh and the cook time is over before you start to wait. Every city needs to have a Blaze!!!",a year ago,Open,36
Eyleen Mitchell,1.0,"I wish i was able to give them a zero star, today January 18th, my daughter and i placed an order in uber eat, mind you we placed order from uber eat all the time. 6 uber driver attempted to pick up our orders and each drivers didnt pick up …More",9 months ago,Open,36
Yanailyz Betances,1.0,I placed a order from Uber eats there was multiple Uber drivers that went to this store and showed the receipt and order number and the person working there said they aren’t making the pizza because it isn’t in their system. and I contacted …More,9 months ago,Open,36
Eva Ajpop,1.0,They gave me the wrong pizza. And on the salad there was a hair. 😤😡🤢,11 months ago,Open,36
Chase DePrize,5.0,"This high-rise vegan cheese pizza with spicy red sauce, onions, pepper, & pineapple is everything! The staff changed their gloves & used a different pizza cutter.",2 years ago,Open,36
Dawn Andrews,4.0,The staff was super friendly  helping with the menu...I would go back again..,10 months ago,Open,36
Robert Medeiros,5.0,Pizza here is really good. A bit on the pricey side for pizza,9 months ago,Open,36
Paula Filoco,2.0,"The pizza tasted great, but they forgot 3 of my fave toppings! :(",9 months ago,Open,36
Adreana dalrymple,5.0,So bomb and ready so quick,8 months ago,Open,36
Heather Von Allmen,4.0,"Stopped there when I was in Cambridge for a business meeting. Saw they had some good reviews so decided to try it. Got the 1/2 pizza and salad combination, and it was very good. Would definitely stop there again if I am in town.",a year ago,Open,36
Andres Townes,1.0,"So let me set the stage. I introduced blaze pizza to all my friends and now after every hang out 2 or 7 times a month about 5-10 of us go to blaze. I have never been to this location, but because for the last 8 months I've loved this …More",a year ago,Open,36
Onur Güvenç,4.0,Good quality pizza with decent prices.,8 months ago,Open,36
Naser Almarzouqi,5.0,"Fresh, crispy, tasty. Build the own pizza us great and can be very rich with all selected toppings. Overall great experience.",a year ago,Open,36
Rosario Knott,5.0,"The pizza was unreal. Its spicy, crunchy, meaty. PERFECT! I find myself trying to find reasons to go that far from where I live, just so we can go back.",a year ago,Open,36
Alex Timofeev,5.0,Great place for a quick lunch. Very friendly and helpful staff and delicious pizza,a year ago,Open,36
Patrick Helmes,5.0,"Blaze has factored heavily into my lunch rotation ever since they started offering the keto dough. At 6 net grams of carbs, it is much easier to justify pizza for lunch as healthy eating. Service is always fast so its a great spot to grab a bite when you're on the go.",a year ago,Open,36
winejew,2.0,"I love thin crust pizza! This was not pizza. This was flat bread loosely covered with some cheese and meat. And yeah, I had high hopes when I saw the ""brick oven"", but it only mildly improved what felt like an open faced sandwich on a …More",a year ago,Open,36
Tony Ramos,5.0,Vegan pizza option? Uh yeah! Delicious. Definitely going back.,a year ago,Open,36
Aayushi Panchal,5.0,"Unlimited toppings. Wood fired pizza
Cheap price. Great taste",a year ago,Open,36
stanley chung,4.0,"Food is always good, but the wait is atrocious here, even without others in line. This location never seems to be ready, between the dough or toppings. By far the slowest Blaze in the Boston area.",a year ago,Open,36
Tim Hamilton,5.0,"I eat here way more than I should. I've tried a lot of different things on their menu. All of it is decent, I haven't ever ordered something that I regretted.Pizza is definitely their strongest dish.
Repeat customer here. Good management and service.",a year ago,Open,36
Fariha O,5.0,Pizza and service was great!,2 years ago,Open,36
Edward Cho,5.0,Great pizza place. Massive overflowing toppings while still maintaining the integral crispness of a thin pizza.,a year ago,Open,36
Frinkasaurus,5.0,"Omg, takes minutes, is super affordable and sooooooo good.",a year ago,Open,36
Spero Dimas,5.0,This pizza is amazing. Fully loaded personal pizzas for $8 with any toppings you want!,a year ago,Open,36
Evette Haddad,5.0,Their pizza - wow! I normally don t like the crust too much but jeez this stuff is soo good. The crust is PERFECT and it s so crunchy! The cheese tastes very good and fresh.,a year ago,Open,36
akanksha k,3.0,Blaze is one of the chains in which location really matters. Blaze on Comm Ave is awesome. But the one closer to Assembly Row was not that good.,a year ago,Open,36
Michael Kuhner,2.0,"The food was great, but to be denied your ""lunch hack"" deal because I was not a college student was really ignorant. You should not have to argue with someone to get an affordable lunch when your company litteraly says "". . .to further support Brand's goal of making Artisanal pizza Accessible To ALL. """,a year ago,Open,36
Ingrid DeLeon Jerez,5.0,Love their pizza. Unlike any other pizzeria.,a year ago,Open,36
Griffin Stotland,5.0,A bit slow but good food,10 months ago,Open,36
David Matsuyama,4.0,Good thin crust personalized pizzas,10 months ago,Open,36
Brendon Davis,5.0,"I like this place. Food is great and customer service is just as good. The guy who put my food in the oven asked me how the food was after I finished. No matter how small, I appreciate little things like that; that's what separates great …More",2 years ago,Open,36
Ravi Yelleswarapu,5.0,Fast and fresh pizza that can have unlimited toppings. I suggest getting the app for special offers,a year ago,Open,36
brandon waring,1.0,"April 21st evening visit - most of the staff were awful, rude and made me uncomfortable. Blaze is one of the only fast-food options that don't make me sick so I frequent other locations. But I will never return to this one. …More",a year ago,Open,36
Keith M,5.0,"The pizza here is of amazing quality and the prices are great! Also the service here is on point, they move at a pretty good pace despite how busy they constantly seem to be. I definitely recommend it if you're in the mood for some pizza.",2 years ago,Open,36
Brenton Palmer,5.0,Visited Cambridge last week and found a gem in Blaze Pizza. Combos were off the hook. Pies delish.,a year ago,Open,36
John Johanson,4.0,"A very satisfying pie, and a cool process. Amazing the oven turns out perfectly fired pizza seemingly microwave-fast!",a year ago,Open,36
Tanveer Deora,5.0,Great service always.,8 months ago,Open,36
Patricia Elizabeth Wright,5.0,"Omg! This place is great, the pizzas are made to order! Fabulous am hooked!!! By the way the service is great to!!!!",a year ago,Open,36
Akash Srivastava,4.0,"This place offers Keto 🍕. It's made with a mix of cauliflower and other low carb flour alternatives averaging at roughly 3g of net carbs. Taste wide though the base isn't great, I still prefer the taste of cauliflower crust which is also available here. I think it has slightly higher net carbs.",a year ago,Open,36
Charlie Byrd,5.0,Mt second visit to a Blaze restaurant. The pizza was great and fast! Rose and Tim were awesome. I watched them work and they practice clean and safe procedures which explains why the restaurant was so clean. Keep up the amazing work!,2 years ago,Open,36
Glenn Hughes,5.0,"Great pizza, custom made, friendly staff",a year ago,Open,36
Danielle Santos,1.0,THEY CLOSED AT 8:25PM WHEN THEY ARE SUPPOSED TO TECHNICALLY CLOSE AT 9PM. THIS IS EXTREMELY INCONVENIENT FOR PEOPLE WHO LEAVE WORK LATE AND IS TRYING TO FIND A MEAL TO EAT. The machines should not be turned off more than half an hour before ACTUALLY closing!,2 years ago,Open,36
Robert Barnes,4.0,"I'm a real Blaze devotee, but my last couple trips had been a slight letdown. Not wild about the menu changes, and the staff (while doing their best) are simply outnumbered at the busier times.",a year ago,Open,36
Erik Antelman,5.0,"Good pizza and it really is fast. Thin crispy crust, all the toppings you could want, price reasonable and staff friendly. I would recommend.",2 years ago,Open,36
Bob Araujo,5.0,Great pizza!  Thin crust made to your preference.  Delicious.  Highly recommended.,a year ago,Open,36
Claudiatouille G,5.0,This pizza came in clutch for me when I was hungry as ever...and it was worth it! the bottom of the crust is not to hard but not too soft and I love to see it getting made in front of my eyes as well as the pizza being fired in front of me. THIS PLACE MAKES ME HAPPY. ON DEAD DAWGS. PERIOD EPI DATS IT.,a year ago,Open,36
Jimmie Rodgers,4.0,"I'm vegetarian, my girlfriend is gluten intolerant, and we can both get something there for a good price. The pizza is pretty decent, but it's not amazing. That's to be expected of the quick fire crust they use, so it's kinda similar to …More",3 years ago,Open,36
Supal Vyas,5.0,My to go pizza place. Great location and just love the concept. Fresh ingredients make a great pizza. Also love their selection of drinks.,a year ago,Open,36
Edward Chopuryan,5.0,Awesome place. Good pizza. Perfect price. :),a year ago,Open,36
Matthew Ramirez,4.0,"It was ightt. Pizza was a tiny bit burnt but it was still gucci. I used to work at one so i get it, you know?",a year ago,Open,36
William Thalheimer,1.0,"Terrible service, incredibly slow process, complete lack of effort by the employees in terms of giving customers prompt attention, food itself was pretty bad too - all the meats were of very low quality. Chicken and bacon were very rubbery. Will not return.",a year ago,Open,36
Aime Syed,4.0,"Sorry about the earlier 1star, thought this was the place below Brooklyn bridge. Sorry, this pizza my boys loved. Totally self made, in front of you & run by a strong girl team. All with a smile and super friendly 🙌👌",2 years ago,Open,36
AKELLA RAVI,4.0,Tasty tasty. Good service,a year ago,Open,36
Fawaad Qamar,4.0,"Good pizza, fast service",a year ago,Open,36
Farimah Eshraghi,3.0,Ok but not the best quality food and very slow and unenthusiastic staff which means their underpaid,a year ago,Open,36
Jodi Edwards,5.0,Always great! Love the whole concept of building your own pizza at one low price. The kids love our too.,2 years ago,Open,36
Ruth Naomi,5.0,Love this place. I love how they have vegan cheese. And it's not expensive.,2 years ago,Open,36
Viper0hr,5.0,"I honestly did not know what to expect when coming here as I've never heard of the place before, but it was well priced and the pizza itself was very good. Staff was friendly, and service was prompt. Well worth it if you enjoy pizza at a good price.",2 years ago,Open,36
Mo Chan,5.0,Great made to order pizza place.,a year ago,Open,36
Vinod Mohanan,1.0,"I had to wait for 1.5 hours to get my pizza. And when he finally made my pizza, he had no boxes to pack them. And the box making process was another 10 minute wait. When I went and requested one of their associates to make a box, he said he …More",a year ago,Open,36
Cissiee Cellucci,5.0,Yummy,a month ago,Open,36
Abhinav Sukumar,4.0,"Always go for the 'make your own' option.. their stock options left me wanting. With the custom pizza, there's good options to mix and match.. wasn't too happy with the gluten free base-ended up being a tad bit chewy.. otherwise, ingredients taste fresh, nice sauces and staff who will pile on the ingredients as you want it...",2 years ago,Open,36
Paul W,5.0,"Fast, friendly good food. 😎👍",a year ago,Open,36
Jay Bean,1.0,If you look at my reviews you would see I love Pizza. I have eaten at other Blaze Pizza locations and this one ended up at the bottom of the list. I had to ask if my pizza was done a couple of times. The people after me got their 3 pizzas …More,a year ago,Open,36
Sunshine 02126,5.0,"You create your own pizza and it is ready in 90 seconds!!!!  Anytime I am at the Cambridgeside Galleria Mall, I normally stop at Blaze Pizza to make a pizza to take home.",a year ago,Open,36
Patricia Patricia,3.0,This place was amazing when they opened. service was fast. Pizza very good. Now... :(  What I can say today I've waited 25 minutes to get my pizza. And it wasn't crowed only 3 people.ahead of me. I visited the store Sunday afternoon FYI,2 years ago,Open,36
Chuck Binda,4.0,"Pretty quick and friendly service. Got the simple pie , which is just a cheese pizza, because it's always a good way to tell if I should go back. I thought it was good but a thin crust should be more crispy. I would still go back. Reasonably priced.",2 years ago,Open,36
Ganna Lytvynenko Amorim,5.0,"Pizza is soooo soooooo good! Vegan cheese, vegan crust, vegan CHORIZOOOOOOO, VEGAN PIZZZAAAA!!! How much better does it get? Will definitely become my regular spot and the prices are fair too. Need to show all my friends this place! And rave about it on Google<3 They have multiple locations around Boston so I'm a happy gal.",a year ago,Open,36
Shay Hadani,1.0,"Really bad management. Terrible service
Didn’t clean the place for a long time.",a year ago,Open,36
Kyle Martin,4.0,wish they would fully cook high rise dough.  and they should also try fully cutting the pizza,a year ago,Open,36
L Brouillard,1.0,"Tried to place an order, automated phone order says download app, what was advertised was not available on app. Call what I thought was the store, turns out to be call center, tells me to dial 33 to get store. Call store tells me they dont …More",a year ago,Open,36
Shriram Sethuraman,5.0,"Love their thin crust and unlimited toppings for less than 10. Gets crowded during lunch time, better to order online/app to avoid the wait.",a year ago,Open,36
James West,5.0,Outstanding flavor and ingredients—not a bad pizza in the shop! Drinks are unique and flavorful. Great prices and food up fast. Great for kids!,2 years ago,Open,36
Ram Yadav,5.0,Delecious pizzas.. Good price...great service,a year ago,Open,36
Wayne Wilson,5.0,"Great Pizza, as always! Love the restaurant design and atmosphere. Kudos to the employees for keeping up with the traffic and delivering another homerun experience!",2 years ago,Open,36
Kevin Glynn,5.0,"If you've never been to a Blaze Pizza, you should fix that right away. It's like Subway meets Pizza, but way better. Gluten free and vegan pizza? Yup. Great prices? Yup. Great quality? Absolutely.",3 years ago,Open,36
Hamza Malik,5.0,"The best pizza I have tasted in a long time. The taste is mesmerizing, I love it. The staff were very nice and cordial. Would definitely recommend you give it a try!!!!!!",2 years ago,Open,36
Aji Hermawan,4.0,Nice and fresh veggie pizza in Cambridge area,2 years ago,Open,36
Kun W,5.0,If happiness can be described in the form of a pizza it would be blaze pizza. You can customize your pizza any way you want. It is ready in less than 10 mins and it taste like the best food you have ever had in your life and you don't even …More,2 years ago,Open,36
Serena Leung,4.0,"Awesome place for some quick made personalized food with friends.  I ate at one of these chains in Raleigh, NC and was so happy to find it here when visiting friends.  They will really customize the pizza to whatever you want regardless of …More",3 years ago,Open,36
Jonathan Patterson,3.0,Was ok. Had a little too much sauce on it and the bottom of the crust was a little blackened for my taste. Didn't like as much as Pizzafire or 1000 Degrees.,a year ago,Open,36
Dr. Cassandra Bragg-Collins,3.0,"The quick concept is nice. The employees were patient. The cook however, he cooked the food too much. If a customer says that their pizza is cooked enough for them, then the cook should take the pizza from the oven. The cook we had that day …More",2 years ago,Open,36
chris_cartaya,5.0,"I love the assembly line approach and seeing it through every Step of the process. Pick what you want, watch it cook, take to stay or to go. Been there twice, staff very friendly. Size is just right, price is just right. Will continue to go back. Wish they had one in east Boston!",4 years ago,Open,36
Phil Shannon,4.0,"Great quick pizza's for lunch. Although the line does get long after noon, it goes quickly. I usually get a 1 topper, and you get to pick out everything you want on it like sea salt and oregano. You can watch it go into the oven and come out @ min later. Nice fresh ingredients, friendly staff.",3 years ago,Open,36
Andy Mei,3.0,"Meh pizza, compared to something like Domino's they're better, though",a year ago,Open,36
Nihal Atawane,5.0,"Tim, who works the night shift, is a superstar. I walked in one minute before the store was supposed to close, and he wasn't impatient in the slightest.",a year ago,Open,36
Sukhbir Singh,1.0,They take forever for service and have to wait just to pay. I would not recommend this place for a quick bite. The manger has no system. Honestly one of the worst places I’ve ever been.,2 years ago,Open,36
Bianca Tayor,5.0,"I keep trying to leave a positive review for Blaze Pizza, but Google keeps removing it???  I'll try again!!!  This is my new favorite pizza place!  Build your own pizza.  Why wasn't this thought of years ago?  Awesome!",3 years ago,Open,36
