name,stars,text,timeSince,openStatus,key
tammy barlow,5.0,I absolutely love the pizza 💕,4 weeks ago,Open,Anthony's Coal Fired Pizza 10205 S Dixie Hwy PINECREST FL 33156-3167 (305) 740-5800
Fulton Ivy,5.0,I ordered from Uber Eats waited 55 minutes and then got a cancellation notice for no reason stated. My wife called Anthony's directly and they had the order which we asked to hold for us and I would pick up. By the time I arrived at Anthony's we were going on 1 hour and 35 minutes. Long story short they were very busy & Vicki the mgr along with Ursula were extremely helpful & ended up turning around a bad situation into a very good one.,a week ago,Open,Anthony's Coal Fired Pizza 10205 S Dixie Hwy PINECREST FL 33156-3167 (305) 740-5800
Vesh Naseer,5.0,"Love the ambience, the great-tasting pizza and the lovely staff.",a month ago,Open,Anthony's Coal Fired Pizza 10205 S Dixie Hwy PINECREST FL 33156-3167 (305) 740-5800
Paolo Saieh,5.0,These people know how to make their pizzas. It was takeout and still amazing. The crust is perfectly baked almost crunchy but still chewy like a good bread. Ingredients and good quality. If you like pepperoni 🍕 it’s delicious 😋,3 months ago,Open,Anthony's Coal Fired Pizza 10205 S Dixie Hwy PINECREST FL 33156-3167 (305) 740-5800
Kat De La Rosa,5.0,I really love their pizza....the staff is great and the restaurant is very clean.,4 weeks ago,Open,Anthony's Coal Fired Pizza 10205 S Dixie Hwy PINECREST FL 33156-3167 (305) 740-5800
Poch,4.0,Great pizza. Was pleasantly surprised for a chain. Meatballs were great too but the spaghetti sauce needs work... too much pepper as well.,7 months ago,Open,Anthony's Coal Fired Pizza 10205 S Dixie Hwy PINECREST FL 33156-3167 (305) 740-5800
Jhulyland,5.0,"CLEAN STORE & GREAT MANAGEMENT!!!

This was my first time at this restaurant and the store was extremely clean. Our server Fabiola was amazing and attentive! The food was fresh & tasted great! The best part is one of the managers Jose Laguerre stopped by our table & asked about our experience and feedback. I will definitely be back!!",3 months ago,Open,Anthony's Coal Fired Pizza 10205 S Dixie Hwy PINECREST FL 33156-3167 (305) 740-5800
George Alonso,4.0,"Food is delicious! Service is good! This place has perfected their craft! Pizza will always come out well done and taste delicious. You can't go wrong here with  pizza or even wings. This location has a bar with tv and a full menu option!

Food may take awhile to come out if the restaurant is packed! They only have one massive oven for all the pizzas so be patient and order an appetizer. Enjoy",7 months ago,Open,Anthony's Coal Fired Pizza 10205 S Dixie Hwy PINECREST FL 33156-3167 (305) 740-5800
Raymond A. Guzman,4.0,"The in-dining experience really makes Anthony's special. Quality food preparation is complemented by friendly service and good music.

While prices are fair, I strongly recommend signing up for their Rewards program - which returns 10% of all dine-in or takeout purchases, net of tax.",3 weeks ago,Open,Anthony's Coal Fired Pizza 10205 S Dixie Hwy PINECREST FL 33156-3167 (305) 740-5800
Catherine Corrigan-Perez,5.0,"We wanted to highly recommend Anthony's Coal-fire Pizza in Pinecrest, FL. During this isolation time, we have been trying new menu options and we ordered the Carnivore pizza adding mushrooms, onions, tomatoes and extra cheese. This is truly the best pizza we have ever had. It is so scrumptious we came back today for a 2nd time this week and this amazingly delicious pizza tasted even better. It is loaded, the sauce is tangy, the crust is thin and so tasty, it's just perfect. Thanks to all the staff at Anthony's. Really tremendous and fantastic friendly customer service. 5 stars!!!! Thanks again, Cathy & Jose Miguel",5 months ago,Open,Anthony's Coal Fired Pizza 10205 S Dixie Hwy PINECREST FL 33156-3167 (305) 740-5800
User 101,1.0,I had the worst customer service experience at Pinecrest branch from the blonde girl at the cashier. The food was late 35 minutes for pickup up and that girl didn't even want to bring the food when it's ready to my car while I'm waiting outside of the restaurant to maintain social distancing. She was very rude and vulgar. Will never go to that branch again!!!,a month ago,Open,Anthony's Coal Fired Pizza 10205 S Dixie Hwy PINECREST FL 33156-3167 (305) 740-5800
Geroge cullim,5.0,"Friendly staff, great food! My order is always ready extremely fast!",2 months ago,Open,Anthony's Coal Fired Pizza 10205 S Dixie Hwy PINECREST FL 33156-3167 (305) 740-5800
Shawn Campbell,5.0,"I really wish one could review on a 10 point scale vs. 1-5 stars, because, I really like to reserve 5 stars for perfection in terms of quality, ambience, service and price. Ideally, I'd give this marvelous restaurant 4.5 stars only because they're quite pricey for pizza, even given the excellent quality. As for location and ambience, the facility is marvelous! We really enjoyed our time and relaxation. The background music was very enjoyable. The pizza was outstanding! Really one of my favorites. We really enjoyed the charred flavor of the crust and the thin texture. As mentioned, the 12"" pizza with 2 toppings was a bit pricey (if I recall $18). The grilled wings were very good, even if not the usual hot-wings I tend to prefer. Finally, the service was very good. I'll definitely return.",a year ago,Open,Anthony's Coal Fired Pizza 10205 S Dixie Hwy PINECREST FL 33156-3167 (305) 740-5800
Nikola Patterson-Molina,5.0,Amazing pizza and service. Curbside pickup has bean great during the pandemic.,3 months ago,Open,Anthony's Coal Fired Pizza 10205 S Dixie Hwy PINECREST FL 33156-3167 (305) 740-5800
Irene M,3.0,"excellent pizza  if you can get it...but they forgot to give my order to the doordash delivery person so I have no dinner tonight! I called and
after 15 minutes on hold, I was disconnected.
super disappointed in service guys....
how can I support my local economy if they forget my food? looks like it's salad again",4 months ago,Open,Anthony's Coal Fired Pizza 10205 S Dixie Hwy PINECREST FL 33156-3167 (305) 740-5800
Step deRdeR,5.0,"Do you want to try fresh , real , tasty pizza? Well this is a must to try and be part of ! Sounds like I've been paid of, but noooo I just love how love can be express in some many ways and Anthony's coal fired pizza is one of it! Love it!!",6 months ago,Open,Anthony's Coal Fired Pizza 10205 S Dixie Hwy PINECREST FL 33156-3167 (305) 740-5800
Martha Pelaez,5.0,Their Brick oven pizza with roasted peppers.  Awesome,2 months ago,Open,Anthony's Coal Fired Pizza 10205 S Dixie Hwy PINECREST FL 33156-3167 (305) 740-5800
Bernard Bohn,1.0,"After years going there, I ordered today on Uber Eats and the order was sent incomplete.  After calling the restaurant for help the host there could care less and hun up the phone.  I had to drive over there to get the rest of the order and the treatment was even more rude.  This guy just damages the image of the restaurant and does not deserve to be a representative of ACP.  I simply wont order there for a long time just because of this.  Wasted 80 buck on cold pizza and aggravation because on just one person ruining the dining experience.  I am a long time Pinecrest resident and have been usual visitors to the household restaurants in the area.",3 months ago,Open,Anthony's Coal Fired Pizza 10205 S Dixie Hwy PINECREST FL 33156-3167 (305) 740-5800
Henry A,5.0,"Good pizza and staff, price was also good.",a year ago,Open,Anthony's Coal Fired Pizza 10205 S Dixie Hwy PINECREST FL 33156-3167 (305) 740-5800
Pedro Orellana,5.0,The Carnivori is a meat lovers perfection and The Meatball & Ricotta is transcendent. My favorite pizza chain.,3 months ago,Open,Anthony's Coal Fired Pizza 10205 S Dixie Hwy PINECREST FL 33156-3167 (305) 740-5800
Ray 0135,5.0,"I was seated quickly. Service was great and was very impressed by the approach of the manager, Jose. He was very attentive all night making sure the service was excellent. I’d definitely go back.",7 months ago,Open,Anthony's Coal Fired Pizza 10205 S Dixie Hwy PINECREST FL 33156-3167 (305) 740-5800
Michael Grenier,5.0,Been coming to Anthony’s for quite awhile now and there pizza never disappoints!,3 months ago,Open,Anthony's Coal Fired Pizza 10205 S Dixie Hwy PINECREST FL 33156-3167 (305) 740-5800
Brian Rippel,4.0,Food was great! Drink was great! The service was a little lacking but well let it slide. It was very busy. I will return and hopefully will be able to give 5 stars.,9 months ago,Open,Anthony's Coal Fired Pizza 10205 S Dixie Hwy PINECREST FL 33156-3167 (305) 740-5800
April Wilson,5.0,We went for dinner Friday night and it was delicious! I love the Arugula burrata salad! We also had the white pizza with prosciutto which is my new favorite! Jordan did such a great job making sure we had a great night. The restaurant was busy but the service was top notch. Will definitely be back next week!,11 months ago,Open,Anthony's Coal Fired Pizza 10205 S Dixie Hwy PINECREST FL 33156-3167 (305) 740-5800
Vicky Tome,5.0,"The best pizza in town!  We also had Capresse salad, coal fired roast beef sandwich and oven roasted potatoes. Everything was excellent!",8 months ago,Open,Anthony's Coal Fired Pizza 10205 S Dixie Hwy PINECREST FL 33156-3167 (305) 740-5800
Glenda Ward,5.0,The pizza is outstanding!!!!   My husband doesn't care for  Italian food but he ate the spaghetti and meatballs and loved it!!!  That says volumes!!!! The atmosphere is great too.  Be prepared to wait... this is a BUSY place.  That in itself is enough testimony for me to know it's so good that people are willing to wait 15  minutes to get in.  Highly recommend you eat there.,a year ago,Open,Anthony's Coal Fired Pizza 10205 S Dixie Hwy PINECREST FL 33156-3167 (305) 740-5800
Suzette Larson,5.0,Had the meatball ricotta and a classic pepperoni pizza. Both were delicious but the meatball ricotta one was LIFE CHANGING. The dough is a perfectly chewy consistency and everything had balanced flavor. Our favorite pizza in Miami!,10 months ago,Open,Anthony's Coal Fired Pizza 10205 S Dixie Hwy PINECREST FL 33156-3167 (305) 740-5800
Steven Pique,5.0,"Great service! We had an issue with Uber Eats and Vicky, the general manager, was awesome in helping us out! Also, the food is amazing.",9 months ago,Open,Anthony's Coal Fired Pizza 10205 S Dixie Hwy PINECREST FL 33156-3167 (305) 740-5800
John Joffre,4.0,Good but a little pricey,a month ago,Open,Anthony's Coal Fired Pizza 10205 S Dixie Hwy PINECREST FL 33156-3167 (305) 740-5800
barbara p,1.0,General Manager extremely use of unnecessary negative verbal tone  towards Doordarsha driver...,2 months ago,Open,Anthony's Coal Fired Pizza 10205 S Dixie Hwy PINECREST FL 33156-3167 (305) 740-5800
Joseph Palomino,5.0,Excellent place to have a nice hearty meal.,a year ago,Open,Anthony's Coal Fired Pizza 10205 S Dixie Hwy PINECREST FL 33156-3167 (305) 740-5800
Edward Wightman,4.0,"Anthony's is always good.

Very good pizza and good service.
The kids always like coming here for the chicken wings and the regular cheese pizza.
One of our favorite pizzas here is the arugula, very fresh and tomato sauce is very light..

Come with plenty of time because it gets packed but is worth the wait.",a year ago,Open,Anthony's Coal Fired Pizza 10205 S Dixie Hwy PINECREST FL 33156-3167 (305) 740-5800
Deniz Ergener,5.0,"I like arugula pizza and eggplant Marino ask for extra sauce... Their meatballs are also very good. Restaurant tends to be very cold, I guess they keep the A/C blasting because of the coal fired pizza oven, bring a jacket with you",9 months ago,Open,Anthony's Coal Fired Pizza 10205 S Dixie Hwy PINECREST FL 33156-3167 (305) 740-5800
EnderBlue 8321,5.0,This place is simply amazing the service is great and the food is even better and our waitress is so kind. I hope you enjoy your experience at Anthony's coal fire,3 years ago,Open,Anthony's Coal Fired Pizza 10205 S Dixie Hwy PINECREST FL 33156-3167 (305) 740-5800
Andres Rodriguez,1.0,HORRIBLE SERVICE AND TAKE WAY TOO LONG WITH MY ORDER NEVER GOING BACK AGAIN,3 months ago,Open,Anthony's Coal Fired Pizza 10205 S Dixie Hwy PINECREST FL 33156-3167 (305) 740-5800
Abier Ismail,5.0,"I had the best experience today with Antony""s Pizza, i ordered a take out under the name Sarah's)  there was a mistake with one item on the order, when i called them, they apologized and not only did they replace the pizza but the manger himself drove and  drop it off at my house... on top of that he  gave a  coupon for next ti,me. i was amazed of how sweet everyone is at the place, over the phone and in person. i highly recommend this place. they have the best pizza and the best people working there.",a year ago,Open,Anthony's Coal Fired Pizza 10205 S Dixie Hwy PINECREST FL 33156-3167 (305) 740-5800
Pedro Lanuza,4.0,"How is place where they sell wings have no sauce? This was really a big disappointment when it came to my wings.

Pizza and wings were tasty though.",9 months ago,Open,Anthony's Coal Fired Pizza 10205 S Dixie Hwy PINECREST FL 33156-3167 (305) 740-5800
Ernesto Alfonso,5.0,Been coming here for years. Everyone from the lower staff to upper management is incredibly courteous and attentive to all your needs. Take-out is remarkably expedient and you feel welcomed as a customer as soon as you walk in through the door (they have staff members waiting to open the door for you when you come in & exit). It’s a great feeling when you see managers actually hustling and working their butts off taking charge of the restaurant and doing REAL work just like the rest of their employees instead of hiding in a room somewhere or behind a computer. Overall it’s must stop location if you find yourself in the area. Very family orientated & you’ll definitely be happy with both the service & food!,a year ago,Open,Anthony's Coal Fired Pizza 10205 S Dixie Hwy PINECREST FL 33156-3167 (305) 740-5800
Andrea Agudelo,5.0,I love Anthony's pizza.  I always go with my family. Vicky is very nice. Recomend 100%. Great service!!👍🙋🏼‍♀️,a year ago,Open,Anthony's Coal Fired Pizza 10205 S Dixie Hwy PINECREST FL 33156-3167 (305) 740-5800
Ekaterina Khayrulina,5.0,We love their meatballs! Service is good too.,9 months ago,Open,Anthony's Coal Fired Pizza 10205 S Dixie Hwy PINECREST FL 33156-3167 (305) 740-5800
Kathy Hunt,5.0,"Awesome lunch, and our server Ivan was phenomenal.  Vicky the manager made us feel welcome and we went above and beyond.  She's very attentive to the guests and cares alot for the employees. Great experience!",a year ago,Open,Anthony's Coal Fired Pizza 10205 S Dixie Hwy PINECREST FL 33156-3167 (305) 740-5800
Dee Nicarr,5.0,"Chicken wings are great, salad ok the eggplant superb.",6 months ago,Open,Anthony's Coal Fired Pizza 10205 S Dixie Hwy PINECREST FL 33156-3167 (305) 740-5800
Alexander Lopez,5.0,Always good pizza made just right with fresh ingredients and awesome meat balls cant go wrong,9 months ago,Open,Anthony's Coal Fired Pizza 10205 S Dixie Hwy PINECREST FL 33156-3167 (305) 740-5800
Janet Bailie,5.0,Great food and service every time.,8 months ago,Open,Anthony's Coal Fired Pizza 10205 S Dixie Hwy PINECREST FL 33156-3167 (305) 740-5800
Jorge Anchia,4.0,Great pizza with many toppings to choose from als6the house salad was great.,9 months ago,Open,Anthony's Coal Fired Pizza 10205 S Dixie Hwy PINECREST FL 33156-3167 (305) 740-5800
Fabio M,5.0,"Excellent food, great service. Good parking availability",11 months ago,Open,Anthony's Coal Fired Pizza 10205 S Dixie Hwy PINECREST FL 33156-3167 (305) 740-5800
Eder Mendes,1.0,"Horrible service. No one greeted us at the door, asked if I could sit myself soon after a hostees reluctantly helped me to a table as if I was interrupting her conversation with another employee. Waited for a waiter for nearly 20mins until we asked to be helped. Another 20mins for the food. Horrible experience, Anthony's not sure if its just this location but I rather not risk a wasted lunch and/or dinner by visiting one of your restaurants again. Train your employees on hospitality and customer service.",10 months ago,Open,Anthony's Coal Fired Pizza 10205 S Dixie Hwy PINECREST FL 33156-3167 (305) 740-5800
spike price,4.0,Good food. Excellent staff,8 months ago,Open,Anthony's Coal Fired Pizza 10205 S Dixie Hwy PINECREST FL 33156-3167 (305) 740-5800
Peter Sauter,4.0,"I'll say it straight away, the great taste of their food is what pushes this review to 4 (and even makes me consider 5) out of 5 stars.

TL;DR: Amazing food, neither cheap nor expensive, bad ambience and spotty service. Their other locals are infinitely better, or you can order it for takeout.

So what's the deal?
The interior of an Antony's Pizza varies from place to place. Oftentimes the interior is quite nice and well furnished, but THIS ONE is quite lackluster. The restaurant is often full (a testament to how good their food is) but the space feels very crammed. The ambient noise can get very loud, and they often play the music at a volume higher than the ambient noise (which can get to be unbearably loud). The furniture and interior design is very forgettable, and presence of TV screens in every direction makes you feel like you're at a sports bar rather than a restaurant.

The service tends to be good, although I recently had a rather odd experience with a missing object (I called, they said it wasn't there, I decided to go there in person, they said the same thing again, then I pushed the matter a little bit more, and all of a sudden the missing object appears. I hate to see the worst in people, but this was fishy...).

Last among the list, is their prices. This is the most minor of issues, seeing as the taste is top notch, but I can't help but to feel like it's a little overpriced for what it is. Maybe it's a combination of the lackluster environment with the stereotype of ""pizza must be cheap no matter what"". But I digress.

I'd recommend that anyone go to Anthony's Pizza for a great meal, any day of the week. But I'd recommend that you go to any of their other locals (the one at Coral Gables is FANTASTIC), or that you get it as takeout.",a year ago,Open,Anthony's Coal Fired Pizza 10205 S Dixie Hwy PINECREST FL 33156-3167 (305) 740-5800
Asaad Asaad,4.0,Delicious but wait time is some what high,8 months ago,Open,Anthony's Coal Fired Pizza 10205 S Dixie Hwy PINECREST FL 33156-3167 (305) 740-5800
Bam Bam,5.0,The service was awesome and the pizza even better!! Nice ambience and the music they play here is also awesome... i would definitely be back here again !,a year ago,Open,Anthony's Coal Fired Pizza 10205 S Dixie Hwy PINECREST FL 33156-3167 (305) 740-5800
Javier F Montes,2.0,Long wait to pickup my order and pizza was burned and cold,3 months ago,Open,Anthony's Coal Fired Pizza 10205 S Dixie Hwy PINECREST FL 33156-3167 (305) 740-5800
Fadil Karmally,3.0,Usually the wings are a good size...the wings here are on the small side.,9 months ago,Open,Anthony's Coal Fired Pizza 10205 S Dixie Hwy PINECREST FL 33156-3167 (305) 740-5800
Dionne Walker,3.0,Chicken wings had feathers and  pineapple is not on option for a topping.,9 months ago,Open,Anthony's Coal Fired Pizza 10205 S Dixie Hwy PINECREST FL 33156-3167 (305) 740-5800
J W,5.0,Great food and great costumer service. Gregory was an excellent waiter. He was very attentive and made sure everyone in our party was taken care of.,a year ago,Open,Anthony's Coal Fired Pizza 10205 S Dixie Hwy PINECREST FL 33156-3167 (305) 740-5800
frank ford,5.0,Chicken wings are great along with their service!,7 months ago,Open,Anthony's Coal Fired Pizza 10205 S Dixie Hwy PINECREST FL 33156-3167 (305) 740-5800
Roxane Brady,4.0,So so good. Love the mini meatballs.,11 months ago,Open,Anthony's Coal Fired Pizza 10205 S Dixie Hwy PINECREST FL 33156-3167 (305) 740-5800
Steve Leonard,2.0,"Not what it used to be. A tired kitchen, tired and undertrained crew,an old menu, frankly living on borrowed time. Stay away from the thinly sliced eggplant pizza. It is just horrendous. Ordered last night for takeout, apart from botching the order when I came to pick up, it was not ""thinly sliced"" - regular slices piled on top of undercooked dough, and sprinkled with marinara sauce. A most unsatisfying experience. Anthony's needs a revamp, new ideas and a new menu, even if it's attained through a radio competition. Good luck.",a year ago,Open,Anthony's Coal Fired Pizza 10205 S Dixie Hwy PINECREST FL 33156-3167 (305) 740-5800
Lauri Prellezo,4.0,"I go here often with my family, and we usually LOVE it. The only reason I'm giving 4 stars instead of 5 was because we had a bad experience last time we went -- I noticed our waitress didn't write down any of our order, and as a result, our entire order was wrong. We didn't receive our appetizer, and our wing order was wrong. But... we didn't complain, just let it be. We waited an additional 30 minutes for our pepperoni pizza, finally were able to flag down our waitress who had disappeared, and she informed us our pizza had been burned and they were remaking it. Oookay. When our pizza finally came out, our appetizer came with it... in the form of a topping on another pizza😑 We sent that one back. Then we asked several times for napkins... she never brought them. Oh well.

Besides that, we usually have a great experience here. Normally, the service is wonderful. Friendly servers. The wings are fantastic, and I LOVE the new dry rub wings. Yum. Love the salad as well. And the pizzas are delicious! Highly recommended. Minus the preoccupied waitress.",a year ago,Open,Anthony's Coal Fired Pizza 10205 S Dixie Hwy PINECREST FL 33156-3167 (305) 740-5800
David R,5.0,"Over priced pizza, guess you might call it gourmet, upper end, but I did not pay so ok with me. Excellent service and good food.",a year ago,Open,Anthony's Coal Fired Pizza 10205 S Dixie Hwy PINECREST FL 33156-3167 (305) 740-5800
Roberto Finale,5.0,"Great food, great service, but stopped giving biscotti with their espresso!  FAIL!",a year ago,Open,Anthony's Coal Fired Pizza 10205 S Dixie Hwy PINECREST FL 33156-3167 (305) 740-5800
Kenneth Delgado,5.0,"I am reviewing this location because it is the one I frequent the most.  However, this certainly goes for all Anthony’s pizza restaurants that I have been to.

Anthony’s remains true to making fresh pizzas with good ingredients.  Their quality does not limit to only their delicious pies however.  From their salads to their scrumptious sandwiches, you cannot go wrong with any menu item that you choose to venture.

The staff is always friendly and courteous at all times of your visit.  Sometimes i find that if you visit a restaurant at a non busy time, the staff tends to feel almost a bit lazy.  This couldn’t be further from the case at Anthony’s.

I will continue to come here to indulge in their Italian specialties and tell my friends and all new greets about the experience that is eating at Anthony’s Coal Fired Pizza.",2 years ago,Open,Anthony's Coal Fired Pizza 10205 S Dixie Hwy PINECREST FL 33156-3167 (305) 740-5800
MM16 J,1.0,As a first time customer I am not impressed with this location. The staff was not friendly or helpful at the Take Out counter.  Horrible customer service. #notreturningtothislocation,11 months ago,Open,Anthony's Coal Fired Pizza 10205 S Dixie Hwy PINECREST FL 33156-3167 (305) 740-5800
Raul marcano bigott,5.0,All is very good in thats place,7 months ago,Open,Anthony's Coal Fired Pizza 10205 S Dixie Hwy PINECREST FL 33156-3167 (305) 740-5800
Rey R,5.0,Great little place to have dinner.  You must try the wings as an appetizer.  The meatball and ricotta pizza was awesome.  Servicer were friendly and fast.,a year ago,Open,Anthony's Coal Fired Pizza 10205 S Dixie Hwy PINECREST FL 33156-3167 (305) 740-5800
Thomas Evans,5.0,"Wife and I were traveling in the Miami area and stopped by for early dinner on a Monday afternoon probably around 4:30.  This was around Pinecrest FL, well off the beach area.  We were some of the first dinners of the evening.  Our pizzas were ready in no time.  She had a 12 inch sausage and sweet pepper pizza, and I had their 12 inch sliced tomato, mozzarella, basil pizza (not to be confused with their margarita pizza) I added hot finger peppers which is the first time I've run into that presentation on a pizza.  Both pizzas were fantastic.  My wife had two glasses of wine, I had two draft beers.  The tab came to $75.00 including tax, not including tip.  So on the pricy side.  Decor was upscale and very nice and the service was excellent.",a year ago,Open,Anthony's Coal Fired Pizza 10205 S Dixie Hwy PINECREST FL 33156-3167 (305) 740-5800
Christian Perez,5.0,Love the pizza here,2 months ago,Open,Anthony's Coal Fired Pizza 10205 S Dixie Hwy PINECREST FL 33156-3167 (305) 740-5800
karen goldberger,5.0,Best pizza ever,2 months ago,Open,Anthony's Coal Fired Pizza 10205 S Dixie Hwy PINECREST FL 33156-3167 (305) 740-5800
Billy Garnet,4.0,Friendly staff. Gluten free options available. Nice atmosphere.,a year ago,Open,Anthony's Coal Fired Pizza 10205 S Dixie Hwy PINECREST FL 33156-3167 (305) 740-5800
Mithlesh Pamnani,4.0,Excellent coal fired pizza.,a year ago,Open,Anthony's Coal Fired Pizza 10205 S Dixie Hwy PINECREST FL 33156-3167 (305) 740-5800
Sebastian Cuellar,5.0,"Great Service, Delicious Food, Excellent Service.",10 months ago,Open,Anthony's Coal Fired Pizza 10205 S Dixie Hwy PINECREST FL 33156-3167 (305) 740-5800
Sachin Patel,3.0,"We ordered a pizza and 5 wings.
Pizza - half mushroom/olives, half spicy sausage/ricotta
Wings - 5 Anthony’s signature

The pizza was ok, the mushroom had a tang suggesting they were canned and not fresh, the olives were super salty. The sausage was tough and seemed burned. The dough was nice.

The wings were also ok, they were definitely on the saltier side but were well cooked. The onions were good too.",a year ago,Open,Anthony's Coal Fired Pizza 10205 S Dixie Hwy PINECREST FL 33156-3167 (305) 740-5800
