name,stars,text,timeSince,openStatus,key
Cody Obropta,5.0,"Anthony's Coal Fired Pizza is an awesome spot. They have a great modern look with both indoor and outdoor seating separated by a large sliding glass door. The bar and tables are clean and elegant and plenty of the beer on tap is brewed specifically for the company!
My friends and I really enjoyed the pizza. The classic plain pizza is high-quality. It features great sauce and a soft, chewy crust that has very good flavor. The white pizza is also deliciously cheesy and cooked to perfection. I would definitely eat here again.",5 months ago,Closed,Anthony's Coal Fired Pizza 10 Sterling Blvd ENGLEWOOD NJ 07631-4834 (201) 431-9404
Ron Law,5.0,"Delicious food, nice ambience.",a year ago,Closed,Anthony's Coal Fired Pizza 10 Sterling Blvd ENGLEWOOD NJ 07631-4834 (201) 431-9404
Shaan Weitjes,5.0,"Yesterday was our first time in this good restaurant. But It is surely not the last. We passed a splendid evening with the good service, with the high quality cooking and fine drinks and with the decent price. We will no doubt go back there soon.",7 months ago,Closed,Anthony's Coal Fired Pizza 10 Sterling Blvd ENGLEWOOD NJ 07631-4834 (201) 431-9404
Bryan Brogdon,5.0,"From the first moment  you come to this restaurant  the waiters give you a comfortable feeling. Very courteous crew, it is a friendly restaurant to to go out with buddies or with your date. delightful  food, qualified  chief cook and stuff, comfortable  pay and generous  service. Highly recommended.",9 months ago,Closed,Anthony's Coal Fired Pizza 10 Sterling Blvd ENGLEWOOD NJ 07631-4834 (201) 431-9404
Ashna Rani,5.0,"Update on my review...
Owner contacted me apologising for the mistake and offered me a comp. its v rare these days for owners to be in touch to do something like this and shows they really care

Original review:

really want to say I love the pizzas here the orders keep getting messed up. Can you spot whats missing?

....

No Feta and No Arugla....and the other half of the pizza had only some tom sauce...

Unfortunately this is the last time we will be ordering from here....",a year ago,Closed,Anthony's Coal Fired Pizza 10 Sterling Blvd ENGLEWOOD NJ 07631-4834 (201) 431-9404
Matthew Brown,5.0,Had a great experience in this spot with my son. The food was served quickly and the service is just awesome. Prices are affordable.,9 months ago,Closed,Anthony's Coal Fired Pizza 10 Sterling Blvd ENGLEWOOD NJ 07631-4834 (201) 431-9404
Will Lee,2.0,"Always enjoyed coming here, but I had a pick up order that was burned and the replacement I went back for had a bit of steel brush (like from a scrubbing pad) in it. Ended up just throwing it out because no one was comfortable eating it after that.

I always hate sending food back because of all the horror stories you hear, so I really hope this was just a fluke and there was no other extra “seasoning” on my meal 😭.",8 months ago,Closed,Anthony's Coal Fired Pizza 10 Sterling Blvd ENGLEWOOD NJ 07631-4834 (201) 431-9404
James Beers,5.0,Great Coal Fired Pizza! Great Salads and their Meat balls are amazing! Nice quiet place for dinner...,7 months ago,Closed,Anthony's Coal Fired Pizza 10 Sterling Blvd ENGLEWOOD NJ 07631-4834 (201) 431-9404
Dave,1.0,Tried their pizza for the first time the other day. It literally tasted like eating a bucket of salt. Wayyy too salty. Are you kidding me?,8 months ago,Closed,Anthony's Coal Fired Pizza 10 Sterling Blvd ENGLEWOOD NJ 07631-4834 (201) 431-9404
Melanie Stokes,5.0,Really like this location. Good food and staff is very friendly.,6 months ago,Closed,Anthony's Coal Fired Pizza 10 Sterling Blvd ENGLEWOOD NJ 07631-4834 (201) 431-9404
James Wally Wallenfelsz,5.0,"We are a military group, and the store manager to great care of us. And the pizza was great!",8 months ago,Closed,Anthony's Coal Fired Pizza 10 Sterling Blvd ENGLEWOOD NJ 07631-4834 (201) 431-9404
Miguel Borrero,5.0,The food is awesome .. but the people that work there are what makes this a truly amazing place. A very friendly and positive environment makes for a place I’d definitely come back too.. great job guys!,a year ago,Closed,Anthony's Coal Fired Pizza 10 Sterling Blvd ENGLEWOOD NJ 07631-4834 (201) 431-9404
Jasmyne Ngo,3.0,"Delivery through Seamless to our hotel.  Delivery was done at a decent time.  Pizza was made wrong, which meant my kid who only eats cheese pizza didn't eat.   No napkins or utensils were included.  Food was decent.",a year ago,Closed,Anthony's Coal Fired Pizza 10 Sterling Blvd ENGLEWOOD NJ 07631-4834 (201) 431-9404
Jason Marc,5.0,Really good pizza and nice staff...never overly packed ....cool place for a relaxed meal,10 months ago,Closed,Anthony's Coal Fired Pizza 10 Sterling Blvd ENGLEWOOD NJ 07631-4834 (201) 431-9404
Chiquita Ross,5.0,Food is delicious.  Service is great,7 months ago,Closed,Anthony's Coal Fired Pizza 10 Sterling Blvd ENGLEWOOD NJ 07631-4834 (201) 431-9404
Scot,5.0,"Good pizza, made to order, not fast",11 months ago,Closed,Anthony's Coal Fired Pizza 10 Sterling Blvd ENGLEWOOD NJ 07631-4834 (201) 431-9404
Kenneth Borovina,4.0,Good is great but other locations are better ambiance!,7 months ago,Closed,Anthony's Coal Fired Pizza 10 Sterling Blvd ENGLEWOOD NJ 07631-4834 (201) 431-9404
Alejandra Limones,5.0,"The pizza and the meatballs are amazing!! The flavors are bold. The ambience is nice and all the people who work there very kind.

Btw they always have a lot of very good hand crafted beers.",a year ago,Closed,Anthony's Coal Fired Pizza 10 Sterling Blvd ENGLEWOOD NJ 07631-4834 (201) 431-9404
CY B,5.0,Cauliflower Pizza!  Awesomely Delicious! I have most of my coworkers enjoying it as well! Yumm!,11 months ago,Closed,Anthony's Coal Fired Pizza 10 Sterling Blvd ENGLEWOOD NJ 07631-4834 (201) 431-9404
Daniela Araujo,5.0,Love the food and the workers there are super nice.,7 months ago,Closed,Anthony's Coal Fired Pizza 10 Sterling Blvd ENGLEWOOD NJ 07631-4834 (201) 431-9404
Bert Rosenbluth,5.0,Excellent Pizza. They work with food allergies.,6 months ago,Closed,Anthony's Coal Fired Pizza 10 Sterling Blvd ENGLEWOOD NJ 07631-4834 (201) 431-9404
Jon Martocci,5.0,"Great when they have a smaller menu so you dont worry about what to choose.
Pizzas are great and the other dishes they have are very tasty and unique",a year ago,Closed,Anthony's Coal Fired Pizza 10 Sterling Blvd ENGLEWOOD NJ 07631-4834 (201) 431-9404
Emel Yilmaz,4.0,"They have great meatballs, ( sometimes they have promotions where they give away the pot !)
The margarita pizza is great..Casual ambiance and friendly staff..",2 years ago,Closed,Anthony's Coal Fired Pizza 10 Sterling Blvd ENGLEWOOD NJ 07631-4834 (201) 431-9404
Kenneth Holz,5.0,Of course you expect decent pizza but they have really good wings also. Better quality than I thought I would get from a chain restaurant.,a year ago,Closed,Anthony's Coal Fired Pizza 10 Sterling Blvd ENGLEWOOD NJ 07631-4834 (201) 431-9404
Naomi Jones,5.0,"This is one of the best restaurants I have ever been to! The service was amazing! To top it off, I had a chocolate cake! I rate this 5 stars as there were no flaws. The servers were very kind and easy to talk to.",2 years ago,Closed,Anthony's Coal Fired Pizza 10 Sterling Blvd ENGLEWOOD NJ 07631-4834 (201) 431-9404
Adrienne Jones,5.0,Great pizza and staff who are also so very helpful and pleasant!,11 months ago,Closed,Anthony's Coal Fired Pizza 10 Sterling Blvd ENGLEWOOD NJ 07631-4834 (201) 431-9404
Mike Horrey,4.0,Pizza was good. Ordered wings well done and they were really good. Menu is very limited. Nice atmosphere,a year ago,Closed,Anthony's Coal Fired Pizza 10 Sterling Blvd ENGLEWOOD NJ 07631-4834 (201) 431-9404
Sevan Curukcu,1.0,"The foods are good but service is definitely disgusting. We ate salad and chicken wings then the waitress brought our pizza. Guess what he didn’t change our plates!!!
Sorry but I can’t it pizza over the bones!!!
I asked him 5 minutes later “Are you planning to change our plates and bring some napkins” he goes oh do you need new plates? Come on whoever is the manager is not doing his job.",a year ago,Closed,Anthony's Coal Fired Pizza 10 Sterling Blvd ENGLEWOOD NJ 07631-4834 (201) 431-9404
Jerry Sitbon,4.0,"Fun place, great music, excellent service, totally enjoyed the the pizza.  Ordered three different types, all were great.  They serve alcohol.  PS: they correctly made a mixed drink.  Outdoor eating too.  * When going there, drive slowly on route 4 when you get close otherwise you need to loop around route 4 to get back. As long as you like good food, music and fun this is a place e you need to try.  Relax and casual.",2 years ago,Closed,Anthony's Coal Fired Pizza 10 Sterling Blvd ENGLEWOOD NJ 07631-4834 (201) 431-9404
Viktoria Merezhana,5.0,Pizza had thin crust and the food was really good,6 months ago,Closed,Anthony's Coal Fired Pizza 10 Sterling Blvd ENGLEWOOD NJ 07631-4834 (201) 431-9404
Brian A.,4.0,Had the plain cheese personal pie and it was pretty good. Only 10 minutes for two personal pies to come out the oven and out the door. Although they did have a nice looking bar that I might have to take advantage of another time.,a year ago,Closed,Anthony's Coal Fired Pizza 10 Sterling Blvd ENGLEWOOD NJ 07631-4834 (201) 431-9404
Angelo Gagliardi,5.0,"Food is very consistent.  Small menu everything is executed well.  Wings and Roasted Cauliflower pizza, my two favorites.",a year ago,Closed,Anthony's Coal Fired Pizza 10 Sterling Blvd ENGLEWOOD NJ 07631-4834 (201) 431-9404
Klim Kavall,4.0,"4 stars due to service! The food was okay at best but our server was great. He helped us the entire time and was readily accessible while still being fully on time with the food.

We had a white pizza and a plain pizza.  Both were done properly but nothing special. The wings were good as well but a bit dry. If you’re on route 4 and want pizza, sure, stop in, but I wouldn’t go out of my way to get here.",2 years ago,Closed,Anthony's Coal Fired Pizza 10 Sterling Blvd ENGLEWOOD NJ 07631-4834 (201) 431-9404
Mary Durant,1.0,"I visited last Saturday a ACFP establishment and had  a small pie half Margarita half white pizza. It was presented so good, the crust was thin and crispy, and they had the perfect blend of ingredients. It looked and tasted so good I thought I’d get it again. I ordered to go, the same pie from the Englewood establishment last night. It was unfortunately neither good to look at or eat. It looked like the preparer took a spoon and plopped the ingredients on. I would get a mouthful of sauce then a mouthful of cheese. And that was the Margarita side. The white  was just as bad. Worst pizza I’ve had. If I would have looked at the pizza before I left, I would have demanded a refund.",a year ago,Closed,Anthony's Coal Fired Pizza 10 Sterling Blvd ENGLEWOOD NJ 07631-4834 (201) 431-9404
Richard Kleiman,5.0,Best salad dressing and always perfectly done pizza,11 months ago,Closed,Anthony's Coal Fired Pizza 10 Sterling Blvd ENGLEWOOD NJ 07631-4834 (201) 431-9404
Sabrina Rimer,5.0,"Good pizza, good drinks, nice staff",11 months ago,Closed,Anthony's Coal Fired Pizza 10 Sterling Blvd ENGLEWOOD NJ 07631-4834 (201) 431-9404
Kevin Willmann,5.0,"Always good, but the staff was exceptional.",7 months ago,Closed,Anthony's Coal Fired Pizza 10 Sterling Blvd ENGLEWOOD NJ 07631-4834 (201) 431-9404
GARY G,5.0,Fun place to eat. Good 🍕,a year ago,Closed,Anthony's Coal Fired Pizza 10 Sterling Blvd ENGLEWOOD NJ 07631-4834 (201) 431-9404
Al Gonzalez,3.0,Very nice establishment in new development on rt4. Nice bar area. I got the classic pizza thinking it was margarita pie.  Didn't realize regular cheese pizza was served on brick oven style,2 years ago,Closed,Anthony's Coal Fired Pizza 10 Sterling Blvd ENGLEWOOD NJ 07631-4834 (201) 431-9404
Steve Copertino,4.0,Great staff and excellent food. Very comfortable atmosphere with reasonable prices,a year ago,Closed,Anthony's Coal Fired Pizza 10 Sterling Blvd ENGLEWOOD NJ 07631-4834 (201) 431-9404
Joung Yoo,3.0,"Nice ambiance, good selection of beer, food is small portions and could use an upgrade.",a year ago,Closed,Anthony's Coal Fired Pizza 10 Sterling Blvd ENGLEWOOD NJ 07631-4834 (201) 431-9404
Irene C,5.0,"Friendly service,  good pizza.",7 months ago,Closed,Anthony's Coal Fired Pizza 10 Sterling Blvd ENGLEWOOD NJ 07631-4834 (201) 431-9404
Chantay Robinson,5.0,"Always smells good here and always someone dining, gotta be a great place to eat",a year ago,Closed,Anthony's Coal Fired Pizza 10 Sterling Blvd ENGLEWOOD NJ 07631-4834 (201) 431-9404
Jade Lefebvre Vignati,5.0,"After reading the few reviews left on the owner Nick, we were unsure about going but finally it was a great decision. The food was great and so was the service. Highly recommend",2 years ago,Closed,Anthony's Coal Fired Pizza 10 Sterling Blvd ENGLEWOOD NJ 07631-4834 (201) 431-9404
Reut Levi,1.0,"Let’s talk about their mozzarella and tomato DISH!!
What in the world ? I’m not gonna serve that dish even for my enemies!!!
The tomato tase like the bottom of the fridge (EXPIRED). the mozzarella was (OK) the only good thing about this dish was the vinegar !!!",a year ago,Closed,Anthony's Coal Fired Pizza 10 Sterling Blvd ENGLEWOOD NJ 07631-4834 (201) 431-9404
Jerome M,5.0,"Great staff, great pizza. Very family friendly so we find ourselves there with our 1yr old daughter there almost weekly when we need a break or just want a lively and welcoming ambience.",a year ago,Closed,Anthony's Coal Fired Pizza 10 Sterling Blvd ENGLEWOOD NJ 07631-4834 (201) 431-9404
Jessica Panicucci,5.0,"I love Anthony's but the two that are closer to me (Fair Lawn and Ramsey) are always super crowded and there is a long wait to get in. I was headed this was on a Saturday night so I called to make a reservation so I wouldn't have to wait and she said you can just walk in. I was shocked at how empty it was. The food and service was excellent. I think from now on, I will drive the little bit further distance to get my favorite wings, meatballs and some arugula and/or roasted cauliflower pizza.",2 years ago,Closed,Anthony's Coal Fired Pizza 10 Sterling Blvd ENGLEWOOD NJ 07631-4834 (201) 431-9404
Lisa Nachberg,4.0,The freshest tasting simply prepared and delish food. Always a great dining out experience. And so reasonable.,2 years ago,Closed,Anthony's Coal Fired Pizza 10 Sterling Blvd ENGLEWOOD NJ 07631-4834 (201) 431-9404
Ken Hart,5.0,"Excellent pizza, the best I've had at any chain restaurant. Very attractive interiors, too, with dark wood and many autographed sports photos on the walls.",a year ago,Closed,Anthony's Coal Fired Pizza 10 Sterling Blvd ENGLEWOOD NJ 07631-4834 (201) 431-9404
Jordan Urbaczek,5.0,"Pizza was great, other apps were good. No complaints, staff was very kind.",a year ago,Closed,Anthony's Coal Fired Pizza 10 Sterling Blvd ENGLEWOOD NJ 07631-4834 (201) 431-9404
Guillermo Builes,5.0,"Thursday nights at Anthony's has become part of my day. The service here is always phenomenal, the food is always delicious, and the drinks are always great. The staff is courteous, friendly, and make you feel at home. I guarantee that you'll leave satisfied.",2 years ago,Closed,Anthony's Coal Fired Pizza 10 Sterling Blvd ENGLEWOOD NJ 07631-4834 (201) 431-9404
Gina Palino,5.0,They have cauliflower 🍕!!How cool is that!!??Pizza is Better then the greasy pies you get elsewhere.,a year ago,Closed,Anthony's Coal Fired Pizza 10 Sterling Blvd ENGLEWOOD NJ 07631-4834 (201) 431-9404
Chiquita Ross,5.0,Great food.  Great lunchtime prices.   Great drinks.,a year ago,Closed,Anthony's Coal Fired Pizza 10 Sterling Blvd ENGLEWOOD NJ 07631-4834 (201) 431-9404
Wisetargo Bio,5.0,"Great place, and really tasty coal pizza and ribs ( very not)",a year ago,Closed,Anthony's Coal Fired Pizza 10 Sterling Blvd ENGLEWOOD NJ 07631-4834 (201) 431-9404
Rani Rani,5.0,Excellent food and service,a year ago,Closed,Anthony's Coal Fired Pizza 10 Sterling Blvd ENGLEWOOD NJ 07631-4834 (201) 431-9404
Nelson Abrahante,5.0,Arleny's service was very good and the food was excellent.,a year ago,Closed,Anthony's Coal Fired Pizza 10 Sterling Blvd ENGLEWOOD NJ 07631-4834 (201) 431-9404
Karna Patel,3.0,Margarita pizza is ok everything else wasn't worth it.,10 months ago,Closed,Anthony's Coal Fired Pizza 10 Sterling Blvd ENGLEWOOD NJ 07631-4834 (201) 431-9404
Aimee W.,5.0,Omg I love this can place. Their pizza is great but there salad is ...yum...This is a definite destinatiion every time I go back to the area to visit family.,a year ago,Closed,Anthony's Coal Fired Pizza 10 Sterling Blvd ENGLEWOOD NJ 07631-4834 (201) 431-9404
Te-Sheng Lin,3.0,I ordered the chicken wings & Eggplant Marino and they were good. We also got a small free pizza but it was kind of harder than we thought. Overall it was a decent pizza bar restaurant with outdoor seatings during summertime and is located on the Rt 4 east next to the Panera and a wireless store with plenty of parking spaces.,a year ago,Closed,Anthony's Coal Fired Pizza 10 Sterling Blvd ENGLEWOOD NJ 07631-4834 (201) 431-9404
Tom Shaw,5.0,Super good yummy,a year ago,Closed,Anthony's Coal Fired Pizza 10 Sterling Blvd ENGLEWOOD NJ 07631-4834 (201) 431-9404
P I,1.0,"I was dining in at you Englewood location the other night and was totally disrespected by your manager Nick. I had my food come out incorrect and he got in my face and told me there’s no way it’s wrong i made it myself. Well first off he shouldn’t have got in my face, very disrespectful and second off if he’s handling money which i saw him do he shouldn’t be handling food. I will never set foot in Anthony’s again and will be posting the video i took of his rant to my social media profile. Shame on Anthony’s for not training your managers on how to treat customers. What a totally disgusting experience that Nick delivered.",2 years ago,Closed,Anthony's Coal Fired Pizza 10 Sterling Blvd ENGLEWOOD NJ 07631-4834 (201) 431-9404
Mark Thompson,2.0,Average pizza curiously devoid of any coal-fired flavor...  The beer selection is good...,a year ago,Closed,Anthony's Coal Fired Pizza 10 Sterling Blvd ENGLEWOOD NJ 07631-4834 (201) 431-9404
Michael M,5.0,Great pizza and wings. Fair price and great location. Definitely coming back,2 years ago,Closed,Anthony's Coal Fired Pizza 10 Sterling Blvd ENGLEWOOD NJ 07631-4834 (201) 431-9404
R Dell,5.0,Delicious pizzas and friendly service. Highly recommended.,a year ago,Closed,Anthony's Coal Fired Pizza 10 Sterling Blvd ENGLEWOOD NJ 07631-4834 (201) 431-9404
Jason Sharp,3.0,"Friendly staff, good ambiance, but all I taste is burnt crust.",2 years ago,Closed,Anthony's Coal Fired Pizza 10 Sterling Blvd ENGLEWOOD NJ 07631-4834 (201) 431-9404
steven perez,1.0,"horrible service, management from Rob is horrible always out of everything.",9 months ago,Closed,Anthony's Coal Fired Pizza 10 Sterling Blvd ENGLEWOOD NJ 07631-4834 (201) 431-9404
Ty McCollum,4.0,"The pizza seemed a little light on the cheese but the crust, sauce, and meats were excellent.",a year ago,Closed,Anthony's Coal Fired Pizza 10 Sterling Blvd ENGLEWOOD NJ 07631-4834 (201) 431-9404
Ernest Kruah,4.0,Alright for a quick bite,a year ago,Closed,Anthony's Coal Fired Pizza 10 Sterling Blvd ENGLEWOOD NJ 07631-4834 (201) 431-9404
Marty Singer,5.0,Excellent food and great service!!!,a year ago,Closed,Anthony's Coal Fired Pizza 10 Sterling Blvd ENGLEWOOD NJ 07631-4834 (201) 431-9404
Max Link,5.0,Always good Pizza and the wings are Great. Mike is a awesome waiter as well,2 years ago,Closed,Anthony's Coal Fired Pizza 10 Sterling Blvd ENGLEWOOD NJ 07631-4834 (201) 431-9404
Vee p,5.0,Great customer service and food,a year ago,Closed,Anthony's Coal Fired Pizza 10 Sterling Blvd ENGLEWOOD NJ 07631-4834 (201) 431-9404
Chanda Fisher,5.0,"Great service, great atmosphere and great food",2 years ago,Closed,Anthony's Coal Fired Pizza 10 Sterling Blvd ENGLEWOOD NJ 07631-4834 (201) 431-9404
Suranjit Mukhopadhyay,4.0,Great pizzas & excellent service!,a year ago,Closed,Anthony's Coal Fired Pizza 10 Sterling Blvd ENGLEWOOD NJ 07631-4834 (201) 431-9404
tom phelan,3.0,"It's alright.  Had the white pie and some wings.  They were both good, but it didn't justify the price.  For those prices it should have been much better.",2 years ago,Closed,Anthony's Coal Fired Pizza 10 Sterling Blvd ENGLEWOOD NJ 07631-4834 (201) 431-9404
Lauren Scher,5.0,Really good food. Friendly staff.,a year ago,Closed,Anthony's Coal Fired Pizza 10 Sterling Blvd ENGLEWOOD NJ 07631-4834 (201) 431-9404
Sharon Tiensch-Forrester,4.0,"I visited this place on a Sunday evening with friends. They had great meatballs, the margarita pizza and cauliflower pizzas were great and they had a great beer selection. This is a pretty cool place, I'd totally go back.",3 years ago,Closed,Anthony's Coal Fired Pizza 10 Sterling Blvd ENGLEWOOD NJ 07631-4834 (201) 431-9404
Emily Jacobs,5.0,"Wings are excellent, the coal fired pizza hits the spot every time. Kudos",2 years ago,Closed,Anthony's Coal Fired Pizza 10 Sterling Blvd ENGLEWOOD NJ 07631-4834 (201) 431-9404
Christina W,5.0,Didn't get anything but everything looked amazing and the atmosphere is very good.,2 years ago,Closed,Anthony's Coal Fired Pizza 10 Sterling Blvd ENGLEWOOD NJ 07631-4834 (201) 431-9404
David Weisenstein,1.0,Food was ice cold. Meatballs were in a sauce of watered down tomatoe sauce.  Nick “the manager” was rude and disrespectful to my group of friends. Avoid this place at all costs.i would give zero stars if I could. Nick should get -10 for his attitude.,2 years ago,Closed,Anthony's Coal Fired Pizza 10 Sterling Blvd ENGLEWOOD NJ 07631-4834 (201) 431-9404
Cendy Rosario,4.0,"Came here for the first time this past Friday and had the eggplant and margherita pizza. Both were Delicious. However, service wasn’t that good. We decided to come back the next day since we were around the area the pizza was and decided to try the wings. Don’t believe the hype! The wings were just ok and to be honest I don’t know where the onions come into play. And service was again bad. I would come back for food and beer tho.",2 years ago,Closed,Anthony's Coal Fired Pizza 10 Sterling Blvd ENGLEWOOD NJ 07631-4834 (201) 431-9404
Philip Tribble,5.0,Very great food and good place to eat. Awesome service from the workers there.,2 years ago,Closed,Anthony's Coal Fired Pizza 10 Sterling Blvd ENGLEWOOD NJ 07631-4834 (201) 431-9404
Sophia Pinzon,4.0,"Very nice place. Clean. Friendly staff. Prices are a bit expensive. The pizza tastes good but overpriced for the sizing/portions. Not many appetizers, especially ones you see in any other pizzeria (garlic knots, hot wings). Outdoor seating is available as well as bar, hightop, and regular tables.",4 years ago,Closed,Anthony's Coal Fired Pizza 10 Sterling Blvd ENGLEWOOD NJ 07631-4834 (201) 431-9404
thomas hanson,5.0,Great pizza and great service,a year ago,Closed,Anthony's Coal Fired Pizza 10 Sterling Blvd ENGLEWOOD NJ 07631-4834 (201) 431-9404
Jake Tucker,3.0,Slow service and limited menue. Reason for the third star is the food is very good.,2 years ago,Closed,Anthony's Coal Fired Pizza 10 Sterling Blvd ENGLEWOOD NJ 07631-4834 (201) 431-9404
Walter Croft,5.0,Easy parking off Rte 4 eastbound; nice table setup n bar area; very attentive service staff and great pizza;,2 years ago,Closed,Anthony's Coal Fired Pizza 10 Sterling Blvd ENGLEWOOD NJ 07631-4834 (201) 431-9404
Jacob Chavez,2.0,"Food was okay, nothing didn't really seem that great! The pizza was good, but the wings were burnt. I understand that the wings could be well done but not burnt. Theres a difference between the two and need to be learned. Beer was good, no much of a variety. All in all the pizza was good but the wings need to be less burnt.",2 years ago,Closed,Anthony's Coal Fired Pizza 10 Sterling Blvd ENGLEWOOD NJ 07631-4834 (201) 431-9404
Jane Manzari,5.0,Great pizza,7 months ago,Closed,Anthony's Coal Fired Pizza 10 Sterling Blvd ENGLEWOOD NJ 07631-4834 (201) 431-9404
Bryan Siddall,5.0,"Meatballs and wings, oh my!  Good service. Nice new space.  And great food with quality ingredients.",3 years ago,Closed,Anthony's Coal Fired Pizza 10 Sterling Blvd ENGLEWOOD NJ 07631-4834 (201) 431-9404
Charlie Unagast,5.0,"The chicken wings are unlike any wings i have ever had,  i am obsessed with them.  The onion and bread with the wings are phenominal too.  The pizza is about as top rate as you're going to find.  The crust is the most obvious thing you'll notice,   the coal fire oven really cooks everything perfectly.  One of my fav Pizza spots.",2 years ago,Closed,Anthony's Coal Fired Pizza 10 Sterling Blvd ENGLEWOOD NJ 07631-4834 (201) 431-9404
Miguel Villamil,5.0,Great pizza and drinks. I usually visit them for happy hour.,2 years ago,Closed,Anthony's Coal Fired Pizza 10 Sterling Blvd ENGLEWOOD NJ 07631-4834 (201) 431-9404
Andrew Philipps,5.0,Great happy hour - drinks and food!  Plus amazing meatballs.,3 years ago,Closed,Anthony's Coal Fired Pizza 10 Sterling Blvd ENGLEWOOD NJ 07631-4834 (201) 431-9404
claudio castillo,5.0,Excellent afmofer outstanding pizza duck a cool place,2 years ago,Closed,Anthony's Coal Fired Pizza 10 Sterling Blvd ENGLEWOOD NJ 07631-4834 (201) 431-9404
Stacey Torres,5.0,Nice atmosphere. A little small though. Great beer selection and the food was very good and came out very quickly.,3 years ago,Closed,Anthony's Coal Fired Pizza 10 Sterling Blvd ENGLEWOOD NJ 07631-4834 (201) 431-9404
Jessica Mancia,5.0,Amazing food. Meatballs are the best around.,2 years ago,Closed,Anthony's Coal Fired Pizza 10 Sterling Blvd ENGLEWOOD NJ 07631-4834 (201) 431-9404
Gary Middleton,3.0,"A good pizza, fine service, nothing particularly notable.",2 years ago,Closed,Anthony's Coal Fired Pizza 10 Sterling Blvd ENGLEWOOD NJ 07631-4834 (201) 431-9404
