name,stars,text,timeSince,openStatus,key
Luis Hallancia,5.0,I Love Anthony’s Coal Fire Pizza!!! Simple the best food with great service to boot,a year ago,Open,Anthony's Coal Fired Pizza 10205 S Dixie Hwy PINECREST FL 33156-3167 (305) 740-5800
Leylani Rubio,4.0,The beer was cold and the pizza was hot. Only complaint was no Buffalo for the wings and the margherita pizza was very well done. The pepperoni of course was nice.,a year ago,Open,Anthony's Coal Fired Pizza 10205 S Dixie Hwy PINECREST FL 33156-3167 (305) 740-5800
Victor Rodriguez,3.0,"Great food, poor customer service. These kids spend more time talking to each other than talking care of customers.",a year ago,Open,Anthony's Coal Fired Pizza 10205 S Dixie Hwy PINECREST FL 33156-3167 (305) 740-5800
William Mora,5.0,"I was invited to this place on my birthday and I was not disappointed the place,was awesome the servers excellent overall I was very pleased .",a year ago,Open,Anthony's Coal Fired Pizza 10205 S Dixie Hwy PINECREST FL 33156-3167 (305) 740-5800
Herga Noda,5.0,Great food and drinks strongly recommended!!,8 months ago,Open,Anthony's Coal Fired Pizza 10205 S Dixie Hwy PINECREST FL 33156-3167 (305) 740-5800
Gisella Alfaro,5.0,"This is a hidden gem, very cozy atmosphere, family friendly and the stuff is very charismatic",a year ago,Open,Anthony's Coal Fired Pizza 10205 S Dixie Hwy PINECREST FL 33156-3167 (305) 740-5800
Elias Kawa,1.0,It's supposed to have high quality ingredients but the final product doesn't prove to be true. Pizza doesn't have enough cheese and is overwhelmed with tomato sauce. The meatballs are equal to a chewy rubber band. Food wasn't good enough to be priced where it's at the moment. And service was bland,2 years ago,Open,Anthony's Coal Fired Pizza 10205 S Dixie Hwy PINECREST FL 33156-3167 (305) 740-5800
Rey R,5.0,Great pizza and service as usual.  Had the wings for the first time and I have to say they were surprisingly really good.,a year ago,Open,Anthony's Coal Fired Pizza 10205 S Dixie Hwy PINECREST FL 33156-3167 (305) 740-5800
bryan osborne,5.0,"Fresh tasting,  fantastic!
Excellent service!",11 months ago,Open,Anthony's Coal Fired Pizza 10205 S Dixie Hwy PINECREST FL 33156-3167 (305) 740-5800
M A,1.0,Excessive wait time and horrible service at the take out counter. If a restaurant is busy then have enough friendly staff to help customers especially on the weekends. Horrible service.,11 months ago,Open,Anthony's Coal Fired Pizza 10205 S Dixie Hwy PINECREST FL 33156-3167 (305) 740-5800
LaKisha Richardson Jones,5.0,A hidden gem with wonderful service. The wait staff and manager were very attentive.  The food was deliciously authentic.,a year ago,Open,Anthony's Coal Fired Pizza 10205 S Dixie Hwy PINECREST FL 33156-3167 (305) 740-5800
John Joffre,5.0,"Good product, good service but expensive",a year ago,Open,Anthony's Coal Fired Pizza 10205 S Dixie Hwy PINECREST FL 33156-3167 (305) 740-5800
Vanessa Velasquez,1.0,"I used to love this place. Now its changed. My pizza orders have arrived with different sized slides. Therefore I’ve come to the conclusion that they re-use slices and cook them again. My burnt crust is proof that they cooked it again. Due to this, the dough came back chewy and old. Dissapointed is an understatement.",a year ago,Open,Anthony's Coal Fired Pizza 10205 S Dixie Hwy PINECREST FL 33156-3167 (305) 740-5800
Giselle Perez,5.0,"really good food, good customer service",11 months ago,Open,Anthony's Coal Fired Pizza 10205 S Dixie Hwy PINECREST FL 33156-3167 (305) 740-5800
Mayling Lopez-Silvero,4.0,We commemorated my son Adrian's birthday there. If he would not have been murdered Adrian would have been 29 years old. He loved pizza. 14 of his lifelong friends joined me there.,a year ago,Open,Anthony's Coal Fired Pizza 10205 S Dixie Hwy PINECREST FL 33156-3167 (305) 740-5800
Richard Cabrera,4.0,"Good food, a bit small but cozy. Food is a bit pricey",a year ago,Open,Anthony's Coal Fired Pizza 10205 S Dixie Hwy PINECREST FL 33156-3167 (305) 740-5800
Edward Young,5.0,This pizza here is excellent 👏🏻,10 months ago,Open,Anthony's Coal Fired Pizza 10205 S Dixie Hwy PINECREST FL 33156-3167 (305) 740-5800
Elisa Granados,5.0,"Their wings and pizza are ON POINT!  Jazmin H., my waitress was awesome; she went above  and beyond her duties.  I would definitely recommend ACFP to everyone.",a year ago,Open,Anthony's Coal Fired Pizza 10205 S Dixie Hwy PINECREST FL 33156-3167 (305) 740-5800
louie porto,4.0,"So i went to this restaurant instead of the one on kendall drive because my daughter has never been. We order 20 wings a meatball and ricotta pizza a square cheese pizza a sparkling water a beer and two waters. For starters the waiter brings a sprite instead of the sparkling water,no big deal he corrects his mistake... everything was delicious. So we had some left over slices of pizza so we ask for them to go then he leaves to the kitchen with the leftovers and kicks the swinging kitchen doors open with his foot and drops the slices on the floor. The whole time im looking at the kitchen cause we were seated right by the register and I can see everything. The guy picks up the slices and some coworkers witness this also. So im thinking ok this guy is throwing them out and hes probably gonna apologize and maybe compensate us or do or say something about what just happened but this douchebag comes back with a box like nothing happened and denies it to my face,whats even worse is that coworkers saw this too and said nothing. This is the worst and most disgusting experience ive had in a restaurant, I will never eat there again and definitely will not recommend that location to anyone. I cant believe this kinda stuff happens and no one said anything. Manager was nice but I dont even know what to say cause that was a terrible and disgusting experience. If I didnt see it we would have eaten pizza that fell on the floor, unacceptable! UPDATE !!! I was contacted by management and everything was resolved in a professional manner and Im very pleased with the outcome,thanks.",a year ago,Open,Anthony's Coal Fired Pizza 10205 S Dixie Hwy PINECREST FL 33156-3167 (305) 740-5800
Raul Ramos,5.0,Their pizza is my granddaughter’s favorite,8 months ago,Open,Anthony's Coal Fired Pizza 10205 S Dixie Hwy PINECREST FL 33156-3167 (305) 740-5800
Gerald Atilus,5.0,Little bit of a switch from your traditional Pizza I love it,10 months ago,Open,Anthony's Coal Fired Pizza 10205 S Dixie Hwy PINECREST FL 33156-3167 (305) 740-5800
john schultz,4.0,They were really busy that night. Its noisy not  a family place a cross between sports bar and restaurant. pretty good thin pizza sorta light on the good stuff. I wanrted for more Sauce and cheese,a year ago,Open,Anthony's Coal Fired Pizza 10205 S Dixie Hwy PINECREST FL 33156-3167 (305) 740-5800
Martha Rivas,5.0,This location on US1 and 112th Street is by far my favorite I've been to other Anthony's and none of them are quite the same as this one it's just very consistent in the quality of the food and customer service. I especially love the cauliflower pizza.,a year ago,Open,Anthony's Coal Fired Pizza 10205 S Dixie Hwy PINECREST FL 33156-3167 (305) 740-5800
JC Zambrana,4.0,"Awesome food, the pies are bit different than NY style but good.",a year ago,Open,Anthony's Coal Fired Pizza 10205 S Dixie Hwy PINECREST FL 33156-3167 (305) 740-5800
Dashiell Torralba,5.0,Delicious.... I love this place,10 months ago,Open,Anthony's Coal Fired Pizza 10205 S Dixie Hwy PINECREST FL 33156-3167 (305) 740-5800
ZAHEER MOHAMED,4.0,Really good pizza. The wings are great also.,a year ago,Open,Anthony's Coal Fired Pizza 10205 S Dixie Hwy PINECREST FL 33156-3167 (305) 740-5800
Dream Menace,5.0,"Delicious food & great service. The manager, Obi, was very attentive, knowledgeable & so much fun. I would definitely recommend & will be return often.",2 years ago,Open,Anthony's Coal Fired Pizza 10205 S Dixie Hwy PINECREST FL 33156-3167 (305) 740-5800
Elio Pascual,5.0,"First time here and the minute you walk through the door you are greeted with smiles and great service. A family-friendly place with amazing dishes. Including their meatballs, which one of the managers was so kind to bring a sample and welcome us himself. I recommend this place if your in the mood for a great time and some coal fried pizza & much more!",3 years ago,Open,Anthony's Coal Fired Pizza 10205 S Dixie Hwy PINECREST FL 33156-3167 (305) 740-5800
Manfred Delgado,5.0,Great please if you are looking for a good pizza or a Calzone or a sandwich or salad. Excellent service and environment. I love this place.,2 years ago,Open,Anthony's Coal Fired Pizza 10205 S Dixie Hwy PINECREST FL 33156-3167 (305) 740-5800
Rolando Hernandez,5.0,Great food and service.,a year ago,Open,Anthony's Coal Fired Pizza 10205 S Dixie Hwy PINECREST FL 33156-3167 (305) 740-5800
Lou R.,2.0,Food was very tasty but my wings were actually Cold? Made them a long while before I ordered. Server was almost invisible. No chemistry or personality. Won't be back for quite a while. Plus...$8.50 for a Craft Beer? Wow.,2 years ago,Open,Anthony's Coal Fired Pizza 10205 S Dixie Hwy PINECREST FL 33156-3167 (305) 740-5800
Albertico 305,4.0,"Very good pizza.  Had a good crispy crust you get from a coal fired oven.  Had the meatballs as an appetizer (very good, Italian style).",2 years ago,Open,Anthony's Coal Fired Pizza 10205 S Dixie Hwy PINECREST FL 33156-3167 (305) 740-5800
Hector Aedo,3.0,"Good pizza, great wings, good service BUT pricey compared to other very good pizza parlors.",a year ago,Open,Anthony's Coal Fired Pizza 10205 S Dixie Hwy PINECREST FL 33156-3167 (305) 740-5800
Ingemar Callejas,5.0,"Good food, good service.",a year ago,Open,Anthony's Coal Fired Pizza 10205 S Dixie Hwy PINECREST FL 33156-3167 (305) 740-5800
Kulsum Hasan,5.0,Love their hot pepper pizza,11 months ago,Open,Anthony's Coal Fired Pizza 10205 S Dixie Hwy PINECREST FL 33156-3167 (305) 740-5800
Jerry Rudoff,4.0,Could be better..you must tell them not to to over cook pizza,a year ago,Open,Anthony's Coal Fired Pizza 10205 S Dixie Hwy PINECREST FL 33156-3167 (305) 740-5800
R Mederos,5.0,Great pizzas. Had a group of 20. The pizzas came out quickly however service was a little slow refilling our drinks!!,a year ago,Open,Anthony's Coal Fired Pizza 10205 S Dixie Hwy PINECREST FL 33156-3167 (305) 740-5800
Patricia Vasquez San Julian,5.0,"I absolutely love this place!
My husband and I visit this place twice a week and always find good service, delicious food, the atmosphere is great. We got to know Robert, the manager and he was amazing not only with us but with the employees. Recommended 100%",3 years ago,Open,Anthony's Coal Fired Pizza 10205 S Dixie Hwy PINECREST FL 33156-3167 (305) 740-5800
Bianca Fontana,4.0,Love their pizza and service! better than other locations to me it's the Best!,a year ago,Open,Anthony's Coal Fired Pizza 10205 S Dixie Hwy PINECREST FL 33156-3167 (305) 740-5800
Maximilian Rodriguez,5.0,Family friendly sit down style place.  Very clean and hip.  Prices are OK.  Food is worth it in quality.  I have had pretty much everything on the menu over years of going to this place and it has been exceptionally good.,2 years ago,Open,Anthony's Coal Fired Pizza 10205 S Dixie Hwy PINECREST FL 33156-3167 (305) 740-5800
Sonia Manners,5.0,"Definitely worth the wait; If you are a pizza lover like myself, you must go here!I would definitely recommend stopping by here and trying their food.",a year ago,Open,Anthony's Coal Fired Pizza 10205 S Dixie Hwy PINECREST FL 33156-3167 (305) 740-5800
George Chehade Xacur,5.0,"It is an excellent place if you feel like having an pizza an something extra. I had the chicken wings and totally recommend them as a starter. If you feel like it, the salad with gorgonzola cheese is a must. We also tried a prosciutto pizza with mushrooms that is amazing. All these with an excellent choice of wines.",2 years ago,Open,Anthony's Coal Fired Pizza 10205 S Dixie Hwy PINECREST FL 33156-3167 (305) 740-5800
Brandon C,5.0,Great pizza and great service,a year ago,Open,Anthony's Coal Fired Pizza 10205 S Dixie Hwy PINECREST FL 33156-3167 (305) 740-5800
Ramon Guiardinu,4.0,"I had a grate experience on this place. I came here with a my family and some friends. It was busy, but we didnt wait too long to get our food. The customer service was the best as the hot wings, the pizza, the salads and the drinks. The only problem was that the guy taking care of me don't spoke Spanish and some of the member of my family couldn't communicate with him but every thing else was great.",2 years ago,Open,Anthony's Coal Fired Pizza 10205 S Dixie Hwy PINECREST FL 33156-3167 (305) 740-5800
Elaine de Valle,5.0,"Love those chicken wings with th
e caramelized onions. Staff is so welcoming and nice.",a year ago,Open,Anthony's Coal Fired Pizza 10205 S Dixie Hwy PINECREST FL 33156-3167 (305) 740-5800
Jose Aninat,5.0,Best Pizza in South Florida!,9 months ago,Open,Anthony's Coal Fired Pizza 10205 S Dixie Hwy PINECREST FL 33156-3167 (305) 740-5800
DEBBIE POTTER,5.0,"Great waitress
Food was good
Uncontrollable disrespectable children at next table.
Waitress was so patient with them. Shame on parents for letting them run around and dance all over.",2 years ago,Open,Anthony's Coal Fired Pizza 10205 S Dixie Hwy PINECREST FL 33156-3167 (305) 740-5800
Elizabeth Carrasco,5.0,As always great,7 months ago,Open,Anthony's Coal Fired Pizza 10205 S Dixie Hwy PINECREST FL 33156-3167 (305) 740-5800
Happy One,5.0,Always great.  Great food and service.  Glad they finally make a Cesar salad dressing.,2 years ago,Open,Anthony's Coal Fired Pizza 10205 S Dixie Hwy PINECREST FL 33156-3167 (305) 740-5800
CHU !,5.0,"Wish take out would add plates, napkins, pepper, and parm cheese without having to ask everytime.",a year ago,Open,Anthony's Coal Fired Pizza 10205 S Dixie Hwy PINECREST FL 33156-3167 (305) 740-5800
Rhode Enriquez,5.0,Excellent service!. Delicious pizza.  Great atmosphere. We had a great time with the family! .,2 years ago,Open,Anthony's Coal Fired Pizza 10205 S Dixie Hwy PINECREST FL 33156-3167 (305) 740-5800
Alejandro Carmenate,5.0,"WOW!! I have been at this location several times but they have perfected the experience. Service, food, and prices are great. They switched from bottled sodas to fountain which is long overdue. 100% recommended.",3 years ago,Open,Anthony's Coal Fired Pizza 10205 S Dixie Hwy PINECREST FL 33156-3167 (305) 740-5800
John Rich,3.0,"The pizza was good, the place was slammed, I waited an additional 20 minutes for my online ordered pizza because the girl behind the register didn't look in the stack my pie was in. Not happy.",a year ago,Open,Anthony's Coal Fired Pizza 10205 S Dixie Hwy PINECREST FL 33156-3167 (305) 740-5800
Angie Thillet,5.0,"This was my first visit with my family. The quality of the pizza, sauce, service and ambience were all superb! We will sure be back soon!",2 years ago,Open,Anthony's Coal Fired Pizza 10205 S Dixie Hwy PINECREST FL 33156-3167 (305) 740-5800
TK-421,5.0,Great meatball sandwich and exceptional service,a year ago,Open,Anthony's Coal Fired Pizza 10205 S Dixie Hwy PINECREST FL 33156-3167 (305) 740-5800
Johanna Mendez,5.0,The Mediterranean pizza was soooo good,a year ago,Open,Anthony's Coal Fired Pizza 10205 S Dixie Hwy PINECREST FL 33156-3167 (305) 740-5800
carmen r,5.0,"Great service, great pizza! Really good ambiance.",a year ago,Open,Anthony's Coal Fired Pizza 10205 S Dixie Hwy PINECREST FL 33156-3167 (305) 740-5800
Lily Balleste,2.0,There are 2 servers for entire restaurant. My food came out incorrectly and my take out order as well. So my food was getting cold while I wait for the other. This was ridiculous!!,a year ago,Open,Anthony's Coal Fired Pizza 10205 S Dixie Hwy PINECREST FL 33156-3167 (305) 740-5800
Moira Suro,5.0,Loved ! Burrata and rúcula salad a must ! The best pizzas ever !,a year ago,Open,Anthony's Coal Fired Pizza 10205 S Dixie Hwy PINECREST FL 33156-3167 (305) 740-5800
Kevin S,5.0,Wowwwwwwwwwwwwwwwwwwwwwwwwwwwwwwwwwwwwwwwwwwwwwwwwwwwwwww the pizza is out of this world different. The wings too a must try,a year ago,Open,Anthony's Coal Fired Pizza 10205 S Dixie Hwy PINECREST FL 33156-3167 (305) 740-5800
Bjorn Hansen,1.0,"Waited 90 minutes for an order that never arrived via uber eats. Our driver, Oscar (uber eats code kdka04) completely scammed us.

First he claims hes slow because of traffic. Total bs. I just got off us1. There was no traffic. Then hes driving left and right, aimlessly and stops at an adreess far from us and calls me. I tell him hes far and where to go and he says “ok i go here”. He turns around , srives in the opposite direction and cancels the order. Unbelievable!!!",a year ago,Open,Anthony's Coal Fired Pizza 10205 S Dixie Hwy PINECREST FL 33156-3167 (305) 740-5800
Marybeth Flanigan,4.0,"Been to the one in Wellington FL. They do have one in CT. I haven't been to it yet,not sure where it is located yet,can't remember. I do know they have them up and down the east coast. Last time saw the list there was around 15  to 20 locations",a year ago,Open,Anthony's Coal Fired Pizza 10205 S Dixie Hwy PINECREST FL 33156-3167 (305) 740-5800
Andres Cantillo,5.0,Pizza is always great and customer service is always A+. The wait is a bit long but that's expected from a popular place.,a year ago,Open,Anthony's Coal Fired Pizza 10205 S Dixie Hwy PINECREST FL 33156-3167 (305) 740-5800
Juan E. Papadopulos,4.0,"Great service and food. Took some time to get seated. We were 20, but had a reservation.",2 years ago,Open,Anthony's Coal Fired Pizza 10205 S Dixie Hwy PINECREST FL 33156-3167 (305) 740-5800
jean u,5.0,It's a good place to eat Italian pizza,a year ago,Open,Anthony's Coal Fired Pizza 10205 S Dixie Hwy PINECREST FL 33156-3167 (305) 740-5800
Rey Lopez,5.0,Best pizza in south Florida! This specific location has been top notch all away around compared to other locations. Top it off with their cheesecake and cappuccino baby.,2 years ago,Open,Anthony's Coal Fired Pizza 10205 S Dixie Hwy PINECREST FL 33156-3167 (305) 740-5800
Martha Roa,4.0,Good pizza and good service.,a year ago,Open,Anthony's Coal Fired Pizza 10205 S Dixie Hwy PINECREST FL 33156-3167 (305) 740-5800
Felipe Barreda,2.0,The wings and salad are always great but the pizza always comes out burnt.   Staff are friendly and helpful.,a year ago,Open,Anthony's Coal Fired Pizza 10205 S Dixie Hwy PINECREST FL 33156-3167 (305) 740-5800
Robert Lepore,3.0,"Their pizza can be very good, but more than infrequently it is not.  If I were to label the complaint, poor quality control would come to mind.  Maybe the pizza is woefully short of sauce, or it is undercooked, or overcooked.  It includes a topping not chosen.  One of the above and more can occur and does.  The place is usually busy and hectic, so when you are asked to check out your pizzas on a very crowded, busy floor, before leaving, it can be rather hard to confirm that they are adequate.  And besides, it is their job to ensure quality, and as pizza goes even in Miami, they are not inexpensive!  Probably more training is in order for their invariably very young staffs.",4 years ago,Open,Anthony's Coal Fired Pizza 10205 S Dixie Hwy PINECREST FL 33156-3167 (305) 740-5800
Alex Aycart,5.0,"Great food, great service,, but it's to Damm cold.. best place to sit is by fne oven!! Very important",2 years ago,Open,Anthony's Coal Fired Pizza 10205 S Dixie Hwy PINECREST FL 33156-3167 (305) 740-5800
Jaime esquenazi,4.0,The food is AMAZING. Especially the wings and pizza. By far one of the best coal fired pizza places in Miami. The service wasnt that great but the food makes up for it. When you walk it feels like a friendly place.,3 years ago,Open,Anthony's Coal Fired Pizza 10205 S Dixie Hwy PINECREST FL 33156-3167 (305) 740-5800
Susana Maldonado,4.0,Good pizza but you got to try their grilled chicken wings!!! Deliciousssss!!,a year ago,Open,Anthony's Coal Fired Pizza 10205 S Dixie Hwy PINECREST FL 33156-3167 (305) 740-5800
charles hilliard,4.0,Love the atmosphere but the pizza wasn't that good,2 years ago,Open,Anthony's Coal Fired Pizza 10205 S Dixie Hwy PINECREST FL 33156-3167 (305) 740-5800
Arnoldo Figueroa,5.0,"Delicius pizza, excelente service, full of TVs playing different games....👍👍👍",a year ago,Open,Anthony's Coal Fired Pizza 10205 S Dixie Hwy PINECREST FL 33156-3167 (305) 740-5800
Rafael Faria TV,5.0,Nice place super service!!,a year ago,Open,Anthony's Coal Fired Pizza 10205 S Dixie Hwy PINECREST FL 33156-3167 (305) 740-5800
George Belloni,1.0,"Ate here twice this week,  tonight calzone was burnt told the waitress never seen a manager. Neal your away for the week and management really dropped the ball. Pretty bad when a manager can’t see a customer especially when the employees outnumbered customers at the time.  👎.  Customers should never have to ask to see a manager after reporting food not right or good.",a year ago,Open,Anthony's Coal Fired Pizza 10205 S Dixie Hwy PINECREST FL 33156-3167 (305) 740-5800
Destinee Bragwell,5.0,Best meatballs and sangria ever! The service is great every time also!,2 years ago,Open,Anthony's Coal Fired Pizza 10205 S Dixie Hwy PINECREST FL 33156-3167 (305) 740-5800
Renee Bertucci,4.0,Always good food. Like their wings too,a year ago,Open,Anthony's Coal Fired Pizza 10205 S Dixie Hwy PINECREST FL 33156-3167 (305) 740-5800
Diana Santana,4.0,Love their pizzas tho lately seems pricey.,a year ago,Open,Anthony's Coal Fired Pizza 10205 S Dixie Hwy PINECREST FL 33156-3167 (305) 740-5800
Carmen Woody,4.0,Beautiful place with great salads. Pizza too over cooked for me but the salad was great.,2 years ago,Open,Anthony's Coal Fired Pizza 10205 S Dixie Hwy PINECREST FL 33156-3167 (305) 740-5800
Aileen Torres,5.0,"From the moment we got there until the moment we left, the experience was BEYOND EXCELLENT!!! Ursula and Carlos displayed great customer service!!! I feel the food tasted even better because of it!!! We will be returning soon !!!!",3 years ago,Open,Anthony's Coal Fired Pizza 10205 S Dixie Hwy PINECREST FL 33156-3167 (305) 740-5800
Oscar Celorio,4.0,Good service. Love the wings!,2 years ago,Open,Anthony's Coal Fired Pizza 10205 S Dixie Hwy PINECREST FL 33156-3167 (305) 740-5800
German Madrid,5.0,Good Pizza. Good place to go with the family!!! Good attendance!!!👍,a year ago,Open,Anthony's Coal Fired Pizza 10205 S Dixie Hwy PINECREST FL 33156-3167 (305) 740-5800
Jack Reiter,5.0,Anthony's has great salad and wings!,a year ago,Open,Anthony's Coal Fired Pizza 10205 S Dixie Hwy PINECREST FL 33156-3167 (305) 740-5800
Mel C,5.0,Their pizza is amazing. And they are SO friendly. Great place!,3 years ago,Open,Anthony's Coal Fired Pizza 10205 S Dixie Hwy PINECREST FL 33156-3167 (305) 740-5800
Fernanda Rojas,5.0,Great pizza. Great service. Can never go wrong with Anthony's.,2 years ago,Open,Anthony's Coal Fired Pizza 10205 S Dixie Hwy PINECREST FL 33156-3167 (305) 740-5800
Rene Tarafa,1.0,"We have been longtime customers (10 years +) to this location & watched management change time & time again. After our experience yesterday we will not be returning. We had to remind them of missing items, pizza was cold & worst of all, the pot of meatballs (reason we mostly went) tasted like smoke. Way over cooked. This was not peak time, the restaurant was empty.",3 weeks ago,Open,Anthony's Coal Fired Pizza 10205 S Dixie Hwy PINECREST FL 33156-3167 (305) 740-5800
Luisa Romeu,5.0,Great place for family and anyone that's a Sports Enthusiast.  You can feed the family and see the games at the same time.,2 years ago,Open,Anthony's Coal Fired Pizza 10205 S Dixie Hwy PINECREST FL 33156-3167 (305) 740-5800
Wally Perez,5.0,Loved the pizza and salad. You'll pay more for better quality,2 years ago,Open,Anthony's Coal Fired Pizza 10205 S Dixie Hwy PINECREST FL 33156-3167 (305) 740-5800
Fernando Ruiz-Moran,5.0,This place is an excellent pizza and Italian food and very much attention to te clients,2 years ago,Open,Anthony's Coal Fired Pizza 10205 S Dixie Hwy PINECREST FL 33156-3167 (305) 740-5800
Robin Sherrill,5.0,Gianni was our excellent server! Love the food here,2 years ago,Open,Anthony's Coal Fired Pizza 10205 S Dixie Hwy PINECREST FL 33156-3167 (305) 740-5800
Derek Sanders,5.0,Definitely the best pizza in Miami.  Everything on the menu is incredible from the wings to the salad to the pizza.  The entire restaurant is extremely kid-friendly and they'll easily accommodate anyone with an allergy or dietary restriction.  Highly Recommend Anthony's!!!,6 years ago,Open,Anthony's Coal Fired Pizza 10205 S Dixie Hwy PINECREST FL 33156-3167 (305) 740-5800
Zion Tea,5.0,Mmmmm,10 months ago,Open,Anthony's Coal Fired Pizza 10205 S Dixie Hwy PINECREST FL 33156-3167 (305) 740-5800
Nory Aldama,5.0,Best pizza ever!,a year ago,Open,Anthony's Coal Fired Pizza 10205 S Dixie Hwy PINECREST FL 33156-3167 (305) 740-5800
Mlton Mercade,5.0,Excellent as always. Tryed something new and WOW FRESH tomatos basil ricotta .,2 years ago,Open,Anthony's Coal Fired Pizza 10205 S Dixie Hwy PINECREST FL 33156-3167 (305) 740-5800
Wilson Kuan,5.0,I'm never dissapointed.  I ussually have Anthony's Favorite sandwich for a quick bite.,2 years ago,Open,Anthony's Coal Fired Pizza 10205 S Dixie Hwy PINECREST FL 33156-3167 (305) 740-5800
Pablo Pizzini,5.0,100% Satisfied,a year ago,Open,Anthony's Coal Fired Pizza 10205 S Dixie Hwy PINECREST FL 33156-3167 (305) 740-5800
ana davidson,4.0,"Love, the pizza and salad, don't have to wait to long for a table grata time /w family",2 years ago,Open,Anthony's Coal Fired Pizza 10205 S Dixie Hwy PINECREST FL 33156-3167 (305) 740-5800
Frank Figueredo,4.0,Pricing keeps it from bring 5 stars,a year ago,Open,Anthony's Coal Fired Pizza 10205 S Dixie Hwy PINECREST FL 33156-3167 (305) 740-5800
