name,stars,text,timeSince,openStatus,key
Libby Mohaffey,5.0,"Great place for quick,  delicious lunch for one or a group.  Aside from pizza,  try the italian tuna salad - dreamy!",3 years ago,Open,Anthony's Coal Fired Pizza 10205 S Dixie Hwy PINECREST FL 33156-3167 (305) 740-5800
Eric G,4.0,Good pizza.  Nice around round favor,2 years ago,Open,Anthony's Coal Fired Pizza 10205 S Dixie Hwy PINECREST FL 33156-3167 (305) 740-5800
Dolores Delgado,4.0,Good service good food.,2 years ago,Open,Anthony's Coal Fired Pizza 10205 S Dixie Hwy PINECREST FL 33156-3167 (305) 740-5800
steven wong,5.0,Love the pizza love to place definitely go back for more,2 years ago,Open,Anthony's Coal Fired Pizza 10205 S Dixie Hwy PINECREST FL 33156-3167 (305) 740-5800
Lisa E,5.0,Love coming with the family here.  Service is fast and friendly.  Food is great.,3 years ago,Open,Anthony's Coal Fired Pizza 10205 S Dixie Hwy PINECREST FL 33156-3167 (305) 740-5800
maria SJ,5.0,"The service was not the best but the manager went above and beyond to make things right. The food was delicious, i will be back!",2 years ago,Open,Anthony's Coal Fired Pizza 10205 S Dixie Hwy PINECREST FL 33156-3167 (305) 740-5800
Mayra Finale,5.0,Great food! But what truly sets Anthony's apart is its excellent service,2 years ago,Open,Anthony's Coal Fired Pizza 10205 S Dixie Hwy PINECREST FL 33156-3167 (305) 740-5800
Denis Rowan,2.0,"Usually it is very good, however, last night the sausage pizza was full of gristle. Not only could you not eat it, you could not chew it. This was on every piece. First time it ever happened but I will think twice before returning.",7 years ago,Open,Anthony's Coal Fired Pizza 10205 S Dixie Hwy PINECREST FL 33156-3167 (305) 740-5800
RJ P,5.0,"Suprised by the servers there, always very competent and pleasant. Haven't had a bad one yet. Good beer selection.",4 years ago,Open,Anthony's Coal Fired Pizza 10205 S Dixie Hwy PINECREST FL 33156-3167 (305) 740-5800
Alan Sutherland,4.0,Nice place. Good food,2 years ago,Open,Anthony's Coal Fired Pizza 10205 S Dixie Hwy PINECREST FL 33156-3167 (305) 740-5800
William Brown,2.0,Good happy hour at bar just beer and wine,a year ago,Open,Anthony's Coal Fired Pizza 10205 S Dixie Hwy PINECREST FL 33156-3167 (305) 740-5800
jessica prieto,3.0,Ok not great,a year ago,Open,Anthony's Coal Fired Pizza 10205 S Dixie Hwy PINECREST FL 33156-3167 (305) 740-5800
Marcela Penaranda,5.0,Best pizza in town hands down,a year ago,Open,Anthony's Coal Fired Pizza 10205 S Dixie Hwy PINECREST FL 33156-3167 (305) 740-5800
Nicole Russell,3.0,Not a lid friendly establishment. No drinking straw policy nor take out cups for kids.,a year ago,Open,Anthony's Coal Fired Pizza 10205 S Dixie Hwy PINECREST FL 33156-3167 (305) 740-5800
Maya Lawson,4.0,"Pizza is amazing, staff very helpful, but music is very loud.",2 years ago,Open,Anthony's Coal Fired Pizza 10205 S Dixie Hwy PINECREST FL 33156-3167 (305) 740-5800
Miguel Velasquez,4.0,All the pizzas are really good. But the ribs are amazing. The service in this one is really good.,4 years ago,Open,Anthony's Coal Fired Pizza 10205 S Dixie Hwy PINECREST FL 33156-3167 (305) 740-5800
Freddy Raynel,5.0,I like the food.,9 months ago,Open,Anthony's Coal Fired Pizza 10205 S Dixie Hwy PINECREST FL 33156-3167 (305) 740-5800
Sandra Borja,5.0,"Excellent service, excellent food!",2 years ago,Open,Anthony's Coal Fired Pizza 10205 S Dixie Hwy PINECREST FL 33156-3167 (305) 740-5800
Rhonda Burns,5.0,Absolutely loved the impeccable service by all the staff and especially the manager. Visiting from out of town and loved the staff and the food!,3 years ago,Open,Anthony's Coal Fired Pizza 10205 S Dixie Hwy PINECREST FL 33156-3167 (305) 740-5800
Manuel Finale,5.0,"From pies, to wings, to beer. Definitely worth the trip. Sausage and onion is my go-to toppings on my pizza.",3 years ago,Open,Anthony's Coal Fired Pizza 10205 S Dixie Hwy PINECREST FL 33156-3167 (305) 740-5800
Randall Clerk,5.0,Great pizza!,a year ago,Open,Anthony's Coal Fired Pizza 10205 S Dixie Hwy PINECREST FL 33156-3167 (305) 740-5800
Nicole Rose,5.0,The pizza was amazing and the rest of my friends liked it too,2 years ago,Open,Anthony's Coal Fired Pizza 10205 S Dixie Hwy PINECREST FL 33156-3167 (305) 740-5800
Roberto Miki,5.0,I love this pizza and staff is always friendly.,2 years ago,Open,Anthony's Coal Fired Pizza 10205 S Dixie Hwy PINECREST FL 33156-3167 (305) 740-5800
G. Chris Boynton,5.0,"Great fresh salad and great pizza. Also try the sanwiches; tuna, chicken, meatball. All tasty.",4 years ago,Open,Anthony's Coal Fired Pizza 10205 S Dixie Hwy PINECREST FL 33156-3167 (305) 740-5800
carolina valencia,5.0,My favorite spot in town. The pizza always tastes fresh.,2 years ago,Open,Anthony's Coal Fired Pizza 10205 S Dixie Hwy PINECREST FL 33156-3167 (305) 740-5800
Craig DeMott,4.0,Great food and service,2 years ago,Open,Anthony's Coal Fired Pizza 10205 S Dixie Hwy PINECREST FL 33156-3167 (305) 740-5800
Kenneth Goodman,5.0,brilliant.. delicious pizza and meat balls,2 years ago,Open,Anthony's Coal Fired Pizza 10205 S Dixie Hwy PINECREST FL 33156-3167 (305) 740-5800
Eulises Melo,3.0,Service is good but nothing like the one in broward. Gotta come back and see. Service is top notch.,5 years ago,Open,Anthony's Coal Fired Pizza 10205 S Dixie Hwy PINECREST FL 33156-3167 (305) 740-5800
Hector Tagliafico,5.0,Best pizza ever super friendly staff everybody was attentive and nice quick service,3 years ago,Open,Anthony's Coal Fired Pizza 10205 S Dixie Hwy PINECREST FL 33156-3167 (305) 740-5800
Maria Herranz,1.0,I did not like the pork ribs,a year ago,Open,Anthony's Coal Fired Pizza 10205 S Dixie Hwy PINECREST FL 33156-3167 (305) 740-5800
Jessica Heller,5.0,Awesome pizza. Best service!,4 years ago,Open,Anthony's Coal Fired Pizza 10205 S Dixie Hwy PINECREST FL 33156-3167 (305) 740-5800
cesar cuadra,5.0,Good fire coal pizza try the house special and the Salad with Italian dressing wow,4 years ago,Open,Anthony's Coal Fired Pizza 10205 S Dixie Hwy PINECREST FL 33156-3167 (305) 740-5800
WRITING HISTORY,5.0,Great coal fired to perfection,a year ago,Open,Anthony's Coal Fired Pizza 10205 S Dixie Hwy PINECREST FL 33156-3167 (305) 740-5800
kay haley,4.0,Good food...waitress a little careless,a year ago,Open,Anthony's Coal Fired Pizza 10205 S Dixie Hwy PINECREST FL 33156-3167 (305) 740-5800
Maria Poli,5.0,Great experience and our Pizza was delicious!!! We had fresh tomatoes and basil. Try it!!,3 years ago,Open,Anthony's Coal Fired Pizza 10205 S Dixie Hwy PINECREST FL 33156-3167 (305) 740-5800
Mayris Maldonado,5.0,Best pizza choices and children wings. Good service.,3 years ago,Open,Anthony's Coal Fired Pizza 10205 S Dixie Hwy PINECREST FL 33156-3167 (305) 740-5800
Moe Niser,4.0,Anthony's coal Pizza is healthy and fresh made. I like their chicken wings and rosemary Bread.,3 years ago,Open,Anthony's Coal Fired Pizza 10205 S Dixie Hwy PINECREST FL 33156-3167 (305) 740-5800
Patrick,1.0,Ordered the Paul & Young becuase of the great reviews. It was very soggy. I guess that was my warning beciase I got food poisoning from it.,4 years ago,Open,Anthony's Coal Fired Pizza 10205 S Dixie Hwy PINECREST FL 33156-3167 (305) 740-5800
Nancy Guardaramos,5.0,"Great meat ball pizza, awesome chicken wings. Looking forward to the next visit",3 years ago,Open,Anthony's Coal Fired Pizza 10205 S Dixie Hwy PINECREST FL 33156-3167 (305) 740-5800
Marina Boucugnani,5.0,Everything is great!,a year ago,Open,Anthony's Coal Fired Pizza 10205 S Dixie Hwy PINECREST FL 33156-3167 (305) 740-5800
Pat Shields,5.0,Service was prompt and pizza was excellent.,2 years ago,Open,Anthony's Coal Fired Pizza 10205 S Dixie Hwy PINECREST FL 33156-3167 (305) 740-5800
Gladys Fernandez,5.0,Excellent and natural loved,a year ago,Open,Anthony's Coal Fired Pizza 10205 S Dixie Hwy PINECREST FL 33156-3167 (305) 740-5800
Gonzalo Pereyra,5.0,"Excellent service, food, and ambiance consistently.  A must!",2 years ago,Open,Anthony's Coal Fired Pizza 10205 S Dixie Hwy PINECREST FL 33156-3167 (305) 740-5800
Marson Cunha,3.0,Pizza is ok. A lot of hype for a regular (honest) pie.,2 years ago,Open,Anthony's Coal Fired Pizza 10205 S Dixie Hwy PINECREST FL 33156-3167 (305) 740-5800
Vanessa L,5.0,BEST PIZZA EVER!!!! your going to love it!! also make sure to try their chiken wings and their key lime pie!! their amazing!,7 years ago,Open,Anthony's Coal Fired Pizza 10205 S Dixie Hwy PINECREST FL 33156-3167 (305) 740-5800
Charles J,4.0,Crowded but worth the wait.,a year ago,Open,Anthony's Coal Fired Pizza 10205 S Dixie Hwy PINECREST FL 33156-3167 (305) 740-5800
Ray Gonzalez/ Brand Ambassador,1.0,"The service SUCKS!! 10205 S Dixie Hwy, Pinecrest",a year ago,Open,Anthony's Coal Fired Pizza 10205 S Dixie Hwy PINECREST FL 33156-3167 (305) 740-5800
Pandora Lee Celestin cabey,5.0,They have the best chicken wings and salads and drinks and great hospitality,3 years ago,Open,Anthony's Coal Fired Pizza 10205 S Dixie Hwy PINECREST FL 33156-3167 (305) 740-5800
Torey Henry,2.0,"Overrated food was just ok , chicken wings had no flavor for an itilan restaurant didn't have much to offer.",2 years ago,Open,Anthony's Coal Fired Pizza 10205 S Dixie Hwy PINECREST FL 33156-3167 (305) 740-5800
Matthew Salazar,4.0,"Solid pizza and service. Place can get a bit cramped and hectic (and loud), but the food is always good.",4 years ago,Open,Anthony's Coal Fired Pizza 10205 S Dixie Hwy PINECREST FL 33156-3167 (305) 740-5800
Robert Augi,5.0,Always love the food and the staff are great!,3 years ago,Open,Anthony's Coal Fired Pizza 10205 S Dixie Hwy PINECREST FL 33156-3167 (305) 740-5800
Tirso,5.0,"Delicious food and great service, what a pleasant experience. Thank you, Crystal",3 years ago,Open,Anthony's Coal Fired Pizza 10205 S Dixie Hwy PINECREST FL 33156-3167 (305) 740-5800
camila palmer,5.0,My second kitchen💕,a year ago,Open,Anthony's Coal Fired Pizza 10205 S Dixie Hwy PINECREST FL 33156-3167 (305) 740-5800
Maytee Diaz-Williams,5.0,"This place is awesome, they have amazing pizza, wings and meatb",3 years ago,Open,Anthony's Coal Fired Pizza 10205 S Dixie Hwy PINECREST FL 33156-3167 (305) 740-5800
JB Benitez,4.0,Love the place. Awesome wings and pizzas.,4 years ago,Open,Anthony's Coal Fired Pizza 10205 S Dixie Hwy PINECREST FL 33156-3167 (305) 740-5800
Ted Abernethy,5.0,Simply the best!,a year ago,Open,Anthony's Coal Fired Pizza 10205 S Dixie Hwy PINECREST FL 33156-3167 (305) 740-5800
brandon parker,5.0,One of my favorites,a year ago,Open,Anthony's Coal Fired Pizza 10205 S Dixie Hwy PINECREST FL 33156-3167 (305) 740-5800
Matthew Gruber,5.0,Excellent pizza and meatballs! Wonderful staff and service!,4 years ago,Open,Anthony's Coal Fired Pizza 10205 S Dixie Hwy PINECREST FL 33156-3167 (305) 740-5800
Miguel Alvarez,5.0,A friendly place,a year ago,Open,Anthony's Coal Fired Pizza 10205 S Dixie Hwy PINECREST FL 33156-3167 (305) 740-5800
Matthew Fisher,4.0,"It's a chain, but really quite good, and the wings are surprisingly fantastic.",4 years ago,Open,Anthony's Coal Fired Pizza 10205 S Dixie Hwy PINECREST FL 33156-3167 (305) 740-5800
Yaidi Grace,5.0,"Omg! The pizza, chicken wings, salad and bread is to die for! I love and recommend! Yum!",7 years ago,Open,Anthony's Coal Fired Pizza 10205 S Dixie Hwy PINECREST FL 33156-3167 (305) 740-5800
Jamel Weatherspoon,5.0,Meatball and rocatta pizza. Yummy.,2 years ago,Open,Anthony's Coal Fired Pizza 10205 S Dixie Hwy PINECREST FL 33156-3167 (305) 740-5800
Edward Tables,4.0,Excellent food and service,2 years ago,Open,Anthony's Coal Fired Pizza 10205 S Dixie Hwy PINECREST FL 33156-3167 (305) 740-5800
Anne Glancy,5.0,Always great. The Paul & Young pie is great.,8 years ago,Open,Anthony's Coal Fired Pizza 10205 S Dixie Hwy PINECREST FL 33156-3167 (305) 740-5800
kris miles,5.0,They get your order right!,a year ago,Open,Anthony's Coal Fired Pizza 10205 S Dixie Hwy PINECREST FL 33156-3167 (305) 740-5800
Matt Wofford,2.0,over-rates to say the least. mediocre pizza at a premium price.,4 years ago,Open,Anthony's Coal Fired Pizza 10205 S Dixie Hwy PINECREST FL 33156-3167 (305) 740-5800
Gloria Golightly,5.0,Nice,9 months ago,Open,Anthony's Coal Fired Pizza 10205 S Dixie Hwy PINECREST FL 33156-3167 (305) 740-5800
Francisco Escobar,4.0,Great pizza and service,2 years ago,Open,Anthony's Coal Fired Pizza 10205 S Dixie Hwy PINECREST FL 33156-3167 (305) 740-5800
Patricia Martinez,5.0,Loved the pizza it's a busy place but the pizza is great!,3 years ago,Open,Anthony's Coal Fired Pizza 10205 S Dixie Hwy PINECREST FL 33156-3167 (305) 740-5800
Leonor Shama,5.0,"My favorite pizza, the ricotta cheese with meatballs. Yum,😁",2 years ago,Open,Anthony's Coal Fired Pizza 10205 S Dixie Hwy PINECREST FL 33156-3167 (305) 740-5800
Elias Mejia,5.0,Nice place good service,a year ago,Open,Anthony's Coal Fired Pizza 10205 S Dixie Hwy PINECREST FL 33156-3167 (305) 740-5800
Sandra Villasuso,5.0,Always so fresh and so good!! Great service!!,3 years ago,Open,Anthony's Coal Fired Pizza 10205 S Dixie Hwy PINECREST FL 33156-3167 (305) 740-5800
richard allen,5.0,Great salad and pie,a year ago,Open,Anthony's Coal Fired Pizza 10205 S Dixie Hwy PINECREST FL 33156-3167 (305) 740-5800
Richard Rios,4.0,Thin crust and well-done!,2 years ago,Open,Anthony's Coal Fired Pizza 10205 S Dixie Hwy PINECREST FL 33156-3167 (305) 740-5800
Shana Cepeda,5.0,Best chicken wings & pizza ever!,2 years ago,Open,Anthony's Coal Fired Pizza 10205 S Dixie Hwy PINECREST FL 33156-3167 (305) 740-5800
Rob Conley,5.0,Best pizza in South miami,2 years ago,Open,Anthony's Coal Fired Pizza 10205 S Dixie Hwy PINECREST FL 33156-3167 (305) 740-5800
"Guy E. Carr, Jr.",5.0,Loved it great pizza,a year ago,Open,Anthony's Coal Fired Pizza 10205 S Dixie Hwy PINECREST FL 33156-3167 (305) 740-5800
Damaris Gonzalez,4.0,Good pizza.,2 years ago,Open,Anthony's Coal Fired Pizza 10205 S Dixie Hwy PINECREST FL 33156-3167 (305) 740-5800
Veronica Sosa,5.0,Delicious pizza everytime,2 years ago,Open,Anthony's Coal Fired Pizza 10205 S Dixie Hwy PINECREST FL 33156-3167 (305) 740-5800
Carlos Garcia,5.0,Always hits the spot!,a year ago,Open,Anthony's Coal Fired Pizza 10205 S Dixie Hwy PINECREST FL 33156-3167 (305) 740-5800
Hugo Rocha,5.0,Great place.,a year ago,Open,Anthony's Coal Fired Pizza 10205 S Dixie Hwy PINECREST FL 33156-3167 (305) 740-5800
Manuel Ramirez,5.0,Best pizza in south miami,2 years ago,Open,Anthony's Coal Fired Pizza 10205 S Dixie Hwy PINECREST FL 33156-3167 (305) 740-5800
Jaelm2013 Nenalinda,1.0,To light,a year ago,Open,Anthony's Coal Fired Pizza 10205 S Dixie Hwy PINECREST FL 33156-3167 (305) 740-5800
Odalis G,4.0,Great pizza and salad.,2 years ago,Open,Anthony's Coal Fired Pizza 10205 S Dixie Hwy PINECREST FL 33156-3167 (305) 740-5800
Carla Petite,4.0,Pretty cool spot.,2 years ago,Open,Anthony's Coal Fired Pizza 10205 S Dixie Hwy PINECREST FL 33156-3167 (305) 740-5800
manuel galo,1.0,Shock,3 months ago,Open,Anthony's Coal Fired Pizza 10205 S Dixie Hwy PINECREST FL 33156-3167 (305) 740-5800
Gaby Arboleda,5.0,Great!!,9 months ago,Open,Anthony's Coal Fired Pizza 10205 S Dixie Hwy PINECREST FL 33156-3167 (305) 740-5800
Joel Montes de Oca,5.0,Both the pizzas and the chicken wings are great!,3 years ago,Open,Anthony's Coal Fired Pizza 10205 S Dixie Hwy PINECREST FL 33156-3167 (305) 740-5800
Juan Colome,3.0,Waitress was terrible,a year ago,Open,Anthony's Coal Fired Pizza 10205 S Dixie Hwy PINECREST FL 33156-3167 (305) 740-5800
Gabriela Fonseca,5.0,Loved the pizza,a year ago,Open,Anthony's Coal Fired Pizza 10205 S Dixie Hwy PINECREST FL 33156-3167 (305) 740-5800
Shashi Maturah,5.0,🔥🍕,8 months ago,Open,Anthony's Coal Fired Pizza 10205 S Dixie Hwy PINECREST FL 33156-3167 (305) 740-5800
djtripmix,5.0,Great food 😋,a year ago,Open,Anthony's Coal Fired Pizza 10205 S Dixie Hwy PINECREST FL 33156-3167 (305) 740-5800
Jared Horenstein,5.0,Great pizza and meatballs,a year ago,Open,Anthony's Coal Fired Pizza 10205 S Dixie Hwy PINECREST FL 33156-3167 (305) 740-5800
Dennis McCarty,4.0,Simply great pizza,3 years ago,Open,Anthony's Coal Fired Pizza 10205 S Dixie Hwy PINECREST FL 33156-3167 (305) 740-5800
Roberto Rodriguez,5.0,Great,a year ago,Open,Anthony's Coal Fired Pizza 10205 S Dixie Hwy PINECREST FL 33156-3167 (305) 740-5800
Carlos Cordoba,5.0,Best pizza and wings ever,2 years ago,Open,Anthony's Coal Fired Pizza 10205 S Dixie Hwy PINECREST FL 33156-3167 (305) 740-5800
United States Of America Film School,5.0,Best Pizza In Miami,2 years ago,Open,Anthony's Coal Fired Pizza 10205 S Dixie Hwy PINECREST FL 33156-3167 (305) 740-5800
Path P,5.0,Best coal fired pizza,2 years ago,Open,Anthony's Coal Fired Pizza 10205 S Dixie Hwy PINECREST FL 33156-3167 (305) 740-5800
g Ashley Izaguirre,5.0,Family oriented,a year ago,Open,Anthony's Coal Fired Pizza 10205 S Dixie Hwy PINECREST FL 33156-3167 (305) 740-5800
Jorden Printz,2.0,Not great pizza,a year ago,Open,Anthony's Coal Fired Pizza 10205 S Dixie Hwy PINECREST FL 33156-3167 (305) 740-5800
Gabriel Beldorati,5.0,Delicious pizza!!!,a year ago,Open,Anthony's Coal Fired Pizza 10205 S Dixie Hwy PINECREST FL 33156-3167 (305) 740-5800
Giovanni Guzman,5.0,Very Good Food !!!,a year ago,Open,Anthony's Coal Fired Pizza 10205 S Dixie Hwy PINECREST FL 33156-3167 (305) 740-5800
Adrian Martinez,4.0,"Very good ,,",a year ago,Open,Anthony's Coal Fired Pizza 10205 S Dixie Hwy PINECREST FL 33156-3167 (305) 740-5800
B.A. Pisani,5.0,Nothing beats a pizza from Anthony's,a year ago,Open,Anthony's Coal Fired Pizza 10205 S Dixie Hwy PINECREST FL 33156-3167 (305) 740-5800
Carlos Naya,4.0,Good Pizza,a year ago,Open,Anthony's Coal Fired Pizza 10205 S Dixie Hwy PINECREST FL 33156-3167 (305) 740-5800
Benny Siegmeister,5.0,The best salads ever!!!!!,a year ago,Open,Anthony's Coal Fired Pizza 10205 S Dixie Hwy PINECREST FL 33156-3167 (305) 740-5800
Big Yellow Steel,5.0,"Pizza, wings and beer !!",a year ago,Open,Anthony's Coal Fired Pizza 10205 S Dixie Hwy PINECREST FL 33156-3167 (305) 740-5800
Ignacio Lopez,4.0,Great Pizza and Salads,2 years ago,Open,Anthony's Coal Fired Pizza 10205 S Dixie Hwy PINECREST FL 33156-3167 (305) 740-5800
eddie juan,5.0,Great pizza!,2 years ago,Open,Anthony's Coal Fired Pizza 10205 S Dixie Hwy PINECREST FL 33156-3167 (305) 740-5800
Christen Hauenstein,5.0,My go to pizza spot,2 years ago,Open,Anthony's Coal Fired Pizza 10205 S Dixie Hwy PINECREST FL 33156-3167 (305) 740-5800
J. Negz,4.0,This is the best Coal Fired Pizza in Miami,a year ago,Open,Anthony's Coal Fired Pizza 10205 S Dixie Hwy PINECREST FL 33156-3167 (305) 740-5800
Miguel Vazquez,5.0,Amazing,2 years ago,Open,Anthony's Coal Fired Pizza 10205 S Dixie Hwy PINECREST FL 33156-3167 (305) 740-5800
Monica Szwarckopf,4.0,Delicious pizza!,2 years ago,Open,Anthony's Coal Fired Pizza 10205 S Dixie Hwy PINECREST FL 33156-3167 (305) 740-5800
Fred Jarque,4.0,Love their pizza,2 years ago,Open,Anthony's Coal Fired Pizza 10205 S Dixie Hwy PINECREST FL 33156-3167 (305) 740-5800
Robert Ortega,4.0,Great pizza,2 years ago,Open,Anthony's Coal Fired Pizza 10205 S Dixie Hwy PINECREST FL 33156-3167 (305) 740-5800
Thank You,4.0,Good and consistent pizza,2 years ago,Open,Anthony's Coal Fired Pizza 10205 S Dixie Hwy PINECREST FL 33156-3167 (305) 740-5800
R M,5.0,Fantastic delicious Pizza :),2 years ago,Open,Anthony's Coal Fired Pizza 10205 S Dixie Hwy PINECREST FL 33156-3167 (305) 740-5800
fernando pava,4.0,Wings are the best!!!,2 years ago,Open,Anthony's Coal Fired Pizza 10205 S Dixie Hwy PINECREST FL 33156-3167 (305) 740-5800
Darren Pais,1.0,My pizza was cold.,2 years ago,Open,Anthony's Coal Fired Pizza 10205 S Dixie Hwy PINECREST FL 33156-3167 (305) 740-5800
D. Hernandez,5.0,Great food and drinks,3 years ago,Open,Anthony's Coal Fired Pizza 10205 S Dixie Hwy PINECREST FL 33156-3167 (305) 740-5800
SF SENNA,5.0,Amazinggggggggggggg,3 years ago,Open,Anthony's Coal Fired Pizza 10205 S Dixie Hwy PINECREST FL 33156-3167 (305) 740-5800
ilaria giudici,5.0,Delicious pizza,2 years ago,Open,Anthony's Coal Fired Pizza 10205 S Dixie Hwy PINECREST FL 33156-3167 (305) 740-5800
Tony Abbattista,5.0,Great pizza,3 years ago,Open,Anthony's Coal Fired Pizza 10205 S Dixie Hwy PINECREST FL 33156-3167 (305) 740-5800
Miguel S,4.0,Very good pizza,3 years ago,Open,Anthony's Coal Fired Pizza 10205 S Dixie Hwy PINECREST FL 33156-3167 (305) 740-5800
Marco Antonio Leautaud,4.0,Decent,2 years ago,Open,Anthony's Coal Fired Pizza 10205 S Dixie Hwy PINECREST FL 33156-3167 (305) 740-5800
Wilmer Urbina,5.0,Amazing!,3 years ago,Open,Anthony's Coal Fired Pizza 10205 S Dixie Hwy PINECREST FL 33156-3167 (305) 740-5800
Ian Raisbeck,5.0,"Not a huge selection of items, but great quality food and beer. Will go again",3 years ago,Open,Anthony's Coal Fired Pizza 10205 S Dixie Hwy PINECREST FL 33156-3167 (305) 740-5800
Pam English,5.0,Outstanding options!,3 years ago,Open,Anthony's Coal Fired Pizza 10205 S Dixie Hwy PINECREST FL 33156-3167 (305) 740-5800
ADJUSTING HER CROWN,1.0,The service was horrible and the pizza was BURNT & left the ABSOLUTE WORST aftertaste in my mouth nearly all day and night!!!!!,3 years ago,Open,Anthony's Coal Fired Pizza 10205 S Dixie Hwy PINECREST FL 33156-3167 (305) 740-5800
Margy Rosado,5.0,"Always go there for Pizza, yummy.",3 years ago,Open,Anthony's Coal Fired Pizza 10205 S Dixie Hwy PINECREST FL 33156-3167 (305) 740-5800
Barry Mezey,5.0,Best Pizza in Miami with best ingredients.,3 years ago,Open,Anthony's Coal Fired Pizza 10205 S Dixie Hwy PINECREST FL 33156-3167 (305) 740-5800
Chris Wells,4.0,Awesome,3 years ago,Open,Anthony's Coal Fired Pizza 10205 S Dixie Hwy PINECREST FL 33156-3167 (305) 740-5800
Itha Mongelli,5.0,Great Pizza!,3 years ago,Open,Anthony's Coal Fired Pizza 10205 S Dixie Hwy PINECREST FL 33156-3167 (305) 740-5800
Jose Marti,5.0,Must have the wings,3 years ago,Open,Anthony's Coal Fired Pizza 10205 S Dixie Hwy PINECREST FL 33156-3167 (305) 740-5800
PAUL KOREN,5.0,Great pizza,4 years ago,Open,Anthony's Coal Fired Pizza 10205 S Dixie Hwy PINECREST FL 33156-3167 (305) 740-5800
frank hernandez,1.0,"Crdit card fraud

Although  Food and The service is great on September 3rd 2016 my Credit card was jeopardized at this location",4 years ago,Open,Anthony's Coal Fired Pizza 10205 S Dixie Hwy PINECREST FL 33156-3167 (305) 740-5800
Jairo Gomez,5.0,Good food,4 years ago,Open,Anthony's Coal Fired Pizza 10205 S Dixie Hwy PINECREST FL 33156-3167 (305) 740-5800
Alina Borbon,5.0,Thanks best pizza ever!!,3 years ago,Open,Anthony's Coal Fired Pizza 10205 S Dixie Hwy PINECREST FL 33156-3167 (305) 740-5800
Gerson Bhomes,4.0,Good pizza,4 years ago,Open,Anthony's Coal Fired Pizza 10205 S Dixie Hwy PINECREST FL 33156-3167 (305) 740-5800
Michelle Campbell,5.0,Best pizza ever!,4 years ago,Open,Anthony's Coal Fired Pizza 10205 S Dixie Hwy PINECREST FL 33156-3167 (305) 740-5800
Sammy O,4.0,Great stuff!!,5 years ago,Open,Anthony's Coal Fired Pizza 10205 S Dixie Hwy PINECREST FL 33156-3167 (305) 740-5800
Mark P,5.0,Excellent!,6 years ago,Open,Anthony's Coal Fired Pizza 10205 S Dixie Hwy PINECREST FL 33156-3167 (305) 740-5800
kyle katarn,3.0,good men,7 years ago,Open,Anthony's Coal Fired Pizza 10205 S Dixie Hwy PINECREST FL 33156-3167 (305) 740-5800
Jeffrey Perlman,5.0,It doesn't stink,7 years ago,Open,Anthony's Coal Fired Pizza 10205 S Dixie Hwy PINECREST FL 33156-3167 (305) 740-5800
john the less,3.0,floor's too greasy.,8 years ago,Open,Anthony's Coal Fired Pizza 10205 S Dixie Hwy PINECREST FL 33156-3167 (305) 740-5800
Bobby Gonz,4.0,Great Wings!,9 years ago,Open,Anthony's Coal Fired Pizza 10205 S Dixie Hwy PINECREST FL 33156-3167 (305) 740-5800
frank tamayo,5.0,"(Translated by Google) Very attentive and very fast

(Original)
Muy atentos y muy rápidos",a month ago,Open,Anthony's Coal Fired Pizza 10205 S Dixie Hwy PINECREST FL 33156-3167 (305) 740-5800
Laura Diaz,5.0,"(Translated by Google) all excellent

(Original)
excelente todo",5 days ago,Open,Anthony's Coal Fired Pizza 10205 S Dixie Hwy PINECREST FL 33156-3167 (305) 740-5800
Gilberto Egañez,5.0,"(Translated by Google) Excellent pizza 🍕

(Original)
Excelente pizza 🍕",3 days ago,Open,Anthony's Coal Fired Pizza 10205 S Dixie Hwy PINECREST FL 33156-3167 (305) 740-5800
Juan C Vargas,1.0,"(Translated by Google) The wait is too much

(Original)
La espera es demaxiado",a month ago,Open,Anthony's Coal Fired Pizza 10205 S Dixie Hwy PINECREST FL 33156-3167 (305) 740-5800
Carlos Manuel Soler,5.0,"(Translated by Google) Un.a good attention I went as Uber eat.

(Original)
Un.a buena atención fui como Uber eat.",6 months ago,Open,Anthony's Coal Fired Pizza 10205 S Dixie Hwy PINECREST FL 33156-3167 (305) 740-5800
FRANCISCO J ROJAS AZUAJE,4.0,"(Translated by Google) It is a good restaurant, although prices are a little above average; however the quality is very good and the establishment is perfect

(Original)
Es un buen restaurante, aunque los precios están un poco arriba de la media; sin embargo la calidad es muy buena y el establecimiento está perfecto",11 months ago,Open,Anthony's Coal Fired Pizza 10205 S Dixie Hwy PINECREST FL 33156-3167 (305) 740-5800
Ricardo Gomez,5.0,"(Translated by Google) The best well-cooked charcoal pizza. Mediterranean the best.

(Original)
La mejor pizza al carbón bien cocida .mediterránea la mejor.",8 months ago,Open,Anthony's Coal Fired Pizza 10205 S Dixie Hwy PINECREST FL 33156-3167 (305) 740-5800
Guillermo Fragachan,5.0,"(Translated by Google) Well

(Original)
Bien",2 months ago,Open,Anthony's Coal Fired Pizza 10205 S Dixie Hwy PINECREST FL 33156-3167 (305) 740-5800
Elisabeth Silva,5.0,"(Translated by Google) Pizza, Meatballs (delicious), Side and chicken thigh and others. Very good.

(Original)
Pizza, Almôndegas(deliciosas), Asinha e coxinha de frango e outros mais. Muito bom.",a year ago,Open,Anthony's Coal Fired Pizza 10205 S Dixie Hwy PINECREST FL 33156-3167 (305) 740-5800
actualidad en Venezuela y en el mundo,5.0,"(Translated by Google) Excellent place

(Original)
Excelente lugar",a year ago,Open,Anthony's Coal Fired Pizza 10205 S Dixie Hwy PINECREST FL 33156-3167 (305) 740-5800
