name,stars,text,timeSince,openStatus,key
John Smith,5.0,"Had an amazing night thanks to Eric... very polite, energetic, friendly, and what a good salesman! Haha our calzone was amazing food took a little while, but Eric also made sure our drinks never went below half full at all times and let us …More",8 months ago,Open,8434071442.0
Sara Bell,3.0,"Paper straw's, and no to go cups. Food was AMAZING! I had the spinach and artichoke dip and a steak and cheese sandwich. Wow wow wow. Friends got 2 pizzas and oh my goodness it was very filling! We all had to get to go boxes lol.",a year ago,Open,8434071442.0
Randall Privett,1.0,"Service was slow.  Pizza was not as ordered.  Manager on duty tried to get out of making our order correct.  Pizza ultimately just not good.  If this is as good as it gets, this chain will go down the tubes soon.",a year ago,Open,8434071442.0
starfox elite,5.0,Good pizza fantastic wings a little pricey but the service is great so it's ok,10 months ago,Open,8434071442.0
Phyllis Inabinet Huey,4.0,Great!!! Better than Lil' C's & close to Papa's .... if ya know what I mean jelly bean.,9 months ago,Open,8434071442.0
Eric Alldredge,5.0,"I went to a Mellow Mushroom maybe 20 years ago in Alabama and I was less than impressed. Begrudgingly, I let my wife drag the family here tonight and we had a wonderful experience. They were a little busy, but the service was still fast and …More",a year ago,Open,8434071442.0
Pauline and Tom's Sparkle Boutique,4.0,Fun experience! Great happy hour!,5 months ago,Open,8434071442.0
Sheila Parnell,5.0,"Delicious Pizza, very helpful server, fun and interesting atmosphere. Check out the local artist offerings!",10 months ago,Open,8434071442.0
Judy Harrelson,5.0,love the green salad with shaved parmesan.  I order with the baked chicken wings.  consistently good from one Mellow mushroom to another.,11 months ago,Open,8434071442.0
Rinal Patel,2.0,"Usually when I go to mellow mushroom it is always a pleasant experience, however, it was below my expectations when I visited this location. My family walked in and we were directed to a table with trash underneath and we asked to move to a …More",a year ago,Open,8434071442.0
D Monch,5.0,The pizza is always great when I go in. I used grub hub and the app was a little wonky. As far as I can tell they are great when it comes to making a pizza vegan. Far better experience than the Charlotte location.,a year ago,Open,8434071442.0
Pri,5.0,Love the food here and their service. Always professional and super friendly. I could literally be satisfied with their appetizers only considering how good they are. We'll definitely dine in here again when we're in Florence South Carolina.,a year ago,Open,8434071442.0
Dean Benschoter,5.0,"Great tasting pizza, large selection of beer, service was excellent and they a completely gluten free pizza!",9 months ago,Open,8434071442.0
Tim Geddings,5.0,"Great service by Eric, good food, and reasonable prices!",8 months ago,Open,8434071442.0
Stephanie Craven,1.0,This is the third time my boyfriend and I have gone here and we’re ‘forgotten’ by wait staff. This past time our waiter had gotten to us at a reasonable time and asked our drink order. We got our drinks and he told us he’ll be right back to …More,a year ago,Open,8434071442.0
Brent,4.0,Pizza is great try the Aces Pineapple cider its expensive 7.50 12oz but well worth it,9 months ago,Open,8434071442.0
Kristen Beigay,5.0,We love the MM.  This restaurant did not disappoint.  We each had a small pizza.  This place had a local one I tried called Melloterranean.  I really enjoyed it.  My husband had his normal bbq chicken.  The waitress was great as well.,a year ago,Open,8434071442.0
Chrissy Todd,5.0,Yummmm! The great white pie was amazing ! Elmo was an awesome waitress!,8 months ago,Open,8434071442.0
Briana Zimmerman,1.0,"No one came to our table to serve us and ignored us, so we left.",10 months ago,Open,8434071442.0
Linda Dickerson,5.0,WOW This Pizza is Great! Thank You!,6 months ago,Open,8434071442.0
Lisa El,4.0,It was all tasty food.  We ordered via seamless and picked up the food and ate it at our hotel.    The food was almost overly tasty actually.   I had a salad that had like extra feta and cranberries and candied pecans.    The musroom soup …More,a year ago,Open,8434071442.0
ImagineStories Outtahere,5.0,The Food was amazing!!,a year ago,Open,8434071442.0
Riley and Rhiannon Stone and green,5.0,Best pizza I have ever had and the nicest people!,8 months ago,Open,8434071442.0
Tiffany Cruse,2.0,Took my son here very recently we hadn't been for a really long time and couldn't remember why then we got the check and remembered! Goodness...we ordered 2 sodas and a pepperoni pizza and it was almost 33 bucks plus tip! The pizza is tasty …More,9 months ago,Open,8434071442.0
Emily Jordan,5.0,our server was Eric and we had outstanding service and was very very pleased!!! thank you eric,7 months ago,Open,8434071442.0
Rebecca Strait,5.0,The food was on point..amazing,5 months ago,Open,8434071442.0
Kristian Hunter,5.0,So our waiter was named Eric and he was completely awesome the entire time. Give this man a raise,8 months ago,Open,8434071442.0
Jaime,5.0,Best pizza place ever. Dairy free options included!!,9 months ago,Open,8434071442.0
Christina B,1.0,"Our waiter was more focused on the table full of drunk girls behind us that kept yelling and breaking shot glasses than our table of two who had been waiting over an hour for one medium pizza. The manager comped our meal and was very nice, but the waiter was just awful. We would have gotten up and left if we hadn’t received our drinks.",a year ago,Open,8434071442.0
Moka C.,5.0,"Great food great vibes. Definitely get your money's worth. Salads are big, calzones are delicious, the burger was amazing according to one of the people who was with us. The pizza is really good as well. The sodas are spot on with equal …More",a year ago,Open,8434071442.0
mike henderson,3.0,"Forgot to put sauce on the pepperoni pizza.  Had to get a cup of sauce and dip the pizza. Not exactly what I had on mind. Was told they would discount meal, but they forgot that also. Finally just paid and left.",a year ago,Open,8434071442.0
Sarah Bass,5.0,Eric was awesome! Very good food,8 months ago,Open,8434071442.0
bella smith,5.0,Friend works there and it's a lit place,5 months ago,Open,8434071442.0
mackenzie reardon,5.0,Had great service by Eric! He was professional and serious!,7 months ago,Open,8434071442.0
Mike Britton,5.0,Great food and awesome service!,5 months ago,Open,8434071442.0
Tim Sheetz,3.0,"Decent pizza, great staff. Not at all mellow, was very sports bar-ish. Not a vibe i was looking for",10 months ago,Open,8434071442.0
Frank Safrit,4.0,The staff are very friendly here. I've got two kids under 3. Going places can be difficult sometimes. But Mellow Mushroom was great. Food was very good if a bit greasy. But its pizza! Cheap beer as well.,a year ago,Open,8434071442.0
Nikke R. Nick,5.0,Love this place!,2 months ago,Open,8434071442.0
EpicTube1,3.0,Delicious food!! Restrooms were absolutely disgusting. Someone really needs to take the time to clean the restrooms once in awhile. Staff members had zero personality.,a year ago,Open,8434071442.0
Caleb Riley,5.0,Eric was awesome. Food was great!,7 months ago,Open,8434071442.0
stacy Wilson,5.0,Great service from Elmo and delicious pizza. We will be back.,8 months ago,Open,8434071442.0
Brad Richardson,4.0,There are several Mellow Mushrooms in South Carolina. The atmosphere and pizza are great! Get the Mighty Meaty. Only downside is that you will wait and wait. Staff seems to be as chill as the decoration statues...,a year ago,Open,8434071442.0
Todd Moseley,4.0,Food was good but finally we had good service,7 months ago,Open,8434071442.0
Kayla,5.0,"The Barbecue Chicken Pizza is the reason my family comes back time after time. They truly have some of the best pizza you will ever eat. The atmosphere is very cool and the wait staff seem very easygoing too. Forget Domino's, I'll remember Mellow Mushroom.",a year ago,Open,8434071442.0
Marcus Fox,4.0,Good  service and Fresh Hot Food.  Great for family night.,9 months ago,Open,8434071442.0
Christine Bradsher,5.0,"Katie is the best server!  Appetizers are always on point, pizzas and calzones are perfect.",a year ago,Open,8434071442.0
Kattarina Kotwica,5.0,Really good hospitality! Eric was a greater server :),8 months ago,Open,8434071442.0
Niche Nichols,5.0,"I love this place. Perfect for hanging out with friends, date night or me time. Good drinks( Arnold Palmer) and ambiance always make me feel special...",a year ago,Open,8434071442.0
Tim Timbo,5.0,Great pizza!Being from New York.,9 months ago,Open,8434071442.0
Aneesha Dickey-Ballard,5.0,Eric was awesome! He anticipated our every want and need!,8 months ago,Open,8434071442.0
Erika L,5.0,"I come here once a month and it is always fresh and delicious. Staff is friendly, service is relatively quick, and the fact that mellow offers vegan options is the sole factor in my decision to frequent their chain. Thank you for offering compassionate choices! I recommend the veg out with vegan cheese and pineapple. 🍕🍍",2 years ago,Open,8434071442.0
Rae Rae,1.0,The service was terrible and the staff all had attitudes and didn't even try to help each other. The wait time is unbearable. We waited for almost 2 hours just for the pizza and didn't get one of our appetizers until after we got the pizza. …More,a year ago,Open,8434071442.0
Jerry Schlossnagle,5.0,Great pizza in a cool atmosphere. What else can you ask for?,10 months ago,Open,8434071442.0
Jennifer Johnson,5.0,LOVE this place!  The bruschetta and wings pair nicely!,10 months ago,Open,8434071442.0
Malcolm Lloyd,5.0,Visit Mellow Mushroom for the first time ever! I love it. Chatted with the bartenders and some of the guests. Will be back!!,a year ago,Open,8434071442.0
Benjamin Cooper,5.0,The food is consistently good. The service is consistently good. I've been here a few times in the past two weeks and it's always great. Highly recommended.,a year ago,Open,8434071442.0
John W Quick,5.0,"Good food, cold beer and Great service.  Smoking allowed outside !! Strongly recommend.",a year ago,Open,8434071442.0
Nichole Kennedy,5.0,Eric was the best server ever ❤️,8 months ago,Open,8434071442.0
Hunt Taylor,4.0,Monster stromboli and great beer selection.,8 months ago,Open,8434071442.0
hanna Talley,5.0,Elmo was a wonderful server and the pizza was awesome!,8 months ago,Open,8434071442.0
Mary Rivera,5.0,The food was great and friendly staff,9 months ago,Open,8434071442.0
Danielle,4.0,"Got pizza there on 4/20. Friendly service. Pizza is always delicious, sometimes it seems to take a while for it but I always find it worth the wait usually.",a year ago,Open,8434071442.0
John Taylor,4.0,"Good stop for someone wanting to stretch their legs when traveling down the interstate. Easy access on and off I-95, and when arriving at 6:30 on a Friday night, my family of 5 was seated right away. The meals were held up a bit in the …More",a year ago,Open,8434071442.0
Jody Richardson,4.0,Shataki pizza is the best pizza I've ever had but don't stop there.   Every pizza on the menu is a taste adventure in its self.,a year ago,Open,8434071442.0
Patrick B,5.0,"Love this place. Visited it in Spartanburg 5 years ago when my daughter started at Converse College. Now I make a point to visit everyone I come upon. Jacksonville, St Augustine, Florence. Never disappointed.",a year ago,Open,8434071442.0
Amanda Tepelides,5.0,Food was amazing!!! Service was not that great.,8 months ago,Open,8434071442.0
Kevin Diaz,5.0,The pizza is really good - also the sticks with the cheese sauce,a year ago,Open,8434071442.0
Dave Isenhower,2.0,"Food was okay, but the bathrooms were disgusting.  Overflowed toilets everywhere.  The waiter seemed disinterested.  Server would leave us before we would finish what we were asking for.",4 months ago,Open,8434071442.0
Dave Lott,5.0,"Wonderfully delicious pizza!  My super server Missy, just as nice as can be got my order moved up for me as I was pressed for time.",9 months ago,Open,8434071442.0
Mary Harris,5.0,"As this was the first time I've eaten here, the staff's guidance around the menu and pizza sizes was helpful. My made-to-order pizza-- with a thin crust and all fresh ingredients--was among the best I've ever eaten. I look forward to eating here again.",a year ago,Open,8434071442.0
Rusram,4.0,Food was good. Waiter was nice.  Kitchen was so slow I ended up needing to shave before I left and there no tissue in the bathroom.,a year ago,Open,8434071442.0
Tim Simpson,5.0,Great Spot,2 months ago,Open,8434071442.0
Jack Folmar,5.0,"Good food, good service, interesting decor",7 months ago,Open,8434071442.0
Thomas Campbell,5.0,Me and my Dad stopped by for a quick lunch and the service and food was great!,11 months ago,Open,8434071442.0
T L,4.0,"Pizza is good, but it ain't cheap, lunch special starts at $8.99 plus drink=$11.99... could have went to Texas Roadhouse for the same money",11 months ago,Open,8434071442.0
Big T,5.0,Amazing--best calzone ever!!,9 months ago,Open,8434071442.0
Laura Langley,5.0,"Grabbed lunch with family — food and our waiter, Eric, were fantastic!",8 months ago,Open,8434071442.0
Parth Bhavsar,4.0,Good food good service,10 months ago,Open,8434071442.0
Jennifer Powell-Gray,5.0,I love that they have gluten free,10 months ago,Open,8434071442.0
Amanda Pachomski,3.0,"They can alter vegetarian menu items to make them vegan by substituting Follow Your Heart cheeze and eliminating butter, mayo, and parm, which I greatly appreciate. Also, they have a great draft beer selection, but overall the experience …More",11 months ago,Open,8434071442.0
joseph king,4.0,"Good food,  clean restaurant,  friendly staff.",11 months ago,Open,8434071442.0
Patman Brayboy,5.0,Everything was perfect,2 months ago,Open,8434071442.0
josh hollens,5.0,"No complaints. Food seemed fresh, they can cater to allergies (mine is celiac). Highly recommended as a quick stop right off I-95",a year ago,Open,8434071442.0
Felipe Tapia,4.0,"Casual pizza and other stuff. We're just passing through on this one, but the pizza we had was great! We also had the bites with the beer cheese. Would definitely recommend them. Parmesan, and garlic butter on them was awesome. The pizza …More",a year ago,Open,8434071442.0
Alisha Newsome,5.0,Overall great experience. Went for my birthday dinner and our waitress Sydney was amazing,a year ago,Open,8434071442.0
William Cole,5.0,"Good food and good service...update 5/1/2020 during this current situation we're all dealing with Mellow has been awsome each time we've ordered from here.  Good friendly service, can't wait until your fully open again",6 months ago,Open,8434071442.0
Tami Tornado,5.0,Just the way it's decorated itself. Very unique. Gotta go. Well worth it.,a year ago,Open,8434071442.0
Tammy Raines,5.0,Great food and great service from Liz,8 months ago,Open,8434071442.0
Daniel Julius Markus,5.0,Great food and reasonably priced.,8 months ago,Open,8434071442.0
Ginny Bailey,5.0,"Going to mellow mushroom is a treat. I love going out to eat and the service here is amazing. The bartenders always treat us well (shout out to Hunter, Blake, David) but the management is clearly above par. Thank you Emily for helping to lift the experience. Wonderful place. Wonderful people. Wonderful management.",2 years ago,Open,8434071442.0
Sarah Smith,1.0,Service was beyond awful from the moment we stepped in the door. Hostess didn't even greet us. Then we sat down and waited almost 10 minutes to even be acknowledged by a waiter. We went ahead and ordered everything at that point. Our food …More,a year ago,Open,8434071442.0
Philonious,5.0,"Bathroom smelled terrible! Other than that, food, good service.",9 months ago,Open,8434071442.0
Mairead T,4.0,Food was great! We got the BBQ chicken pizza (can't remember menu name). It was delicious and filling. Service on the other hand was lacking and slow.,a year ago,Open,8434071442.0
B Peoples,5.0,The calzones are the size of a small dog and delicious. Definitely recommend,a year ago,Open,8434071442.0
Bill M.,5.0,Nice ambience and food.,11 months ago,Open,8434071442.0
Gene Stepp,5.0,Josh was great as our server and bartender! Food was awesome. Funky Q  pizza was great! Thankyou!,a year ago,Open,8434071442.0
Darrell Boyleston,5.0,Great food.  Nice staff.,a year ago,Open,8434071442.0
Christina Morgan,5.0,"Food was amazing, and Eric was awesome!",8 months ago,Open,8434071442.0
Amy Dolbow,1.0,"Waited over an hour for our 2 pizzas and meatball trio app. Meatballs came out and were completely charred ON THE INSIDE!  A table came in after us and received their meal before we even got our appetizer of pretzel bites. Pizza was good, but sent back the meatballs and asked they be removed from the bill as they were not edible.",a year ago,Open,8434071442.0
Chris Froland,5.0,"Best casual dining experience around Magnolia Mall, the pizza is fantastic",a year ago,Open,8434071442.0
Gary Tod Sanders,5.0,Great pizza and atmosphere! 👍👍,10 months ago,Open,8434071442.0
Lisa Ramirez,5.0,"Pizza and service very good, plus a nice selection of hard ciders. I travel through here occasionally for work, and this will be on my go-to list.",a year ago,Open,8434071442.0
Glenda Conrad,5.0,"The food was PERFECT, and our service was impeccable!!",10 months ago,Open,8434071442.0
Kelly Hickey,5.0,Eric was outstanding!! Job well done!!,7 months ago,Open,8434071442.0
som shine,5.0,Really good pizza.  Yum!,11 months ago,Open,8434071442.0
James Ricketts Jr,4.0,This place has great food vary enjoyable some of the service needs work or it would have been 5 stars,a year ago,Open,8434071442.0
Harold Curtice,2.0,"Went there with a group of co-workers. Music was so loud, I'm surprised anyone heard anything. It was Trivia Tuesday also. You guys know there's other volume levels other than bursting eardrums... Sorry. Not looking to a return visit here.",a year ago,Open,8434071442.0
JCazz11,5.0,Delicious pizza,2 months ago,Open,8434071442.0
nogodsnomasters,3.0,"Every time I take my father here, he is more gentle afterwards. His pants fit better, and his phone fits in his pocket. Last night, on the way home from the restaurant, he took his shirt off in the car. Thanks, Dad! …More",a year ago,Open,8434071442.0
Cassandra Brunson Stokes,4.0,Service was excellent it just took a long time to get our food.,a year ago,Open,8434071442.0
Michelle Monahan,5.0,Good food and service,11 months ago,Open,8434071442.0
Rosalynn M. Rice,4.0,"Dinner was good. Our server Aaron, was pleasant and attentive. He kept our drinks filled and ensured we went home with beverages should we so desire. My party of 2 sat at a secluded booth near the back. It was nice to not have to be surrounded by many people after a long work week.",2 years ago,Open,8434071442.0
Chris Alex,3.0,Chill hippy pizza place. Pizza was just OK and server seemed unhappy to be there but the place was cool.,2 years ago,Open,8434071442.0
Jane Grice,5.0,"Had desperately wanted to try since I was told they added GF option; so glad I did. Was road tripping from Tampa, Florida to Washington DC and found them using the ""Find Me Gluten Free"" app. Used the Mellow Mushroom order online making life and the trip really easy! 5 stars don't seem enough to express how delighted I am. 😁",a year ago,Open,8434071442.0
Sonahime,5.0,Mellow mushroom is kicking up the vegan options! Yas!!,a year ago,Open,8434071442.0
Pete Ayala,5.0,Awesome food!,a year ago,Open,8434071442.0
Malarie Rollins,5.0,Eric was a great server.,8 months ago,Open,8434071442.0
Ashlee Terie Colón,5.0,"Love the pizza!  They even have a vegan option, or youcan get 2 different flavors on 1 pizza for the times you can't make a decision!.. It's pricy but tastes amazing!",a year ago,Open,8434071442.0
Joe Fischer,4.0,"Good food, good service, beer and booze in stock!!",11 months ago,Open,8434071442.0
Jennifer Cooper,4.0,Went her for a paint night with a friend. Everything was good except the room we we're in was hot. I had a brownie Sundae and it was delicious. Staff was nice and efficient.,2 years ago,Open,8434071442.0
Aaron Haffner,5.0,Great food and atmosphere.,8 months ago,Open,8434071442.0
Jamie Watson,5.0,Love the pizza an uniqueness in ingredients .,11 months ago,Open,8434071442.0
Remi Zecman,4.0,Nice variety of pizza and it was good,10 months ago,Open,8434071442.0
Jessica G.,2.0,I just really don't care for Mellow Mushroom no matter the location.,7 months ago,Open,8434071442.0
Erika Cruz-Abraham,5.0,I'm a salad person..a great place to get a salad..have not yet tried their pizzas..but from what I heard their pizzas are great,a year ago,Open,8434071442.0
Amy Vaughn,5.0,Food is really good and tasty. Some of the staff are interesting. Very detailed devil tattoos and earring other than ears.,2 years ago,Open,8434071442.0
Christopher McCray,3.0,"I like Mellow Mushroom, but not this location. Don't get me wrong. The atmosphere is great, drink selections relatively broad, and most of the food is great. However, The two times I have visited the pizza has been mediocre. I love pizza, …More",2 years ago,Open,8434071442.0
Daniel Franz,5.0,Excellent pizza and very attentive servers.,a year ago,Open,8434071442.0
Amie & Joe Lemire,4.0,Need better wait staff.... food was ok.,a year ago,Open,8434071442.0
Jeremy Carroll,4.0,Good food good drinks and a good selection of beer if that is your thing,4 years ago,Open,8434071442.0
BigRed Entertainment,5.0,"Liz was very helpful with beer selections. Food was excellent, and the choice of beer for me was delicious.",a year ago,Open,8434071442.0
Ann Walls,4.0,Service is great. The food was wonderful. Great place to feed a vegan.,a year ago,Open,8434071442.0
Terrell Floyd,5.0,Great place for family or just to go hangout at times. They have great food and surprisingly many options to choose from. The scenery is great as well and I enjoy being able to sit outside during the warm months and relax. Overall it's one of my favorite places.,2 years ago,Open,8434071442.0
Lorraine Howard,4.0,"Food was great,  waitress was a little slow getting a check to us",a year ago,Open,8434071442.0
Sally Atkinson,5.0,Great food and even greater server! Very busy and there was a long wait. We went on a Friday night. Less crowded during week nights! Worth the wait.,2 years ago,Open,8434071442.0
Tony Carter,5.0,Love their pizza!,8 months ago,Open,8434071442.0
Breauna Hannah,5.0,Eric the server was great !,8 months ago,Open,8434071442.0
James Jones,5.0,Great food ....fast service the pizza was epic!!!,a year ago,Open,8434071442.0
Cortney Harless,5.0,Best one in the franchise!,9 months ago,Open,8434071442.0
Camryn McCall,5.0,Eric did great!,8 months ago,Open,8434071442.0
Miranda Spivey,3.0,"Great food, slow service. Got there around 3pm on Thursday and we were the only customers. Though, somehow, the service was extremely slow and two of our orders were wrong. Then it took about 15 minutes to get another plate out. The sandwiches were really good.",a year ago,Open,8434071442.0
wanda,5.0,Great beer selection.  Bartender was so nice. Recommended a great pie and some beers to try. Atmosphere was great!,2 years ago,Open,8434071442.0
Dave L,4.0,Very good pizza for a chain restaurant. Keep in mind that if it's a little busy you may have to wait for a little while for your pizza. Everything is made to order. This is not a brick oven pizzeria though.,2 years ago,Open,8434071442.0
Michelle Brown,5.0,"The food is always good and if you want something different, try the Ceasar pizza. It's fabulous.",a year ago,Open,8434071442.0
Tamera Weedon,2.0,"It's disappointing that I was unable to even get food from this location. I've been to multiple locations and this one was far from the worst. I ordered a pizza with tempeh online. When it was brought out to me, it looked like they had …More",a year ago,Open,8434071442.0
Kimberly Burris,3.0,"We hadn't been to a Mellow Mushroom since we moved from Georgia over 10 years ago. We had to travel up to Florence for some medical care and realized there was one on our route home, so if course we had to stop for a pie. What a …More",a year ago,Open,8434071442.0
Christopher Fredericks,5.0,"Great service, cheesy pizza (in a good way).",a year ago,Open,8434071442.0
Jamie carnero,5.0,Food is amazing and the drinks are strong,11 months ago,Open,8434071442.0
JENNIFER MYERS,2.0,"Waitress rude and never smiled the entire time, waited an hour for pizza that came out wrong. By the time I got the correct pizza I was just ready to go and didnt even want it. Waitress never apologized even after admitting it was her fault …More",a year ago,Open,8434071442.0
Aaron Smith,5.0,"Always friendly staff and a huge selection of beer. Great pizza, and you can mix and match if you get a calzone!!",a year ago,Open,8434071442.0
Lane McDaniel,4.0,Yo. Get a salad too! They're delish.,a year ago,Open,8434071442.0
Joseph Purington,5.0,"Love their pizza. I do 10 hours if driving when I do volunteer runs to cotton branch animal sanctuary.
I always stop at the Mushroom and have never been disappointed.!",2 years ago,Open,8434071442.0
Mrs HebrewQueen,5.0,"Great atmosphere, food and service!",a year ago,Open,8434071442.0
Tina Outlaw,4.0,Food was great. Too slow though,a year ago,Open,8434071442.0
Ronald Tucker,5.0,Bartenders are Amazing! Beer knowledge is impressive.,a year ago,Open,8434071442.0
marlin20092009,4.0,"It's good food,  slow service every time ive been here.   Which is why 4 stars",a year ago,Open,8434071442.0
Todd Mitchell,5.0,Great pizza!  Awesome service!,a year ago,Open,8434071442.0
