name,stars,text,timeSince,openStatus,key
Isaac Crum,4.0,Pizza is great. Other food is great. There prices are super crazy though. Pizza pies should not be $26.00 a pie. I understand your running a business and your food is good but real it in a little please.,a year ago,Open,7322444202.0
Tina Mergner,2.0,"Staff is extremely friendly and welcoming. Only 3 other tables had people and it took almost 45 mins for our food to come. There was 5 of us, all ordered different things, and 3 of us had extremely dry over cooked food.",a year ago,Open,7322444202.0
Michael Giordano,3.0,"Not bad, they have some very unique types of pizza, but definitely overpriced and can't rival a really good pizza parlor",8 months ago,Open,7322444202.0
K Mad,5.0,"Always exceptional service, and the food is always excellent. We enjoyed wings, a mushroom pie, and a cookie dessert. I would love to see more fresh dessert options, but was satisfied with my choices.",a year ago,Open,7322444202.0
Irish Doxie,4.0,In house eating is FANTASTIC here... To go orders are hit or miss....the burgers and wings awesome.  Servers are uber friendly!!!,a year ago,Open,7322444202.0
Deanna D,5.0,"Yummy! Love the build your own pizza menu.  Different than a regular ole slice of pizza.  Everything is fresh and the crust is sooo good! Fun atmosphere as well on trivia night! Great,  friendly staff!",a year ago,Open,7322444202.0
Mike Sanders,4.0,"We've something of a tradition in the making when my brother returns to Toms River, we have pizza at Mellow Mushroom.  It's a warm and welcoming atmosphere where nothing's expected of you, quite casual and comfortable.  I've also been going …More",a year ago,Open,7322444202.0
Jimmy,5.0,"Great place to eat. Have a couple drink and hangout, with friends and family. Anwersome customer service!",2 years ago,Open,7322444202.0
John Lacko,1.0,Overpriced pizza. Inattentive staff. Once was enough for me.,9 months ago,Open,7322444202.0
Philip Martin,4.0,"Always excellent, great pizza, great beer selection, family friendly.",8 months ago,Open,7322444202.0
Frank Hager,4.0,First time there had a wrap. It was very tasty. It came with a noodle and pesto salad. That was  interesting. It had great music from 70s and 80s playing. Our waitress was a southern belle and she was excellent. …More,2 years ago,Open,7322444202.0
Chris Gable,4.0,The 🍕 is good and the beer selection is excellent.,8 months ago,Open,7322444202.0
Naomi Capasso,4.0,"The pizza/food is excellent. Ingredients are stellar and the meals are mega-upscale bar food. The price reflects the quality. Lots of pizza, lots of bread based options. They had vegetarian, and gluten free options also. It's a groovy …More",2 years ago,Open,7322444202.0
Les Conrad,5.0,Very good food and great service,11 months ago,Open,7322444202.0
Aced985,5.0,"Great food, great staff, and great experience!  Came here on their Trivia night on Monday evening.  Fun stuff!",a year ago,Open,7322444202.0
Andrew Salvatore,5.0,Excellent place... Apps were amazing and pizzas were delicious and good size for the price... Look forward to returning!,a year ago,Open,7322444202.0
Dominic Sychtysz,4.0,Pretty good! More sauce prefer,10 months ago,Open,7322444202.0
Dennis Wilcox,5.0,"Love this place. Pizza is outstanding! Salad is excellent! Selection is quite nice. Atmosphere is friendly and welcoming. Service is super. Wine, beer and spirits selection is fabulous. A great restaurant to have lunch or dinner. Lunch …More",2 years ago,Open,7322444202.0
Alex Burns,3.0,"Live game show going on at our arrival and continued on throughout our diner. Way too loud!
Italian hoagie was different from any I've had in my entire life. It was ok but …More",a year ago,Open,7322444202.0
Ty prince,5.0,"Omg, this place is so amazing! The food & the environment is very creative and innovative.",a year ago,Open,7322444202.0
john blevins,5.0,Best pie. Ever. The pretzel bites app with the beer cheese dip is flipping awesome too! Friendly staff as well. Highly recommend!,a year ago,Open,7322444202.0
Melissa Pajak,2.0,Bar service is terrible and slow. Always takes several minutes to even get noticed and they take even longer to come back around to take a food order or ask about refills. Pizza is usually pretty good but on several occasions I've ordered a salad with grilled chicken and they always forget the chicken and I have to ask for it again.,a year ago,Open,7322444202.0
Alyssa Brown,5.0,The great white pizza was out of this world on top of great service!! Definitely coming back.,a year ago,Open,7322444202.0
thomas tozzi,3.0,The beer is good. Menu is slim,a year ago,Open,7322444202.0
Jake Piercy,5.0,"I had an awesome time when i went a few months ago. Awesome food. Great service from Chris, one of the bartenders. And great hospitality by the whole staff. I had previously left a 1 star, and i have no idea how. So i changed it as soon as …More",2 years ago,Open,7322444202.0
Patrick Shields,5.0,Out for a Sunday drive with the wife on Father's Day testing out her new truck we drive down Route 37 West and I see you this restaurant that says Mellow Mushrooms well worth of mushroom Fanatics where you going there like I got to go down …More,a year ago,Open,7322444202.0
Constance Collins,4.0,The staff was friendly and thoughtful. The music that they had playing was nice. I plan on going back again.,a year ago,Open,7322444202.0
M Nuke,5.0,"Manager Cali was Awesome! We waited 15 minutes and no one came to the table, she took notice and really went out of her way to make things right. Great job!",a year ago,Open,7322444202.0
Christy Lee Smith-Fabio,5.0,Love this place. The food is excellent. The staff is pleasant. The drinks are amazing.,a year ago,Open,7322444202.0
John F,2.0,"I wasn't impressed. The drinks are expensive and the food is just so so. Nice atmosphere and friendly service, but not a place I need to visit again.",a year ago,Open,7322444202.0
Jackie Nowak,3.0,It was ok. I just discovered their gluten free pizza have had it three times now. Prior two times it was really awesome. I bragged to my spouse about it and finally got him to try it tonight and the crust was overcooked. That destroyed the …More,a year ago,Open,7322444202.0
Justin Grande,5.0,Awesome delicious pizza choices! Great service... the staff I interacted with were all amazing,a year ago,Open,7322444202.0
Eric Gabelmann,4.0,Like this place. Good ciders on tap and shitaki mushroom pie is interesting.  Tried dueling pianos. Seems not so good as the money grabbing aspect of getting a song played is disappointing.,a year ago,Open,7322444202.0
Shell C,5.0,The atmosphere is very cheerful and uplifting! The waitstaff go out of their way to make sure everything is to your satisfaction. The pizzas are delious. Also I appreciate being served a sample glass of the sweet water blu berry before …More,a year ago,Open,7322444202.0
Pat Kennedy,5.0,The bartender was really great I ordered a shiitake mushroom pizza it was absolutely delicious,a year ago,Open,7322444202.0
Brian Thelin,3.0,"Food is great, but the wait was insane.",a year ago,Open,7322444202.0
Rose Ford,2.0,"I'm giving this a 2 and I think that's being quite generous. Having been to the location in Delray Beach, FL on multiple occasions I had much higher expectations than what I received. The food at best was mediocre, the service to match …More",a year ago,Open,7322444202.0
Chris D,4.0,"Love the atmosphere..full of druggies unfortunately..thats toms river for you though. Good food, good entertainment.",a year ago,Open,7322444202.0
Michael Smith,4.0,"Good atmosphere, really good food, and has gluten free options... my service wasn't great, but I guess that is a matter of which server on which night. Would still suggest you give the place a shot... has amazing pizza options",2 years ago,Open,7322444202.0
Bill Skinner,1.0,Worst dining experience I've ever had. Waited at my table 20 minutes for someone to ask me if i needed anything. Got first round of drinks quickly because we wouldn't let the waiter leave until he took out order. Waiter didn't go over …More,2 years ago,Open,7322444202.0
CTROY2369,1.0,"The Worst Dining Experience I've Had In Over A Decade At Least. The Service Was Terrible (Bar). We Waited Over An Hour For A Meatball Sub (Which Tasted Charred). And, Every Time We Asked About It, She Just Looked Over Our Shoulder Towards …More",a year ago,Open,7322444202.0
Tyler Cassidy,5.0,This place reminds me of summer of 76’ cruising around in my new impala. Only if that cute manager could’ve come with,a year ago,Open,7322444202.0
heidi gebhard,4.0,Food is great. Great environment.,a year ago,Open,7322444202.0
Luigikid64 Gaming,5.0,"Great atmosphere, Amazing Pizza, and Wonderful service and staff! Totally worth the 2 hour drive",a year ago,Open,7322444202.0
Jennifer McDowell,5.0,"Best pizza sauce and cheese combo I’ve come across lately! Also, Abbey the waitress is stellar!",a year ago,Open,7322444202.0
James Ritz,5.0,"Our office had a lunch there for a retirement party. It was the best yet, so many items to chose from on the menu. You won’t be disappointed.",a year ago,Open,7322444202.0
D LoCo,4.0,"Food was good. Staff was friendly.  They have some fun games in the back to play while you wait. Nice place for a casual, mellow meal. Good mix of classic rock music playing in background.  Holy Shitake pie was amazing! Pizza dough is delicious.",2 years ago,Open,7322444202.0
Laurie Woolridge,5.0,Great food and very attentive staff,9 months ago,Open,7322444202.0
Ken Hagen,4.0,Service was excellent pizza was good,a year ago,Open,7322444202.0
James Dodd,5.0,Fun place relaxing atmosphere and kid friendly.,a year ago,Open,7322444202.0
Ghostarmy Gaming,5.0,"Awesome food, service, and atmosphere",a year ago,Open,7322444202.0
Jason Olesen,3.0,Mediocre pizza and slow table service.  Nice atmosphere.  The mushroom soup was good and the meatballs were tasty.,a year ago,Open,7322444202.0
Maria Alexander,5.0,It was great but t he. Musicaian left. Toooooooooo early 😩😩😩,a year ago,Open,7322444202.0
Mark Terhune,1.0,Horrible service an food awaited for 45 mins to get our food the soup came out cold the waiter never asked if I wanted a refill they all seemed lost u ask them a question an I get idk let me find out an the menu has like nothing on it an …More,a year ago,Open,7322444202.0
Marcelle Maggio,5.0,Pizza is out of this world!!,5 months ago,Open,7322444202.0
Donna Farmer,5.0,Let me begin by saying the lil salad was very tasty and the pizza was delicious. The waiter Kyle was very friendly and made us feel special. The manager Chris could not do enough to make sure that our visit was pleasant. He is a real asset …More,2 years ago,Open,7322444202.0
Stephen Greeley,5.0,We always get the pretzel bites for an appetizer. M'lady orders the Holy Shiitaki and I get the Mighty Meaty. The secret of Mellow Mushroom is their crust. Truly incredible flavor and texture. The pretzels are made from the same dough. …More,a year ago,Open,7322444202.0
Josias Hernandez,5.0,Food was good and drinks were on point defenatly worth it,2 years ago,Open,7322444202.0
Ausberto Orozco,5.0,"Went here yesterday for the first time. Very clean and friendly place. Service was fast, food was hot and fresh, and prices were fair. I think I found myself a new spot to come get some good food. Thanks guys, keep up the good service.",2 years ago,Open,7322444202.0
Shawn Brendlen,5.0,Fantastic pizza great attentive wait staff cool place cant wait to go back.,a year ago,Open,7322444202.0
David Henneberger,1.0,"Wow, what a disappointment,  ordered at register, 20 minutes wait for take out, received cold... ? Really? Had them put back in oven, still received luke warm... ? What the hell?Would have been better off with Digiorno at home, least case …More",a year ago,Open,7322444202.0
Connor McGinley,3.0,"The food is just okay, but the I love the bar. They have a great beer and liquor selection. The bartender was so great the night we went. After trying the food the first time, I said I probably wouldn't go back, but it looks like they're doing better now. To be honest, I recommend sticking to the bar.",2 years ago,Open,7322444202.0
Lillie Wilkins,5.0,Great pizza to take out for family weekends :),a year ago,Open,7322444202.0
steven cook,5.0,Great juicy burgers and pretzel bites,a year ago,Open,7322444202.0
Cecilia Ward,5.0,A fun and lively atmosphere....LOVE the Kosmic Karma and Buffalo Chicken Pizzas!!!,a year ago,Open,7322444202.0
Laurie Kathryn,3.0,"cool atmosphere, great boardwalk & steel decor, excellent beer selection- but the food is lame.  At least the three times I went.  I will go back for the beers and good service.",a year ago,Open,7322444202.0
Johadane Pierre,3.0,Good pizza. Neat place. Nice staff.,a year ago,Open,7322444202.0
K Diamond,2.0,Too many good pizza places in the area to go back. Pizza was ok. Way overpriced.  Just wasnt impressed.,a year ago,Open,7322444202.0
James Merrell,5.0,The food here is fantastic. The wings and pizza are hands down the best in the area. The bar is also a huge highlight for those trying to find their new favorite beer. The staff and atmosphere are also extremely friendly and knowledgeable! Definitely a great addition to the area!,3 years ago,Open,7322444202.0
Helio Guzman,5.0,First time guests and definitely not the last. Great atmosphere and phenomenal pizza (Their Mushroom pie is out of this world),a year ago,Open,7322444202.0
Victoria York,5.0,Very fun environment.  Great food and good drinks. Servers are extremely friendly.,a year ago,Open,7322444202.0
Dennis Mortensen,4.0,Good pizza,3 months ago,Open,7322444202.0
Kylene Clemens,2.0,"I've been here three times and only the first time was a good experience.  The last two times, including our visit last night, were sub-par.  Unfortunately, it seems that the wait staff is not really trained well enough before they are on …More",2 years ago,Open,7322444202.0
Ed Jones,5.0,Nice waitress.   Good pizza.,a year ago,Open,7322444202.0
Em M,5.0,Pretty cool place. Great prices and the food was really good. Try the pretzel bites with the beer cheese dip...very good! Cool bar and lots of seats and tv's. Good menu and build your own pizzas! Will come back for sure.,3 years ago,Open,7322444202.0
beth applegate,5.0,Food is always delicious. Staff is typically very friendly and food comes out timely,a year ago,Open,7322444202.0
Terry King,4.0,"The pizza here is always great! It's a little on the pricey side, but they have great happy hour specials and a super friendly staff. A nice change of atmosphere!",2 years ago,Open,7322444202.0
Victoria Weiss,3.0,"Cool atmosphere,  different types of pizzas and then ur normal bar food stuff, Not as amazing at I thought it would be but there mushroom pizza was delicious! The meatballs on the appetizer menu not as yummy a little tough but overall still enjoyable",a year ago,Open,7322444202.0
Samantha Lanza,1.0,Went for lunch & stood there for 10 minutes waiting to be seated and no one came. Just a waitress who stared at us as we walked out!!! Unbelievable and it wasn’t even busy!!!,a year ago,Open,7322444202.0
Maureen Colder,4.0,Pizza is quite good. Very tasty and not too greasy. Price is good and size is great. Salads could be a bit crispier. I had a Caesar Salad that was a bit soggy. Service was good but not great.,2 years ago,Open,7322444202.0
joseph pirozek,4.0,"Good food, very loud when we went for ""Halloween Party"".
I liked the one in #Delray Beach Florida better, more beer on tap there.
Overall it was a good time.",2 years ago,Open,7322444202.0
Judy Pace,5.0,I usually don't write reviews but after seeing a review that just doesn't ring true to me I am prompted to write.  My husband and I are frequent patrons at the Mellow Mushroom. We always choose to sit at the bar because of the comfortable …More,2 years ago,Open,7322444202.0
Catherine Salvatore,5.0,Very good food and service,a year ago,Open,7322444202.0
Rita Maggio,5.0,Fantastic food and service! Great selection! Make sure you order an appetizer! It takes a long time to make the pizza fresh!!! Great ambiance too!,2 years ago,Open,7322444202.0
Kevin Ferro,1.0,The bartender Chris is a con who tries to convince you into buying more food and drinks only to run your tab up to get a higher tip. Then takes shots with other employees while behind the bar to then tell you stories about how he’s in love with his manager. The food is tasty but came out cold. A one and done place to try.,2 years ago,Open,7322444202.0
Jason J Miller,3.0,"Menu is fun, decor is fun. Staff can be more attentive ... but they are ""mellow"" and remember it is not fine dining. Suggestion is to go there.. share pies ... get extra napkins.. sit back and enjoy pizzas. Holy Shitake (deserves a 4.5 star …More",2 years ago,Open,7322444202.0
Google User,1.0,"Highly recommend avoiding this place. It deserves to be shut down for violating multiple health codes. Dirty plates, dirty silverware and that’s just the surface. Watching the staff touch their hair-hats-phones was disgusting. Then the …More",2 years ago,Open,7322444202.0
Piero L,5.0,This is an awesome concept. The staff is very friendly and go above and beyond to make you feel welcomed. Their list of craft beer is very impressive. The decor is rustic/industrial modern. Their food is amazing. You must try the pretzel …More,3 years ago,Open,7322444202.0
S Snyder,5.0,"I love Mellow, the food is so delicious and there's so many options for my gluten free friends. The bartenders are so friendly and Jess the manager is so nice and helpful! I cant wait to come back!",2 years ago,Open,7322444202.0
Dan DeGaetano,1.0,Placed a to go order. Was told 20 minutes. Waited 30 minutes for the wrong order. Now a total of 50 minutes and still no food. Maybe 6-7 tables were full. Not busy. No excuse for such poor service.,a year ago,Open,7322444202.0
Maria Keeley,3.0,"The service was excellent.  The food was just ""ok"" for the prices we paid.  Fun atmosphere though.  Ill give it another try for sure.",a year ago,Open,7322444202.0
Patrick J Connelly,5.0,"The restrooms are immaculate, you could eat your pizza from the floor they're so clean.  The bartender makes a spectacular margarita.  The manager tends to take exceptional care of his guests.",2 years ago,Open,7322444202.0
BOB GRADIO,5.0,"It was TERRIFIC! Delicious food, very reasonably-priced, very cool atmosphere, and a very positive energy staff!",a year ago,Open,7322444202.0
Robin Aniboli,5.0,Always out go to for pizza and great salads,a year ago,Open,7322444202.0
Charles Gelco,3.0,Service and appearance/decor was good.  Food was ok.  My daughter's food came out room temperature to cold.  Management took care of that issue.  Overall good experience.,a year ago,Open,7322444202.0
Barbara Niess,5.0,Love the pizza. Friendly staff. Nice atmosphere. I ordered from the app and it was ready when I arrived.,a year ago,Open,7322444202.0
Kimberly Sean,3.0,Nice environment friendly staff  drinks could be colder,a year ago,Open,7322444202.0
Glen Miller,2.0,ordered a sandwich and wasnt great the manager and staff handled everything great and the atmosphere is nice however I have not been back since,a year ago,Open,7322444202.0
Sierra Mutou,5.0,Great pizza and service,a year ago,Open,7322444202.0
A Giambona,3.0,"Food is great my last waiter was ok but I have to say whenever we go workers seem annoyed we're there.  Not saying you need to jump
Up An down but they seem pretty miserable. When I walked up at first I mistaken …More",a year ago,Open,7322444202.0
Nate Collins,5.0,Love it here. Lots of yummy veg friendly menu choices. Avocado sandwich is great add is the mushroom soup. It's great that  you can order half a sandwich. Also rotating local items too. …More,3 years ago,Open,7322444202.0
Tom Griffiths,5.0,Good pizza and cool bar,10 months ago,Open,7322444202.0
Kathy Lilla,5.0,"Great Atmosphere, the Staff is so friendly. Our Server was always  aware of our table and what we needed. I had a Ritz burger that came with a side of small roasted Potatoes. DELISH! I would recommend this place to my friends.",2 years ago,Open,7322444202.0
Bruce A. Kaminsky,4.0,"Not at all what my wife and I expected. It's a family oriented place with pizzas and sandwiches plus meat, fish and chicken full meal entrées. Game areas, big screen TVs, music. I'd def go back 🍕🍝🥗🍜",2 years ago,Open,7322444202.0
Dianna Kula,5.0,Wonderful staff and amazing food.  I've never seen a place so beautifully decorated. The staff really love working their. They tell you all about the reason it's decorated the way it is and that they are all different. They hold …More,2 years ago,Open,7322444202.0
Wendi Higgins,1.0,"This is an updated review from our most recent experience:

The bartender literally ignored our party when we were trying to order drinks …More",a year ago,Open,7322444202.0
Robert Mason,5.0,My son recommended. Food was great and the price was reasonable. I'll be back!,2 years ago,Open,7322444202.0
Aaron Greenwood,5.0,"Very cool and fun place to visit. Especially with kids. Staff is very friendly and helpful. Food is always fresh. There is some free games in the back to play which is always really fun. Definitely an enjoyable place to visit with family, friends, and kids.",2 years ago,Open,7322444202.0
Anthony Khouzam,4.0,"Fun environment, live entertainment, and courteous speedy service. Pizza ok with choice of regular and thin crust, and maybe pan. Large selection of beer.",a year ago,Open,7322444202.0
Darren Cassidy,3.0,"Always 50/50 The portion sizes with salads and anything other then pizza are pretty pricey for what they give you, I always feel like im spending way more then I'm getting back which is never good, The food is pretty good though I love …More",a year ago,Open,7322444202.0
Franklin Boucher,5.0,Favorite pizza! Friendly people and great atmosphere every time!,a year ago,Open,7322444202.0
Michael Lilla,5.0,"The food was outstanding  The waitress was so overwhelmingly pleasant.  I will be going back!  Thank you to Katie, the bartender, for keeping us at the restaurant even longer after dinner due to her great personality.",2 years ago,Open,7322444202.0
Nicole Pace-Addeo,5.0,"Love the pizza, calzone and beer cheese. So delicious! They often have a lot of coupons available, which makes it even better to visit here. I would say it's a little pricey but a great experience and a fun night out with really delicious pizza.",a year ago,Open,7322444202.0
Diane Rome,5.0,Excellent pizza and staff are great,a year ago,Open,7322444202.0
Kathleen Urban,5.0,We frequent MM food is always good! Love their salads and pretzle bites,a year ago,Open,7322444202.0
Cindy Benson,5.0,"My husband and I went with my daughter and son onlaw and our 3 grandsons 1 yr to 4 years old. The food was delicious, great prices and our waiter went above and beyond to help my daughter with her dairy and egg allergies. I would recommend this for anyone w children.",2 years ago,Open,7322444202.0
Tracy L,5.0,"Upon entering I was greeted by 2 friendly young ladies by the name of Ashley & Julia. They made us feel very welcomed. Sam was our waiter he was very friendly made us laugh.
Food was good so was the beer ;)",3 years ago,Open,7322444202.0
Lisa DePalma,4.0,"Some food options that are specials  are only Monday to Friday. The Meatball Calzone was a good size for the price . Tasted ok. The half of Italian sandwich came toasted, which I was not expecting, and was very small, but also tasted ok. On the plus side lots of beer choices, huge bar area. Waitress was great though.",a year ago,Open,7322444202.0
Micky Gallina MUSIC,5.0,I personally recommend the place to everyone it is very well and manners and service and food and everything so truly if you feel like having a bite go over to Mellow Mushroom I recommended on 35 East,a year ago,Open,7322444202.0
Fred Pucylowski,4.0,Had been to a MM on Hilton Head Island and surprisingly it was good and now I can say the same thing about the Tom's  River location. The product is quite good for a pizza place in which no one is named Tony and it was pleasingly …More,2 years ago,Open,7322444202.0
Shayne Aquino,5.0,My friends and I come here regularly and it's always fun and the food is always good. Definitely recommend the Holy Shittake Pie if you like mushrooms.,a year ago,Open,7322444202.0
Gabriel Quevedo,5.0,"Really fast service, even while busy. They really stepped up their game. The staff is friendly and the manager it vigilant when trainees are on for the night. Our food came out pretty fast, even though the server kept trying to deliver it …More",2 years ago,Open,7322444202.0
C J,5.0,Drove 2 hours round trip to get 3 take out pizzas because this is the closet mellow mushroom to me. Definitely worth it! Tastes exactly like the locations in the south.,2 years ago,Open,7322444202.0
Matt Marino,1.0,This place is dirty and overpriced with sloppy service. Plates were dirty and still given to us. AND the chairs are NOT comfortable at all. Its a shame because this is a beautiful restaurant but unless you get a full sided booth... someone …More,3 years ago,Open,7322444202.0
Janet Jacob,1.0,"I can't decide what was worse...the garbage pizza, our terrible waitress or the questionable ""pretzel bites"" that were nothing more than underdone dough balls. We paid $51 for three of us and for terrible service and even worse food. Never again.",a year ago,Open,7322444202.0
Eryka Bonanomi,3.0,"Service was distracted and two male managers randomly barged into the ladies bathroom while I was washing my son's hand. They scared the heck out of me, then claimed they were inspecting. The food is good, but none of the other crazy is worth it. Music is also too loud to talk to your table mates.",a year ago,Open,7322444202.0
