name,stars,text,timeSince,openStatus,key
Rahul Iyer,5.0,"Amount of toppings, cheese was appropriate. Not too less or too much to make pizza soggy. The bread dough was soft and fluffy.
Hummus was also wonderful.",3 years ago,Open,8652770600.0
Tay U.,5.0,"I can't remember what our waitress' name was and I'm thoroughly disappointed in myself for that. She was fantastic, patient, helpful, and incredibly friendly. Our youngest son was having a fit for a good amount of our visit and instead of …More",3 years ago,Open,8652770600.0
Christopher Munsey,5.0,"Excellent service, food, and atmosphere. Granted there was not many people there, we were extremely well taken care of and the food was great.",2 years ago,Open,8652770600.0
Rachel Dodgen,1.0,Dry  pizza overpriced beer!,11 months ago,Open,8652770600.0
Anthony Desalvo,2.0,"I love mellow mushroom, this negative review is reserved for this location in Gatlinburg, TN. This place does not live up to the mellow mushroom standard! I ordered online and my order was not received there (the location was correct on my …More",2 years ago,Open,8652770600.0
Meghana Reddy Mopur,4.0,"Friendly service.
The place was super crowded at around 10 pm on a long weekend. However, the food was right on. Ordered veggie calzone with chicken, it was delicious. Time was …More",2 years ago,Open,8652770600.0
Sadie Taylor,1.0,"Never walked out of a restaurant until this place. Gluten free pizzas are over priced and service is terrible.
I came into mellow mushroom for the first time with my husband. We sat for …More",2 years ago,Open,8652770600.0
Travis Gray,2.0,"Went on a Saturday evening. Food was good, but the service was quite disappointing. We arrived at the host stand and there was nobody around. We waited for a while, and somebody finally came to seat us. After being seated, there was no …More",3 years ago,Open,8652770600.0
Ben Honey,2.0,"Have always loved mellow mushroom, first time at this location and sat at table for 15 minutes before a server came by. Waiters, waitresses, and kitchen staff sitting at tables talking and eating while working, pizza was lukewarm when it finally came, only bad expierience I've ever had at a mellow mushroom, GO ELSEWHERE",2 years ago,Open,8652770600.0
Mariusz Mioduszewski,1.0,"Wait to make order 20 mins...food was ok
Prices way to high",a year ago,Open,8652770600.0
Leann Estrada,5.0,"Delicious pizza, relaxed atmosphere, wonderful service! Our server was Steven, originally from Australia and he was great! We will definitely eat there again!!!!!!!!",2 years ago,Open,8652770600.0
Sharon Brandon,5.0,Really great pizza and fresh salads,a year ago,Open,8652770600.0
Celsa Allende Stallworth,5.0,The staff was amazing and the food delicious,a year ago,Open,8652770600.0
Charles Prowant,5.0,Food and service was great,a year ago,Open,8652770600.0
Suzanne Homemaker,2.0,"Service wow! Walked up and host outside looked at us like we were annoying her by being. She stared at us. I had to ask her, “do we seat ourselves or what?”
She said “oh go upstairs” …More",2 years ago,Open,8652770600.0
Connor,2.0,Very vey slow and the pizza is not the best,a year ago,Open,8652770600.0
Jonathan Bottomlee,3.0,Food was ok.  Pizza came and it took 10 mins to get plates.  Waitress had the personality of a old lunch lady.  Maybe she was hung over because it was New Years.,a year ago,Open,8652770600.0
Ryan,3.0,"Pizza was good, but sandwich was weak.  Service didn't wow me.  I got pizza and requested garlic which I figured it was standard procedure to give garlic powder, instead I received melted garlic butter which I was charged $1.50 when the …More",2 years ago,Open,8652770600.0
Holly Sanderson,3.0,Just average pizza. Great variety of vegan and vegetarian options. Fun atmosphere. Very slow service.,3 years ago,Open,8652770600.0
Lorri Knapp,5.0,Hot and yummy,5 months ago,Open,8652770600.0
pamela ballew,4.0,Great pozza,8 months ago,Open,8652770600.0
Angel Kirk,5.0,Never had a bad experience here! Awesome food and service!,2 years ago,Open,8652770600.0
Charles Smith,5.0,Fun place good beer,a year ago,Open,8652770600.0
Eric Aufdencamp,4.0,I've only had one experience here. But if you like pizza this is it,a year ago,Open,8652770600.0
jay barbieri,1.0,"Music was way too loud.  Hostess did not ask preference for in or outside.  Wait staff nice, but had hard time hearing them over the loud music.  Pizza was ok.  Wait staff did not ask if we wanted deserts. …More",2 years ago,Open,8652770600.0
Tanya Lemorin,5.0,"First time, it was delicious!",10 months ago,Open,8652770600.0
Lyndsey McSwain,5.0,"Everything I've ever eaten here is amazing! Hands down the best pizza crust! Service is awesome,  food is quick!",2 years ago,Open,8652770600.0
James Hall,4.0,Great food. Service was slow.,a year ago,Open,8652770600.0
Brittney Gebers,3.0,Service was lacking. Not necessarily bad but felt forgotten and didn't get what we needed in any kind of timely manner. The pizza was ok but nothing special or extraordinay.,a year ago,Open,8652770600.0
Lauren Lux,5.0,Awesome pizza! Great atmosphere.,a year ago,Open,8652770600.0
Amanda Wyatt,4.0,"We visit every mellow mushroom we find. This was my favorite as far as taste goes. The crust didnt taste like such a heavy wheat as usual so I enjoyed the other taste of the pizza better. However, you enter the restaurant and youre …More",2 years ago,Open,8652770600.0
Sonja Beasley,5.0,Great service and pizza,a year ago,Open,8652770600.0
Angela Rangel,5.0,The pizza is great. I love the spin dip. What i really love is the fun environment.,2 years ago,Open,8652770600.0
Tim Loomis,5.0,"Absolutely loved Mellow Mushroom! My first time there and it was an awesome! The place looked amazing, great pizzas and, in my opinion, Jenny is the Most Beautiful Waitress!! Thanks for an amazing first time!! Definitely worth driving 3 hours!",4 years ago,Open,8652770600.0
Raghunath Mallina,4.0,Good place to get food near the smoky mountains,3 years ago,Open,8652770600.0
James Hoffman,3.0,Very friendly staff with over priced pizza,a year ago,Open,8652770600.0
John Williams,5.0,Cool place! Very big! Good food!,a year ago,Open,8652770600.0
Amy Hixon,5.0,"We arrived in Gatlinburg very late and were looking for somewhere to eat. It was very close to their closing time, however we were still seated and taken care of. We opted for the patio seating so that we could see the street. Our server, I …More",4 years ago,Open,8652770600.0
Bryan Starkey,5.0,Mellow mushroom is the bestest place,a year ago,Open,8652770600.0
James Holston,3.0,The food was tasty. There dough is unique. The service was not good at all though... couldn't handle the crowd.,2 years ago,Open,8652770600.0
Dalton Leman,4.0,Dang tasty pizza,11 months ago,Open,8652770600.0
Jeff Keeter,4.0,"Unlike some other reviews I've read, our service was fast and friendly. We've eaten at many Mellow Mushrooms in many locations and this one ranks with the best. Frida was very attentive and friendly. Good job guys. Four stars only because they didn't serve Highland Gaelic Ale...",3 years ago,Open,8652770600.0
The Modern Yogi,5.0,GO SEE GILLIAN! She is so sweet and kind! She will take good care of you and/or your family :) :),2 years ago,Open,8652770600.0
Jim Whitt,5.0,This was our first visit to Mellow Mushroom. We loved it. We will definitely be coming back.,2 years ago,Open,8652770600.0
Angela Holton,3.0,Not so impressed with the food however the atmosphere and staff were great.,a year ago,Open,8652770600.0
Anthony Robertson,2.0,Service needs improvement. We were seated outside but asked to move. Host acted like a first class prick. May have been 10 customers in the place so there were plenty of seating options. The Island at Pigeon forge locals much better.,4 years ago,Open,8652770600.0
lori oberholtzer,5.0,"Best pizza in town, even the crust is delicious",a year ago,Open,8652770600.0
Caryn Ewald,5.0,Delicious! Not too crowded for a Saturday night.,a year ago,Open,8652770600.0
Kimberly Schmidt,2.0,Bad service they tried to make it right by giving us 20% off,a year ago,Open,8652770600.0
Bernard Shuford,5.0,"We were a big group, so we overwhelmed our lone server, but the pizza was INCREDIBLE and he did a good job. MM really should put a better system in place for servers to handle multiple checks in a single party. He was having to organize …More",3 years ago,Open,8652770600.0
TheFlemster 818,3.0,Good but a medium cheese pizza is 12 bucks,a year ago,Open,8652770600.0
natalie leech,5.0,Love the pizza but really love the sangria's!🍹,a year ago,Open,8652770600.0
BT Hicks,4.0,Food was great. Service was ok.,a year ago,Open,8652770600.0
Benita Kyle,3.0,Great food staff is a little unkind. Being in Gatlinburg I thought they would have southern hospitality but no.,a year ago,Open,8652770600.0
Jonathan Reis,4.0,Good service and location. I feel that mellow mushroom isn't the same as it used to be. Doesn't seem to taste as good as years past.,3 years ago,Open,8652770600.0
Ronnie Schrum,1.0,So disappointing!  Some of our group had been to Mellow Mushrooms in other states and were very pleased but this one was terrible. The restaurant was not busy at all but was told a table for 7 would take 20 mins. The service was awful. Our …More,3 years ago,Open,8652770600.0
Yanet Hebra,5.0,The food here is awesome! Love the wheat free alternative breading! Probably the only pizza I've been able to eat at a restaurant that is actually wheat free!,2 years ago,Open,8652770600.0
Marcus Kirby,4.0,"Good food,  long wait for food,  great view of the street.",a year ago,Open,8652770600.0
James Musgrove,4.0,"Good food, good service, good price, decent beer selection.",a year ago,Open,8652770600.0
Bridget Crume,5.0,Pizza was a little bland but overall the gluten free pizza was good and the atmosphere was great as always!,a year ago,Open,8652770600.0
John Howerton,3.0,"Pizza was excellent,  $12.50 for a plain cheeseburger and chips was a little much. Need a kids menu.",a year ago,Open,8652770600.0
Ashley Barnett,4.0,"We called in and made a pick up order. The food was wonderful however, the gentlemen I spoke with on the phone wasn't familiar with their menu. When we got back to our hotel the I notice that the ""nacho"" cheese I paid $3 for was beer cheese …More",4 years ago,Open,8652770600.0
William Cummings,5.0,Great food good service,a year ago,Open,8652770600.0
Stefanie Barton,3.0,"Waited 15 mins (not packed at the time) for someone to take order, then another 25 for cold pizza",a year ago,Open,8652770600.0
Cecelia Williams,5.0,Shawn at the bar was amazing. He was friendly and down to earth. He made my 1st visit a blast.,2 years ago,Open,8652770600.0
Allan Arroyo-Melendez,5.0,Awesome pizza and good beer!,a year ago,Open,8652770600.0
Richard Valentine,5.0,Great gluten free pizza,a year ago,Open,8652770600.0
Diana Espinoza,1.0,My family was looking forward to eating here. The place wasn’t packed and were promptly seated.  However the server never came. Not even to get our drink options. We saw staff walking back and forth which I am assuming that they were taking …More,2 years ago,Open,8652770600.0
Catherine White,1.0,"Never got sitted, wasn't crowded, overlooked by several other incoming white customers, we were told they wasn't any sits available and the place was almost empty, even outdoor seating available, after enduring this for 45 minutes we left, Diversity Training needed IMMEDIATELY !! LAWSUITS ON THE WAY !!",a year ago,Open,8652770600.0
Kelly Reinhart,4.0,Good food priced affordable.,a year ago,Open,8652770600.0
Sabrina Wade,5.0,Best pizza crust in Tennessee,a year ago,Open,8652770600.0
Rachel Defrancesco,5.0,Love the pizza here😍,a year ago,Open,8652770600.0
Kathy Wallace,2.0,Service was poor. Food was not hot or cooked correctly to order.,a year ago,Open,8652770600.0
Mandy Abercrombie,4.0,"We love Mellow! The staff at this one didn't seem to want to be at work when we visited this time, however",a year ago,Open,8652770600.0
Cathy Lawson,5.0,Fantastic pizza! My first time but not my last!!!,a year ago,Open,8652770600.0
Mel Marie,1.0,"Pricing is appalling for what you get. This was my first visit at a Mellow Mushroom. I ordered a shiitake pizza and the minimal amount of toppings were all dumped in the middle, resulting in a ridiculous amount of dry and boring crust. The …More",2 years ago,Open,8652770600.0
Marc Williams,3.0,"Had a couple lagunitas ipas and shared a delicious pizza and a caesar salad, as always pizza was very good. However, upon arriving we were greeted by a hostess that was laughably rude. She greeted us by saying, “it will be at least 30-40 …More",a year ago,Open,8652770600.0
Denise Sluder,4.0,I love the grilled cheese cheese burger. We sat at the bar because there was a small wait. The chairs were very uncomfortable.,2 years ago,Open,8652770600.0
Jodi Cook,5.0,Mellow Mushroom has great pizza. You can choose from a variety of different crusts and toppings. They also serve great mushroom soup.The service was great. Love the  decor.,3 years ago,Open,8652770600.0
Jenny Southard,5.0,Amazing pizza!,10 months ago,Open,8652770600.0
Tina Rawlins,2.0,Ordered cheese bread but very little cheese and was very dry. Coke tasted bad,a year ago,Open,8652770600.0
Victoria Raber,5.0,Excellent service and food,a year ago,Open,8652770600.0
Steve Salyers,5.0,Great place to enjoy a pizza and the Gatlinburg strip.,a year ago,Open,8652770600.0
Brittany V,5.0,"Wonderful outdoor patio overlooking Gatlinburg. Great frozen drinks. Our pizza and appetizer were delicious. Best of all, our server was amazing! Incredibly nice and helpful.",4 years ago,Open,8652770600.0
Grant Phillips,5.0,"Great place for eating and enjoying your time with company, friends or loved ones. Be prepared to stay for a long time as it is a 4 course meal type of please.",2 years ago,Open,8652770600.0
Leila Galaba,5.0,Excellent food and service. And not unreasonable with their prices either. Great beer selection too. Perfect place to bring the family or just relax at the bar. By far my favorite spot in Gatlinburg!,5 years ago,Open,8652770600.0
Thomas Olson,4.0,Good food. Portions are large.,a year ago,Open,8652770600.0
Andrew Zimmerman,3.0,"It's fine. Nothing special. Friendly, but kind of slow, service. Decent pizza with lots of topping options.",3 years ago,Open,8652770600.0
Brigit Olivero,1.0,Worst meal experience in 15 years.  I have enjoyed Mellow Mushroom in other locations.  This one is abysmal.  The kitchen made SO MANY mistakes.  The manager failed to rectify.,2 years ago,Open,8652770600.0
Travis,5.0,"Pizza at Mellow Mushroom, need I say more? Well, ok I will.
One of the many stops that hit every time we're in Gatlinburg. Great pizza and the staff is always on the ball.",3 years ago,Open,8652770600.0
Kellie Lipke,3.0,"The Hostess was eating a big salad when we came in. Not trying to hide it, just having her lunch at the podium. Our server however was beyond expectations and very personable!",3 years ago,Open,8652770600.0
Kendall Leake,3.0,"Pizza was ok, little pricey for what it was, maybe we ordered the wrong one since it was not very flavorful.",a year ago,Open,8652770600.0
Chadd A,1.0,"This was one of the worst experiences we have ever had at a mellow mushroom. We have eaten at around 15 mellow mushrooms from Florida, Georgia and Tennessee. service at this location was absolutely terrible as a Young Man waiting on us did …More",a year ago,Open,8652770600.0
Mary B,1.0,Pizza had a good taste however my husband and I got sick after eating here.,a year ago,Open,8652770600.0
Chelsea Carlson,5.0,I expected good food and I got good food! I am so glad I go to go. The restaurant itself is really cute too!,3 years ago,Open,8652770600.0
Shane Bowman,5.0,"Food was great of course but the service was phenomenal, and we had a group of 25",a year ago,Open,8652770600.0
Paola Davalos,2.0,Not good food nor service. Would not recommend or return. The pizza dough did not taste good at all.,2 years ago,Open,8652770600.0
Al Mullin,5.0,"Great food and service, if it's pizza in Gatlinburg, go here.  Unique creative choices.",2 years ago,Open,8652770600.0
Lindsay Barnes,5.0,"Food was great, and they were able to accommodate a gluten free vegan diet. Our waiter was unfortunately unfamiliar with celiac and gluten free diets, but he was able to get the needed information from the kitchen.",2 years ago,Open,8652770600.0
Daniel Vanover,5.0,Another great location for a great restaurant.  The pizza here is some of the best I've had.  Really great experience every time.,4 years ago,Open,8652770600.0
Kip Arnold,5.0,Awesome pizza !,a year ago,Open,8652770600.0
Mattea Russell,5.0,Came to Galtinburg on a weekend trip with my boyfriend and decided to try this location! Not only was the atmosphere and service great but we are big pizza fans and this was some of the best pizza we’ve ever had! If you like buffalo chicken pizza I highly reccomend it!,2 years ago,Open,8652770600.0
Vincent Mortellaro,5.0,Went here twice with my gf to try their pizza while we were in town. The vegan pizza was amazing (great cheese) and the service was awesome.,2 years ago,Open,8652770600.0
Keta Napier,5.0,We were sat on the balcony and it was perfect. Pizza was delish...our waiter was attentive and cool,2 years ago,Open,8652770600.0
Shubert Mendez,5.0,Best tasting pizza,a year ago,Open,8652770600.0
John Phillips,2.0,"Hostess didn't greet, just basically looked at s like we were crazy for coming in at 845pm. Took 10 minutes before we saw a waiter. Took drink order, non-alcoholic came out immediately, one beer took another 5 minutes. Server disappeared …More",3 years ago,Open,8652770600.0
Caryn Hensley,5.0,Best frickin pizza of my life. For real. And my husband is picky about sauces. He doesn't like chunky sauce. This had small chunks but he said was good so he ignored it. Crust was AMAZING. and the waitress was awesome. (Hostess (guy) was …More,4 years ago,Open,8652770600.0
Tim Kerrigan,5.0,Arrived in Gatlinburg and read the reviews for the Mellow Mushroom. They weren't good. Went anyway. Food and service was excellent. Didn't like one of the beers I ordered and they made it right. Waiter got a nice tip. Great service and food was good.,5 years ago,Open,8652770600.0
Michael Bear,5.0,I loved this place. The service was great and the pizza was fantastic!,2 years ago,Open,8652770600.0
Daniel Milligan,5.0,"Great food, great service.  I would definitely eat here again.  Kids really enjoyed it.",3 years ago,Open,8652770600.0
Kelly Lawrence,1.0,Fast service. Very rude. Drinks are very weak. Bad service and wouldnt advice anyone to come,2 years ago,Open,8652770600.0
Jessica Coffey,5.0,Great food..,11 months ago,Open,8652770600.0
David Watterworth,5.0,Excellent pizza and wings!,a year ago,Open,8652770600.0
King Cypher,5.0,Their pizza is life changing,a year ago,Open,8652770600.0
Scott Everett,5.0,Great time with awesome people!,a year ago,Open,8652770600.0
Annette Hansen,5.0,Nice place with great view,a year ago,Open,8652770600.0
Tammy Hyde,5.0,Our first time at Mellow Mushroom was great!,a year ago,Open,8652770600.0
Dustin Kirby,4.0,A little warm inside. Great pizza Holy shitake is awesome. It has garlic sauce drizzle so bring gum.,3 years ago,Open,8652770600.0
thelastmohawkin,4.0,Bloody expensive. Great though.,a year ago,Open,8652770600.0
Mark Angel,5.0,"Amazing everything.  Food, service and atmosphere",2 years ago,Open,8652770600.0
Krista Henson,1.0,"Long post.
Tonight my family of 14 was sat in the back party room. We were split up into 3 separate tables. 10 minutes after being sat, the waitress (named jessie) came to …More",a year ago,Open,8652770600.0
oliverplays 14,3.0,Good pizza. Tried the beer cheese upon recommendation from server. Bad idea. Nothing like the beer cheese at Lil Big Britches Brewing.,2 years ago,Open,8652770600.0
Dj Huffman,4.0,Food was really good.   Our waiter could have been a little more into his job though,2 years ago,Open,8652770600.0
Billy Hunter,4.0,Good place to eat great view...,a year ago,Open,8652770600.0
Stacey Keeper,1.0,"Pizza was cold, and I have been waiting for the server to bring me a refill on my soft drink since he brought our pizza. Me and my husband have finished the pizza, and still no refill.",2 years ago,Open,8652770600.0
Zeeshan Aslam,3.0,"Pizza combination were kind of odd, the bread was sweet. I imagine we might have just gone too crazy but it isn't your normal pizza. If you Hungry from a long day need something familiar this isn't the place.",4 years ago,Open,8652770600.0
James Jett,4.0,Good quality pizza and wings. Have visited here at different times and different locations. Seems to be quality across the board. Not the cheapest but quality always is worth a little more,2 years ago,Open,8652770600.0
L Abell,5.0,Gluten free pizza. Kinda chewy but delicious,2 years ago,Open,8652770600.0
Akhilesh Shah,4.0,"Nice, huge place..serving a variety of Continental food including some very American Hoagies and all. Service was a bit slow and the food was quite Ok. Nice place to chill though a tad bit noisy",a year ago,Open,8652770600.0
Peggy Hansen,2.0,"I usually love the Mellow Mushroom, but this one was kind of gross. The waiter was greasy. And they put us at a table on the outer patio where every time the door opened to the inside, a giant fan would blow really loud and drown out conversation. The pizza was good, but the atmosphere really took away from the experience.",2 years ago,Open,8652770600.0
Hollie Berry Elizondo,5.0,"Favorite dishes: veggie calzone, holy shitake, and pretzels with beer cheese. Great local beer selection too!",2 years ago,Open,8652770600.0
Timnothy Oltjenbruns,5.0,"One of the best pizza places I have visited. Though it's not authentic Italian or New York pizza, it's incredibly delicious. All the staff was extremely friendly.",4 years ago,Open,8652770600.0
Brad Bushard,4.0,Good mushroom pizza (go figure) in a neat setting,2 years ago,Open,8652770600.0
Steven Rowland,5.0,If you are in the mood to sit down and eat pizza its a no brainer. Their pizza is delicious and they have a good craft beer selection. I am a little bummed they no longer carry honey to dip my crust in but its still a 5 star establishment.,3 years ago,Open,8652770600.0
Brandon Edwards,4.0,A bit pricey for pizza but was very tasty.,2 years ago,Open,8652770600.0
Amisha Chauhan,1.0,Messes up our order and gave us wrong itmes,a year ago,Open,8652770600.0
Neal Niswender,5.0,"Good pizza, salads, and beer selection. Staff was curtious and attentive. Visited a few times will in Gatlinburg.",2 years ago,Open,8652770600.0
Meloney Wilson,1.0,Im a server at Bdubs in Ohio. My husband needed to use the restroom so we stopped there. As I waited on him. The guy working was really rude to me n made me feel uncomfortable. Then he told a guest right in front of me that his shift was …More,2 years ago,Open,8652770600.0
Michael Nellett,5.0,Great food and pure server Cortney was amazing!!!,a year ago,Open,8652770600.0
Paul Coomer,5.0,"Nice atmosphere, good food.  Several unique pizza choices, and we had a great view of the downtown stores.",2 years ago,Open,8652770600.0
Patricia Estep,5.0,Food and service was Super.  Atmosphere was fun.,2 years ago,Open,8652770600.0
Ansal Shah,2.0,"Great service but very average pizza. Too sweet, so much cheese and very little topping. Not to mention, you pay 25 bucks for large pizza which is too much for this quality. Our waiter was good though. I guess some ppl may like this pizza …More",3 years ago,Open,8652770600.0
Heidi C,5.0,Great pizza and appetizers are awesome too! Dudes Daiquiri is good too!,2 years ago,Open,8652770600.0
Don Miller,4.0,Great tasting pizza!,a year ago,Open,8652770600.0
Gabe Seelye,4.0,Great atmosphere and pizza. Little pricey on alcohol.,2 years ago,Open,8652770600.0
James Shealy,5.0,"Jerry provided the best service as our waiter and if that wasn't enough, the manager checked on us as well. The pizza and wings were cooked absolutely perfect, and holiday beers were delicious! Best mellow we've ever been to and good atmosphere. Highly recommend for Gatlinburg eats.",4 years ago,Open,8652770600.0
bro davis,1.0,"Food was good but Jennifer Henderson has to be the most rudest, smart mouth person I've ever met, we had our 2 autistic children with us & you would have thought that they committed a crime by talking to her, she was told that they have …More",4 years ago,Open,8652770600.0
Dan McKinnies,4.0,I really like their pizza and the decor is awesome!,a year ago,Open,8652770600.0
Daniel Buckenmyer,5.0,"We excitedly drive 7 hours each direction, passing several other locations of the MM, just to go to this one. Usually we go for at least one meal a day, but we only got to go once on our two day trip this time. Oh, and we checked out some …More",3 years ago,Open,8652770600.0
katherine hamilton,5.0,The waiter was always asking if we needed anything and he kept us updated on our food,a year ago,Open,8652770600.0
Samuel Baldwin,5.0,Great place to eat.  Center of town.  Great pizza.,2 years ago,Open,8652770600.0
Josh B,5.0,Great pie,7 months ago,Open,8652770600.0
Andrew S,4.0,Salads were excellent lol,a year ago,Open,8652770600.0
ליאת דוד,5.0,"Great atmosphere, good service and tasty pizza",2 years ago,Open,8652770600.0
Jose Mireles,5.0,Corey was awesome and a great bartender. Atmosphere fun and food was great.,2 years ago,Open,8652770600.0
Ann Chamberlin,1.0,They are very unhelpful rude. Used short staffed as an excuse for not seating us did not go out of their way for the customer. There was plenty of seats for some reason the server couldn't walk 10 feet to our table. Young adults running …More,2 years ago,Open,8652770600.0
Esteban Rodarte,5.0,Always great!,10 months ago,Open,8652770600.0
