name,stars,text,timeSince,openStatus,key
Alyssia Rebuck,4.0,"The food has never disappointed. Can be a hit or miss with the quality of the staff, but when there are a lot of young employees that is to be expected. They have been unfortunately slow with getting food to the table on a consistant basis, ranging from 25-35min wait after placing an order during both busy and slow times.",2 years ago,Open,3362352840.0
Kristy Marshall,5.0,"Jess was our waitress, she was very kind and gave wonderful service",a year ago,Open,3362352840.0
Anna Hawkins-Ross,4.0,This mellow mushroom is very nice. Food was good and server was nice.,a year ago,Open,3362352840.0
Maiya J.,5.0,"The atmosphere the place is really chill.  The pizza was really good, and the jerk wings were as well.  The staff was very friendly.",a year ago,Open,3362352840.0
Khaleelah Thompson,5.0,"Always ❤️ love coming into the down town Mello mushrooms, staff always friendly, always on the ''A'' game when it comes down to the tap beers, love the jerk wings keep up the great work!!!!",a year ago,Open,3362352840.0
Joey Martin,5.0,Always love Mellow Mushroom and this one is in a great location with the typical Mellow Mushroom decor that will brighten up your day. You can't beat the amount and extremely high quality of food you get for the price. The beer selection is …More,2 years ago,Open,3362352840.0
Domanique Webb,5.0,The food was delicious!,11 months ago,Open,3362352840.0
walter atkins,5.0,"Great pizza as aways. 10 mellow mushroom I have eaten and it never disappoints. First one I have been to with no WIFI??? Service a little off at the beginning, but server upped her game as meal went on.",2 years ago,Open,3362352840.0
Brandon Mickie,4.0,Food was good service was ok. Good overall,a year ago,Open,3362352840.0
Whitney Justice,5.0,The food and service were phenomenal!,a year ago,Open,3362352840.0
Urban Hermit,5.0,Best pizza I've had in a while. The restaurant had a nice atmosphere. Beer selection was good so there's something for everyone. I would return next time I'm in the mood for pizza.,2 years ago,Open,3362352840.0
Kevin Brown,5.0,Best calzones in Greensboro. Pizzas are good too.,a year ago,Open,3362352840.0
Frank Harmon,5.0,"Great atmosphere, great service, and great food! Always a fun experience!",a year ago,Open,3362352840.0
Lena Troxtell,3.0,The food was good. The server was nice but the service was slow. It was lunchtime but it wasn't that busy. I don't know if they were under staffed or what. I will go back again though.,2 years ago,Open,3362352840.0
Felicia Troxler,5.0,"Service was excellent. My waitress was great. No long wait, food was hot, delicious. Atmosphere was awesome. I have o my been here 2x but will be back again. Excellent service and food each time. Will buy a groupon for here every time I see but will come without and will tell friends!",3 years ago,Open,3362352840.0
Tammy Fischer,5.0,Awesome pizza 4 down south!,a year ago,Open,3362352840.0
Angel Guerrero,4.0,"Got the order wrong, made us wait extra 20 min since the messed up reservation. Food was good.",a year ago,Open,3362352840.0
Jason Phillips,5.0,Great pizza with fresh ingredients and a doughy crust with parmesan and butter. Great beers on tap. One thing I love is that each Mellow Mushroom has its own unique style. We’ve been to the one in Winston and Asheville and all three are great.,2 years ago,Open,3362352840.0
Ava Milton,5.0,The food was delicious the staff was friendly 😊,a year ago,Open,3362352840.0
Jim Turnage,5.0,"Service excellent, quality excellent, salads are outstanding!",a year ago,Open,3362352840.0
Teresa Taylor,5.0,"Our family stopped by here on the way home to Virginia. We ordered two pizzas, both of which were great but the Magical Mystery Tour pizza was out of this world delicious! Really cool atmosphere with mismatched chandeliers and beautiful stain glass windows. Service was fast and friendly.",4 years ago,Open,3362352840.0
Meredith Carlson,5.0,"LOVE the whole wheat crust here, always fresh and delightful.",a year ago,Open,3362352840.0
lurking Caro,5.0,The pizza and calzones are really good. Lots of room. Clean bathrooms.,a year ago,Open,3362352840.0
John Walker,5.0,Always  great service and wonderful food,a year ago,Open,3362352840.0
Mark Roscoe,5.0,Perfect 👌 size portion big selection of craft beers,a year ago,Open,3362352840.0
"Advanced Technology Investigations, LLC",5.0,Awesome food and friendly staff. Usually don't have to wait long even in busy times. I highly recommend if your looking for a non typical pizza place.,3 years ago,Open,3362352840.0
Jeffrey Alston,4.0,"Mellow Mushrooms are growing into a big chain, and the different locations can be hit or miss.  This particular one is very good.  The location is pretty large and accommodating and makes a good pie.",2 years ago,Open,3362352840.0
joseph wooten,5.0,Daughter has a milk allergy. They make her pizza with vegan cheese and she loves it everytime. Thanks for caring,2 years ago,Open,3362352840.0
Kathleen Moncla,5.0,"Very good food, excellent service. Our waitress was very kind and helpful with our 2 year old grandson. We will come back again!",2 years ago,Open,3362352840.0
Loretta Divine,5.0,Great shitake mushroom pizza!  Good service!,a year ago,Open,3362352840.0
Topher Glass,5.0,The food is scrumptious! The chicken & cheese hoagie is delicious and the vegan cheese pizza cant be beat! The servers are always friendly and knowledgeable. The building is also decorated is the most beautiful stained glass windows too!,2 years ago,Open,3362352840.0
Basil Agapion,5.0,The wings are FANTASTIC! Pizza crust is amazing.,a year ago,Open,3362352840.0
Benjamin Lugo Velez,1.0,Worst cheese and steak ever.  No flavor.  Bread felt like a tear old,a year ago,Open,3362352840.0
Todd Harmon,5.0,Best pretzels and wings in town!,a year ago,Open,3362352840.0
Jeffrey Cardona,5.0,"Wow,this place is excellent! I highly recommend it. All of our food was great and fresh tasting. I had the Jerk Chicken sandwich and it blew my mind! …More",4 years ago,Open,3362352840.0
Anna Stephanie,5.0,Love the food. Great service!,a year ago,Open,3362352840.0
Caryl Cheeseman,5.0,DELICIOUS!!  Had the white pizza with 3 kinds of mushrooms and carmalized onions.  So good!,a year ago,Open,3362352840.0
Ty Bosworth,5.0,"Fast lunch service, great menu choices, high quality food.  I love this place and eat here often.",2 years ago,Open,3362352840.0
Katie McDaniel,5.0,Best veggie pizza ever!!,10 months ago,Open,3362352840.0
Noah Clark,5.0,Good food an service at Greensboro location,a year ago,Open,3362352840.0
Jason Loper,4.0,Good food good service,a year ago,Open,3362352840.0
KeKe Key,5.0,The best pizza in the triad! Love this place!,a year ago,Open,3362352840.0
Matt Ringrose,4.0,"This a great place to eat with amazing beer options/specials. It can be a little pricey, but I find you typically get what you pay for. They have lots of choices and an extensive menu. The service can be a little slow, and you will often wait a while to be seated. I wouldn't recommend going here if you are on a tight schedule.",2 years ago,Open,3362352840.0
earl williams,5.0,"Awesome variety, perfect location close to shops",a year ago,Open,3362352840.0
Marilyn Mars,5.0,"Great setting with lots of prisms giving it a festive atmosphere. Then, the food was awesome. Terrific friends didn't hurt the experience one bit. We would come again.",3 years ago,Open,3362352840.0
Riddhi Rathi,5.0,Great vegetarian/vegan options and pretty eclectic decor. Can get very loud and busy over the weekends.,a year ago,Open,3362352840.0
Rey Perez,5.0,It is a nice pizza place and brew nice place to have a group dinner.,a year ago,Open,3362352840.0
Erica Talley,3.0,"We're originally from Chicago and mourned the loss of good pizza after living in the Triad for two years with a zero success rate of finding a worthy pizza joint. Then, we happened upon Mellow Mushroom. The staff is pleasant (even if a …More",3 years ago,Open,3362352840.0
Gabriel Zeller,5.0,"Good service, great food!",a year ago,Open,3362352840.0
Faith peace,4.0,Good food and awesome waitress we went on a Saturday night and waited 45 minutes for a table it was worth the wait,a year ago,Open,3362352840.0
Victor Pabon,4.0,"A little pricey for a pizza restaurant but the food is good. Service was a little slow but they might have been shorthanded. Overall, a quirky hipster type of place with good food.",3 years ago,Open,3362352840.0
D. Lockley,5.0,Pizza and wings are absolutely AMAZING!!!,a year ago,Open,3362352840.0
Anonymous,5.0,"Always quick excellent service, staff is laid back and funny. Brilliant food and excellent decor.",2 years ago,Open,3362352840.0
Charles Kibby,5.0,Superb eatery. Great staff and food. Quirky decor but some of the most amazing stained glass windows. Great location right downtown.,3 years ago,Open,3362352840.0
Candice Campbell,4.0,One of my favorite pizza joints.,a year ago,Open,3362352840.0
Sherry Cole,5.0,First time eating there. Loved loved loved it. Not many places you can go and sit down and eat a pizza any more,2 years ago,Open,3362352840.0
"Billy Walker, Jr.",5.0,I got a small House Special pizza. Best tasting pizza I've had in a LONG time!,2 years ago,Open,3362352840.0
Jalen Knops,5.0,"Always a way to get a feel of Asheville, when I cant take a vacation.",a year ago,Open,3362352840.0
CIMORELLI FAN FOREVER,5.0,Love their pizza and subs. The food is always good and I find that it is a very nicely designed restaurant.,2 years ago,Open,3362352840.0
sergio almeida,4.0,The food is always amazing at this location. The service is great too. I always get enough honey with my pretzels. The pizza is pretty fantastic too. …More,4 years ago,Open,3362352840.0
Kay Raines,5.0,Sooo good yummmyyy you will definitely enjoy the food and the atmosphere,a year ago,Open,3362352840.0
Erika Stafford,4.0,"Quant location. Food was good, as expected. The seating is a little iffy.",a year ago,Open,3362352840.0
Avery Cotton,5.0,"We called ahead, as we were on the road travelling and wanted to make sure that they could accommodate the allergies of our party.  After informing them of our group's allergies (gluten, dairy, and egg) they reassured me that they could …More",3 years ago,Open,3362352840.0
Dylan Weaver,5.0,Great pizza and reasonable prices. Would definitely recommend,2 years ago,Open,3362352840.0
Carly Starkey,5.0,First time at this location. I tried a pizza without really reading the description (my fault). I ordered another pizza was totally going to pay for the pizza I messed up... but the manager came over and told me they were taking it off the …More,3 years ago,Open,3362352840.0
DANIEL Steele,5.0,Great service and great food,a year ago,Open,3362352840.0
Shannon Perez,4.0,Great place with reasonable prices.,a year ago,Open,3362352840.0
Pukysand,5.0,Great,2 months ago,Open,3362352840.0
Cj Moser,5.0,Great pizza and wings,10 months ago,Open,3362352840.0
steve prophater,5.0,"Great food, atmosphere, did I say food!! Brutus salad, pizza!!!",a year ago,Open,3362352840.0
Michael Churgel,5.0,We always love Mellow Mushroom in whatever City we visit one in. The service here was excellent. And the food is always good. Try the stuffed mushroom which was not on the menu but is so yummy.,3 years ago,Open,3362352840.0
Shauna Ireland,5.0,They made a vegan cheese bread with marinara sauce that was so good I actually thought it was real cheese. I appreciate that they have some vegan options and they are delicious!,2 years ago,Open,3362352840.0
Harley Putnam,5.0,Great pizza! 🐓,11 months ago,Open,3362352840.0
Jaime Cebollero,5.0,The absolute best,11 months ago,Open,3362352840.0
NeedsMoreTry,1.0,"Good food, horrible business practice. They sent me a coupon for some free pretzels with my next order and the instructions stated I needed to show coupon to claim. I showed it to the cashier as I picked up my order. She said since I paid …More",2 years ago,Open,3362352840.0
Sheon Graves,5.0,GREAT DINING AND STAFF***,a year ago,Open,3362352840.0
Rayne Harris,2.0,"I am sure the food here is great as with other Mellow Mushrooms I have patronized. Unfortunately I never got that far at this particular establishment.
My wife and I were seated at a table for two and the table was so small when the …More",7 years ago,Open,3362352840.0
catherine keating,3.0,Downtown so the parking is hard.  The food and service are ok.,a year ago,Open,3362352840.0
adrian jacox,4.0,Great food atmosphere  and service.,a year ago,Open,3362352840.0
Christopher Harden,5.0,"I don't crave pizza often. When I do, I only want Mellow Mushroom. The Mighty Meaty aka the Meataterian makes me very happy.",2 years ago,Open,3362352840.0
Tara 79,5.0,Their Steak with Green Peppers and Xtra cheese Calzones are A-MA-ZINNG!!!,a year ago,Open,3362352840.0
Kristin Walker,5.0,Amazing atmosphere and excellent food. The staff is always friendly and fast. Outside seating is lovely as well.,3 years ago,Open,3362352840.0
Billy McDowell,4.0,Good pizza & good service.,a year ago,Open,3362352840.0
Tonya Evans,5.0,Very good and the waitress was very attentive.,a year ago,Open,3362352840.0
Bryon Feth,3.0,"Pizza was good, a bit on the oily side...slow service...on the high price side for portion size",a year ago,Open,3362352840.0
jd quinitchette,5.0,"A great find. Less than $25 for the 3 of us. I had the jerk chicken half hoagie. Awesome like real food, not like restaurant food at all.
So we're back during the Pride weekend, and this was our choice amid all the …More",4 years ago,Open,3362352840.0
Ben Yates,5.0,The vegetarian pizza and chicken salad were awesome. Place is super busy and we had to track down our original waiter to pay the bill but other than that very good food.,2 years ago,Open,3362352840.0
William Glasscock,2.0,Arrived at 5:30 an was seated at 7:30 beer was worm food was good an the wate staff was great but i won't be going back,a year ago,Open,3362352840.0
John Stevens,5.0,Great pizza and service,a year ago,Open,3362352840.0
Petty Wise,5.0,Pizza was amazing 😍 wings were great. Waitress was great everything is great. Thank You !,2 years ago,Open,3362352840.0
christopher watson,5.0,Great White pizza is phenomenal!,2 years ago,Open,3362352840.0
Fani Mwasiti,4.0,"I been to this place soo many times, my church used to take us high and middle school to Mellow Mushroom a lot.",2 years ago,Open,3362352840.0
Lisa Winslow,4.0,"Always love Mellow Mushroom. Their staff has improved over the years, just wish they offered more vegan options like other pizza joints around town",2 years ago,Open,3362352840.0
Matthew Shanley,5.0,My new favorite place to eat.,a year ago,Open,3362352840.0
Scott Logan,4.0,Great pizza. I love sitting outside. Good service,2 years ago,Open,3362352840.0
Loc Queen,5.0,"This is my favorite pizza place even though I do not go as often as I would like to.The staff is always super friendly,helpful,and very knowledgeable.I do not even like anything bbq on my pizza but I can eat there chicken bbq pizza every single day!You couldn't ask for better quality pizza!The drinks are always amazing too!",2 years ago,Open,3362352840.0
Ebony Davis.ebony79@gmail.com,5.0,Great food. Flies on the outside patio are really bad. But overall awesome food.,2 years ago,Open,3362352840.0
The Wassa Wassa Show,5.0,. Awesome place to eat everything is great from the service to the full to the drinks I've been there on three events birthday parties Gatherings it's always been a pleasure to be there,2 years ago,Open,3362352840.0
Daniel Turner,5.0,"Dinner, service, and beer was excellent!!!",a year ago,Open,3362352840.0
Mark Miele,3.0,"Stopped  in to the Mellow Mushroom  on New Years Day 2019 on way home from a trip. Fairly busy when we're arrived,  place filled with the young hipster crowd.
Was seated promptly.  Our server was friendly. I believe her name was Tay. …More",a year ago,Open,3362352840.0
Emily Spiering,5.0,"Amazing pizza for a great price. Nice, cute, local place.",2 years ago,Open,3362352840.0
Beatrice Kwok,5.0,"It was my first time at the Mellow Mushroom in Greensboro and it did not disappoint! My husband placed an order online around 6PM and requested the pizza be ready at 7:30 for pick up. Parking was a bit difficult as it is downtown, but I …More",3 years ago,Open,3362352840.0
L J,5.0,Great food!,10 months ago,Open,3362352840.0
Treva Wine,5.0,Great pizza and service. Thanks for a nice luncheon.,2 years ago,Open,3362352840.0
william lampkin the Fam,4.0,"Great food, sometimes the service is lacking. Depends on which server you have.",a year ago,Open,3362352840.0
Larry Arnold,5.0,Best pizza EVER!!! WHY DID I WAIT SO LONG TO INDULGE AT THIS WONDERFUL EPICUREAN DELIGHT????,2 years ago,Open,3362352840.0
carmen santiago,5.0,"Good pizza, good service",a year ago,Open,3362352840.0
Heather Independent Avon Rep,5.0,My favorite sit down pizza place. Prices are compareable for what you get. They sell mixed drinks etc. They also have pasta and other stuff but we always get pizza. Look for them on groupon and you'll save atleast $10 they are on there almost every month.,2 years ago,Open,3362352840.0
EndlessMotions Non-Profit,5.0,"People are soooo kind. Had a super big to go order and we got cups,ice,plates, tea,pizza,salad, and napkins.   All was missing was MM chewing for us.  Beautiful place to eat!",2 years ago,Open,3362352840.0
Gina Leigh,5.0,One of my favorite places to eat. Such great food and always satisfied no matter what location we go to!,2 years ago,Open,3362352840.0
John Starke,5.0,Nice place good food and great pizzas,a year ago,Open,3362352840.0
Shelly Acuff,5.0,"The service was awesome tonight.  The waitress had a great personality and was great with suggestions.  Our food was exceptional.  The stuffed Portobello is always a favorite and the vegetable tortilla soup , another favorite.",2 years ago,Open,3362352840.0
William Lee,4.0,Lots of outdoor games and good food,a year ago,Open,3362352840.0
Brandon Gainey,5.0,"We built our own pizza. We had pepperoncini, mushrooms, and pineapple. It was delicious!",2 years ago,Open,3362352840.0
Nadine Klabunde,4.0,"We are very picky about our pizzas, but mellow mushrooms has never disappointed us! Great pizza and delicious prezels.
Only the service could have been better today, they seemed to be very understaffed.",2 years ago,Open,3362352840.0
LORETTA CUTHRELL,1.0,Horrible service! I ordered a extra large pizza and waited 45 minute only for the waitress to come inform me that they never made my order. After waiting 45 minute I just left. I have no plans on going back.,2 years ago,Open,3362352840.0
Kimberly Pierson,4.0,"The food is great, but the service is slow. If you have a large group, something will get messed up. Great for long lunches or dinners, but never if you're on a time crunch.",3 years ago,Open,3362352840.0
Angela B. Proctor,5.0,"Great service, great food, great atmosphere",2 years ago,Open,3362352840.0
Ahbi Bügger,5.0,"Kind staff, groovy ambiance, stellar whute pizza. Only comment- their pretzel bites are not really pretzels lol",a year ago,Open,3362352840.0
Destiny Wolford,5.0,Nice decorations. Great service and friendly staff. Food is delicious 👌,2 years ago,Open,3362352840.0
kathy vanhook,5.0,Great spinach salad and very friendly atmosphere,a year ago,Open,3362352840.0
hannah wagner,5.0,This is a really good place and is pretty veg friendly :),2 years ago,Open,3362352840.0
David Murin,3.0,"Pizza was great Maui Wowie, wings were great. Why 3 stars I ordered sweet tea and I noticed my glass had lipstick on it. The glass was never washed, the waiter apologized and got me a new glass after that the magic was gone.",3 years ago,Open,3362352840.0
Avid Traveler,5.0,Great pie! Calzones are awesome to. Beer selection is killer as well.,a year ago,Open,3362352840.0
David McMurray,4.0,Always great service and good food. If you come here on a Friday through Sunday night be prepared to wait. The line is usually out the front door. Worth the wait!,3 years ago,Open,3362352840.0
Tim Binford,4.0,"Delicious food served in a funky, artistic setting. They serve many vegetarian entrees. As one might expect, most of their entrees include mushrooms. Their pizzas taste fresher than I have found anywhere else.",4 years ago,Open,3362352840.0
Spencer Gallimore,5.0,Pizza is always great! Expect a wait on the weekends. The restaurant theme is creative and the wait staff are always attentive. Definitely a place you have to try if you have never been here before.,4 years ago,Open,3362352840.0
J,3.0,"To be fair, we came on a Sunday which was quite busy and the new waiter was still very new and kind of shy. Although we were seated fast it took awhile for our order to be taken, the pizza to actually show up, refills, and the check to …More",2 years ago,Open,3362352840.0
Christina Keith,1.0,"Rude waitor.
Poor service.
Good food.
Kinda Family Friendly.",2 years ago,Open,3362352840.0
Rashad Musulin,5.0,"This is a beautiful restaurant with great food, service and ambiance. The decor is very elegant. If you are in Greensboro and are looking for a top restaurant, you must dine here.",3 years ago,Open,3362352840.0
Donna Allen,5.0,"Best pizza around.  The staff is really great, too.",2 years ago,Open,3362352840.0
Alexander Czentye,5.0,Great place and atmosphere. Had a huge party of 60+ and they accomodated everyone perfectly,2 years ago,Open,3362352840.0
Joey S,5.0,Excellent food and friendly staff. This was my first time eating here but not my last.,2 years ago,Open,3362352840.0
Hvnshallburn 666,4.0,Great staff.  The food was amazing as usual.,2 years ago,Open,3362352840.0
Poncho Herring,5.0,Love the mighty meaty Pizza,a year ago,Open,3362352840.0
Melissa Hairston,5.0,"Great food,  good atmosphere,  good music,  friendly staff",2 years ago,Open,3362352840.0
Michael Sabido,5.0,Philly cheese steak was fantastic,a year ago,Open,3362352840.0
nay mickie,5.0,"Was my first time, and I loved it! Very good pizza",2 years ago,Open,3362352840.0
Ashley Abbott,5.0,Great food and beer selection.,a year ago,Open,3362352840.0
Constance Hamilton,4.0,"It was date night. We Enjoyed the atmosphere,  service and the food.  For appetizers we got the pretzels and for our Entrée we shared a House pizza.  IT WAS DELICIOUS👍👍👍👍👍!",3 years ago,Open,3362352840.0
Elisha Palmer,5.0,Best greek salad..,a year ago,Open,3362352840.0
Tom Taylor,5.0,Pizza was great!,a year ago,Open,3362352840.0
Deja G,5.0,Delicious salads,9 months ago,Open,3362352840.0
Jason Locklear,5.0,Excellent pizza!,9 months ago,Open,3362352840.0
Frank Harmon,5.0,Always fantastic food and service!,a year ago,Open,3362352840.0
Madame Melinda,5.0,"Great selection, great food, very pricey.",2 years ago,Open,3362352840.0
Jason Hooper,4.0,Its very good food with average customer service. The place itself is nice tho.,2 years ago,Open,3362352840.0
Mike,3.0,"Overpriced custom pizzas. Great staff, great decor.",a year ago,Open,3362352840.0
Sadia Pollard,5.0,Will substitute for dairy free chesse on all dishes,a year ago,Open,3362352840.0
Alice Schulte,4.0,Love the vibe in this Mellow Mushroom. Had a great salad and our server was terrific.,2 years ago,Open,3362352840.0
Ramona Williams,4.0,"Can you say Mediterranean pizza our go to fav, need more tziaki sauce (cucumber sour cream love, love, love it)",2 years ago,Open,3362352840.0
Greasy Chicken,5.0,Great food good drinks the salads are awsome.,2 years ago,Open,3362352840.0
speedracers81,4.0,Food is usually good and is the service.Go early or later because it's usually very busy.,2 years ago,Open,3362352840.0
Maudiel Ramirez,5.0,Dining great! Mellow Mushroom isn't very expensive either. Great place to dine in with family and friends,3 years ago,Open,3362352840.0
Markus Christel,5.0,"Excellent pizza, great place to kick back and relax.",a year ago,Open,3362352840.0
Cara Moravian,5.0,Really good food I'm always impressed,2 years ago,Open,3362352840.0
Ziggixdon 713,5.0,Romantic date with my Wife!,a year ago,Open,3362352840.0
Kevin Eckard,5.0,Best pizza in a long time!,a year ago,Open,3362352840.0
Stephanie Lee,5.0,Some of the best pizza and service I've had! Alec was AMAZING! I definitely recommend Mellow Mushroom for date night or any other night!!,4 years ago,Open,3362352840.0
J S,5.0,The price is equal to the quality of their pizza. High end toppings in high end locations cost more. And it is worth the price. Some of the best pizza I have ever had.,8 years ago,Open,3362352840.0
Jeanne Bohm,4.0,Great pizza,9 months ago,Open,3362352840.0
Benjamin Tosto,5.0,"I've been to a few Mellow Mushrooms in my time, and this one met all my hopes and expectations - however it has a downright suspicious amount of beautiful stained glass artwork. Well done to whoever was in charge of decorating the place!",2 years ago,Open,3362352840.0
Daymien McCoy,4.0,"Good food, service could be little more attentive.",2 years ago,Open,3362352840.0
Heba Wasfy,1.0,Food is very bad and my plate was pasta with shrimp the shrimp was very bad and tomatoes was expired with bad smell,a year ago,Open,3362352840.0
Amber Clontz,5.0,"This place is  amazing, they had a fantastic staff! My cup never got empty and the food was brought out in a timely fashion, not to mention the taste was impeccable.",2 years ago,Open,3362352840.0
Jeff Smith,4.0,Great pizza,10 months ago,Open,3362352840.0
Joy Tveila,4.0,"a little pricey for the food.,it is good though",2 years ago,Open,3362352840.0
Eddie Boyd,5.0,Real hand made pizza with real toppings and ingredients,a year ago,Open,3362352840.0
Judi Bray,5.0,"Fresh pizza in a pleasant atmosphere. The service was great and the only downside is the lack of free, easy to access parking. Well worrying the hassle.",2 years ago,Open,3362352840.0
Mayank Bhatt,5.0,"Great Pizzas, Salads and drinks. Good people and friendly atmosphere.",2 years ago,Open,3362352840.0
