name,stars,text,timeSince,openStatus,key
Browns- All-Around,4.0,"Good food.,always packed on weekends. Florence is really growing so this is the case with many,popular,restaurants on weekends. Weekdays is better or get there early on weekends nut wings are really good and,Pizza is good as well. Staff is pleasant.",2 years ago,Open,8434071442.0
Jenny Olszowy,5.0,"Great pizza, salads, appetizers and service!",2 years ago,Open,8434071442.0
Mike Drew,5.0,Great pizza and calzones. Friendly and helpful server. Would love to go again! Tip- there's an ice cream stand right next door!,2 years ago,Open,8434071442.0
Fred Blake Spa,5.0,The bar staff and Kate is the best! We were there to chill after a long day of work and it was a great time! #NotNascarFans,2 years ago,Open,8434071442.0
Shannon Sagrillo,5.0,"Chill place with great pizza. Restaurant and bar side option. Bar has NFL Sunday ticket and 8 large screen TV's, and a lots of beers on tap.",a year ago,Open,8434071442.0
Ronnie E Culbertson,5.0,Good pizza...and other items.,a year ago,Open,8434071442.0
Miranda Rae Hay,5.0,I absolutely love to eat at Mellow Mushroom! And it's my number one choice pub to drink at too! I enjoy the environment because I've always been a hippie but you don't have to be a hippie to feel comfortable here or to enjoy the best pizza and beer in town!,2 years ago,Open,8434071442.0
Suggestive Carp,5.0,"I always get carded when I ask ""what would you recommend"" which makes me laugh but my server had some good taste in beer.",a year ago,Open,8434071442.0
James Pratt,3.0,"Great pizza, painfully sloooow service, seemingly detached waiter",11 months ago,Open,8434071442.0
Peter Nixon,5.0,"Very fresh, large salads and delicious pizza & wings!  Awesome and very attentive service!  Unique and inviting environment!",a year ago,Open,8434071442.0
Je'taime Henry,3.0,I went to Mellow Mushroom in Atlanta and thought that I would receive the same type quality in my food. I was greatly disappointed when the food didn't taste the same. For the price of the food to me it's not worth and its a little …More,3 years ago,Open,8434071442.0
Adam Brown,5.0,Nice selection of beer and different options for pizzas.,a year ago,Open,8434071442.0
Robert Slabaugh,4.0,"Good place for pizza, also has good subs",a year ago,Open,8434071442.0
William Lusher,4.0,The food us always amazing. They mess up about every other visit but we keep going back because they fix it immediately and hook us up with free food,a year ago,Open,8434071442.0
Alexis Smith,1.0,"The place was pretty empty for a Saturday, which I should've paid attention to. The food was VERY displeasing. Very greasy and tasteless. The server didnt really seem to know what he was doing. A relative asked for a shot of crown. The …More",a year ago,Open,8434071442.0
Tonya Chandler,4.0,The Enchanted Spinach Salad with all natural grilled chicken was delicious! It would be a bonus to Mellow Mushroom's menu if they added all natural drinks to their menus such as hand squeezed lemonade and sparkling water with natural fruit juice/herbs and natural sweeteners.,2 years ago,Open,8434071442.0
Dendy Holcombe,1.0,"Other mellow mushroom locations have been great. This experience was lacking,  food tastes fine but finding a plastic bag in my salad ruined the meal.",a year ago,Open,8434071442.0
Cassandra Anderson,5.0,Love the many different choices of pizza and beer... living my best life..,a year ago,Open,8434071442.0
Jonathan Blancett,3.0,"The service was just ok. They have a huge selection of beer on tap. If you want to have a group function I highly recommend getting the private room, which you have to reserve a week in advance or you are SOL. The pizza was average for a …More",2 years ago,Open,8434071442.0
Craig Kesner,5.0,Best pizza !!   You have to try it.   It’s amazing.,a year ago,Open,8434071442.0
nayr savid,4.0,Great beer selection.,a year ago,Open,8434071442.0
Sean Wilhelm,5.0,Delicious pizza. The flavor of the crust is great. The sauce is delicious and they have vegan cheese and tofu and tempeh as a topping with different marinades.,2 years ago,Open,8434071442.0
Terrell Mccall,5.0,Freshly made pizza...perfect taste!!!,a year ago,Open,8434071442.0
Mitch Deighan,5.0,"Mellow Mushroom has consistently great pizza and fun vibes at every location I've been to, this one included.",a year ago,Open,8434071442.0
Greg White,5.0,Eric was a great waiter,8 months ago,Open,8434071442.0
K Hugg,1.0,"If I had the option to give a zero I would. My son and I went to mellow mushroom for an after school lunch (we arrived a little before 1p) because he received great news that day. When we arrived, we were seated immediately. We were told by …More",3 years ago,Open,8434071442.0
Sagar Baxi,5.0,Ordered the Kosmic Karma - everything tasted really fresh and delicious.,a year ago,Open,8434071442.0
Joy Richardson,5.0,Great food and service,8 months ago,Open,8434071442.0
Missy Wheeler Isaiah 26:20,5.0,Love it. Most places i can't seem to find something i want to eat. This place i want one of everything lol,a year ago,Open,8434071442.0
Crinkles Crink,5.0,Great! They even have options for my boyfriend who has celiacs disease which is amazing. And just overall good food!,a year ago,Open,8434071442.0
Travis Garrett,3.0,Was disappointed to see my favorite pizza at the mellow mushroom back home was removed from the menu but the made it for me anyways.  The pizza here is quite expensive though.,a year ago,Open,8434071442.0
Joshua Ayres,1.0,Slow.... Busier last winter(headcount) and slower(headcount) this summer but slower service time.,a year ago,Open,8434071442.0
Andrew Gardner,4.0,Stoner palace,4 months ago,Open,8434071442.0
Domonique Dotts Dotson,5.0,I honestly have not received great customer service in awhile.... But MM was so chill. The atmosphere was very relaxing and the music selection was impressive (especially bring it was 2:30pm). Our waitress suggested the best burger I've even had!!!! I had to compliment the chef! Awesome experience! I'll definitely be back.,3 years ago,Open,8434071442.0
John Cox,4.0,The pizza was good and the black and tan was nice.,a year ago,Open,8434071442.0
Laurie Nilsen,4.0,Delicious. Reasonable. Good service,a year ago,Open,8434071442.0
Jennifer Perez,4.0,The only reason I'm dropping a star is because of how slow the service is. The food is great the service is great. Is just a little bit too slow for a quick lunch.,2 years ago,Open,8434071442.0
Jamie Williford,4.0,"Yummy food, cool atmosphere. Prices are fair and the store is clean. Staff is quick and accurate. Would eat here again.",2 years ago,Open,8434071442.0
L Durant,4.0,"The pizza was absolutely delicious! There's a longer wait for your pizza than in other pizza parlors, but it's worth it. We had great service as well.",2 years ago,Open,8434071442.0
Laura Walkup,2.0,It was slow and the staff didn't  care and the people  that was cooking  the food care about  one thing  and.it was the waitress  it was dirty,a year ago,Open,8434071442.0
Wendy Jessen,5.0,THE ONLY PIZZA we eat the best we've found on the east coast 🌹😀,a year ago,Open,8434071442.0
Christopher Byrd,5.0,My only suggestion is to please get a large gluten free crust,a year ago,Open,8434071442.0
edna white,5.0,I love the pizza. The best there is in the pizza industry..,a year ago,Open,8434071442.0
Tranisa Dixon,5.0,Waitress was awesome & very attentive and the food was good....a win-win,a year ago,Open,8434071442.0
Mike Harrelson,5.0,Great service and food...,11 months ago,Open,8434071442.0
Chris Maher,4.0,"Good pizza,  friendly staff,  decent music.",a year ago,Open,8434071442.0
David Matta,4.0,"Really good pizza and a friendly atmosphere, but the bartenders need to learn how to prioritize to get things done. It took over an hour to get a pizza and a beer and the place wasn't all that busy. I had hoped to be in and out in an hour.  Instead ur was more like two.",2 years ago,Open,8434071442.0
Keegan LeMay,4.0,Pretzel bites and mighty meats pizza were bomb as hell. Needs a better server though,a year ago,Open,8434071442.0
David Moore,5.0,It was great. Never disappoint s,a year ago,Open,8434071442.0
Tyler Hopkins,3.0,Took awhile for the food to come but great,a year ago,Open,8434071442.0
chris blackmon,5.0,Great food great service,a year ago,Open,8434071442.0
Ryan M,4.0,I love Mellow.  This is one of the better ones as well.  Our pizza was good.  We had a good time playing corn hole.  Service was good as well.,3 years ago,Open,8434071442.0
Chris Pak,5.0,Food and service was great!  Awesome beer selection and great food!,a year ago,Open,8434071442.0
Shannon Carmichael,5.0,Guinness on tap and Holy Shiitake! was a good combination! Delicious 😋!!!,a year ago,Open,8434071442.0
Nep Nep,4.0,"Pretty ok, not really worth the money but pretty ok",a year ago,Open,8434071442.0
Nicole Adkins,5.0,"Great food, cold beer & great service!!",a year ago,Open,8434071442.0
thomas brueckner,4.0,Nice beer selection & tasty food only complaint was the take out boxes but that doesn't matter much since you want to eat it all.,a year ago,Open,8434071442.0
Brent King,5.0,Food is fantastic and very fast service.,a year ago,Open,8434071442.0
Itz - Gacha - Rosie - Playz,5.0,Great food slow service,a year ago,Open,8434071442.0
Kathy Leach,5.0,Server Courtney did an excellent job! Great food great service!,a year ago,Open,8434071442.0
Kathy Tlougan,5.0,I haven't yet got to try the food but the service is excellent and by the amount of deliveries that I make from there the food is great also,a year ago,Open,8434071442.0
Ethan Saul,2.0,Good chicken sandwich. Pizza was terrible. Tastes like Chucky Cheese fake pizza,a year ago,Open,8434071442.0
Amy Black,5.0,Very good food.  The mushroom soup was delicious.,a year ago,Open,8434071442.0
Rich Christopher,5.0,"Awesome food and atmosphere. Highly recommend, always satisfying.",a year ago,Open,8434071442.0
Krystal Aull,5.0,Love this place! Great food every time. Great place to take the family or just friends getting together! They also have a party room for meeting's and birthday's!,3 years ago,Open,8434071442.0
Annie Bedenbaugh,5.0,Love the food and customer service ♡♡,a year ago,Open,8434071442.0
Annitra Goodman,4.0,Overall good service,8 months ago,Open,8434071442.0
Amber Lee,5.0,"Great food, atmosphere, and staff!",a year ago,Open,8434071442.0
Tim Clark,4.0,Great bartenders. Pretty good food. Abandoned gas station style restrooms.,2 years ago,Open,8434071442.0
Barry Suggs,5.0,Great Pizza and prompt friendly service....,a year ago,Open,8434071442.0
K Miller,4.0,Great pizza. Beer was good although a little pricey.,a year ago,Open,8434071442.0
Rebecca Conway,3.0,The pizza is typically good. The restaurant is located right off two interstates which make it convenient for travelers. Service is slow and always has been due to the slow kitchen. There is a bar with 5 screens tuned to sports.,3 years ago,Open,8434071442.0
Macy Hensley,3.0,My husband and I went here on a Wednesday night. It wasn't too busy. We walked in and the hostess just looked at us. We didn't even get greeted. We said just us two. She looked sarcastic at us and asked did we want the bar. We said no. She …More,3 years ago,Open,8434071442.0
Ezell Washington,1.0,Walked into the bar area and sat myself ... several waiters passed by without acknowledging me.  I sat patiently waiting on service until young caucasion girls sat down.  They were immediately addressed so i left and went to Percy and …More,2 years ago,Open,8434071442.0
Richard Rapelye,5.0,Great atmosphere. Staff was friendly and food was tasty.,2 years ago,Open,8434071442.0
Armichael Franz,5.0,"The food and drink were uncommonly delicious, but the treat of the day was provided through the  service as well as beer and victuals knowledge of our waiter/bartender David. What a master of culinary knowledge!",2 years ago,Open,8434071442.0
Mary nemeth,5.0,They have the best pizza,a year ago,Open,8434071442.0
Jameila Beams,5.0,Great carbs! Fabulous service. Excellent sweet tea.,a year ago,Open,8434071442.0
Chris Norton,5.0,Friendly servers and relaxed atmosphere. Very unusual but very good pizza creations.,2 years ago,Open,8434071442.0
Freddie Sullens,5.0,"Great food, friendly staff, clean and priced well  ... I'm a fan!!",a year ago,Open,8434071442.0
Randall Wilkes,5.0,Service and food was great!!!!,5 months ago,Open,8434071442.0
Embracing Jae',4.0,Private room to hold gatherings,a year ago,Open,8434071442.0
brittania gibson,1.0,I am traveling for work so I’m not familiar with their business hours. When I called to ask if they deliver I was told no because they close in 30 minutes and then I was hung up on. I then called back to see if I could just pick up and the girl just put me on hold instead of helping me. Very disappointed in the customer service.,2 years ago,Open,8434071442.0
Rick Clowney,5.0,We hard a large group of approximately 16 - 20 with Sidney as our server. The service was outstanding and the food was very good. Everyone really enjoyed the evening highly recommend Mellow Mushroom to anyone. The group had such a good experience that we are talking of scheduling another dinner there.,3 years ago,Open,8434071442.0
DS CC,3.0,My kids love this place but 3 bucks per topping and they dont put 3 bucks worth of toppings on .... thats insane.,a year ago,Open,8434071442.0
Bill Matthews,4.0,Not on the menu anymore but order the Thai dye pizza. Best one there.,a year ago,Open,8434071442.0
eric Hodgdon,5.0,As long as Jordan is your server you will have the greatest experience!,2 years ago,Open,8434071442.0
Tony Eller,4.0,I am gluten free and they accommodated me with a delicious gluten free pizza and friendly service,a year ago,Open,8434071442.0
Samantha Melton,5.0,Food and service was GREAT! Will be back again!,a year ago,Open,8434071442.0
Michael,1.0,"Very kind server, but the service was unbelievably slow.  I know that's part of their model (the idea is you wait longer for something that's fresh), but the local mom and pop pizza near me is faster and fresher. On top of an hour + wait, …More",3 years ago,Open,8434071442.0
Tim Bussey,5.0,Excellent salad and pizza for lunch. Will be back soon.,a year ago,Open,8434071442.0
Mandie Haynes,5.0,They have a huge variety of pizza here. Everything I've ever tried was great. It is just really hot inside every time I've went. Great service.,2 years ago,Open,8434071442.0
Paul Thompson,2.0,"Food is always great, but the service has been terrible every time I've come here.",2 years ago,Open,8434071442.0
Brandy O'Grady,1.0,DEAD COLD solid pizza (as in the cheese was so cold it was solid). Got it 1 hour 25 minutes after ordering. They refunded us but it was unacceptable - they shouldn't even have a delivery service if they can't figure out how to deliver a hot …More,2 years ago,Open,8434071442.0
Patriotic Oath,5.0,Excellent eatery... great friendly service... great atmosphere; what else do you need,2 years ago,Open,8434071442.0
scott dixon,5.0,"Great food and staff, definitely will stop in while traveling through the area.",2 years ago,Open,8434071442.0
Jessica Cecil,1.0,To say the service was bad is being nice. We were seated right away but it took the waitress 15 minutes to arrive at our table. She took our drink order and returned to take our order 10 minutes later. We ordered 3 pizzas and 2 salads. …More,6 years ago,Open,8434071442.0
Roger Lane,4.0,"Best pizza, great service.",a year ago,Open,8434071442.0
Mike Lopez,5.0,Always a family favorite. Great stop off I95 if you need a break.,a year ago,Open,8434071442.0
Michael Stevens,3.0,"We had a large crowd, so to a long time to get our food.  Once we got the food it was hot.  I'm not a big fan of pizza places, we didnt select this place.",2 years ago,Open,8434071442.0
Allyson Dantzler,2.0,Food was very good...service was AWFUL! Not even busy at lunch and our server just talked and hung out...i had to ask another server to take our order...no refills on drinks...i asked for the check as soon as the pizza came out..i was …More,3 years ago,Open,8434071442.0
Desiree Solomon,3.0,"I went this past Sunday around 7/730 pm. When we walked in, we weren’t greeted. A server came and grab a menu and didn’t even acknowledge us. Then a server came over and sat us. The server was very sweet, but she seemed really tired. I …More",2 years ago,Open,8434071442.0
Vin ferraro,4.0,"Good food, great prices, Friendly staff.",2 years ago,Open,8434071442.0
Freespirit,5.0,The food and atmosphere was great. My grandchildren loved the pizza!,2 years ago,Open,8434071442.0
Robin Parker,5.0,Mine and my husbands first time eating here and it was amazing!! Pizza was the best I’ve ever eaten and the service was great!! Friendly staff!!- with Larry Parker,2 years ago,Open,8434071442.0
Lulu Jackson,5.0,My favorite place to eat.! Their calzones are huge,a year ago,Open,8434071442.0
Brandy Thomas,5.0,"Go to Mellow Mushroom on occasion. Love their food. On this visit one of my calzones was wrong. I told the waitress, who immediately apologized, took it back, even after I had already cut a third of it off and ate some before realizing it …More",2 years ago,Open,8434071442.0
Shannon Mcgee,1.0,"If I could have given no star I would have. Our server was polite. However after I had to wait for almost 2 hours for a pizza, I asked for a manager. Her name was Emily. She refused to come out the kitchen telling the server to say she was …More",2 years ago,Open,8434071442.0
Jackie Cannon,5.0,The food and the portion was great!!! The price was pretty good as well. You have to experience it for yourself.,3 years ago,Open,8434071442.0
That Guy Phil,5.0,"Great atmosphere, friendly staff and the service was very good",a year ago,Open,8434071442.0
Latasha Britt,3.0,1st time trying.. willing to give another shot,a year ago,Open,8434071442.0
Gerald Chambers,3.0,"Ok. Not crazy about the pizza crust. Service at bar was not good. I was by myself and ignored for 10 minutes with 2 people behind bar more interested in talking then at least saying ""I'll be with you in a minute"". I ordered a pizza and 10 …More",2 years ago,Open,8434071442.0
Stacy Martin-Duffy,5.0,Love the food and everyone was friendly and helpful.,a year ago,Open,8434071442.0
Deborah Hickman,4.0,Large salad with fresh vegetables and tasty dressing offered on the side allows a variety of dietary restrictions to be met.,2 years ago,Open,8434071442.0
DarkChonochi numero 2,5.0,"Best pizza
Mouth watering",a year ago,Open,8434071442.0
Velvet W,5.0,"Great, friendly staff. Food is amazing.",a year ago,Open,8434071442.0
Temo Castro,1.0,"Worst manager ever, took us out of an empty area because "" it was only for bartender"" nobody was there. I used to be regular customer, won't come again",a year ago,Open,8434071442.0
Loyd Parker,5.0,Awesome subs cook mellow environment,a year ago,Open,8434071442.0
Richard Edwards,5.0,Mellow Mushroom is always a treat.  I am a huge fan of the Mowie Wowie pizza.  It's not like anything anywhere else.,2 years ago,Open,8434071442.0
George Major,5.0,Awesome pizza!!  Just check the size you’re ordering because they were larger than expected.,2 years ago,Open,8434071442.0
Christine Darling,5.0,The food was great and I can't  wait to take my grandchildren there.,2 years ago,Open,8434071442.0
Keith Sutton,4.0,Wonderful delicious pizza. Great service!,2 years ago,Open,8434071442.0
Joe Olin,5.0,"I've eaten at least one piece of Every Pizza they Have on the Menu. All of them were good. This place is solid, don't hesitate to dine here.",2 years ago,Open,8434071442.0
Stephanie Williams,5.0,Great fun family atmosphere! Great food and service,2 years ago,Open,8434071442.0
Red Robin,1.0,Was very disappointed with the service. I have been to several Mellow Mushrooms and recieved great service.  But we entered this one in Florence SC at about 11:05. We was the first customers of the day. We sat at the bar tables. A waitress …More,3 years ago,Open,8434071442.0
Will Riggs,4.0,Pizza is made to order and always fresh. Does take a while to get served due to pizza being made when order is placed but good customer service and any kind of pizza you might want to drinks.,2 years ago,Open,8434071442.0
Richard Franklin,4.0,"Cameron was a great waiter!   Mighty meaty Pizza was awesome, love the crust but the meat. ..really good.   Will definitely eat here again!",4 years ago,Open,8434071442.0
Christine Fusco,1.0,Terrible service and food. Waited 30 min just to get served😱,a year ago,Open,8434071442.0
Wandur,3.0,Just okay. I had a burger which was a safe bet but others in my party were conflicted about the shitake mushroom pizza. Overall the service and atmosphere was cool for a quick bite.,2 years ago,Open,8434071442.0
Angela Fowler,5.0,"Great pizza, salads and appetizers. The bartenders are awesome!!",2 years ago,Open,8434071442.0
Debbi Heisey,3.0,"First time was hoping for more. Only pizza, subs, burgers and wings of all things. No pasta but will say service is good.",2 years ago,Open,8434071442.0
C Hardin,1.0,"This restaurant is TERRIBLE! None of the employees are dressed to portray they work there, including the manager.  The women's restroom was filthy, dirty...smelt & felt like the floor was mopped with urine. Very gross, worried what the …More",2 years ago,Open,8434071442.0
Vicki Gilbert,5.0,Fantastic food and excellent service. I highly recommend,2 years ago,Open,8434071442.0
Beth Purnell,5.0,The bruschetta was delicious!,a year ago,Open,8434071442.0
S H,4.0,"Great food, great service and pretty quick for fresh pizza",2 years ago,Open,8434071442.0
Joshua Moan,2.0,"Had to wait for service for a while, they didnt check on us, and we got charged differently then what was on the menu for our drinks. The pizza was fine, but I really just did not like the service.",2 years ago,Open,8434071442.0
Kristen Gilchrist,1.0,"Awful, the service was terribly slow. When our app of pretzel bites got there the waiter set them on the table and said um their a little over cooked, we can make new ones if these aren't alright. (They were rock hard) our food came out …More",2 years ago,Open,8434071442.0
Alemeter Williams,5.0,Best pizza ever,a year ago,Open,8434071442.0
Sue Jankowiak,5.0,Good vegan pizza.,a year ago,Open,8434071442.0
David Macias,4.0,Much respect to the manager. Pizza was burned. He went above and beyond to make it right. The  including no charge for the replacement pizza  and apps.,2 years ago,Open,8434071442.0
Andrew Bates,3.0,"Pretty slow service, although the food is good. They make a good salad. Would rate higher if I didn't have to wait upwards of 45 minutes to get a regular size pizza.",7 years ago,Open,8434071442.0
Deb R,5.0,"Great service,  great food, arrived sooner than expected",2 years ago,Open,8434071442.0
Leslie Rushing,5.0,This was our first time eating here.  We will be back.,a year ago,Open,8434071442.0
Maibritt Tunstall,5.0,Love this place. Vegan friendly,2 years ago,Open,8434071442.0
Matt Blackmon,2.0,"Menu is outdated. Ordered 6 beers from the menu and they only had one available. Gave up after the 6th. Offered $5 apps for happy hour and or of the 5 that were listed, only 1 was available. Worst mellow mushroom, yet. The 1 beer was good.",3 years ago,Open,8434071442.0
Brian Kennedy,2.0,Poor service. So so food.,a year ago,Open,8434071442.0
R M,5.0,good service nicw staff lots of beer,2 years ago,Open,8434071442.0
Pamela Smith,5.0,David was a great bartender. Food was delicious and have several different drafts on tap.,2 years ago,Open,8434071442.0
Joseph Corbin,5.0,Great service and nice clean outdoor seating area.,2 years ago,Open,8434071442.0
Ashley Pogue,3.0,Had a very long wait period for my food... service wasn't all that great..n the food it was pretty decent... but very expensive,2 years ago,Open,8434071442.0
Sharisse Mckithen,5.0,My granddaughter love it!! Clean and kid friendly!!,2 years ago,Open,8434071442.0
Rachel McKnight,5.0,Called in a order for a lil salad.  It was ready in less that 5 minutes and cost just over $5.  It's a late lunch so enough to get me through the day until supper tonight.,2 years ago,Open,8434071442.0
Karen M Souder,5.0,Very good food and great vegetarian selection. Will be visiting  these restaurants  when I see them.,2 years ago,Open,8434071442.0
Joshua Casey,5.0,Awesome food great atmosphere,a year ago,Open,8434071442.0
Terry Joyner,5.0,Good food and great service,2 years ago,Open,8434071442.0
Diane Lee,5.0,Great food and great service,a year ago,Open,8434071442.0
Pam Lane,5.0,Club sandwich was delicious!  Service was superb!,2 years ago,Open,8434071442.0
Brad Carr,2.0,"I've taken my family to MM for 3-4 years now, and the location in Florence it seems it has just given up. Quality and service have been on the decline and our visit today was the worst. The pizza my wife and I split was poorly made and …More",3 years ago,Open,8434071442.0
A Wake,5.0,Great place to watch a football game. Excellent food and friendly staff.,3 years ago,Open,8434071442.0
Courtney Pack,5.0,Good atmosphere and good.  Was very friendly,2 years ago,Open,8434071442.0
Keith Bobick,5.0,I have been to several mellow mushrooms across the eastern US. This one does not disappoint. Awesome pizza and great selection of local and regional craft beers.,3 years ago,Open,8434071442.0
Vishal Tambolkar,4.0,All variety of pizzas available. Enjoy the beer with pizza which feel better.,2 years ago,Open,8434071442.0
Jo Nathan,1.0,"The pizza made my stomach hurt, it took FOREVER to get food. So much for being on time!!!",a year ago,Open,8434071442.0
Neil Wittberg,3.0,Good pizza but slow service,2 years ago,Open,8434071442.0
Joy Aldridge,1.0,"Still angry. Took 1 hr to get food. Nothing difficult. Full kitchen (8 men) acting like they were busy. Made 2 pizzas other than our food. Not sure if the cooks were playing games with waitress, didn't like her...It was obvious they were …More",3 years ago,Open,8434071442.0
