name,stars,text,timeSince,openStatus,key
Jonathan Scott,5.0,Great Atmosphere!!!❤ Corey and Sam are Awesome!!❤,a year ago,Open,7063224602.0
Dale Sides,5.0,I think the busier they are sitting the week the better the service is.,a year ago,Open,7063224602.0
Casey Wilson,5.0,House special is a great pizza service is superior,a year ago,Open,7063224602.0
Jasmine Heckman,5.0,Great gluten free options and delicious salads.  Fun atmosphere and totally appropriate to bring children.,a year ago,Open,7063224602.0
ryan farrow,5.0,Always the best pizza in town.,a year ago,Open,7063224602.0
Jim Mendoza,4.0,Many varities o pizza and food xx good prices.,a year ago,Open,7063224602.0
Joshua MeyersPeone,4.0,Awesome place with friendly servers and a menu when so many creative and delicious options. It was a pleasure dining here with my family.,a year ago,Open,7063224602.0
Cody Powell,5.0,Great food and great service.,a year ago,Open,7063224602.0
Chadrick Meridy,5.0,Great pizza! Not the processed Pizza Hut or Dominos pizza,a year ago,Open,7063224602.0
Joanne Brown,1.0,"7.00 for spinach and artichoke dip, received less than two ounces, not even half a container.  The wings were medium rare almost too under.  This place is a complete rip-off of a good name.  Couldn't believe the fact that the dip covered three pieces of the 8 pieces of garlic toast provided.  NEVER AGAIN in Columbus.",a year ago,Open,7063224602.0
Liam Kline,3.0,"I ate an average pizza, and paid $20. This was for the smallest pizza you can get. Just go to dominos, you and your wallet will be happier.",a year ago,Open,7063224602.0
Shaina Merine,5.0,"Great, fresh pizza!",9 months ago,Open,7063224602.0
nathan bradley,4.0,"Went out to Mellow Mushroom and had prompt service. Mellow Mushroom has a wonderfully relaxing environment, accompanied by a kind staff. The only downside was that our server had a miscommunication and one of our pizzas was not rang in. …More",3 years ago,Open,7063224602.0
Rhonda Little,5.0,Wonderful place.  David is an excellent waiter,a year ago,Open,7063224602.0
Lynette Vidal,5.0,"The service at the Columbus, GA, location was nice and helpful when we needed her. The pizza was sooooo delicious! The crust was light and crunchy, the base was not soggy, and the ingredients tasted fresh! The pizza wasn't scalding hot …More",2 years ago,Open,7063224602.0
Thomas Flanagan,5.0,Outstanding nothing more to say,a year ago,Open,7063224602.0
Noel Lucas,5.0,"Excellent service, even more excellent food! It's my son and I's favorite specialty pizza place.",a year ago,Open,7063224602.0
Josh Reynolds,5.0,"Always a good time! Great beer selection. Mighty Meaty pizza hits the spot every time. There's just SO much meat, you gotta remember to order extra cheese just to hold it all together.  And I order a side of beer cheese EVERY time to dip …More",4 years ago,Open,7063224602.0
Jay Harris,5.0,"Great service, amazing pizza pie",a year ago,Open,7063224602.0
ftrkngfspn DJAG,5.0,"Visiting from California.
I know it is hard to compare pizzas with so many variations such as deep dish, new York style, and extra thin crust, but this pizza  stands as one of the best …More",3 years ago,Open,7063224602.0
kacy shafer,5.0,The pizza is amazing,11 months ago,Open,7063224602.0
Alyssa Moody,3.0,"I ordered the steak and cheese hoagie today. The food did not have any seasoning on it, there was barley any cheese on it, and I asked for no tomatos. I pulled the tomato's off and still ate it since I was hungry. I'm just not sure what happened to this place because the food used to be worth the price.",a year ago,Open,7063224602.0
Mark Major,3.0,Average pizza. Nice service,a year ago,Open,7063224602.0
Donna H. Pentecost,5.0,Always a good experience....great service and great food...group of 8 and everybody loved the food.,a year ago,Open,7063224602.0
John Knop,1.0,Great food....service is SLOW!!!!  Did I mention the service is slow?  The last three times I’ve brought my family in here it has taken forever.  This time we had to just get up and leave.  Probably won’t be coming back for a while. …More,2 years ago,Open,7063224602.0
M Golden,5.0,Best service i've ever had! Our waiter (Corey) was AWESOME!!! Corey worked effortlessly moving around the restaurant helping customers and making recommendations. I've been to Mellow Mushroom before several times before but this time Corey …More,3 years ago,Open,7063224602.0
Jo R,4.0,"The pizza was really good, but I'm pretty sure our server was on drugs, he wrote down our tickets twice, once when we ordered and again when we asked for the check.",a year ago,Open,7063224602.0
Kim LaJoy,5.0,Excellent food!,8 months ago,Open,7063224602.0
Chloe Butler,4.0,Amazing food staff was alright,a year ago,Open,7063224602.0
Michael Sabato,4.0,"Good food, nice wait staff, a little pricey.",a year ago,Open,7063224602.0
Clifford Spickler,5.0,"As always this place is great, the portions are great and the staff is always friendly.",a year ago,Open,7063224602.0
Jennifer Haygood,5.0,"Was unsure what to order and the waitress Danielle F. was extremely friendly and extremely helpful. Gave her suggestions on pizza and salad we placed our order and the food was wonderful. Our tea glass never went empty, The salad and the …More",3 years ago,Open,7063224602.0
Charles Taylor,3.0,Good pizza but the quality at this location is incredibly inconsistent. I've had soft chewy crust and last time it was burnt crunchy crust.,a year ago,Open,7063224602.0
Cristina Killingworth,5.0,"Awesome servers, bartenders and pizza makers!! The pizzas, pretzels, spinach dip and salads are my favorites!! One of the cleaniest restaurants in Columbus!!",a year ago,Open,7063224602.0
Lynette Teall,5.0,Our go to pizza place...very kid-friendly which helps when we’ve got an energetic 3 year old. The Great White is our family favorite hands down.,2 years ago,Open,7063224602.0
Joni Johnson,5.0,Great food!!! Great people!!!,3 months ago,Open,7063224602.0
Cornelius Haugabook,5.0,"Great time, great food & David was an awesome server!",a year ago,Open,7063224602.0
Gary Stogner,5.0,Always great pizza and service.,a year ago,Open,7063224602.0
Jessica Behnken,5.0,Great service and great pizza!,a year ago,Open,7063224602.0
James Decker,5.0,"Friendly and professional staff.   Prompt service, and excellent food!",a year ago,Open,7063224602.0
Tony Shirley,5.0,"Great pizza, great price, wonderful service.",a year ago,Open,7063224602.0
Tscharner Love,5.0,"Great pizza, great price, great atmosphere, & we had a wonderful server! Will definitely be back!",2 years ago,Open,7063224602.0
Bryndon Howell,4.0,"Apparently, this place is known for their pizza, Which I understand why - Big Slices, Very High quality toppings, and fresh, hot pizza. Not like any other pizza chains around here (e.g. Marcos, Papa Johns...) However, I believe they cook …More",4 years ago,Open,7063224602.0
Asa Merrill,5.0,"Great pizza, great staff, and great atmosphere.",a year ago,Open,7063224602.0
rebecca oakes,5.0,Frendly,9 months ago,Open,7063224602.0
Brandon Benner,4.0,There was good service and good pizza it was over all good.,a year ago,Open,7063224602.0
Leah Smithwick,5.0,Food was delicious and the service was great!,a year ago,Open,7063224602.0
Ronisha Anderson,5.0,"Nice atmosphere, love the spinach and artichoke dip...",a year ago,Open,7063224602.0
Shannon Hinton,5.0,Jazmine is wonderful!!,a year ago,Open,7063224602.0
John Passmore,5.0,Great calzone and pretzel knots.,a year ago,Open,7063224602.0
DGCrossfit1,1.0,"We will never go back to Mellow Mushroom. We ordered 2 large pizzas, when we got there to pick them up they ""lost"" the ticket and never made them. Not a huge deal, I realize mistakes happen. They ended up finding our ticket in the computer …More",5 years ago,Open,7063224602.0
Sara Rines,4.0,"Good pizza, fast service, a little too pricey for the food.",2 years ago,Open,7063224602.0
Gerald Bedgood,5.0,"Great service, delicious pizza.",a year ago,Open,7063224602.0
Elizabeth King,5.0,Great food and service,a year ago,Open,7063224602.0
Jacob Silcox,4.0,One of my favorite pizza places! Only 4 stars because parking can be kinda crazy when they get a little busy. Don't let that stop you though!,3 years ago,Open,7063224602.0
Sherry Robinson,4.0,"Food was delicious, service was great. The prices were a little high but were worth it",2 years ago,Open,7063224602.0
Jeremy Barrett,5.0,Food was excellent and the service was great great. Try the Pacific Rim pizza!,a year ago,Open,7063224602.0
Sabra Blanchett,3.0,The cheese bread and spinach dip was delicious. Friends loved the Greek salad. Service was very good.,3 years ago,Open,7063224602.0
Ann Le,5.0,The pizzas and Greek salad with house dressing was delicious and were served promptly.  The server was very professional and friendly.  We were able to watch the football game in a relaxed environment.,3 years ago,Open,7063224602.0
Stephen Moore,5.0,Very clean and great establishment and friendly staff,a year ago,Open,7063224602.0
Zuleika Amin,1.0,Awful experience . I went to try the pizza. Me and my son was seated and we never got served. We waited on a server and no one came to our table . Then a white couple comes in and get seated and served. Staff was not busy. Not a lot people …More,4 years ago,Open,7063224602.0
stephanie lenderman,5.0,The gluten free crust is amazing! Also the stuffed portobello mushroom was really good. Everything tasted extremely fresh. Service was excellent.,3 years ago,Open,7063224602.0
Matt Jones,5.0,"Great place, great food",a year ago,Open,7063224602.0
Veronica Iezzi,5.0,Gluten free pizza was delicious!!!,a year ago,Open,7063224602.0
GA Twindom,1.0,"Pizza was horrible. Soggy, pizza with subpar toppings.   Am not  picky person. Service was slow. Didn’t even eat the pizza and was refunded for the pizza. Even the kids pizza was some bread with soggy cheese and tomato sauce. Just not what one expects from a pizza restaurant, let alone Mellow Mushroom.",2 years ago,Open,7063224602.0
Christopher Hundley,5.0,Great pizza wonderful service,a year ago,Open,7063224602.0
Tina M.,5.0,One of our favorite go to for a pizza and beer. Awesome crew that works there.,a year ago,Open,7063224602.0
Becky Maguire,5.0,Great pizza and wait staff,a year ago,Open,7063224602.0
Emily U,5.0,Awesome food! Awesome service.,a year ago,Open,7063224602.0
Darryl Ward,4.0,Great as usual.,a year ago,Open,7063224602.0
Meghan Langley,5.0,So impressed! Pizza is so dang good here! The crusty is nicely crunchy and flakey. Ordered the pretzel bites for an app and they are super good as well! I also won at bingo and got a free small pizza! So glad we tried this place! :),3 years ago,Open,7063224602.0
Zach Combs,5.0,"Because I'm a meat lover, every time I go there I get a small Mighty Meaty pizza. The pizza's awesome, not to mention there's nothing small about it! I can only eat half of it there. Then I take the rest to go and usually eat it the next …More",5 years ago,Open,7063224602.0
Lucas Witherspoon,5.0,Go on $1 wine Wednesdays.,11 months ago,Open,7063224602.0
Susanne Jones,5.0,Best pizza in town hands down.,a year ago,Open,7063224602.0
Juan Orellana,4.0,We decided to order some Oven-Roasted Chicken wings and they were incredibly delicious. We had the Jerk Chicken wings and the Sweet Thai Chili chicken wings. Also ordered a Buffalo Chicken Pizza which was ok but not the best. …More,8 years ago,Open,7063224602.0
Aaron Sovern,3.0,"Pizza dough was flat and soggy. Toppings were good, though. Good for ""bar"" pizza with a few cold beers. Service was excellent.",3 years ago,Open,7063224602.0
Lucas Shaffer,5.0,"The Mellow Mushroom never disappoints. They pies are cooked fresh to order and has that rare ability to be cooked just about the same way you had it the prior time.  Add the collection of draft beer that will keep you mesmerized for hours, …More",6 years ago,Open,7063224602.0
Danielle Smith,5.0,"Great food, great people",a year ago,Open,7063224602.0
Nathan&Daria Copley,5.0,Great staff friendly enviroment,a year ago,Open,7063224602.0
Dagmar Alexander,1.0,I have had the worst dining out experience in 14 years. We arrived at the restaurant at 7:15. I ordered a glass of Merlot at 7:30. I ordered a dip and a Portobello Mushroom at 7:40. My child ordered a little cheese pizza at 7:40. My wine …More,4 years ago,Open,7063224602.0
Deutschland Reform,4.0,"Buffalo chicken and Mellowterranean Pizza were both good. Quick, attentive, and friendly service.",2 years ago,Open,7063224602.0
Kim Wilhite,4.0,"Nice place. Fast, friendly service",2 years ago,Open,7063224602.0
Bianca Hinojosa,5.0,Yummy. Def try.,a year ago,Open,7063224602.0
Robbie Bryant,5.0,Great pizza,11 months ago,Open,7063224602.0
Amanda Hall,5.0,"Great atmosphere, great music, friendly service, decent prices. Just an over all steller vibe",3 years ago,Open,7063224602.0
Brenda Knight - Johnston,5.0,Still the best pizza in town!  Yum!!,a year ago,Open,7063224602.0
Angela F,4.0,Little pricey but food was amazing,2 years ago,Open,7063224602.0
Kevin C,5.0,Tasty pizza.  Very nice atmosphere.  Good selection of beer.,3 years ago,Open,7063224602.0
Jaime Wright,1.0,"Honestly, every time I've eaten here its been a disappointment. Had a cool, funky atmosphere. Pizza was poorly made, sloppy, hardly any toppings AND expensive. Not worth the $$ of ya ask me. Have a nice wide variety of beer at the bar tho.",5 years ago,Open,7063224602.0
Ben Trippe,5.0,Love it everytime,a year ago,Open,7063224602.0
Kate Quattlebaum,5.0,Absolutely wonderful customer service. After a mixup on the food they completely redid the order within 10 minutes no hassle absolutely Absolutely wonderful customer service. After a mixup on the food they completely redid the order within …More,2 years ago,Open,7063224602.0
chad rogers,5.0,We had the house specialty pizza which was delicious. Our waitress was friendly and was always looking to see if we needed anything. Even with a full house the wait to get in wasn't very long.,4 years ago,Open,7063224602.0
Charles Woodruff,4.0,"Decent beer list, typically good pizza, and our server was great. I will return when in Columbus.",2 years ago,Open,7063224602.0
jess gus,5.0,Best gourmet pizza around,a year ago,Open,7063224602.0
Michelle Blackburn,5.0,Awesome@@,9 months ago,Open,7063224602.0
Marquitia Dudley,5.0,Love the prizza!!! is a little pricey,2 years ago,Open,7063224602.0
Helga Moore,5.0,Awesome vegan pizza,a year ago,Open,7063224602.0
Kimberly Lickliter,4.0,Good food but too expensive,a year ago,Open,7063224602.0
Clay Ogata,4.0,Good solid food.,a year ago,Open,7063224602.0
Kirk Davis,5.0,Always good pizza and great customer service!,2 years ago,Open,7063224602.0
Steven B,4.0,Friendly staff and good food! Would recommend to anyone to go here.,3 years ago,Open,7063224602.0
Mark Woodhams,4.0,"They have a good beer selection, great pizza, and salad. That's pretty much all I've ever eaten there and I've never been disappointed.",4 years ago,Open,7063224602.0
OSS Property Maintenance,5.0,This is the best pizza place,a year ago,Open,7063224602.0
Joshua Carpenter,5.0,Great pizza.,a year ago,Open,7063224602.0
Gregg Fischer,5.0,I love the pizza!,a year ago,Open,7063224602.0
Jessica W,5.0,Best pizza in town. Great selection on tap. Fun to play bingo.,3 years ago,Open,7063224602.0
neal jacobs,5.0,Courteous and clean place,a year ago,Open,7063224602.0
Thomas Hammer,4.0,"new menu has weird stuff like ricotta cheese in the calzones.  if it ain't broke, don't fix it.",2 years ago,Open,7063224602.0
James McVey,5.0,Always a great choice to eat! Great pizza and a great beer selection.,4 years ago,Open,7063224602.0
Warren Howard,4.0,Great selection of gourmet pizzas. Excellent service. Strange decor.,7 years ago,Open,7063224602.0
Callme Fishmeal,5.0,"First time eating here and absolutely loved it! Wide variety of options on both the food and drink menu. Had a delicious vegan calzone with a strong cocktail. The veggies in the calzone were so fresh and flavorful, and they use the BEST …More",3 years ago,Open,7063224602.0
Kori Lynn,5.0,"Mellow Mushroom is probably one of the best pizza places in Columbus, I love the original artwork that they have and the food is super good!",4 years ago,Open,7063224602.0
D King,2.0,2 stars for the staff and the atmosphere. The pizzas are overpriced for no apparent reason,3 years ago,Open,7063224602.0
April gavin,3.0,Came tonight on a Monday. We didn't know it was $1 for a slice of pizza. I asked the host that sat us and he told me. Our waiter never said 1 word about it. Now it took almost 30 mins for our appetizers. We then had to wait 5 mins to get tp …More,3 years ago,Open,7063224602.0
jim lindenau,5.0,Awesome place in the wold of The Great Mushroom,3 years ago,Open,7063224602.0
Marilyn Richardson,5.0,"""Once my favorite place.....great food great staff and excellent management.""",3 years ago,Open,7063224602.0
Zac Swanson,4.0,"The pizza is amazing and they have a great selection of beer.  One of my favorite restaurants in Columbus, GA.  They recently remodeled a little bit and it seems like a much bigger place now.",7 years ago,Open,7063224602.0
ShaTara Anderson,5.0,Great Lunch! Everything was hot and fresh!,3 years ago,Open,7063224602.0
Lester Adams,5.0,"Fantastic pizzas and atmosphere, relax and enjoy the friendly service.",4 years ago,Open,7063224602.0
DeAnna Malone,2.0,Had a tofu hoagie and it was terrible ! My mom had a hamburger and loved it ! I’ll be back to try something else though !,2 years ago,Open,7063224602.0
Tara Avery-Fraser,5.0,Best pizza in town,a year ago,Open,7063224602.0
Anne Marie,3.0,"Awesome pizza and service.  The cook messed up the special order, if you have an allergy pay attention to the food",3 years ago,Open,7063224602.0
Love & Light,5.0,Absolutely love this place ! The staff are very friendly and the food is amazing !!!,3 years ago,Open,7063224602.0
tara fontaine,4.0,"I was greeted by a friendly staff who were very polite. The food was pretty good, I'm happy.",7 years ago,Open,7063224602.0
Kevin M,5.0,Great!,10 months ago,Open,7063224602.0
Rick Kelly,5.0,Great pizza,a year ago,Open,7063224602.0
Peter Sharkey,5.0,Great lunch stop!,a year ago,Open,7063224602.0
Steve Antonoff,5.0,"Great pizza and friendly, attentive staff.  I sat around a while after eating to read and no one tried to rush me out.",3 years ago,Open,7063224602.0
Des Gangler,5.0,Good pizza and fast service.,3 years ago,Open,7063224602.0
Saul Slowik,4.0,"Consistently good, like every other Mellow Mushroom I've ever been to. Good food, good beer selection.",4 years ago,Open,7063224602.0
Charles Bryant,5.0,Excellent pizza,a year ago,Open,7063224602.0
Samantha Walker,4.0,Great pretzels,a year ago,Open,7063224602.0
Sarah Flagg,5.0,I LOVE this place. Best pizza around.,7 years ago,Open,7063224602.0
Laurie Novak,5.0,Enjoy the eclectic selection of pizzas and craft beer options.,6 years ago,Open,7063224602.0
Danielle Brake,1.0,"All 6 people in our group were sick with upset stomachs & diarrhea within two hours after eating the food at Mellow Mushroom on Veterans Parkway in Columbus, GA. We will not be recommending this place to anyone or eating there again!!!!!!",a year ago,Open,7063224602.0
Travis Deal,5.0,You can catch some hawgs in here boy! Wooooweeee bigguns nice and ripe! This place has the pickin's id come everyday if i could!,4 years ago,Open,7063224602.0
Zachary Spraggins,5.0,Friendly staff excellent service,2 years ago,Open,7063224602.0
Wise Conscious,5.0,It was OK I guess,a year ago,Open,7063224602.0
Richard Wood,5.0,Good food and service.,3 years ago,Open,7063224602.0
Alex Potteiger,5.0,Good food and good service,3 years ago,Open,7063224602.0
Jennifer Brou,4.0,The pizza here is great and our server was very attentive.,4 years ago,Open,7063224602.0
Anthony Bankhead,4.0,Always treated well good food and fast accurate service,7 years ago,Open,7063224602.0
Trenanika Hoskins,4.0,Great calzones!,a year ago,Open,7063224602.0
Matthew Nestor,5.0,"If there was a heaven for cheesy, doughy foods, it would look like this.",3 years ago,Open,7063224602.0
Jon Brewer,5.0,Pizza is good but place is a hippie hang out beer selection is good also,8 years ago,Open,7063224602.0
Barry Dean Barrentine Jr.,5.0,GF says 5 out of 5... I do too !,a year ago,Open,7063224602.0
Germy Bunds,5.0,"Great food, great vibes, good times.",3 years ago,Open,7063224602.0
Bobby Crotty,4.0,Good pizza. I've heard that they aren't very military friendly though.,9 years ago,Open,7063224602.0
Jonathan Caldwell,5.0,Great food and beer. Great staff,3 years ago,Open,7063224602.0
Jack Burton,4.0,"Best pizza in Columbus, but skip the rest of their menu.",10 years ago,Open,7063224602.0
Steve Mcdowell,5.0,delish,a year ago,Open,7063224602.0
R Rodriguez,5.0,They have beer.,3 years ago,Open,7063224602.0
Sharon Kennard,5.0,Great food,a year ago,Open,7063224602.0
Taneeka Jenkins,5.0,GREAT pizza!,a year ago,Open,7063224602.0
dc wolt,4.0,Great fresh pizza and the like,2 years ago,Open,7063224602.0
Mz S,3.0,Nice atmosphere,a year ago,Open,7063224602.0
Melissa Woodham,4.0,Delicious,a year ago,Open,7063224602.0
Connie Aguirre,3.0,"Food was OK,  staff was really nice...",5 years ago,Open,7063224602.0
Tamika D. Nicholson,4.0,Great place for pizza!,2 years ago,Open,7063224602.0
Jeremy Robinson,5.0,Number 1 pizza spot with vegan options,a year ago,Open,7063224602.0
Sally Moore,5.0,Always good,a year ago,Open,7063224602.0
Jason Holmes,5.0,Good bartender,a year ago,Open,7063224602.0
Kim Williams,4.0,Love this place and the quality of food offered. It is a treat to go.,5 years ago,Open,7063224602.0
Maurice Ray,5.0,"Larry was right! Once you had been here, I will want to come back! Thanks for the invite",a year ago,Open,7063224602.0
rey parra,3.0,ordered appetizers and never got them before the main meal .,2 years ago,Open,7063224602.0
James Gray,5.0,They have crayons.,a year ago,Open,7063224602.0
Gary Cash,5.0,Wonderful food,a year ago,Open,7063224602.0
Beverly Canedo,5.0,Best pizza in town especially for discerning tastes.,5 years ago,Open,7063224602.0
Yves Jean,4.0,Was good,a year ago,Open,7063224602.0
Debro Tsagaris,5.0,Yummy,a year ago,Open,7063224602.0
Sheila Atkinson,5.0,Great place,a year ago,Open,7063224602.0
charmander man,4.0,Took too long to bring out hummus,4 years ago,Open,7063224602.0
Erin McClendon,4.0,Customer service slacking,2 years ago,Open,7063224602.0
Joe Massoud,5.0,👍👍,9 months ago,Open,7063224602.0
Walter Hinds,5.0,Great!!!,11 months ago,Open,7063224602.0
Carlos Escobar,5.0,Nice,2 years ago,Open,7063224602.0
David Rathel,5.0,Meat lovers.,a year ago,Open,7063224602.0
Edmund Gilbert,5.0,Awesome,a year ago,Open,7063224602.0
the random hotdogs,3.0,Alright,2 years ago,Open,7063224602.0
Rob Peters,5.0,Great beer and great pizza,3 years ago,Open,7063224602.0
keefo rizzo,5.0,Awesome pizza,3 years ago,Open,7063224602.0
Randy Geeslin,5.0,Staff is friendly!,2 years ago,Open,7063224602.0
Kamian Alexander,3.0,Good Pizza!,3 years ago,Open,7063224602.0
Sherrie Fentress,3.0,Feels like family,3 years ago,Open,7063224602.0
Bout Nine,5.0,Loved it!!!!,3 years ago,Open,7063224602.0
Terry Woods,5.0,Great pizza!,3 years ago,Open,7063224602.0
heith seewald,4.0,Good atmosphere.,3 years ago,Open,7063224602.0
Edward Parsons,3.0,Average place.,3 years ago,Open,7063224602.0
Cade Cov,5.0,A+ pizza and service,4 years ago,Open,7063224602.0
Justin Whaley,5.0,Dollar slice Monday is a staple in our office,5 years ago,Open,7063224602.0
Jeffrey Rybik,5.0,Sit at the bar for a blast with Sam and Mike.,7 years ago,Open,7063224602.0
Nate Mansur,3.0,the service was very very slow. The inside was a little bit weird looking.,7 years ago,Open,7063224602.0
Matt Johnson,2.0,"Good place to eat if you like over priced, bland pizza.",8 years ago,Open,7063224602.0
LEILA PEREZ,5.0,"Love pizza, come here...",9 years ago,Open,7063224602.0
Miguel Caguas,5.0,"(Translated by Google) Very delicious pizza.

(Original)
Pizza muy deliciosa.",a year ago,Open,7063224602.0
Sean Leytham,4.0,,a year ago,Open,7063224602.0
Michelle C,1.0,,2 years ago,Open,7063224602.0
Nathaniel Cochran,5.0,,2 months ago,Open,7063224602.0
Cory Tallman,5.0,,9 months ago,Open,7063224602.0
Richard,1.0,,3 years ago,Open,7063224602.0
ItsJustBeth,5.0,,2 years ago,Open,7063224602.0
BJ,1.0,,2 years ago,Open,7063224602.0
Jason Foley,4.0,,4 years ago,Open,7063224602.0
Sam Nobles,5.0,,3 years ago,Open,7063224602.0
Robert Brown,4.0,,2 months ago,Open,7063224602.0
John Doe,4.0,,a year ago,Open,7063224602.0
Allison Koch,4.0,,2 years ago,Open,7063224602.0
Jeffrey Rettig,4.0,,2 years ago,Open,7063224602.0
Dr. John Hatcher,3.0,,a year ago,Open,7063224602.0
Tamekia Moses,5.0,,a month ago,Open,7063224602.0
Terry Butler,5.0,,a year ago,Open,7063224602.0
robert brooks,5.0,,a year ago,Open,7063224602.0
Brittany Foster,5.0,,a year ago,Open,7063224602.0
Tiffany Applewhite,5.0,,11 months ago,Open,7063224602.0
Joseph Barrett,4.0,,a year ago,Open,7063224602.0
Logan Hamilton,5.0,,4 years ago,Open,7063224602.0
Terri Myers,5.0,,11 months ago,Open,7063224602.0
JuanValentin Gil-Rodriguez,5.0,,10 months ago,Open,7063224602.0
Jonathan King,4.0,,a year ago,Open,7063224602.0
Ricky Moran,5.0,,a year ago,Open,7063224602.0
JAy Murrell,3.0,,a year ago,Open,7063224602.0
Lindsay Harrison,5.0,,a year ago,Open,7063224602.0
Joseph Heath,5.0,,a year ago,Open,7063224602.0
Shane Harrison,5.0,,3 years ago,Open,7063224602.0
Valkyrie Dare,4.0,,4 years ago,Open,7063224602.0
Joshua Ainsworth,5.0,,a year ago,Open,7063224602.0
Brandy Blackburn,4.0,,9 months ago,Open,7063224602.0
Sandra Hammock,5.0,,2 years ago,Open,7063224602.0
Jay Askew,4.0,,a year ago,Open,7063224602.0
Carlos Felipe Antonorsi,5.0,,5 months ago,Open,7063224602.0
Rex Wilkinson,5.0,,9 months ago,Open,7063224602.0
matthew reeves,5.0,,11 months ago,Open,7063224602.0
Raine Maus,5.0,,a year ago,Open,7063224602.0
Rob,5.0,,a year ago,Open,7063224602.0
Ron Antinore,5.0,,3 years ago,Open,7063224602.0
