name,stars,text,timeSince,openStatus,key
Aida Poethig,5.0,Love this place. We go there all the time  Food is great & tasty. A must to go place!!,a month ago,Open,8434071442.0
12YOUWILLBURN12 DERPY DERP,5.0,Great pizza and friendly staff. My visit today was a bit slow to deliver food after ordering but the food is well worth any wait. A worthy place to stuff your face. 10/10,a month ago,Open,8434071442.0
Eric G,2.0,Food is good our last couple of visits service lacked. It wasn't busy and our server forgot our kids meal and had to wait another 15 20 minutes didn't even offer anything,a week ago,Open,8434071442.0
Mr CEO,5.0,"It was a great experience. The dinning experience had every other tabletop available for socisl distancing. The food was good. We had wings, subs, and pretzel bites. The greeter forgot about us on the school bus side. Nice environment. The restrooms needed attention.",a month ago,Open,8434071442.0
Justin Williamson,5.0,"We have been here several times now and have received great food with good service. Wait times for food can be longer than usual with Mellow Mushroom, but it takes 20+ minutes to cook a good pizza. I'd suggest a salad or ready made app if …More",4 months ago,Open,8434071442.0
Pamela Togans,1.0,Walked in at 720 pm was sat at table. Waitress got our order and drinks and by 8 pm we still had no food and our waitress was not to be found. They were more concerned with filling takeout orders vs taking care of tbe 3 tables they had …More,5 days ago,Open,8434071442.0
Holly Hatfield,5.0,"Always a great experience at Mellow Mushroom Florence! 👍🏽👍🏽 Shout out to Eric for the best customer service EVER! He was very polite, provided updates on our food/beverages, and abided by all virus regulations. He was very personable, and attentive to our needs while dining-in. Thanks for a great visit, and great pizza! 😀🍕",3 months ago,Open,8434071442.0
Larry Carter,5.0,Great pizza. Great staff. Lots of TVs with sports. All leads to a GREAT TIME,2 weeks ago,Open,8434071442.0
L Hopkins,5.0,I usually never leave a review...but Eric was so wonderful that I honestly had to sing his praises. We have eaten here many times and we walked away very impressed with him. He definitely needs to be promoted. We own our business and we see that this guy has the traits to manage at the top level. Very impressed!,4 months ago,Open,8434071442.0
Shannon Nichols,2.0,"Dirty, dirty, dirty. Bathrooms had black mold rings, tables left dirty with dishes and food, floors needed to be swept. Never been to a Mellow Mushroom like this. Very disappointing.",2 days ago,Open,8434071442.0
Rachael,5.0,Great pizza and one of the best places to go with a gluten allergy. There are so many available pizza options and even a gluten free brownie for dessert. And the gluten free options aren't even that much more expensive. Definitely one of my staple places when going out to eat.,2 months ago,Open,8434071442.0
Kelly Reardon,1.0,Food is great. I don't know whats going here but my son and I are the only people here and we have been waiting over an hour for 2 small pizzas. There is ZERO excuse for this. My son is still waiting for a refill on his drink (20 minutes). …More,2 months ago,Open,8434071442.0
Jackson Fitzgerald,1.0,"cooks weren’t wearing masks, bathrooms were disgusting and clearly have not been cleaned in forever. Took over an hour for our two pizzas. Many tables were not cleaned off and they were not busy at all! They put wayyyyyy to much cheese on …More",4 weeks ago,Open,8434071442.0
luke oliver,5.0,Co worker and I went there today (10/19/20) after getting into town for work. We had a round of drink and 2 small pizzas. They both came out at the same time but mine came out a little extra crispy and slightly burnt. The server told me …More,3 weeks ago,Open,8434071442.0
Katie Mathews,5.0,"The pizza was amazing and our server Eric absolutely killed it tonight. The restaurant was busy, but dude was literally running around making sure we and all of his other tables were all taken care of. I'll absolutely be back next time I'm in Florence!",4 months ago,Open,8434071442.0
sharif rahimtoola,5.0,"Good beer selection, friendly and attentive bartender, great pizza.  Toppings were crispy and fresh.  I will be adding this place to my rotation of road trip restaurants.",2 months ago,Open,8434071442.0
Blake Mathews,5.0,"The food was amazing, and the service was fast even though they were busy. Our server, Eric, was easily the best I've ever had at any restaurant I've been too. Ole dude was running back and forth and insanely friendly throughout the whole meal.",4 months ago,Open,8434071442.0
Shirley Coleman,1.0,This was my worst visit in all my visits to Mellow Mushrooms. My party and I waited for almost an hour for our food. After waiting the appetizer came out and beer cheese was cold. We were told the cheese pizza that was ordered would be …More,2 months ago,Open,8434071442.0
Thomas West,2.0,Waited an hour and a half sevice was slow.  Server kept saying the kitchen was slammed which would if been fine but everyone around us was served there food and new people arrived  abs served before  us.  The server was still friendly but …More,a month ago,Open,8434071442.0
Heather N,4.0,"We made reservations for a group of 35, they had an entire room for us, but only one waitress,  almost everyone had a good experience except for 2 people they never got their food...the waitress told them it was coming 3 or more times …More",a year ago,Open,8434071442.0
David Fleming,5.0,Food and service was excellent. Very fun atmosphere!!,4 days ago,Open,8434071442.0
Janice Rausch,5.0,"Had the most wonderful experience today at Mellow Mushroom. Eric was our server, and he was absolutely phenomenal! He was attentive, dedicated to our table, and on time with every request we had. He made our dining experience the best we’ve …More",7 months ago,Open,8434071442.0
Staci Henderson,3.0,"I, unfortunately, did not have a good experience when visiting the restaurant. I was there with a group of ladies (it was only 4 of us in total). We arrived at about 5 pm on August 22, 2020, and we were immediately seated outside. We …More",2 months ago,Open,8434071442.0
Maceo Jordan,4.0,"This was a great place to eat at even though we realized it was close to thier closing time they didn't mention it and still let us in, also gave us grade A service, not knowing we just left another establishment we sat in almost 2 hours …More",3 months ago,Open,8434071442.0
Michelle Brueger,5.0,"I went to Mellow Mushroom for the first time
March 6, 2020. I ordered a cheese steak to go. The service was extremely fast. Blake, who took my order, was friendly and helpful and the sandwich was …More",8 months ago,Open,8434071442.0
PeppehGreens,5.0,Amazing food. Eric our server knew the menu perfectly and walked us through the menu perfectly to find exactly what we wanted. …More,3 months ago,Open,8434071442.0
jayanday tv,5.0,I had a great experience here on Sunday! My waiter was Eric and he was the sweetest guy! He made sure we were comfortable and made sure to check on us every time he passed by. Our food was delicious and the pizza was amazing! It came out …More,8 months ago,Open,8434071442.0
Eric Moore,1.0,Probably the worst experience I've ever had in a restaurant.  Food was horrible and the kitchen was playing their music so loud i couldn't even eat.  Also the entire staff thought is was party time at the bar at 745.  I've never been so …More,a month ago,Open,8434071442.0
R. Webb,2.0,"None of the cook staff were wearing masks. They all had them, however, none actually had them on. The person that appeared to be in charge had a mask on but it was down around his chin. I do not recommend eating here until they get serious about their customers safety.",3 months ago,Open,8434071442.0
Kelly mcgregor,4.0,Tried a new pizza husband liked it I got my regular Holy Shiitake Pie it was yummy but needed to be cooked a little longer. Took to long to get food to me especially since there were  hardly any tables server said new cook which explains pizza not crispy enough. Overall it was good and service was good.,a year ago,Open,8434071442.0
David Hessie,5.0,The pizza is awsome. This is such a nice quaint place. Great for families and couples. I love to go here when I'm in the area. Cant wait till I can return in the future.,5 months ago,Open,8434071442.0
Jonathan Brooks,4.0,Great Craft beer selection.  Plus pizza was Good as always.,a month ago,Open,8434071442.0
Becky Pedersen,5.0,Excellent service by Molly and the wings and pizza are perfecto!!,2 weeks ago,Open,8434071442.0
Cheryl West,5.0,Food and service we had Elizabeth she was fantastic,a month ago,Open,8434071442.0
Freddie Moses,5.0,Awesome customer service and delicious food to match.,2 months ago,Open,8434071442.0
Tenesha,5.0,Eric was an amazing server he was very polite and sweet. The food was fantastic I loved it the atmosphere was nothing but good and positive. He made sure I had everything right off the bat. The food was over the top amazing and so slamming …More,8 months ago,Open,8434071442.0
Katrina Judge,5.0,Eric was simply the best!!! He over delivered and exceeded our expectations... Whenever you go to mellow mushroom please ask for Eric you will not be disappointed!!!,3 months ago,Open,8434071442.0
raynard wallace,5.0,"My waiter Eric was awesome he was funny, helpful, amazing, fast accurate with the service very polite . Very detailed with helping us with our order selection the food was great and the place was awesome as well  thank you mellow mushroom",3 months ago,Open,8434071442.0
Alezeania Mitchell,5.0,Great food & outside seating...,2 months ago,Open,8434071442.0
Jim Kelley,5.0,Great food and great service at the Mellow Mushroom in Florence today. Thanks Eric for the exceptional service and handling of our food allergies!,3 months ago,Open,8434071442.0
Ann Murray,5.0,Wait staff was awesome. Hostess was very sweet. Got us set up with no issues.. we will be going back..  We went for my son's 11th birthday...,4 months ago,Open,8434071442.0
Kayla Curry,5.0,We come here regularly. Had a great experience. Eric was our server. He greeted us at the door. Took really good care of us. Even when it was 8pm and they closed at 9. We had refills before we knew we needed them. Didn't have to ask for …More,8 months ago,Open,8434071442.0
Melissa Burge,5.0,First time I had been here. I really found the service great and the food was awesome!,a month ago,Open,8434071442.0
Wanda Yow,5.0,Good pizza - excellent curbside service,4 weeks ago,Open,8434071442.0
Steven Reeves,5.0,"Tried this place a month ago and have been here 3 more times since. The atmosphere is nice and the food is great. The servers are prompt, attentive and courteous. If you haven't been here to eat yet, you are missing out.",a year ago,Open,8434071442.0
Michael Brown,5.0,"Great atmosphere, great food, good service, mildly hip environment.",2 months ago,Open,8434071442.0
Ratched01,3.0,"Good food. Good service. But the portion sizes are very small for the price you pay. The mushroom soup is very good and costs 4.50,  but you only get like 5 spoonfuls of soup! It's not That good where it's a dollar per bite. The pizza was good, or at least my kids say it was",10 months ago,Open,8434071442.0
John Tragesser,3.0,Casual atmosphere.  Ordered the wings and brochette from the appetizer (munchies) menu.  Wings are decent and not over cooked.  Brochette with goat cheese was very good.  Wife ordered the pretzel bites which is their pizza dough made into …More,7 months ago,Open,8434071442.0
Dalasia Nash,2.0,"Dear Guest Services Manager,

Tonight I visited your establishment for the first time ever. Unfortunately,  my …More",10 months ago,Open,8434071442.0
Rachael Beargeon,5.0,I love this restaurant. The pretzel bites are amazing. The pizza is always perfect!,5 months ago,Open,8434071442.0
Darryl Page,5.0,"Good food (generous portions) with great service. A variety of beers on tap. Would strongly recommend the pizzas, salads (huge), and wings!",4 months ago,Open,8434071442.0
Kelli Dailey,5.0,Our server was the best.  He was so awesome and very helpful and so kind.  Eric was amazing.,5 months ago,Open,8434071442.0
Marshal Andrews,5.0,Eric was great and the food was awesome . Eric was great at keeping us up to date on our orders and keeping our drinks full,3 months ago,Open,8434071442.0
Koiya Tisdale,5.0,"The food was amazing, and the service was fast Our server, Eric, was the best.Eric was very friendly and respectful throughout the whole time Me and my BF was there.. Way to go Eric we will be back soon..",3 months ago,Open,8434071442.0
Adam Forrester,4.0,You know what to expect from Mellow Mushroom.   This one a pretty good example.  The service was good and they made some good vegan options for us.,11 months ago,Open,8434071442.0
Joanna Baker,4.0,Food was good but service was a little slow,2 months ago,Open,8434071442.0
Dallas Jackson,5.0,"Very nice staff, very clean restaurant, very good food",2 months ago,Open,8434071442.0
April Johnson,5.0,"Pizza was yummy and the service was superb! Our server, Missy, was very friendly, prompt, & knowledgeable. She recommended toppings that were delicious. Ask for Missy and try the mushroom trio, you won't be disappointed!",8 months ago,Open,8434071442.0
Stephanie Trautman,5.0,I think I just discovered my favorite Pizza.....Just Great Food and a Great Time.  Eric our waiter was wonderful and made sure we had everything we needed...,5 months ago,Open,8434071442.0
Tyffany Berry,5.0,First time ever going to mellow mushroom and it was amazing!,3 months ago,Open,8434071442.0
Andrea Carpenter,5.0,Grat pizza. Of course. Great service.,3 months ago,Open,8434071442.0
Heather Nolan,5.0,Good pizza. Great service. Eric made sure order was exactly right and was very prompt and accommodating. Service like this is the reason My family and I will be back very soon.,7 months ago,Open,8434071442.0
Victoria Floyd,5.0,We always go to Mellow mushroom every time we come to Florence! My favorite pizza in the world. Our waiter was Eric and he was super friendly and made sure we were taken care of the whole tome we were there!,7 months ago,Open,8434071442.0
Mickie Matthews,5.0,Always love eating here. I love the calzones! Our server was Eric and he was fantastic. He made sure our drinks were always filled and was attentive our entire meal.,7 months ago,Open,8434071442.0
Ryan Schebel,5.0,Really unique and eclectic place. Great pizzas. Tons of draft beer. Lots of tvs on the bar side. Large room off the bar for groups.  Great service. No complaints on my visit!,9 months ago,Open,8434071442.0
James Hardy,2.0,"Take cash with you! Food is was good and service is usually good, but it can take awhile to get your food. One major concern last week was that the roaming credit card thief/waiter Eric from Percy's is here too. Don't give access to your …More",8 months ago,Open,8434071442.0
Phil greenberg,5.0,"Best gluten free pizza when traveling.  Has been consistent from location to location and my family like their regular pizza and food, too.  Good service as well and interesting atmosphere.",8 months ago,Open,8434071442.0
Mona Freeman,2.0,One of the worst experiences of dining I have had in a long time. First my husband ordered soup. They came back and said they didn’t have it. Second we ordered sandwiches and after 45 min they brought them after complaining. My sandwich was …More,4 months ago,Open,8434071442.0
lillie matthews,5.0,The food was great as usual! Eric was attentive and friendly despite being pretty busy. Overall wonderful experience,7 months ago,Open,8434071442.0
Jen Dailey,5.0,I went for my birthday dinner and our server Eric made it a wonderful experience!,5 months ago,Open,8434071442.0
Britt Wenzl,5.0,Our server was ERIC and he was outstanding!  He was such a great server! Very calm and excellent service! Probably one the best vists we had at this mellow!,7 months ago,Open,8434071442.0
Stacie Windham,5.0,Eric was an awesome server!  He was consistently checking on us and making sure we had everything we needed!  One of the best servers I’ve had here!,8 months ago,Open,8434071442.0
Betty Bark,1.0,"I stopped here during a 12 hour trip yesterday and got take out via online order. I was in a hurry by tthe time my food came out to me so I did not get tto eat it until hours later. The sandwich was AWFUL, and they didn't even give me the chips. Horrendously over priced, terrible quality.",4 months ago,Open,8434071442.0
Kevin Pachis,5.0,Maui Wowie pizza and meatball sub were best i have ever had,4 months ago,Open,8434071442.0
Matt Merkel,4.0,"Pizza is good. Took home the leftovers and it almost seemed like the crust was whole wheat or something. Not that that's bad or anything. Pretty tasty actually. Sure better than your big national chains. A good option if your standards are higher than Pizza Hut, et al. Oh, also a good enough selection of beer. Yay!",a year ago,Open,8434071442.0
April VanDonkelaar,5.0,The food was so good. We had a hummus appetizer and it was yummmy. The pizza was sit on and our server Eric was so attentive. Great service. And so cute.😁,8 months ago,Open,8434071442.0
M G,5.0,Always love this place!  Tried a burger this time.   Was supurb!,a year ago,Open,8434071442.0
Daniel S,5.0,Elmo was awesome! Kept checking on us and never had to ask for a thing! Great personality! Great asset to the company.,8 months ago,Open,8434071442.0
Antron Jackson,5.0,Great place excellent service,a month ago,Open,8434071442.0
David Henson,5.0,Wonderful staff and amazing grub. The pizza is to die for. Great selection of beer. The magic mushroom soup is some of my favorite soup ever! Cool atmosphere :),2 years ago,Open,8434071442.0
Whitney Lovette,5.0,Awesome food and service!,2 weeks ago,Open,8434071442.0
christopher phillips,5.0,Great food and service,a year ago,Open,8434071442.0
Jeff Bullis,5.0,Never fails. Not sure I have had a bad pizza there. Stellar service. All good.,a year ago,Open,8434071442.0
Henry Arrington,5.0,"Delicious pizza and wonderful customer service. Eric is a great server. We never had to look for him, he was there whenever needed.",8 months ago,Open,8434071442.0
Rebekah Kinsey,5.0,Great customer service!! Eric was awesome.,4 months ago,Open,8434071442.0
Fritz Miller,5.0,Pizza taste great and wing,a year ago,Open,8434071442.0
Kevin S,5.0,Awesome  Pizzas and a ton of micro brews to choose from.,4 months ago,Open,8434071442.0
Country Lifestyle,5.0,"Enjoyed the food here and it was truly a ""Mellow"" mood. Check out the paintings, etc. on the wall 👌🏾 A rewards program here would be a great add in if they dont already have one.",8 months ago,Open,8434071442.0
Joe Adkins,5.0,Great Place! Good service & good atmosphere.,a year ago,Open,8434071442.0
Lavona Brockington,5.0,"I really enjoyed date night with the Hubby!! I'm vegan and the appetizers were great, the veg out pizza was amazing, and most importantly the service was spectacular!! I will definitely be back!!!",2 years ago,Open,8434071442.0
Jodi Fuerst,4.0,"The building needs some cleaning up, but the service was great and the food delicious. I had the tempah hoagie, a must try",5 months ago,Open,8434071442.0
Diane Bass,5.0,Eric was an excellent waiter! He made my first experience here awesome I will definitely be coming back,8 months ago,Open,8434071442.0
Brittney Asman,5.0,"Cute, fun, and tasty. Great service",4 months ago,Open,8434071442.0
anjelica bethea,5.0,Me & my daughter enjoyed our wings & all mighty pizza everything was hot & delicious.... even our Arnold palmers was made just right lol.... First time & we loved it thanks Eric Johnson you was a great server we’ll be back😘😘😘,8 months ago,Open,8434071442.0
Tammy Girl,4.0,Appetizers are the bomb! The pizza is good but the apps are better! Try their bruschetta! Omg! I love the art from local artists on display and for purchase! We sat near the open kitchen and were able to hear the cooks singing and laughing. …More,10 months ago,Open,8434071442.0
darby mcelveen,5.0,"My second visit to Mellow Mushroom was awesome. Missy recommended the Holy Shitake with teriyaki steak. Probably my new favorite! With a sweet water 420, SO GOOD!!!",7 months ago,Open,8434071442.0
Denise Benjamin,5.0,Eric was awesomeness!!! He knew exactly what we needed every time he come to the table without us asking! I will definitely come back to see Eric!!,8 months ago,Open,8434071442.0
S B,3.0,Horrible service. Slow and just overall uninviting.,2 months ago,Open,8434071442.0
Ann White,4.0,"The food was good but could have had a bit more flavor. My kids LOVED the mac n cheese. The service was alright.  The waitress seemed like she was somewhere else,  she messed up a few things throughout the night like forgetting a drink order and bringing a second spoon for 2 kids.  But, I would go again.",a year ago,Open,8434071442.0
LeeAnn Hayes,5.0,ERIC WAS AWESOME!!!!! He was very attentive and super friendly.  Good customer service makes ALL the difference!,8 months ago,Open,8434071442.0
Lori Cheffar,3.0,"Good place for a quick bite. Good salad, had a smaller version so i left happy. The pizza was also a good choice. Fun place to for the family",11 months ago,Open,8434071442.0
Brandon Moore,5.0,"food was great, as always. the service was phenomenal honestly. especially fond of the server we had, named eric. He did a spectacular job, earned a big tip lol",8 months ago,Open,8434071442.0
Sarah Nystrom,5.0,Great if you love craft beer on tap and the food is amazing.,2 years ago,Open,8434071442.0
patricia dew,5.0,The food here is excellent and the service is always great!,a year ago,Open,8434071442.0
Ashley Dingle,5.0,"Eric was our waiter and gave excellent service.  He was very attentive, quick and courteous.",8 months ago,Open,8434071442.0
Silver Axel,5.0,Quick and amazing service from Eric. The food was good and the buffalo chicken pizza was smacking!,7 months ago,Open,8434071442.0
Lynda A. Lindsey,4.0,"Slow getting the order out considering the low patronage, but the food was tasty and the staff polite and thoughtful.",7 months ago,Open,8434071442.0
Jamie Gee,4.0,Food was delish...wish the setting was quicker as we went mid afternoon and the restaurant was NOT busy at all. The staff made us wait while they cleaned tables...should have been cleaned before as they were not busy as at.,a year ago,Open,8434071442.0
Heidi Oakley Stivender,5.0,"We received AWESOMENESS from our hostess.  Thanks ELMO, keep up the great work.",7 months ago,Open,8434071442.0
Victor Pecorella-Bumb,5.0,Eric was my waiter and he provided a wonderful experience for us! Definitely coming again.,8 months ago,Open,8434071442.0
SMALL HOUSE PROJECT,3.0,The food was good could've been better cuz my wings were room temp and my fruit punch had no flavor. Service was good and totally enjoyed my pizza. Overall I will be back but this time I'll try the bar.,a year ago,Open,8434071442.0
Casey Wilkes,5.0,"Great food as always and great service from Eric, he’s the best water refiller in town 😂😂",7 months ago,Open,8434071442.0
Mando Brando,5.0,"The food was great, my server Eric was awesome. Jerk wings were perfect.",8 months ago,Open,8434071442.0
Dey McCall,5.0,Our server was awesome. Eric was chill and got everything right. Give this man a raise!!,8 months ago,Open,8434071442.0
Joe Driggers,5.0,"Great service, excellent pizza. Also our server, Eric was top notch.",8 months ago,Open,8434071442.0
Nichole Avant,5.0,Service was great. The food was good and hot. My family enjoyed it and we wil be back,11 months ago,Open,8434071442.0
Noah Karydis,5.0,The Pizza was amazing and the service by Eric was spectacular!!!,4 months ago,Open,8434071442.0
John Popowski,2.0,Didn't like.  Wont go back. Bleh pizza.,2 months ago,Open,8434071442.0
Robert Conklin,3.0,Sounds like I need to meet this fellow Eric everybody talks about Eric if you look at their reviews their contributions are only like one or two sounds like friends or just buttering him up I haven't been there but I need to go if somebody …More,6 months ago,Open,8434071442.0
Phillip Lardieri,5.0,Eric provided superior service to our table. DEFINITELY COMING  BACK!!,8 months ago,Open,8434071442.0
Amanda Ayala,5.0,"Pleasantly surprised!  The pizza was delicious, service was a little wonky but I would totally go back.",a year ago,Open,8434071442.0
Lyndsey Lawson,5.0,"Can't go wrong with any menu item.
I prefer vegetarian foods and this is the kind of place to go with carnivores thanks to the variety of options available to both!  I don't feel like a weirdo asking for anything special.",9 months ago,Open,8434071442.0
Tracy Seward,5.0,It was our first time eatting there it was very good. We will go back,8 months ago,Open,8434071442.0
Kacy Hartson,5.0,Great service and great pizza!  Our server Eric was amazing!,7 months ago,Open,8434071442.0
Carolyn Johnson,5.0,Eric was a great waiter—very attentive and good at his job.,7 months ago,Open,8434071442.0
Darris Tate,5.0,Awesome food and service,a month ago,Open,8434071442.0
Tammy Williams,5.0,Our server Eric was Awesome!! The food was delicious as always,8 months ago,Open,8434071442.0
Etienne Blouin,5.0,Always a nice selection of beers and food is good!,a year ago,Open,8434071442.0
Gregory Lykens,4.0,"Drove from Chesterfield, SC  to try the pizza.  It was good.  Not NY style pizza but old world style.  Crust was sprinkled with parmesan cheese. Tasty. I ordered a large 16 inch cheese pizza. …More",9 months ago,Open,8434071442.0
Brandon McLaughlin,5.0,We went here for lunch today ordered the trio meat balls for an appetizer and a small pizza for the 2 of us. The food was delicious and the lunch time atmosphere was laid back. Will be going back to enjoy lunch again.,a year ago,Open,8434071442.0
