name,stars,text,timeSince,openStatus,key
Anthony Vicidomini,3.0,Not to bad a place but waited way too long for the food. Something was wrong with the kitchen. Not sure if I will ever go back. Wait staff was very pleasant.,a year ago,Open,7322444202.0
Jay S,4.0,The pizza is pretty good considering the type of bar/restaurant it is,a year ago,Open,7322444202.0
John Butterfield,2.0,"Wanted to like this spot but unfortunately I can't recommend it. The wait staff failed to bring us plates for our appetizers, the air conditioning is set up so that if your seat is in the wrong place, the napkins will be noticeably moving …More",2 years ago,Open,7322444202.0
Daniel Hagerman,3.0,"The ambiance is amazing, the staff are excellent but the menu was not great for my son.  He is a picky eater at 12.  The food was good though.",2 years ago,Open,7322444202.0
Rita Fischer,1.0,Not much of a selection..no entrees burgers sandwiches wraps pizza ...,a year ago,Open,7322444202.0
precision Brown,3.0,"Nice place to hang out for awhile
Pretty good food too",a year ago,Open,7322444202.0
mastercheifgamer201,5.0,Some of the best pizza in the area.,a year ago,Open,7322444202.0
Jennifer Palmerson,4.0,Fun night with Dueling Pianos. $2.50 Coors Light draft during happy hour. 5 oven baked wings for $5.99.,2 years ago,Open,7322444202.0
liam Vosper,5.0,"Super chill atmosphere, live music, loaded potato pie is amazing.",a year ago,Open,7322444202.0
Janell Brown,4.0,I live close by yet today was my first visit ..came for a late lunch ...luv the decor and the music !!! I ordered the baked wings and a meatball pizza. The wings were crispy and cooked to perfection!  The meatballs on pizza had great flavor …More,2 years ago,Open,7322444202.0
Kimberly Cunha,5.0,Very good wine prices,a year ago,Open,7322444202.0
cate klacik,2.0,"Slow service, just ordinary pizza, nothing to blow your mind",a year ago,Open,7322444202.0
anthony,4.0,"Great hip looking place, especially for my wife and I who are mid 20s and enjoy beer on tap, live music, and younger environments. Now, food-- appetizers are better than my pizza. Ill still be coming back for the jerk wings, pretzels and …More",3 years ago,Open,7322444202.0
Allan Leeman,4.0,Pizza was good but they were skimpy with the toppings.,a year ago,Open,7322444202.0
Jason Britton,3.0,Food was good but staff at the time was super unexperienced.,a year ago,Open,7322444202.0
anth arag,2.0,"Very limited menu, they had run out of blue cheese dressing for the wings and salad",a year ago,Open,7322444202.0
Steve N,4.0,Loved the atmosphere. A great place to chill... Good was also very good....,2 years ago,Open,7322444202.0
dan Migs,4.0,"Was surprised to find out this was a chain place (why yes, I AM one of those Jersey pizza snobs, thanks for asking!). Still, very tasty, highly enjoyable pizzas! Crust is on the crisp outside, softer inside, and dusted with parmesaen. Beer …More",2 years ago,Open,7322444202.0
Jim M.,1.0,"Known for their pizza but I could honestly make better pizza in my own kitchen. Decor doesn’t make sense, not sure what kind of place it is. Someone in my party asked for mushrooms on their pizza and, lol, they couldn’t even get that right.",2 years ago,Open,7322444202.0
Cheryl Conklin,5.0,Great thin crust pizza.,a year ago,Open,7322444202.0
Renee Wilson,4.0,"Bartender was AWESOME. Very helpful.  Kitchen had an issue about making pizza without parmesan cheese as I'm highly allergic.  Had to remake it 3 times.  But Katie took care of the bill,  was very apologetic and tried to compensate for the mistake.  I would go back.",2 years ago,Open,7322444202.0
Terry Kriel,1.0,I would give this place 0 stars  I feel bad for the owner of this restaurant being a restaurant owner myself.  My husband and I walked in sat at the bar for 10 to 15 minutes as we watched three bartenders talking among themselves and never …More,2 years ago,Open,7322444202.0
Donna Shenesky,5.0,First time there.  Mushroom soup was delicious and pizza was incredible.  Can't wait to go back!,2 years ago,Open,7322444202.0
Laura Salerno,3.0,Food was good once we got it. Service and the kitchen were extremely slow. We waited over 45 minutes for appetizers. Most of our dinners were basically served right on top of appetizers.  Several people in our party either got the wrong …More,2 years ago,Open,7322444202.0
Rick Sonnenberg,5.0,The environment and atmosphere is great. The bartender and servers were friendly. Appetizers were ok to good.  But the specialty pizzas are fantastic. The crust is amazing on its own.  Now I would not go here for a plain pie.  Be creative and explore their options or customize your own creation.,3 years ago,Open,7322444202.0
Monica M,3.0,"My friend and I came here last week. The food was decent, nothing special. And the severs were friendly. A little too friendly. We had at least 7 people come by the table to ask us how our meal was, which is nice but my friend and I couldn't even have a conversation without being interrupted.",3 years ago,Open,7322444202.0
Laura Langel,1.0,Not impressed at all table of 9 food came out all different times not cooked right. Won't be back.,a year ago,Open,7322444202.0
Matthew Bilinski,5.0,Love Mellow!!! Their pizza is amazing!! Service is always good.,a year ago,Open,7322444202.0
Gabrielle F,1.0,"The bartender told me that a Belgian golden ale was an IPA, which I should have double checked on, but I just assumed she knew. Then she served it to me in a hot glass twice, because I asked for a new not hot glass and then got another hot …More",3 years ago,Open,7322444202.0
maggie crowe,3.0,They don't have half the menu stocked!! Servers are nice and apologetic though!,a year ago,Open,7322444202.0
jeffers pascal,1.0,I've been to mostly all the Mellow Mushroom on the east course and this one was the worst the bartender sucks he pour me a Guinness and I said they for 35 minutes and he didn't even come and give it to me never going back to that Mellow Mushroom thumbs down,a year ago,Open,7322444202.0
Gregory Bain,3.0,"I think they have it set up backwards. Big bar at the back entrance but you enter at the ""front. Even the big sign is in the back of the building.  Anyway, it's a trendy bar and restaurant. Specializes in pizza. I loved the special, but I also had dieara the next morning.",3 years ago,Open,7322444202.0
Joseph Cornell,1.0,My family and I arrived here for a late lunch after going to the women's day or at ocean County mall. Our first impression was good. Interesting decor the kids loved the dragons. The appetizers were good but the first issue was when they …More,3 years ago,Open,7322444202.0
Chilll,1.0,"This review is for the meatball sub. This is the worst meatball sub I have ever had in my life.The  meatballs ( if that's what they really are)are dark brown,just about burnt all the way around. Have a very weird taste. I think they buy …More",2 years ago,Open,7322444202.0
Bill Delucia,4.0,"Great wings, cheap drinks. Good beer selection. Would like to see more variety of beers besides IPAs though.",2 years ago,Open,7322444202.0
Louis Verange,1.0,Have had a few bad experiences here. Two times I called for pick up and waited an extra 15 minutes both times for my food to be ready. Had ordered a medium and they placed it as a large. The pretzel bites are not pretzels. They had coupons …More,2 years ago,Open,7322444202.0
samantha miskin,5.0,Good food with a fun atmosphere,a year ago,Open,7322444202.0
Annette Boughton,4.0,First time we went there. Food was great & all the staff was awesome. We'll go again,2 years ago,Open,7322444202.0
Jim Stapleton,5.0,The food and service were good when we ate there. There was also a live band playing that night. Definitely a good place to check out when you are in the area.,2 years ago,Open,7322444202.0
Ray T a,5.0,"Clean, simple place, great food and service.",3 years ago,Open,7322444202.0
Kevin Kinslow,2.0,"Ordered wings and a gluten free pizza. Wife and I watched as cooking staff played in their hair, ate, rubbed their noses and played on cell phone. none of them bothered to wash their hands after any of this. Do they think because they put on gloves it makes it ok? All need serve safe training.",3 years ago,Open,7322444202.0
Enrica Funari,1.0,Horrible food! Never go back..the hamburger was definitely not beef!..was a strange color..awful,a year ago,Open,7322444202.0
Deniss Sossa,2.0,"Blah in every way! Service is always mediocre at best.  Food lacks Wow factor...save your money and make it at home....if you can dab a little around your kitchen, it would taste the same. …More",a year ago,Open,7322444202.0
chas nuedling,5.0,great vegan options,10 months ago,Open,7322444202.0
raymond Gardner,4.0,"Nice acoustic guitarist, nice bartender service and the Shitake Mushroom pizza was  quite tasty.",a year ago,Open,7322444202.0
Marc Micciulla,3.0,The food it ok. We like the Holy Shitaki Mushroom pizza.  The beer is better.,a year ago,Open,7322444202.0
Jillian Gray,5.0,I love mellow!! They have a great rotating tap and yummy food. We go for bingo on mondays mostly or Wednesday is ladies night it's like $5 bottle of wine.,2 years ago,Open,7322444202.0
jerra banasiak,4.0,Clean. Good food. We go once a year. No fries for the kids tho.,2 years ago,Open,7322444202.0
Charlie Winkler,4.0,Delicious Pizza! Great vibe and ambiance. Only downside is the price. A buffalo chicken personal pie after tax and tip will run you around to $18. But for some it might be worth it,3 years ago,Open,7322444202.0
Gabriella Curcio,2.0,"This is the most honest review ever because I thought this place would have been better.
I live in central jersey, however, my grandparents live down in toms river so we …More",a year ago,Open,7322444202.0
Danny Seymour,4.0,"Would have been a 5 but it was kids night and the DJ was WAAAAY too loud.
If you like mushrooms the Holy Shittaki pie is the absolute best.",a year ago,Open,7322444202.0
Pito Ramos,4.0,"Love their pizzas!!! And drinks are good as well, no complaints.",a year ago,Open,7322444202.0
Beau Grzywinski,1.0,"No soap in the mens bathroom, no toilet paper in the women's bathroom. Server came over to us 15 minutes after we sat down. It took 50+ minutes to get food. We eventually just got it to go since we were the third people to have issues.",a year ago,Open,7322444202.0
Randy Parker,1.0,"The atmosphere is really cool and different from any other place around here. Went there with my wife and two kids. Our food came out at different times. It took 25 minutes for my daughter to get her salad with grilled chicken, meanwhile …More",3 years ago,Open,7322444202.0
Rodney Collins,5.0,A new and unique restaurant for the neighborhood I enjoyed my first dinner evening interesting conversation with staff and have fun well done welcome to the neighborhood. FYI new update Wednesday night is ladies night. and all bottles of wine are just dollars $5.00 👍🏽😁🤩,2 years ago,Open,7322444202.0
Michael Nixt,4.0,"Lunch service was a bit slow.  Food was good, but I unfortunately won't be returning for lunch. I don't have an hour to wait to get lunch.",2 years ago,Open,7322444202.0
Andrew Morgan,5.0,My colleague and I stayed at the Courtyard for 4 nights while attending an Institute at Samford University. This is the first time we have stayed at this hotel. I must say I was very pleased at the amazing experience we had. The room was super clean and very quiet. The location is very convenient.,3 years ago,Open,7322444202.0
Mari Petersen,4.0,Food is great! Service is mediocre!,a year ago,Open,7322444202.0
Casey Laboy,5.0,We love the pizza and apps. Great tap list and by far some of the best wine I've had out.,2 years ago,Open,7322444202.0
Maddie McGreevy,5.0,Best pizza place ever. My favorite is the buffalo chicken pizza and it's so good. The restaurant itself reminds me of Alice in Wonderland.,2 years ago,Open,7322444202.0
Lois Eichele,1.0,Not as good as I have experienced in the past,11 months ago,Open,7322444202.0
Chris Nonya,4.0,"Great food, great atmosphere, great people! Our waitress Briana was awesome and a great sport even though my step dad tried hooking us up lol. Definitely will go back",3 years ago,Open,7322444202.0
bibli addict,1.0,"Three middle-school aged hostesses doing the job of one person, as slowly and condescendingly as possible. Everyone who walked in was told it was an hour wait, so twice as many people left than stayed and waited. Waiting area isn't big, so …More",3 years ago,Open,7322444202.0
gayle epple,3.0,"The Host/Manager was great.He asked us if we needed anything and even went and got our food when we felt it was taking too long.
The calzone was great but the pizza was ok.It wasn't the taste but the …More",2 years ago,Open,7322444202.0
Rokyah,4.0,"Great atmosphere, decor. Good food. Nice to see a unique place in our area. Just wish it was closer to shore area...",2 years ago,Open,7322444202.0
Tracey Andino,5.0,Aside from there being a super long wait at times because it's a new place the food it delicious!!! If you like mushrooms try the holy shiktaki pizza! Truffle oil with a variety of mushrooms! The dough here is great and made with molasses and that adds such a great flavor to the dough!!,3 years ago,Open,7322444202.0
Joe Kay,5.0,"Their mushroom soup is OUTSTANDING, and we love their pizzas.  Their Greek salad is very good too.",2 years ago,Open,7322444202.0
Bruce Cashman,4.0,"Great Calzone
Build you own salad",a year ago,Open,7322444202.0
Billy Dee,3.0,Average tasting food and service.,a year ago,Open,7322444202.0
Karen Reuther,3.0,Interesting place. I like the sausage crumble sandwich. My Sister likes the pizza and pretzel bites. Service is okay.,2 years ago,Open,7322444202.0
Douglas Warwick,4.0,Funky atmosphere of course but very clean n friendly staff. Prices a bit high for pizza but it is very delicious. Would definitely go back for more and check out happy hour,3 years ago,Open,7322444202.0
Mariah Jones,5.0,Mello Mushroom had fun and food for the whole family,a year ago,Open,7322444202.0
Randy Leach,4.0,Loved the meatball appetizer,8 months ago,Open,7322444202.0
Lisa Molnar,5.0,Great pizza and great staff! Every one who works here is lovely,2 years ago,Open,7322444202.0
steve castle,5.0,Great beer choices and great food.  Staff is friendly and service is fast.  The bar seats are not very comfortable though,3 years ago,Open,7322444202.0
Andrew Schneider,4.0,"Lots of Vegan options for pizza.  Staff is always friendly and the beer menu is well selected, big, and rotates frequently.  Lots of Southern Tier options particularly!",2 years ago,Open,7322444202.0
Marilyn Moscarell,1.0,Wasn't worth the money no wonder why it was empty for lunch,a year ago,Open,7322444202.0
Dolores defranco,4.0,Thai dye pizza was delicious,a year ago,Open,7322444202.0
Elizabethann Mcmurray,5.0,"Great food, great atmosphere, waitstaff if fantastic.  Enjoyable visit",2 years ago,Open,7322444202.0
Tiffani Saunders,5.0,My husband an I absolutely love this place I'm originally from Down South an thru have them all over I am so glad they finally built one up here yayyyy!!!!! If I could give this place 10 stars I would great staff an awesome food an I love the theme of the restaurant an hour the setup is....,2 years ago,Open,7322444202.0
St Nu,3.0,"Ehhhhh. It was ok. I've been to Mellow Mushrooms in different states. This one is different. Maybe times have changed, but this doesn't remind me of the restaurants out of state.",2 years ago,Open,7322444202.0
Christopher DeLuise,5.0,"Very fun place. The dueling pianos were fantastic! Food service was a bit slow(1hr+ for a pizza), but it was very busy at that time due to the show.",2 years ago,Open,7322444202.0
Devon Gordon,4.0,"Great pizza , good drinks, unique atmosphere",a year ago,Open,7322444202.0
Ashley Mccabe,5.0,Just love their pizzas!!!  Gluten free awesome.  Ingredients so fresh!!  Only place I eat pizza now.  Staff is super too!!!,3 years ago,Open,7322444202.0
Ryan McGonigal,4.0,"Two words.
Cheese calzone. Forgotten boardwalk funnel cake. …More",a year ago,Open,7322444202.0
Mike Buchinski,5.0,"Great atmosphere, great pizza/food, good beer selection and prices and excellent service",2 years ago,Open,7322444202.0
Dan Gold,4.0,Definitely a different spot. Pizza was good and i had an amazing sandwich. They have vegetarian and vegan options which is a plus for my family.,2 years ago,Open,7322444202.0
Jessika Smith,5.0,"I love this place! Unique pizza choices, delicious apps, and a fantastic beer selection. Ladies night $5 bottles of wine are also a huge plus :) will be back often!!",3 years ago,Open,7322444202.0
Spirit Warrior,3.0,"First time here. There's a cute metal work dragon greeting patrons by the front door. The interior decor is whimsical. There's a full bar, wall-mounted tv's. Staff was friendly and ace was clean, including the restroom. I had a Ceasars …More",2 years ago,Open,7322444202.0
Shelley Hamilton,5.0,"Different crust,  really tasty... not every place has artichoke hearts, so I like this place for that.  Monday was bingo and beers..fun!",2 years ago,Open,7322444202.0
Sal Alio,5.0,"Excellent build your own pizza selection, great variety of craft beer available at a moderate price range.
Nice place!!!",2 years ago,Open,7322444202.0
Mamma Smurf,1.0,"Terrible service, very long wait, waitress was offended when confronted. The manager was mousy but she did finally bring us our food, the waitress never asked to refill our drinks, never apologized that our wait was an hour at lunchtime on Wednesday. The pizza was good but for what they charge the toppings barely covered 1/2 the pie.",2 years ago,Open,7322444202.0
JoAnn Currie,5.0,The waitress suggested a pizza with fresh mozzarella and pesto drizzled on top it was the best pizza I've had in a long time.,2 years ago,Open,7322444202.0
micheal wulf,5.0,Food was great staff very friendly and the manager Chris was very helpful!  I would go back again,2 years ago,Open,7322444202.0
Scott Brunotte,5.0,Great pizza! Potato pie was delicious!,a year ago,Open,7322444202.0
Bill Harrison,3.0,Nice place the Burger suck,a year ago,Open,7322444202.0
Patrice Farquharson,5.0,"Vegan Friendly!! My friends and I decided to visit this Mellow Mushroom late Saturday night. I am allergic to dairy and the menu had a few options to choose from. After asking our server Jacob lots of questions, I ordered a pizza with pesto …More",3 years ago,Open,7322444202.0
Jose Torres,1.0,Garbage service and reheated wings....,a year ago,Open,7322444202.0
Jean Marie Soranno,5.0,Great margaritas!,10 months ago,Open,7322444202.0
Jacob Kaiser,4.0,Get selection of beer. Our server was super friendly don't remember his name. And the pizza was good.,3 years ago,Open,7322444202.0
Daniel Suarez,2.0,Limited menu. Requested temperature for burgers was ignored and over cooked. No french fries here instead you'll get roasted potatoes. Soups we're great. If you want pizza this a good place. But don't expect an inexpensive pizza.,2 years ago,Open,7322444202.0
Leslie Mcewan,5.0,"Friendly Atmosphere, Great Bar Service 👍",a year ago,Open,7322444202.0
Hunter Darton,4.0,"This is a really cool place to come and just hang out for a bit. It has a really cool vibe to it. I also hear that there's only around four locations in America, so this is a must see if you're around one!",3 years ago,Open,7322444202.0
Kerri Gilman,4.0,"We had an enjoyable lunch with good service. My only complaint would be the amount of soup they charge $5.99 for.... good soup, but not that good.",2 years ago,Open,7322444202.0
Lisa Puglisi,3.0,"Overall decor unique. Food and service average. Limited menu of pizza, salad, and sandwiches.",2 years ago,Open,7322444202.0
Jeffrey Coulson,5.0,First time pizza was Great,a year ago,Open,7322444202.0
Michele Arban,5.0,"The food here is SO GOOD!!! Try the Great White pizza, you'll be glad you did!",2 years ago,Open,7322444202.0
Jordan Palamar,4.0,"Good for a quick bite, wider beer selection than most and almost always have some kind of live entertainment.",2 years ago,Open,7322444202.0
Nick Kube,1.0,It's my first visit seems awesome so far but there a very bad issue at the bar with the way the plumbing is set up and I'm sorry but smelling human waste as I'm trying to enjoy my drinks and food is not a good time would easily give five …More,3 years ago,Open,7322444202.0
John Carling,4.0,Descent food. Reasonably priced. Nice atmosphere.,2 years ago,Open,7322444202.0
Scot Austin,5.0,Good selection.  Area in the back for some games.  Brought the soccer team there a couple of times for lunch.,2 years ago,Open,7322444202.0
Dan Watters,5.0,Fun on Thursdays. Kids eat free and they have  characters and activities.,a year ago,Open,7322444202.0
Ruth Waddington,5.0,Great pizza. Great atmosphere. Really enjoyed our dinner.,2 years ago,Open,7322444202.0
tracy bendian,1.0,Really didn't want to give this place one star.  I've been here 4 times so I think that's enough to form an opinion. First time when the place first opened. Everything was great. Second time service was not good food was mediocre.  Gave it …More,3 years ago,Open,7322444202.0
Dee Murray,4.0,"Awesome place and good food. Pizza is different than a typical pizzerias', but delicious",2 years ago,Open,7322444202.0
Michael Sharp,5.0,"Love the beer selections, and the Bartender was great.  Also love the pretzel.",2 years ago,Open,7322444202.0
Bobbie AAronson,5.0,Best pizza I've ever had!  Brochetta was scrumptious!  Atmosphere is delightful....an absolutely fun time!extremely welcoming staff.,3 years ago,Open,7322444202.0
Mandar Patil,5.0,"Good service, plenty of options to choose from the menu. The 2 pizzas we tried were finger licking delicious,with good portion sizes.Neat & Clean place with a modern decor...love it",3 years ago,Open,7322444202.0
Kevin McCarthy,4.0,"Giving this 4 stars for the simple fact I didn't have the pizza, and since this a pizza place I believe 5 stars should be reserved for when I actually have the pizza. However, I did have the garlic bread with pepperoni and a Sausagefest …More",2 years ago,Open,7322444202.0
kathleen grady,5.0,"Vegan, vegetarian, gluten free(separate prep area), carnivore I could bring all of my teens and we were all happy! Fresh veggies, delicious and reasonable.",3 years ago,Open,7322444202.0
Jenna Moore,2.0,"Cool atmosphere terrible pizza. Even my 4 year old disliked it. That says something since she will eat frozen pizzas. Why eat here, especially  when in NJ. Any pizzaria is going to be better!",2 years ago,Open,7322444202.0
Cynthia Famularo,5.0,Love the fact that they have 42 beers on tap!! Chris the bartender is a beer matter and can help you find the brew that fits your needs!! Apps are great!!,3 years ago,Open,7322444202.0
TKM MKT,1.0,Took an hour and fifteen minutes to get two medium pies and a children's pretzel. The 3 year old I was with nearly flipped out crying for his food. For some reason they brought out the adult food first and kids five minutes later. Pizza is mediocre at best on top of everything AND $20??!  I'll never go back.,2 years ago,Open,7322444202.0
Louis Maiocco,5.0,"Good food,nice atmosphere and great staff",2 years ago,Open,7322444202.0
Rick ONeill,5.0,Awesome. Spinach artichoke dip was best I've had. White shark pizza was amazing. Little pricey but we'll worth it.,3 years ago,Open,7322444202.0
James Scott,4.0,Food was really good... even my picky 2yr old went to town on the pizza.  But have to knock it down a star for the cleanliness of the dishware. Had some unknown floating things pasted all around the first cup I was given... almost made me walk oit at that point but was an anniversary meal for wife and i,3 years ago,Open,7322444202.0
William DeOcampo,1.0,Food was good but by far the worse service I have ever had. Order my son's food first with the pretzel bites appetizer. Ordered some over priced drinks with 2 medium pizzas. Got the drinks 20 mins later.... asked the waitress about the …More,2 years ago,Open,7322444202.0
Jason Pharo,5.0,Our first time and we enjoyed it. Will visit again.,2 years ago,Open,7322444202.0
airborneleads1981,3.0,"good pizza joint,  they have free basketball, air hockey,  corn hole for the kids or yourself.",2 years ago,Open,7322444202.0
Ron Ceglia Jr.,5.0,Great food and atmosphere.  My daughter loved the game area,2 years ago,Open,7322444202.0
Tracy Goldych,3.0,"This one was disappointing. The pizza looks amazing. It is not. I can see why it is a popular chain in the South, but as a NJ local this pizza didn't cut it. Toppings were great, but the crust is bland, plain dough almost like a bready …More",3 years ago,Open,7322444202.0
michelle gourley,3.0,"Fun looking place with activities. Lots of beers on tap, if your into that. Salad was ok and pizza tastes like a step above frozen pizza you make at home. After looking at the surroundings, they are trying to accommodate for kids and adults, although im just not seeing it. Go try it once, and then make your decision.",3 years ago,Open,7322444202.0
Sherri Grossman,5.0,They have great food and we get this one person Jen who is wonderful she knows what we are eating,2 years ago,Open,7322444202.0
Sherri Donovan,4.0,Nice Atmosphere kinda wish it was near the water though😋Pizza decent😋,2 years ago,Open,7322444202.0
Nancy Schlagenhaft,4.0,Great bbq chicken pizza,a year ago,Open,7322444202.0
C M,4.0,"Fresh ingredients for menu items.
But menu limited to pizza, calzones, sandwiches, 1 burger, 2 soups.
Large tables for groups. Bar area separate from restaurant seating area. Specials each night of the week",3 years ago,Open,7322444202.0
Anna Horn,5.0,We went to lunch with friends. Our waiter was Sam. Highly recommend him. Took care of all our needs and had a GREAT personality. Will be returning.,3 years ago,Open,7322444202.0
