name,stars,text,timeSince,openStatus,key
Joseph Rhone,4.0,"We always enjoy Mellow Mushroom. The dining room is decorated with a lot of cool artwork and an awesome fish tank.  We had the brashuto, and it was delicious. We also had a pepperoni pizza, and it too,  was delicious. Great pizza is hard to find in this part of the country. So if you 're in the mood for great pizza, try Mellow Mushroom.",a day ago,Open,7063224602.0
Michaela Tamayo,5.0,"We held my daughter's first birthday party here. The staff was helpful, friendly and very patient with all 10 kids (smash cake mess included). The food was delicious and affordable. We'll definitely be back!",a year ago,Open,7063224602.0
Holly,5.0,Food was amazing and the drinks were even better. I highly recommend the peach buzz!,a day ago,Open,7063224602.0
Paige Divins,5.0,Amazing flavor! Their sauce is unique tasting and the crust is super delicious. We have been trying to find a good pizza place and so far this and one other have made the cut!,a month ago,Open,7063224602.0
Brianna Valentine,5.0,Wednesday is bingo bought. Happy hour is from 4pm-7pm. Pizza is worth it,8 months ago,Open,7063224602.0
Aubrey Hillion,5.0,Our food is always good from here! We've been to mellow mushroom all over and this is by far the best!,2 weeks ago,Open,7063224602.0
M Phillips,1.0,"The food just isn't very good. This is my second time trying. I got a steak calzone, the steak ums steak tasted freezer burned and The calzone was undercooked. The cheese bread was extremely cold and the pepperoni tasted cheap or stale. Just didn't seem like quality ingredients. I wasn't impressed. The staff is very nice.",a month ago,Open,7063224602.0
David Berrio,5.0,"Great people , great service, great atmosphere. had an overall amazing experience. I would definitely go back.!!",2 months ago,Open,7063224602.0
Jerimiah McIntosh,4.0,Excellent food!!! Waiter was good tonight. Great atmosphere clean place.,a month ago,Open,7063224602.0
Tabitha Morrell Myler,5.0,Needed Pizza to go and in a hotel so they set me up with all the plates knives forks parmesan cheese red pepper flakes awesome way to go!!!,a month ago,Open,7063224602.0
William S. Godfrey,5.0,"Best pizza in Columbus, no contest. In car pickup is great.",a month ago,Open,7063224602.0
Malcolm Hatcher,5.0,The pizza here is SO good! You can tell that all of the toppings are fresh and the crust has a crunch to it that the other pizza delivery restaurants can't duplicate! We had the mighty meaty pizza. I also had a caesar salad and the sunset in paradise cocktail. Everything was great including the service!,5 months ago,Open,7063224602.0
Casey Lynn,5.0,A little pricey but pizza is soooooo good!!!! They have a great lunch special too from 11am to 2pm!!!,a month ago,Open,7063224602.0
Donna Dunlap,5.0,great family restaurant... and full bar,4 days ago,Open,7063224602.0
Brandon Lopez,5.0,"This is literally the best restaurant pizza I've had. The decor is funky and enjoyable. Service is good, and so are the sandwiches.",4 months ago,Open,7063224602.0
SuperAbigail1979,5.0,Really great pizza place. Lots of options!,a month ago,Open,7063224602.0
Pamela McDowell,5.0,"Love Mellow Mushroom! Love the relaxed atmosphere, the food, and the beverages. Service is almost always great. Pizza is killer and I enjoy trying new beers. Servers will even bring you a tiny glass to sample. Prices are reasonable. Wish they would sell the tshirts again.",8 months ago,Open,7063224602.0
no one,4.0,Loved the food but was disapointed the bartender took my dates drink at the bar and not mine til 10 min later~ kind of rude. Id go back for the food but sit at a table instead of the bar,4 days ago,Open,7063224602.0
Maurice Brown,5.0,Good customer service and the food was out quickly!,3 weeks ago,Open,7063224602.0
Nick Wrenn,5.0,Definitely plan on enjoying your dinner or lunch. Laid back atmosphere with Delicious food is perfect for everyone.,4 months ago,Open,7063224602.0
Ty Chan,4.0,The service was great our server Charlie was great. Food was a pretty good drinks was on point,3 months ago,Open,7063224602.0
Corey Moore,5.0,Best service location of all the ones I have been too. Doesn't have that slow mood. Upbeat and open.,4 months ago,Open,7063224602.0
N W.,5.0,"Good food and service, couldn't have asked for more.",2 months ago,Open,7063224602.0
Christopher Lee,4.0,Went with my two sons. The waitress was professional and coach us through everything since it was our first time there. Only issue I had was that two more customers came in and received their pizza before us. The waitress apologized about …More,7 months ago,Open,7063224602.0
Mariah Thomas,2.0,"I ordered online and came in to pick up, they forgot to add pepperoni. I just had them add it on instead of remaking it because I was short on time. I feel because they made a careless error I should've been compensated with a free drink or a 10% discount off my next order since I had to wait extra for them fix it, but nope!",a year ago,Open,7063224602.0
Jane Godfrey,5.0,Fantastic service and great attention to detail,a month ago,Open,7063224602.0
Phil Belanger,4.0,"Luxury pizza at luxury prices. You pay for the quality. Highly recommend the Great White or Mighty Meaty. Only reason for four stars is that the past three times I ordered the Great White for take out, the fresh basil I received was extremely old and nasty.",7 months ago,Open,7063224602.0
Matt Hartman,5.0,"First time visit, and now I wish we had one around our area! The pizza's were great from the excellent crust to the abundant toppings. There was also a good drink and beer selection. The service was on point as well.",9 months ago,Open,7063224602.0
Charles Kincaid,4.0,Great pizza! Great service!,3 months ago,Open,7063224602.0
Javi Anica,4.0,Some of the best pizza in Columbus. The ingredients are fresh and delicious. I also had an IPA that paired well with my pizza. I will definitely go back.,a year ago,Open,7063224602.0
Candice Head,5.0,This place is great (as always)! No matter busy or slow you get the same type of service... Top notch!,8 months ago,Open,7063224602.0
Raysaan Churchill,1.0,I placed an order online for pickup and was told my order would take around 25 minutes until ready. When I got there I was told they had no online order to which I showed them my confirmation email. A manager then came out and told me it …More,7 months ago,Open,7063224602.0
Jackie Love,5.0,"The pizza was good too but there was too much crust with not enough cheese this time on the buffalo chicken. It still tasted great just needed some more sauce. Otherwise, the service was good and the place was clean. No complaints here.Thin pepperoni and we opted for medium. There was lots of Parmesan cheese on it which made it tasty.",a year ago,Open,7063224602.0
Amanda Edward,5.0,My go to place to enjoy a delicious pizza. Boys and I love to have the chicken and spinach with extra cheese. Definitely our favorite items to have on pizza. 🧡,11 months ago,Open,7063224602.0
Chivas Kimber,5.0,"First time at a mellow mushroom and it was incredible. The mushroom soup, spinach dip and pizza was insanely tasty. Cannot wait to go back...",8 months ago,Open,7063224602.0
Hunter McDowell,1.0,Not a good experience with the staff. Very inconsiderate and rude.,a month ago,Open,7063224602.0
Olivia Reed,5.0,"Mellow Mushroom offers excellent customer service with high quality, fresh pizzas. These are not your $5/drive through window pizzas. They certainly cost more, but don't you deserve it? Tuesday is trivia night and Wednesday is Bingo and $1/wine night. Highly recommended for the occasional special night out.",a year ago,Open,7063224602.0
Cody Willis,4.0,"Excellent pizza and phenomenal staff. Can take a while if they are busy, but well worth the wait.",9 months ago,Open,7063224602.0
Kim Tomlin,5.0,"Greek salad was very good. Pizza great too. Jonathan was our server. We had a large party and he did a great job.  Definitely will be back our next visit to Columbus, Ga.",a year ago,Open,7063224602.0
Nancy Loofboro,5.0,Can't beat their pizza.,3 days ago,Open,7063224602.0
Lovie Korn,5.0,"the mushrooms on the pizza were delicious,  the chocolate brownie Devine, and our waitress was super sweet",a year ago,Open,7063224602.0
marc venditti,5.0,Awesome pizza! Great wings!,3 months ago,Open,7063224602.0
Carmen Sanchez,5.0,"I ordered a vegan pizza and it was delicious!
The customer service was great .",2 years ago,Open,7063224602.0
Billy Cox,4.0,"Great food, good service.",3 months ago,Open,7063224602.0
Pat Henley,5.0,Very good!,a week ago,Open,7063224602.0
Victoria Thomas,5.0,The Mighty Meaty pizza and the sausage calzone was very good. The wings were surprisingly awesome as well. We had a wonder server name Jon. Kudos on your superb customer service. We will be back.,a year ago,Open,7063224602.0
Leella,5.0,"Great service and great atmosphere, It’s always packed because the pizza is phenomenal!",8 months ago,Open,7063224602.0
Skim Shank,3.0,"Almost always great. Just for today, when you use onions on the mushroom pizza, please check the freshness of the layers you are putting on. I just had a bite of dried outer skin of an onion, which just becomes cardboard when baked. Not pleasant!",a year ago,Open,7063224602.0
Angie White,5.0,Mellow is our go to place for the best pizza in town. We always sit at the bar and the service never disappoints.,9 months ago,Open,7063224602.0
Cullen McGill,5.0,Went for the first time this past August for my birthday to grab a burger and a beer and I've wondered why it had taken so long to finally eat here it was great,8 months ago,Open,7063224602.0
Greg Vaughn,5.0,"Was a great pizza. I had the house special and loved it, piles of toppings. The medium, which was 6 slices was enough for two people.
The decor was fantastic mushroom themed throughout. Service was fantastic never …More",a year ago,Open,7063224602.0
Ethan Smith,5.0,Everything is really good. Pizza. Hoagie. Wings. Calzone. Service. Trivia.,9 months ago,Open,7063224602.0
micah eifrid,4.0,"Mellow Mushroom has consistency down. Every location I've ever to, their food is consistently good  and always taste fresh. …More",a year ago,Open,7063224602.0
Melvin Moore,5.0,This is a wonderful place to hang out with friends or bring the family.,8 months ago,Open,7063224602.0
Meagan Oswald,5.0,BEST PIZZA EVER. friendly service. Laid back.,8 months ago,Open,7063224602.0
Stacey Ballard,5.0,Great environment and tasty pizza. I love the bruschetta.,9 months ago,Open,7063224602.0
William Bell,5.0,Love all of the fun pizzas. Crust is absolutely perfect!,9 months ago,Open,7063224602.0
Mari,5.0,The pizza is great here.  My favorite  is the Maui Waui.,8 months ago,Open,7063224602.0
Sylvia,5.0,Great prices. Great happy hour.  Goid food.,10 months ago,Open,7063224602.0
James Ragan,3.0,"The pizza overall was expensive at $25-30 for a large pizza; that's a bit much! The place itself was clean and the server was really nice so that's not a factor. However, again, that price is a bit steep for anything other than a nice dinner and I don't think a pizza place is a ""fancy clothing"" kind of place.",11 months ago,Open,7063224602.0
Josh Ainsworth,5.0,The food is excellent and the service is awesome. A little pricey though.,11 months ago,Open,7063224602.0
Dennis Moore,5.0,Love the place.  Great pizza and bar. The calendar is really cool and a great deal.,a year ago,Open,7063224602.0
Will Hunt,5.0,Great calzones hold the regatta ;),5 months ago,Open,7063224602.0
Prophet,5.0,I ordered for pick up and once I got to the location they didnt have any record of my order. Luckily the lady I was talking to pushed my order ahead of everyone and then informed me of a special for 2 pizzas that cut my bill in half. The pizza was amazing.,a year ago,Open,7063224602.0
Nina Moten,5.0,excellent pizza,a week ago,Open,7063224602.0
Donna Brown,5.0,Always a great time & eating experience at Mellow Mushroom. Love the burgers. Love the pizza. Great staff. They really know their stuff!!,a year ago,Open,7063224602.0
Tarren Bruce,4.0,There pretty good. Service is great .,9 months ago,Open,7063224602.0
D H,1.0,"After sitting and waiting to have our order taken, other patrons came through the door and were seated, and a server approached their table immediately. After my husband asked the female why we weren't ahead of them. She was basically …More",a year ago,Open,7063224602.0
Jason Reed,5.0,Can't beat great pizza and great drinks! Family friendly pizza place with full bar and several beers on tap. Tons of ingredient options and the service has been great everytime we are at this location. The pizza pictured (Margherita sp?) is no longer on the menu but was one of our favorites!,a year ago,Open,7063224602.0
Bruce Stansbury,5.0,Great food.  Real ingredients.  Hand made.  Waiter staff is excellent with recommendations and energy to match the folks at the table.  I enjoy fellowshipping with friends and family at mellow mushroom.  Bring a large group for some awesome fun with great food.,a year ago,Open,7063224602.0
Mike Nelson,5.0,Best pizza I ever had...Our waitress was top notch and deserves a raise...She was Amazing !!!!,11 months ago,Open,7063224602.0
Eric Griggs,4.0,Great food. Very polite and friendly service there.,10 months ago,Open,7063224602.0
Amber Sipe,1.0,We had terrible service. People who came in after us was served before us. We had to wait along time for our order. The people who was waiting on us treated everyone better then us. Probably wont be back for a while.,a year ago,Open,7063224602.0
Connie Baldwin,5.0,The Pizza was great. Loved the crust. The Bruschetta was the best in town so far.,a year ago,Open,7063224602.0
George Bowen,4.0,Good food and good atmosphere,9 months ago,Open,7063224602.0
Tonia Vaughn,4.0,"Dined in 3/19/2019 8:42PM
$53.68 (with tax) plus $10 tip …More",a year ago,Open,7063224602.0
Jim Notdisclosing,5.0,Best pizza I’ve ever had hands down. I go here every time I’m in Columbus on business. Awesome taps to boot.  The service and atmosphere are top notch. Give it a shot if you haven’t already as you will not be disappointed. See ya in March when I come into town.   😃,a year ago,Open,7063224602.0
Mayerly Rozo,5.0,Good family place to eat,a year ago,Open,7063224602.0
Tanya Haas,5.0,Best pizza in my opinion by far. Service wasnt so great but this is the first time it wasnt. A little pricey.,a year ago,Open,7063224602.0
Amanda Nichole Wooten,4.0,"Service was awesome, Appetizers were amazing! 😘",8 months ago,Open,7063224602.0
Diogenes Rexach,5.0,Awesome pizza with a good customer service.,8 months ago,Open,7063224602.0
Gary Deloach,5.0,I've never had bad service or bad food.,9 months ago,Open,7063224602.0
Erica Drake,5.0,"One of my preferred spots for quality Pizza. great place to chill, get away, eat some good food. the prices are fair for the quality of food.",a year ago,Open,7063224602.0
Shadavia Perry,4.0,Good pizza,2 months ago,Open,7063224602.0
Jerrica Lewis,5.0,Delicious pizza & fresh salads. Worth the price.,a year ago,Open,7063224602.0
Ann Hutton,5.0,"Loved it. They have gluten free and vegan options clearly marked on the menu. Everything is made fresh and if you've never had stone baked pizza or calzones, you have no idea what you're missing. The staff was awesome. Out waiter was super …More",2 years ago,Open,7063224602.0
G Smooth,5.0,Great food and a good atmosphere to wine down your day.,a year ago,Open,7063224602.0
Mike Harmon,3.0,Good but kinda pricey,8 months ago,Open,7063224602.0
Sockswflipflops 91,3.0,"It was my fiance's first experience with Mellow Mushroom. As for me I have ate there a number of times I praise the pizza, the sauce and customer service. But this time the experience was not so enjoyable the service was not that bad. But …More",a year ago,Open,7063224602.0
Kirk Wilson,4.0,"Pretty good. Food good, service very good.",11 months ago,Open,7063224602.0
Myfootsasmokin,4.0,"Best pizza in area! However the title of ""best"" is shared with another. Cirones is Italian style while Mellow Mushtoom is more American style. Both are excellent. One caveat, if you dine at one, you must try the other next time. This is the only review I've done with two competitors at once. It's just that both are Columbus best.",a year ago,Open,7063224602.0
robert wilburn,1.0,Bruschettea was cold and soggy the calzone was Luke warm.,9 months ago,Open,7063224602.0
Monica Salawe,5.0,Food was on point exact as advertised very fresh,9 months ago,Open,7063224602.0
Heather Haskell,5.0,I like theirbeer selection as well as their menu. I had a Greek salad this time and it was great. I got the smaller salad with chicken added and it was plenty for me.,a year ago,Open,7063224602.0
Sara Ulkloss,5.0,Yummy pizza... really good pizza dough.  Had the buffalo chicken pizza... it was delicious.,a year ago,Open,7063224602.0
Amy Carver Haynes,5.0,Cool place with cool atmosphere. This is a franchise but they all are super authentic. It’s a great vibe with the hipster type employees. Everyone is friendly and great service. Pizza and salads are great. Real pizza like it’s supposed to …More,2 years ago,Open,7063224602.0
Justin Hall,5.0,Pretty great all around,10 months ago,Open,7063224602.0
Nickolas Guinn,5.0,Amazing absolutely flawless that's the only thing I can say to even describe the food and workers,a year ago,Open,7063224602.0
Kalisto Cutamora,5.0,Love it. Lively and friendly staff. The food was great too. Definitely gonna be a regular spot for me and my family now.,a year ago,Open,7063224602.0
BringerOfToast212,5.0,I love this place ask for a chicken parmesan pizza it isn't on the menu but it's one of those secret items. Very filling pizza pretty average speed and I recommend dipping crust in center dressing it's amazing,a year ago,Open,7063224602.0
Matt Towns,3.0,"Here's the thing: I love this place. Their pizza is really good, and their cheese curds are phenomenal.
BUT: Their onions are TERRIBLE! I ordered a half and half, both sides with …More",a year ago,Open,7063224602.0
MP Ossa,5.0,Tempeh and vegan options too: love me a tempeh sandwich,a year ago,Open,7063224602.0
Marc Cox,5.0,"Great food, decent service, always a favorite",9 months ago,Open,7063224602.0
Stephen Gautreau,5.0,"Best  pizza I have found in the metropolis of Columbus! Attentive staff, great food and reasonable $$$",a year ago,Open,7063224602.0
Matt Hurley,5.0,Awesome atmosphere and great service,7 months ago,Open,7063224602.0
E&S,5.0,"Our first time to eat there.
We really enjoyed the vegan options. The server was kind and friendly. the",a year ago,Open,7063224602.0
Meeko Compton,5.0,Tried the mighty meaty pizza. It was delicious. Service was great and the atmosphere was chill and mellow,a year ago,Open,7063224602.0
Ellen McCall,5.0,"Good food
Friendly people",7 months ago,Open,7063224602.0
Marianne,5.0,Regardless of the city this is always a great choice for great pizza.,a year ago,Open,7063224602.0
William Sullivan,5.0,Great service from that bartender sam love her,a year ago,Open,7063224602.0
Davita Bynam,4.0,Great pizza,3 months ago,Open,7063224602.0
Diane Marsh,5.0,Great Experience.  They accommodate their  patrons.  I was satisfied both in Columbus Ga and in Tennessee 👍,a year ago,Open,7063224602.0
Anna Guzman,4.0,They have good pizza and salad and the service is great,a year ago,Open,7063224602.0
Traci Rayner,5.0,Great service and great Pizza,a year ago,Open,7063224602.0
Cdw vlogs,5.0,Food is amazing!!!!!! The staff is the reason I go back,6 days ago,Open,7063224602.0
Sabrenia West,4.0,Food is always fresh.,8 months ago,Open,7063224602.0
A. Lyvers,5.0,"Whenever I am in Columbus, I make sure to stop in to MM. The service is great, and they serve some of the local favorites that my home location stopped selling (Thai Dye Pizza!). I'd take this over Old Chicago any day.",a year ago,Open,7063224602.0
Robert Hewitt,5.0,Really good food nice family place,a year ago,Open,7063224602.0
The Pickachu That could,5.0,Great pizza and amazing waiters,8 months ago,Open,7063224602.0
Ali Alkenane,5.0,First time ordering here and I love pizza. Was not disappointed.,a year ago,Open,7063224602.0
RussellandLori Bukowski,3.0,Service was great but everything else... First time eating there.   Place was too loud.  Crying baby in one booth and a baseball team on other side. Food was okay.  Too much parmesan on everything.  Pepperoni should have been cooked more.,a year ago,Open,7063224602.0
Tamika Parris,5.0,Great pizza.. wonderful service..and their drinks special will have you coming back 😋,a year ago,Open,7063224602.0
The Nutsheller,5.0,I highly recommend Mellow Mushroom. There are now SO many different pizarre's in Columbus. Mellow Mushroom though I think personally is a step above. They truly have quality food that is just clean taste and with the risk in sounding cheesy …More,2 years ago,Open,7063224602.0
Travis St. John,5.0,"Quick, hot delicious pizza.  Highly recommend creating your own..  so much better being customized",a year ago,Open,7063224602.0
MrTrisonik,5.0,Good food lovely service,8 months ago,Open,7063224602.0
NOS Nero,5.0,I loved my first visit here. I stopped in and was greeted at the door. The menu is beautiful. The food is just as good as it sounds. Looking forward to my next visit already. I ordered the vege calzone.,a year ago,Open,7063224602.0
B.E. Alex,5.0,Great atmosphere... Great food and absolutely  awesome service from Jasmine!!!  You can't go wrong with Pizza or any food from here...,2 years ago,Open,7063224602.0
Mike P,4.0,Awesome joint!!,4 months ago,Open,7063224602.0
Heather Hamby,1.0,"I have called 8 times over thr last couple of hours trying to call in an order and no one answers the phone.
Id be more than happy to send a screenshot of my call log to management.",a year ago,Open,7063224602.0
Pat Donovan,4.0,Great pizza. Took my son here after his turning blue ceremony.,a year ago,Open,7063224602.0
lefty's rightwich,5.0,Food was absolutely delicious!! Decor so much fun and groovy!!,a year ago,Open,7063224602.0
Sherrie' Fentress,5.0,Ross. Is tight but his food is-good and the employees are really outstanding.,a year ago,Open,7063224602.0
Laura Schelling,5.0,The food is great and the service is friendly,a year ago,Open,7063224602.0
Samir Pingle,5.0,Awesome Garlic Bread and Calzone! Last time had tried their Pizza which was fabulous....so came in again!,a year ago,Open,7063224602.0
Shawn Fowler,1.0,"The beer menu is great, the food is good too. The menu is a disaster. It is 18 pages of red white and black type, of food items with goofy names. You will reach for the beer menu by the time you settle on something and never flip through …More",3 years ago,Open,7063224602.0
Robin Pearson,5.0,"David our waiter was wonderful! We had our granddaughter Ava with us and he was excellent with her.  She wants to ALWAYS eat there when she visit with us but, only If David is there.  Mushroom soup is wonderful.",2 years ago,Open,7063224602.0
Mark McCausland,5.0,"Went for dinner, stayed longer than planned for bingo night!!

Great food, if you've never had high-quality pizza you can't go wrong with Mellow Mushroom.",a year ago,Open,7063224602.0
Jessies -Girl Fentress,5.0,The employees are the best and my daughter works there okay. She's the best waitress and bartender,a year ago,Open,7063224602.0
Paul Scheibler,2.0,We had to leave because they couldn't provide a gluten free pizza for our grandson. He had been soooooooo excited about coming here only to be disappointed.,a year ago,Open,7063224602.0
La Vida Loca,5.0,"Absolutely love this place.  The service alone is 5stars, then the food is cheesy, delicious goodness.  It's a little ironic that I don't like mushrooms 😁😁😁",2 years ago,Open,7063224602.0
Rick B,5.0,"I eat here frequently.  The food is always good, as is the service.  Lunch special is a good value.",a year ago,Open,7063224602.0
Ben Dent,5.0,Magic Mushroom Soup! Fantastic,11 months ago,Open,7063224602.0
Bruce Lawson,3.0,Got my order wrong and they took away potato pizza,8 months ago,Open,7063224602.0
T Daugherty,5.0,"Delicious food, I love eating here",a year ago,Open,7063224602.0
John Zapata,5.0,Amazing! Great pizza and there mushroom soup is the best I have had.,a year ago,Open,7063224602.0
DANIEL PINGLETON,4.0,Friendly staff and awesome pizza,a year ago,Open,7063224602.0
C Policastro,5.0,"I live in NJ and eat pizza fairly often, and I really enjoyed my food here. This is really good food, the pizza is some of the best I've ever had. Great crust, really cheesy with good cheese, the meatballs and sausage is really tasty. The …More",2 years ago,Open,7063224602.0
Fire Raven,5.0,Good food and great service,a year ago,Open,7063224602.0
Pale Horse,4.0,"Good service, good food... I'll be back for more...",a year ago,Open,7063224602.0
Jay,5.0,They was fast on point did great they have real pizza.,a year ago,Open,7063224602.0
Swedish Wolf,5.0,"Amazing Pizza, Excellent Service!",a year ago,Open,7063224602.0
Candice Strickland,5.0,"Been coming here for years.  The people are always so helpful and the food is always fresh.  Awesome beers on tap, too! ♡ Great job y'all!",2 years ago,Open,7063224602.0
Charles Ridgeway,4.0,Great pizza and will definitely be returning for more. Took me more then 3 years to finally try it. Should of alot sooner,a year ago,Open,7063224602.0
Joseph Porter,5.0,Excellent 🍕. Great service.,a year ago,Open,7063224602.0
Vallery Havens,5.0,"Great service. Outstanding pizza. Overall, I’m satisfied with Mellow Mushroom!

PS I love the menu!",2 years ago,Open,7063224602.0
Ben Amos,4.0,Good food and service. Can't go wrong with the classic pepperoni.,a year ago,Open,7063224602.0
tim curran,5.0,"Food was very good good.

However, the service was superb. Andrea AKA Andi was the true gem of the …More",3 years ago,Open,7063224602.0
Jake Green,5.0,Very good pizza,9 months ago,Open,7063224602.0
